-- PostgreSQL version of MySQL dump
-- Converted by convert_batch_mysql_to_postgres.py

INSERT INTO "file_list" ("id", "file_no", "category", "title", "doc1", "entry_date_real") VALUES
(1513, 'MSB/CB/A-84', 'Achievements of CID(SB)', 'Drug seized', '', '2021-09-15');
INSERT INTO "file_list" ("id", "file_no", "category", "title", "doc1", "entry_date_real") VALUES
(1514, 'MSB/CB/A-84', 'Achievements of CID(SB)', 'Main Book', '', '2022-01-07');
INSERT INTO "file_list" ("id", "file_no", "category", "title", "doc1", "entry_date_real") VALUES
(1515, 'MSB/CB/A-84', 'Achievements of CID(SB)', 'OPERATION DETAILS OF CID(SB)', '', '2021-10-27');
INSERT INTO "file_list" ("id", "file_no", "category", "title", "doc1", "entry_date_real") VALUES
(1516, 'MSB/CB/A-84', 'Achievements of CID(SB)', 'Report Drugs', '', '2021-02-14');
INSERT INTO "file_list" ("id", "file_no", "category", "title", "doc1", "entry_date_real") VALUES
(1517, 'MSB/CB/A-84', 'Achievements of CID(SB)', 'Statement of Subash Das', '', '2021-08-31');
INSERT INTO "file_list" ("id", "file_no", "category", "title", "doc1", "entry_date_real") VALUES
(1519, 'MSB/CB/A-76(A)', 'PCJSS/Santi Bahini', 'Camp of PCJSS with coordinate', '', '2020-12-15');
INSERT INTO "file_list" ("id", "file_no", "category", "title", "doc1", "entry_date_real") VALUES
(1520, 'MSB/CB/A-76(A)', 'PCJSS/Santi Bahini', 'SO, CID(SB);
INSERT INTO "file_list" ("id", "file_no", "category", "title", "doc1", "entry_date_real") VALUES
(TLABUNG, MIZORAM', '', '2020-12-11');
INSERT INTO "file_list" ("id", "file_no", "category", "title", "doc1", "entry_date_real") VALUES
(1521, 'MSB/CB/A-76(A)', 'PCJSS/Santi Bahini', 'Camp image', '', '2021-01-28');
INSERT INTO "file_list" ("id", "file_no", "category", "title", "doc1", "entry_date_real") VALUES
(1522, 'MSB/CB/A-90', 'National Foundation for Communal Harmony', 'Enquiry report on alleged activities of PCJSS.', '', '2021-01-28');
INSERT INTO "file_list" ("id", "file_no", "category", "title", "doc1", "entry_date_real") VALUES
(1523, 'MSB/CB/A-76(A)', 'PCJSS/Santi Bahini', 'Lungpuk 1 & 2', '', '2020-12-15');
INSERT INTO "file_list" ("id", "file_no", "category", "title", "doc1", "entry_date_real") VALUES
(1524, 'MSB/CB/A-76(A)', 'PCJSS/Santi Bahini', 'Lungpuk 1 & 2', '', '2020-12-15');
INSERT INTO "file_list" ("id", "file_no", "category", "title", "doc1", "entry_date_real") VALUES
(1525, 'MSB/CB/A-76(A)', 'PCJSS/Santi Bahini', 'February 2020, Monthly Report on Human Rights Situation CHT', '', '2020-03-09');
INSERT INTO "file_list" ("id", "file_no", "category", "title", "doc1", "entry_date_real") VALUES
(1526, 'MSB/CB/A-62', 'Chin National Front(CNF)/Chin National Army(CNA)', 'Pu Sawmtea Report NIA letter no. RC-18/2021/NIA-DLT/5940.', '', '2021-10-29');
INSERT INTO "file_list" ("id", "file_no", "category", "title", "doc1", "entry_date_real") VALUES
(1527, 'MSB/CB/A-62', 'Chin National Front(CNF)/Chin National Army(CNA)', 'REPORT ON SEEKING OF ASYLUM BY CHIN NATIONAL ARMY (CNA) DUE TO MILITARY COUP IN MYANMAR', '', '2021-03-08');
INSERT INTO "file_list" ("id", "file_no", "category", "title", "doc1", "entry_date_real") VALUES
(1528, 'MSB/CB/A-62', 'Chin National Front(CNF)/Chin National Army(CNA)', 'Request to provide details pertaining to CNF (Chin National Front).', '', '2021-11-01');
INSERT INTO "file_list" ("id", "file_no", "category", "title", "doc1", "entry_date_real") VALUES
(1529, 'A-3', 'Sinlung Hills Development Council SHDC', 'Conduct of veracity of details of location of camps and movements of armed miscreants inside India - Regarding.', '', '2021-04-30');
INSERT INTO "file_list" ("id", "file_no", "category", "title", "doc1", "entry_date_real") VALUES
(1530, 'A-3', 'Sinlung Hills Development Council SHDC', 'Bangladesh miscreants - Regarding.', '', '2021-01-08');
INSERT INTO "file_list" ("id", "file_no", "category", "title", "doc1", "entry_date_real") VALUES
(1531, 'A-3', 'Sinlung Hills Development Council SHDC', 'Bangladesh miscreants - Regarding.', '', '2021-01-08');
INSERT INTO "file_list" ("id", "file_no", "category", "title", "doc1", "entry_date_real") VALUES
(1532, 'A-3', 'Sinlung Hills Development Council SHDC', 'IG BSF-REGION COMMANDERS BGB LEVEL BORDER CO-ORDINATION CONFERENCE JUNE 2021 - VERIFICATION THEREOF.', '', '2021-08-17');
INSERT INTO "file_list" ("id", "file_no", "category", "title", "doc1", "entry_date_real") VALUES
(1533, 'MSB/CB/B-71/L&S', 'Lok Sabha/Rajya Sabha Question', 'Lok Sabha Admitted Provisional Starred Question Dy.No. 13511.', '', '2012-04-20');
INSERT INTO "file_list" ("id", "file_no", "category", "title", "doc1", "entry_date_real") VALUES
(1534, 'MSB/CB/B-71/L&S', 'Lok Sabha/Rajya Sabha Question', 'Lok Sabha Question Dy.No. 18636.', '', '2014-01-07');
INSERT INTO "file_list" ("id", "file_no", "category", "title", "doc1", "entry_date_real") VALUES
(1535, 'MSB/CB/B-71/L&S', 'Lok Sabha/Rajya Sabha Question', 'Lok Sabha Question Dy.No. 4732.', '', '2013-06-14');
INSERT INTO "file_list" ("id", "file_no", "category", "title", "doc1", "entry_date_real") VALUES
(1536, 'MSB/CB/B-71/L&S', 'Lok Sabha/Rajya Sabha Question', 'Lok Sabha Question Dy.No. 13558', '', '2011-12-09');
INSERT INTO "file_list" ("id", "file_no", "category", "title", "doc1", "entry_date_real") VALUES
(1537, 'MSB/CB/B-71/L&S', 'Lok Sabha/Rajya Sabha Question', 'Lok Sabha Question Dy.No. 18825(a).', '', '2011-12-19');
INSERT INTO "file_list" ("id", "file_no", "category", "title", "doc1", "entry_date_real") VALUES
(1538, 'MSB/CB/B-71/L&S', 'Lok Sabha/Rajya Sabha Question', 'Lok Sabha Unstarred Question Dy.No. 8038.', '', '2015-12-09');
INSERT INTO "file_list" ("id", "file_no", "category", "title", "doc1", "entry_date_real") VALUES
(1539, 'MSB/CB/B-71/L&S', 'Lok Sabha/Rajya Sabha Question', 'Notice Starred Question No. 3 of Lok Sabha', '', '2011-09-03');
INSERT INTO "file_list" ("id", "file_no", "category", "title", "doc1", "entry_date_real") VALUES
(1540, 'MSB/CB/B-71/L&S', 'Lok Sabha/Rajya Sabha Question', 'Sending of required information on Lok Sabha Questions.', '', '2010-04-26');
INSERT INTO "file_list" ("id", "file_no", "category", "title", "doc1", "entry_date_real") VALUES
(1541, 'MSB/CB/B-71/L&S', 'Lok Sabha/Rajya Sabha Question', 'Lok Sabha Starred Question Dy. No. 9465.', '', '2014-12-29');
INSERT INTO "file_list" ("id", "file_no", "category", "title", "doc1", "entry_date_real") VALUES
(1542, 'MSB/CB/B-71/L&S', 'Lok Sabha/Rajya Sabha Question', 'Lok Sabha Starred Question Dy.No. 4921.', '', '2011-08-09');
INSERT INTO "file_list" ("id", "file_no", "category", "title", "doc1", "entry_date_real") VALUES
(1543, 'MSB/CB/B-71/L&S', 'Lok Sabha/Rajya Sabha Question', 'Sending of required information on Lok Sabha unstarred questionÃ‚Â  No. 3091.', '', '2022-09-13');
INSERT INTO "file_list" ("id", "file_no", "category", "title", "doc1", "entry_date_real") VALUES
(1544, 'MSB/CB/B-71/L&S', 'Lok Sabha/Rajya Sabha Question', 'Lok Sabha Provisional Starred/Unstarred Question No. 426.', '', '2013-08-05');
INSERT INTO "file_list" ("id", "file_no", "category", "title", "doc1", "entry_date_real") VALUES
(1545, 'MSB/CB/B-71/L&S', 'Lok Sabha/Rajya Sabha Question', 'Lok Sabha Provisional Starred Question D.No. 19658.', '', '2012-01-19');
INSERT INTO "file_list" ("id", "file_no", "category", "title", "doc1", "entry_date_real") VALUES
(1546, 'MSB/CB/B-71/L&S', 'Lok Sabha/Rajya Sabha Question', 'Lok Sabha Admitted Provisional Starred Question Dy.No. 4389.', '', '2012-03-16');
INSERT INTO "file_list" ("id", "file_no", "category", "title", "doc1", "entry_date_real") VALUES
(1547, 'MSB/CB/B-71/L&S', 'Lok Sabha/Rajya Sabha Question', 'Lok Sabha Provisional Starred/Unstarred Question Dy.No. 2321.', '', '2013-06-11');
INSERT INTO "file_list" ("id", "file_no", "category", "title", "doc1", "entry_date_real") VALUES
(1548, 'MSB/CB/B-71/L&S', 'Lok Sabha/Rajya Sabha Question', 'Lok Sabha Question Dy.No. 4389.', '', '2012-05-01');
INSERT INTO "file_list" ("id", "file_no", "category", "title", "doc1", "entry_date_real") VALUES
(1549, 'MSB/CB/B-71/L&S', 'Lok Sabha/Rajya Sabha Question', 'Lok Sabha Question Dy No. 133.', '', '2014-07-24');
INSERT INTO "file_list" ("id", "file_no", "category", "title", "doc1", "entry_date_real") VALUES
(1550, 'MSB/CB/B-71/L&S', 'Lok Sabha/Rajya Sabha Question', 'Lok Sabha Question Dy.No. 11465.', '', '2014-01-30');
INSERT INTO "file_list" ("id", "file_no", "category", "title", "doc1", "entry_date_real") VALUES
(1551, 'MSB/CB/B-71/L&S', 'Lok Sabha/Rajya Sabha Question', 'Lok Sabha Question Dy.No. 11988', '', '2012-10-19');
INSERT INTO "file_list" ("id", "file_no", "category", "title", "doc1", "entry_date_real") VALUES
(1552, 'MSB/CB/B-71/L&S', 'Lok Sabha/Rajya Sabha Question', 'Lok Sabha Question No. 5738.', '', '2013-06-14');
INSERT INTO "file_list" ("id", "file_no", "category", "title", "doc1", "entry_date_real") VALUES
(1553, 'MSB/CB/B-71/L&S', 'Lok Sabha/Rajya Sabha Question', 'Sending of required information on Lok Sabha Question Dy. No. S496.', '', '2010-08-04');
INSERT INTO "file_list" ("id", "file_no", "category", "title", "doc1", "entry_date_real") VALUES
(1554, 'MSB/CB/B-71/L&S', 'Lok Sabha/Rajya Sabha Question', 'Sending of required information on Lok Sabha Starred Question Dy. No.35.', '', '2011-02-22');
INSERT INTO "file_list" ("id", "file_no", "category", "title", "doc1", "entry_date_real") VALUES
(1555, 'MSB/CB/B-71/L&S', 'Lok Sabha/Rajya Sabha Question', 'Sending of required information on Lok Sabha Starred Question No. D-No. 13013.', '', '2010-12-09');
INSERT INTO "file_list" ("id", "file_no", "category", "title", "doc1", "entry_date_real") VALUES
(1556, 'MSB/CB/B-71/L&S', 'Lok Sabha/Rajya Sabha Question', 'Sending of required information on Lok Sabha Unstarred Question No. Dy 4489.', '', '2010-12-20');
INSERT INTO "file_list" ("id", "file_no", "category", "title", "doc1", "entry_date_real") VALUES
(1557, 'MSB/CB/B-71/L&S', 'Lok Sabha/Rajya Sabha Question', 'Sending of required information on Lok Sabha Unstarred Question.', '', '2011-08-04');
INSERT INTO "file_list" ("id", "file_no", "category", "title", "doc1", "entry_date_real") VALUES
(1558, 'MSB/CB/B-71/L&S', 'Lok Sabha/Rajya Sabha Question', 'Sending of required information on Lok Sabha/Rajya Sabha questions.', '', '2010-08-13');
INSERT INTO "file_list" ("id", "file_no", "category", "title", "doc1", "entry_date_real") VALUES
(1559, 'MSB/CB/B-71/L&S', 'Lok Sabha/Rajya Sabha Question', 'Lok Sabha Provisional Admitted Starred Question Diary No. 4906.', '', '2014-12-29');
INSERT INTO "file_list" ("id", "file_no", "category", "title", "doc1", "entry_date_real") VALUES
(1560, 'MSB/CB/B-71/L&S', 'Lok Sabha/Rajya Sabha Question', 'Ã‚Â  Lok SabhaÃ‚Â  Provisional Starred Question Dy. No. 4475.', '', '2014-11-25');
INSERT INTO "file_list" ("id", "file_no", "category", "title", "doc1", "entry_date_real") VALUES
(1561, 'MSB/CB/B-71/L&S', 'Lok Sabha/Rajya Sabha Question', 'Lok Sabha Starred Question Dy. No. 9465.', '', '2014-12-29');
INSERT INTO "file_list" ("id", "file_no", "category", "title", "doc1", "entry_date_real") VALUES
(1562, 'MSB/CB/B-71/L&S', 'Lok Sabha/Rajya Sabha Question', 'Lok Sabha Starred Question Dy.No. 1298.', '', '2014-06-14');
INSERT INTO "file_list" ("id", "file_no", "category", "title", "doc1", "entry_date_real") VALUES
(1563, 'MSB/CB/B-71/L&S', 'Lok Sabha/Rajya Sabha Question', 'Lok Sabha Provisional Starred Question Dy.No. 19103.', '', '2013-06-14');
INSERT INTO "file_list" ("id", "file_no", "category", "title", "doc1", "entry_date_real") VALUES
(1564, 'MSB/CB/B-71/L&S', 'Lok Sabha/Rajya Sabha Question', 'Lok Sabha Starred/Unstarred Question Dy No. 1687.', '', '2014-07-24');
INSERT INTO "file_list" ("id", "file_no", "category", "title", "doc1", "entry_date_real") VALUES
(1565, 'MSB/CB/B-71/L&S', 'Lok Sabha/Rajya Sabha Question', 'Lok Sabha Question Dy.No. 14446.', '', '2011-12-09');
INSERT INTO "file_list" ("id", "file_no", "category", "title", "doc1", "entry_date_real") VALUES
(1566, 'MSB/CB/B-71/L&S', 'Lok Sabha/Rajya Sabha Question', 'Ã‚Â  Lok Sabha Unstarred Question Dy.No. 1842.', '', '2015-12-07');
INSERT INTO "file_list" ("id", "file_no", "category", "title", "doc1", "entry_date_real") VALUES
(1567, 'MSB/CB/B-71/L&S', 'Lok Sabha/Rajya Sabha Question', 'Ã‚Â Lok Sabha Unstarred Question Diary No. 654.', '', '2014-08-22');
INSERT INTO "file_list" ("id", "file_no", "category", "title", "doc1", "entry_date_real") VALUES
(1568, 'MSB/CB/B-71/L&S', 'Lok Sabha/Rajya Sabha Question', 'Lok Sabha Unstarred Question Diary No. 7892.', '', '2014-03-18');
INSERT INTO "file_list" ("id", "file_no", "category", "title", "doc1", "entry_date_real") VALUES
(1569, 'MSB/CB/B-71/L&S', 'Lok Sabha/Rajya Sabha Question', 'Lok Sabha Unstarred Question Dy.No. 1836.', '', '2012-03-16');
INSERT INTO "file_list" ("id", "file_no", "category", "title", "doc1", "entry_date_real") VALUES
(1570, 'MSB/CB/B-71/L&S', 'Lok Sabha/Rajya Sabha Question', 'Lok Sabha Unstarred Question Dy. No. 4084.', '', '2013-08-27');
INSERT INTO "file_list" ("id", "file_no", "category", "title", "doc1", "entry_date_real") VALUES
(1571, 'MSB/CB/B-71/L&S', 'Lok Sabha/Rajya Sabha Question', 'Lok Sabha Unstarred Question Dy.No. 4585.', '', '2012-03-22');
INSERT INTO "file_list" ("id", "file_no", "category", "title", "doc1", "entry_date_real") VALUES
(1572, 'MSB/CB/B-71/L&S', 'Lok Sabha/Rajya Sabha Question', 'Lok Sabha Unstarred Question Dy.No. 13956.', '', '2013-06-14');
INSERT INTO "file_list" ("id", "file_no", "category", "title", "doc1", "entry_date_real") VALUES
(1573, 'MSB/CB/B-71/L&S', 'Lok Sabha/Rajya Sabha Question', 'Lok Sabha Unstarred Question No. 4822.', '', '2013-06-14');
INSERT INTO "file_list" ("id", "file_no", "category", "title", "doc1", "entry_date_real") VALUES
(1574, 'MSB/CB/B-71/L&S', 'Lok Sabha/Rajya Sabha Question', 'Lok Sabha Unstarred Question No. 6628.', '', '2013-06-14');
INSERT INTO "file_list" ("id", "file_no", "category", "title", "doc1", "entry_date_real") VALUES
(1575, 'MSB/CB/B-71/L&S', 'Lok Sabha/Rajya Sabha Question', 'Lok Sabha Unstarred Question No.3176 (Dy. No. 7892).', '', '2014-12-29');
INSERT INTO "file_list" ("id", "file_no", "category", "title", "doc1", "entry_date_real") VALUES
(1576, 'MSB/CB/B-71/L&S', 'Lok Sabha/Rajya Sabha Question', 'Lok Sabha Provisional Starred/Unstarred QuestionÃ‚Â Dy. No. 18638 .', '', '2014-01-07');
INSERT INTO "file_list" ("id", "file_no", "category", "title", "doc1", "entry_date_real") VALUES
(1577, 'MSB/CB/B-71/L&S', 'Lok Sabha/Rajya Sabha Question', 'Ã‚Â Ã‚Â  Rajya Sabha Question Dy. No. S1275.', '', '2013-08-14');
INSERT INTO "file_list" ("id", "file_no", "category", "title", "doc1", "entry_date_real") VALUES
(1578, 'MSB/CB/B-71/L&S', 'Lok Sabha/Rajya Sabha Question', 'Rajya Sabha Question Dy. No. S2794.', '', '2013-08-07');
INSERT INTO "file_list" ("id", "file_no", "category", "title", "doc1", "entry_date_real") VALUES
(1579, 'MSB/CB/B-71/L&S', 'Lok Sabha/Rajya Sabha Question', 'Rajya Sabha QuestionÃ‚Â  Dy. No. U1369 and Dy. No. U2298', '', '2013-03-15');
INSERT INTO "file_list" ("id", "file_no", "category", "title", "doc1", "entry_date_real") VALUES
(1580, 'MSB/CB/B-71/L&S', 'Lok Sabha/Rajya Sabha Question', 'Rajya Sabha Starred/Unstarred Question Dy. No. S3285, U1611', '', '2013-12-11');
INSERT INTO "file_list" ("id", "file_no", "category", "title", "doc1", "entry_date_real") VALUES
(1581, 'MSB/CB/B-71/L&S', 'Lok Sabha/Rajya Sabha Question', 'Rajya Sabha Starred/Unstarred Question Dy. No. S3346', '', '2013-12-13');
INSERT INTO "file_list" ("id", "file_no", "category", "title", "doc1", "entry_date_real") VALUES
(1582, 'MSB/CB/B-71/L&S', 'Lok Sabha/Rajya Sabha Question', 'Rajya Sabha Starred/Unstarred Question Dy. No. U1501', '', '2013-12-11');
INSERT INTO "file_list" ("id", "file_no", "category", "title", "doc1", "entry_date_real") VALUES
(1583, 'MSB/CB/B-71/L&S', 'Lok Sabha/Rajya Sabha Question', 'Ã‚Â  Rajya Sabha Starred Question No. 38 dt 23.11.2011 regarding \"Pilferage of explosives and their misuse\".', '', '2013-08-22');
INSERT INTO "file_list" ("id", "file_no", "category", "title", "doc1", "entry_date_real") VALUES
(1584, 'MSB/CB/B-71/L&S', 'Lok Sabha/Rajya Sabha Question', 'Ã‚Â Ã‚Â  Rajya Sabha Starred Question No. S973.', '', '2013-08-22');
INSERT INTO "file_list" ("id", "file_no", "category", "title", "doc1", "entry_date_real") VALUES
(1585, 'MSB/CB/B-71/L&S', 'Lok Sabha/Rajya Sabha Question', 'Rajya Sabha Provisional Starred/Unstarred Question Dy. No. S3642.', '', '2014-01-30');
INSERT INTO "file_list" ("id", "file_no", "category", "title", "doc1", "entry_date_real") VALUES
(1586, 'MSB/CB/B-71/L&S', 'Lok Sabha/Rajya Sabha Question', 'Rajya Sabha Provisional admitted Starred Question Dy. No. S4581.', '', '2014-02-27');
INSERT INTO "file_list" ("id", "file_no", "category", "title", "doc1", "entry_date_real") VALUES
(1587, 'MSB/CB/B-71/L&S', 'Lok Sabha/Rajya Sabha Question', 'Rajya Sabha Starred Question No. 46.', '', '2014-12-01');
INSERT INTO "file_list" ("id", "file_no", "category", "title", "doc1", "entry_date_real") VALUES
(1588, 'MSB/CB/B-71/L&S', 'Lok Sabha/Rajya Sabha Question', 'Ã‚Â  Rajya Sabha Unstarred Question No. 353.', '', '2014-12-01');
INSERT INTO "file_list" ("id", "file_no", "category", "title", "doc1", "entry_date_real") VALUES
(1589, 'MSB/CB/B-71/L&S', 'Lok Sabha/Rajya Sabha Question', 'Rajya Sabha Unstarred Question No. 367.', '', '2014-12-01');
INSERT INTO "file_list" ("id", "file_no", "category", "title", "doc1", "entry_date_real") VALUES
(1590, 'MSB/CB/B-71/L&S', 'Lok Sabha/Rajya Sabha Question', 'Rajya Sabha Starred/Unstarred Question Dy. No. S4586.', '', '2014-02-07');
INSERT INTO "file_list" ("id", "file_no", "category", "title", "doc1", "entry_date_real") VALUES
(1591, 'MSB/CB/B-71/L&S', 'Lok Sabha/Rajya Sabha Question', 'Rajya Sabha Starred/Unstarred Question Dy.No. S1315.', '', '2014-07-14');
INSERT INTO "file_list" ("id", "file_no", "category", "title", "doc1", "entry_date_real") VALUES
(1592, 'MSB/CB/B-71/L&S', 'Lok Sabha/Rajya Sabha Question', 'Rajya Sabha Unstarred Question No. 800.', '', '2014-07-15');
INSERT INTO "file_list" ("id", "file_no", "category", "title", "doc1", "entry_date_real") VALUES
(1593, 'MSB/CB/B-71/L&S', 'Lok Sabha/Rajya Sabha Question', 'Ã‚Â  Rajya Sabha Provisional Admitted Unstarred Question Diary No. S665', '', '2015-04-07');
INSERT INTO "file_list" ("id", "file_no", "category", "title", "doc1", "entry_date_real") VALUES
(1594, 'MSB/CB/B-71/L&S', 'Lok Sabha/Rajya Sabha Question', 'Rajya Sabha Provisional Admitted Unstarred Question Diary No.Ã‚Â  Ã‚Â S684, S710, S723.', '', '2015-04-07');
INSERT INTO "file_list" ("id", "file_no", "category", "title", "doc1", "entry_date_real") VALUES
(1595, 'MSB/CB/B-71/L&S', 'Lok Sabha/Rajya Sabha Question', 'Rajya Sabha Provisional Admitted Unstarred Question Diary No.Ã‚Â  S714.', '', '2015-04-07');
INSERT INTO "file_list" ("id", "file_no", "category", "title", "doc1", "entry_date_real") VALUES
(1596, 'MSB/CB/B-71/L&S', 'Lok Sabha/Rajya Sabha Question', 'Rajya Sabha Provisional Admitted Unstarred Question Diary No. S1150 for 29th April, 2015.', '', '2015-04-27');
INSERT INTO "file_list" ("id", "file_no", "category", "title", "doc1", "entry_date_real") VALUES
(1597, 'MSB/CB/B-71/L&S', 'Lok Sabha/Rajya Sabha Question', 'Rajya Sabha Privisional Admitted Question S1436.', '', '2015-05-18');
INSERT INTO "file_list" ("id", "file_no", "category", "title", "doc1", "entry_date_real") VALUES
(1598, 'MSB/CB/B-71/L&S', 'Lok Sabha/Rajya Sabha Question', 'Ã‚Â  Rajya Sabha Question Starred/Unstarred Diary No.S1465.', '', '2015-03-03');
INSERT INTO "file_list" ("id", "file_no", "category", "title", "doc1", "entry_date_real") VALUES
(1599, 'MSB/CB/B-71/L&S', 'Lok Sabha/Rajya Sabha Question', 'Rajya Sabha Starred/Unstarred Question Diary No. S2249.', '', '2015-05-08');
INSERT INTO "file_list" ("id", "file_no", "category", "title", "doc1", "entry_date_real") VALUES
(1600, 'MSB/CB/B-71/L&S', 'Lok Sabha/Rajya Sabha Question', 'Rajya Sabha Starred/Unstarred Question Diary No. U771.', '', '2015-03-03');
INSERT INTO "file_list" ("id", "file_no", "category", "title", "doc1", "entry_date_real") VALUES
(1601, 'MSB/CB/B-71/L&S', 'Lok Sabha/Rajya Sabha Question', 'Rajya Sabha Provisional Admitted Unstarred Question Diary No.U927.', '', '2015-03-03');
INSERT INTO "file_list" ("id", "file_no", "category", "title", "doc1", "entry_date_real") VALUES
(1602, 'MSB/CB/B-71/L&S', 'Lok Sabha/Rajya Sabha Question', 'Rajya Sabha Starred/Unstarred Question Dy.No. S2637.', '', '2015-07-31');
INSERT INTO "file_list" ("id", "file_no", "category", "title", "doc1", "entry_date_real") VALUES
(1603, 'MSB/CB/B-71/L&S', 'Lok Sabha/Rajya Sabha Question', 'Rajya Sabha Starred/Unstarred Question Dy. No. S 196.', '', '2016-04-25');
INSERT INTO "file_list" ("id", "file_no", "category", "title", "doc1", "entry_date_real") VALUES
(1604, 'MSB/CB/B-71/L&S', 'Lok Sabha/Rajya Sabha Question', 'Rajya Sabha Starred/Unstarred Question Dy. No. S 1019.', '', '2016-03-21');
INSERT INTO "file_list" ("id", "file_no", "category", "title", "doc1", "entry_date_real") VALUES
(1605, 'MSB/CB/B-71/L&S', 'Lok Sabha/Rajya Sabha Question', 'Rajya Sabha Provisional Starred/Unstarred Question Dy. No. S 1918.', '', '2016-02-26');
INSERT INTO "file_list" ("id", "file_no", "category", "title", "doc1", "entry_date_real") VALUES
(1606, 'MSB/CB/B-71/L&S', 'Lok Sabha/Rajya Sabha Question', 'Rajya Sabha Starred/Unstarred Question Dy. No. U892.', '', '2016-05-09');
INSERT INTO "file_list" ("id", "file_no", "category", "title", "doc1", "entry_date_real") VALUES
(1607, 'MSB/CB/B-71/L&S', 'Lok Sabha/Rajya Sabha Question', 'Rajya Sabha Starred/Unstarred QuestioÃ‚Â n Dy. No. U3200.', '', '2017-03-23');
INSERT INTO "file_list" ("id", "file_no", "category", "title", "doc1", "entry_date_real") VALUES
(1608, 'MSB/CB/B-71/L&S', 'Lok Sabha/Rajya Sabha Question', 'Rajya Sabha Starred/Unstarred Question Dy. No. S6246.', '', '2018-03-21');
INSERT INTO "file_list" ("id", "file_no", "category", "title", "doc1", "entry_date_real") VALUES
(1609, 'MSB/CB/B-71/L&S', 'Lok Sabha/Rajya Sabha Question', 'Rajya Sabha Provisional Admitted Question Diary No.S1185', '', '2019-06-26');
INSERT INTO "file_list" ("id", "file_no", "category", "title", "doc1", "entry_date_real") VALUES
(1610, 'MSB/CB/B-71/L&S', 'Lok Sabha/Rajya Sabha Question', 'Rajya Sabha Starred Question Dy. No. S2575 regarding Citizenship to refugees from Afghanistan, Bangladesh and Pakistan.', '', '2019-07-12');
INSERT INTO "file_list" ("id", "file_no", "category", "title", "doc1", "entry_date_real") VALUES
(1611, 'MSB/CB/B-71/L&S', 'Lok Sabha/Rajya Sabha Question', 'Rajya Sabha Starred/Unstarred Question Dy. No. S4208.', '', '2019-07-15');
INSERT INTO "file_list" ("id", "file_no", "category", "title", "doc1", "entry_date_real") VALUES
(1612, 'MSB/CB/B-71/L&S', 'Lok Sabha/Rajya Sabha Question', 'Rajya Sabha Starred/Unstarred Question Dy. No. U 388.', '', '2020-02-07');
INSERT INTO "file_list" ("id", "file_no", "category", "title", "doc1", "entry_date_real") VALUES
(1613, 'MSB/CB/B-71/L&S', 'Lok Sabha/Rajya Sabha Question', 'Rajya Sabha Provisional Admitted Starred/Unstarred Question Dy.No.U844.', '', '2012-02-23');
INSERT INTO "file_list" ("id", "file_no", "category", "title", "doc1", "entry_date_real") VALUES
(1614, 'MSB/CB/B-71/L&S', 'Lok Sabha/Rajya Sabha Question', 'Rajya Sabha Admitted Unstarred Question No.848.', '', '2012-03-23');
INSERT INTO "file_list" ("id", "file_no", "category", "title", "doc1", "entry_date_real") VALUES
(1615, 'MSB/CB/B-71/L&S', 'Lok Sabha/Rajya Sabha Question', 'Rajya Sabha Question Dy. No. S-1122.', '', '2012-04-25');
INSERT INTO "file_list" ("id", "file_no", "category", "title", "doc1", "entry_date_real") VALUES
(1616, 'MSB/CB/B-71/L&S', 'Lok Sabha/Rajya Sabha Question', 'Sending of required information on Rajya Sabha UnstarredÃ‚Â Question Dy.No. S 1556.', '', '2011-11-02');
INSERT INTO "file_list" ("id", "file_no", "category", "title", "doc1", "entry_date_real") VALUES
(1617, 'MSB/CB/B-71/L&S', 'Lok Sabha/Rajya Sabha Question', 'Rajya Sabha provisional admitted questions Diary No. U2126.', '', '2015-03-03');
INSERT INTO "file_list" ("id", "file_no", "category", "title", "doc1", "entry_date_real") VALUES
(1618, 'MSB/CB/B-71/L&S', 'Lok Sabha/Rajya Sabha Question', 'Q. 2343 PROGRESS OF TRILATERAL ROADÃ‚Â  July 31, 2014', '', '2014-11-24');
INSERT INTO "file_list" ("id", "file_no", "category", "title", "doc1", "entry_date_real") VALUES
(1619, 'MSB/CB/B-71/L&S', 'Lok Sabha/Rajya Sabha Question', 'Rajya Sabha Question Dy. No. S-4890, S-4897.', '', '2011-08-16');
INSERT INTO "file_list" ("id", "file_no", "category", "title", "doc1", "entry_date_real") VALUES
(1620, 'MSB/CB/B-71/L&S', 'Lok Sabha/Rajya Sabha Question', 'Rajya Sabha Question Dy. No. 14480.', '', '2011-08-29');
INSERT INTO "file_list" ("id", "file_no", "category", "title", "doc1", "entry_date_real") VALUES
(1621, 'MSB/CB/B-71/L&S', 'Lok Sabha/Rajya Sabha Question', 'Ã‚Â Ã‚Â  Rajya Sabha Question Dy. No. S-2121.', '', '2007-10-23');
INSERT INTO "file_list" ("id", "file_no", "category", "title", "doc1", "entry_date_real") VALUES
(1622, 'MSB/CB/B-71/L&S', 'Lok Sabha/Rajya Sabha Question', 'Ã‚Â  Rajya Sabha Question Dy. No. S-2121.', '', '2010-08-09');
INSERT INTO "file_list" ("id", "file_no", "category", "title", "doc1", "entry_date_real") VALUES
(1623, 'MSB/CB/B-71/L&S', 'Lok Sabha/Rajya Sabha Question', 'Sending of required information on Rajya Sabha Provisional Starred  Question No. S-798.', '', '2010-11-25');
INSERT INTO "file_list" ("id", "file_no", "category", "title", "doc1", "entry_date_real") VALUES
(1624, 'MSB/CB/B-71/L&S', 'Lok Sabha/Rajya Sabha Question', 'Sending of required information on Rajya Sabha questions No.S-4014 andNo.U543.', '', '2014-01-07');
INSERT INTO "file_list" ("id", "file_no", "category", "title", "doc1", "entry_date_real") VALUES
(1625, 'MSB/CB/B-71/L&S', 'Lok Sabha/Rajya Sabha Question', 'Rajya Sabha Starred Question Dy. No. S-4898, S-4899.', '', '2011-08-16');
INSERT INTO "file_list" ("id", "file_no", "category", "title", "doc1", "entry_date_real") VALUES
(1626, 'MSB/CB/B-71/L&S', 'Lok Sabha/Rajya Sabha Question', 'Rajya Sabha Starred/Unstarred Question No. S1261.', '', '2013-03-11');
INSERT INTO "file_list" ("id", "file_no", "category", "title", "doc1", "entry_date_real") VALUES
(1627, 'MSB/CB/B-71/L&S', 'Lok Sabha/Rajya Sabha Question', 'Ã‚Â  Rajya Sabha Unstarred Question No.367.', '', '2014-12-16');
INSERT INTO "file_list" ("id", "file_no", "category", "title", "doc1", "entry_date_real") VALUES
(1628, 'MSB/CB/B-71/L&S', 'Lok Sabha/Rajya Sabha Question', 'Rajya Sabha Unstarred Question Dy. No. S1403.', '', '2016-02-22');
INSERT INTO "file_list" ("id", "file_no", "category", "title", "doc1", "entry_date_real") VALUES
(1629, 'MSB/CB/B-61/Misc', 'Miscellaneous', 'INTENTION TO ORGANISE PROGRAMMES OF DEMONSTRATIONS, DHARNAS AND RALLIES, ETC. AT PARLIAMENT HOUSE', '', '2020-09-07');
INSERT INTO "file_list" ("id", "file_no", "category", "title", "doc1", "entry_date_real") VALUES
(1630, 'MSB/CB/B-71/L&S', 'Lok Sabha/Rajya Sabha Question', 'Lok Sabha Unstarred Question Dy. No. 4161', '', '2020-03-04');
INSERT INTO "file_list" ("id", "file_no", "category", "title", "doc1", "entry_date_real") VALUES
(1631, 'MSB/CB/B-71/L&S', 'Lok Sabha/Rajya Sabha Question', 'Lok Sabha Unstarred Question Dy. No. 633.', '', '2020-01-31');
INSERT INTO "file_list" ("id", "file_no", "category", "title", "doc1", "entry_date_real") VALUES
(1632, 'MSB/CB/B-71/L&S', 'Lok Sabha/Rajya Sabha Question', 'Reply of Parliament Questions.', '', '2010-09-29');
INSERT INTO "file_list" ("id", "file_no", "category", "title", "doc1", "entry_date_real") VALUES
(1633, 'MSB/CB/B-71/L&S', 'Lok Sabha/Rajya Sabha Question', 'Rajya Sabha Question No. 348,405,351 and 403.', '', '2020-02-13');
INSERT INTO "file_list" ("id", "file_no", "category", "title", "doc1", "entry_date_real") VALUES
(1634, 'MSB/CB/B-72/AQ', 'Assembly Question', 'Assembly Starred Question No. 66.', '', '2015-03-11');
INSERT INTO "file_list" ("id", "file_no", "category", "title", "doc1", "entry_date_real") VALUES
(1635, 'MSB/CB/B-72/AQ', 'Assembly Question', 'Assembly Starred Question No. 259', '', '2013-03-04');
INSERT INTO "file_list" ("id", "file_no", "category", "title", "doc1", "entry_date_real") VALUES
(1636, 'MSB/CB/B-72/AQ', 'Assembly Question', 'Assembly Starred Question No. 259', '', '2013-03-04');
INSERT INTO "file_list" ("id", "file_no", "category", "title", "doc1", "entry_date_real") VALUES
(1637, 'MSB/CB/B-72/AQ', 'Assembly Question', 'Assembly Starred Question No. 197', '', '2013-03-18');
INSERT INTO "file_list" ("id", "file_no", "category", "title", "doc1", "entry_date_real") VALUES
(1638, 'MSB/CB/B-72/AQ', 'Assembly Question', 'Assembly Starred Question  No. 197', '', '2013-03-04');
INSERT INTO "file_list" ("id", "file_no", "category", "title", "doc1", "entry_date_real") VALUES
(1639, 'MSB/CB/B-72/AQ', 'Assembly Question', 'Assembly Starred Question No. 607', '', '2013-03-13');
INSERT INTO "file_list" ("id", "file_no", "category", "title", "doc1", "entry_date_real") VALUES
(1640, 'MSB/CB/B-72/AQ', 'Assembly Question', 'Assembly Starred Question No. 607', '', '2013-03-06');
INSERT INTO "file_list" ("id", "file_no", "category", "title", "doc1", "entry_date_real") VALUES
(1641, 'MSB/CB/B-72/AQ', 'Assembly Question', 'CONFIDENTIAL\r\n\r\nOFFICE OF THE SUPERINTENDENT OF POLICE\r\nCID(SB);
INSERT INTO "file_list" ("id", "file_no", "category", "title", "doc1", "entry_date_real") VALUES
(MIZORAM, AIZAWL\r\n\r\n\r\nNo. MSB/CB/B-72/09 		              Dated Aizawl, the            March. 2013.\r\n\r\nTo,\r\n\r\n			The Asst. Inspector General of Police -I\r\n		', '', '2013-03-05');
INSERT INTO "file_list" ("id", "file_no", "category", "title", "doc1", "entry_date_real") VALUES
(1642, 'MSB/CB/B-72/AQ', 'Assembly Question', 'Assembly Starred Question  No. 316', '', '2013-03-05');
INSERT INTO "file_list" ("id", "file_no", "category", "title", "doc1", "entry_date_real") VALUES
(1643, 'MSB/CB/B-72/AQ', 'Assembly Question', 'Assembly Starred Question No. 36.', '', '2015-03-24');
INSERT INTO "file_list" ("id", "file_no", "category", "title", "doc1", "entry_date_real") VALUES
(1644, 'MSB/CB/B-72/AQ', 'Assembly Question', 'RUKBONA-A INHNAMHNAWIH MAN TAWH TE', '', '2015-03-16');
INSERT INTO "file_list" ("id", "file_no", "category", "title", "doc1", "entry_date_real") VALUES
(1645, 'MSB/CB/B-72/AQ', 'Assembly Question', 'INRUKBO/KIDNAPPING CHUNGCHANG', '', '2017-03-14');
INSERT INTO "file_list" ("id", "file_no", "category", "title", "doc1", "entry_date_real") VALUES
(1646, 'MSB/CB/B-72/AQ', 'Assembly Question', 'Ã‚Â  Assembly Starred Question No. 263 regarding insurgency in Mizoram.', '', '2017-03-17');
INSERT INTO "file_list" ("id", "file_no", "category", "title", "doc1", "entry_date_real") VALUES
(1647, 'MSB/CB/B-72/AQ', 'Assembly Question', 'Ã‚Â  Assembly Starred Question No. 263 regarding insurgency in Mizoram.', '', '2017-03-17');
INSERT INTO "file_list" ("id", "file_no", "category", "title", "doc1", "entry_date_real") VALUES
(1648, 'MSB/CB/B-72/AQ', 'Assembly Question', 'INRUKBO/KIDNAPPING CHUNGCHANG', '', '2017-03-14');
INSERT INTO "file_list" ("id", "file_no", "category", "title", "doc1", "entry_date_real") VALUES
(1649, 'MSB/CB/B-72/AQ', 'Assembly Question', 'KIDNAPPING DURING 1999 TO 2008', '', '2014-11-24');
INSERT INTO "file_list" ("id", "file_no", "category", "title", "doc1", "entry_date_real") VALUES
(1650, 'MSB/CB/B-72/AQ', 'Assembly Question', 'Write-upÃ‚Â  onÃ‚Â  HomeÃ‚Â  DepartmentÃ¢â‚¬â„¢s demands and Wind-up Speech of HonÃ¢â‚¬â„¢bleÃ‚Â  HomeÃ‚Â  MinisterÃ‚Â  forÃ‚Â  theÃ‚Â  FifteenthÃ‚Â  SessionÃ‚Â  of the Seventh Legislative Assembly of Mizoram.', '', '2018-03-16');
INSERT INTO "file_list" ("id", "file_no", "category", "title", "doc1", "entry_date_real") VALUES
(1651, 'MSB/CB/B-72/AQ', 'Assembly Question', 'Assembly Starred Question No. 46.', '', '2018-03-06');
INSERT INTO "file_list" ("id", "file_no", "category", "title", "doc1", "entry_date_real") VALUES
(1652, 'MSB/CB/B-72/AQ', 'Assembly Question', 'SEIZURE OF ARMS & AMMUNITIONS DURING 2017 Ã¢â‚¬â€œ 2018 (TILL DATE)', '', '2018-03-16');
INSERT INTO "file_list" ("id", "file_no", "category", "title", "doc1", "entry_date_real") VALUES
(1653, 'MSB/CB/B-72/AQ', 'Assembly Question', 'ARRESTED FOREIGNERS/INSURGENTS WEF 2012-2018', '', '2019-03-12');
INSERT INTO "file_list" ("id", "file_no", "category", "title", "doc1", "entry_date_real") VALUES
(1654, 'MSB/CB/B-72/AQ', 'Assembly Question', 'Assembly Starred Question no. 165.', '', '2019-11-14');
INSERT INTO "file_list" ("id", "file_no", "category", "title", "doc1", "entry_date_real") VALUES
(1655, 'MSB/CB/B-72/AQ', 'Assembly Question', 'Ã‚Â Ã‚Â  Assembly Starred Question No. 104.', '', '2019-03-12');
INSERT INTO "file_list" ("id", "file_no", "category", "title", "doc1", "entry_date_real") VALUES
(1656, 'MSB/CB/B-72/AQ', 'Assembly Question', 'AKLAS UDDIN', '', '2015-07-14');
INSERT INTO "file_list" ("id", "file_no", "category", "title", "doc1", "entry_date_real") VALUES
(1657, 'MSB/CB/B-72/AQ', 'Assembly Question', 'AKLAS UDDIN', '', '2015-07-14');
INSERT INTO "file_list" ("id", "file_no", "category", "title", "doc1", "entry_date_real") VALUES
(1658, 'MSB/CB/B-72/AQ', 'Assembly Question', 'Remarks of DGP(M) (Aklas Uddin)', '', '2015-07-15');
INSERT INTO "file_list" ("id", "file_no", "category", "title", "doc1", "entry_date_real") VALUES
(1659, 'MSB/CB/B-72/AQ', 'Assembly Question', 'LATEST SET-UP OF HPC(D) AS ON 9.3.2015 -COMPILED BY FIELD NRANCH', '', '2015-03-27');
INSERT INTO "file_list" ("id", "file_no", "category", "title", "doc1", "entry_date_real") VALUES
(1660, 'MSB/CB/B-72/AQ', 'Assembly Question', 'NOTES ON HPC(D) W.E.F. 2014 TO TILL DATE', '', '2015-05-29');
INSERT INTO "file_list" ("id", "file_no", "category", "title", "doc1", "entry_date_real") VALUES
(1661, 'MSB/CB/B-72/AQ', 'Assembly Question', 'NOTEWORTHY ACTIVITIES OF HPC(D) W.E.F. 2008', '', '2015-05-21');
INSERT INTO "file_list" ("id", "file_no", "category", "title", "doc1", "entry_date_real") VALUES
(1662, 'MSB/CB/A-132', 'Terrorist related matters', 'Ã‚Â  Measures to strengthen the National Anti-Terrorism Framework-Ã‚Â  regarding.', '', '2015-07-07');
INSERT INTO "file_list" ("id", "file_no", "category", "title", "doc1", "entry_date_real") VALUES
(1663, 'MSB/CB/A-132', 'Terrorist related matters', 'MEASURES TO STRENGTHEN THE NATIONAL ANTI-TERRORISM FRAMEWORK', '', '2016-07-19');
INSERT INTO "file_list" ("id", "file_no", "category", "title", "doc1", "entry_date_real") VALUES
(1664, 'MSB/CB/A-62(B)', 'Mara Peoples Army', 'Mara People''s Army (MPA) Training in Churachandpur, Manipur.', '', '2015-07-09');
INSERT INTO "file_list" ("id", "file_no", "category", "title", "doc1", "entry_date_real") VALUES
(1665, 'MSB/CB/B-72/AQ', 'Assembly Question', 'Concerns of the State Government with respect to the current state of India- Myanmar Ã‚Â Ã‚Â border policing', '', '2015-04-13');
INSERT INTO "file_list" ("id", "file_no", "category", "title", "doc1", "entry_date_real") VALUES
(1666, 'MSB/CB/B-72/AQ', 'Assembly Question', 'MIZORAM CHHUNGA HEL MAN TEÃ‚Â  WEF. 1997 - 2014', '', '2015-04-10');
INSERT INTO "file_list" ("id", "file_no", "category", "title", "doc1", "entry_date_real") VALUES
(1667, 'MSB/CB/B-26/HPC(D)', 'Correspondence on HPC(D) B-114', 'HPC-D Area of Command', '', '2015-03-31');
INSERT INTO "file_list" ("id", "file_no", "category", "title", "doc1", "entry_date_real") VALUES
(1668, 'MSB/CB/B-26/HPC(D)', 'Correspondence on HPC(D) B-114', 'ARMS AND AMMUNITION SNATCHED AWAY BY HPC(D) OUTFIT', '', '2010-01-01');
INSERT INTO "file_list" ("id", "file_no", "category", "title", "doc1", "entry_date_real") VALUES
(1669, 'MSB/CB/B-26/HPC(D)', 'Correspondence on HPC(D) B-114', 'BACKGROUND NOTE OF HPC(D)', '', '2015-04-01');
INSERT INTO "file_list" ("id", "file_no", "category", "title", "doc1", "entry_date_real") VALUES
(1670, 'MSB/CB/B-26(B)', 'HPC(D)  Lalhmingthanga Sanate faction', 'HPC(D)', '', '2010-01-03');
INSERT INTO "file_list" ("id", "file_no", "category", "title", "doc1", "entry_date_real") VALUES
(1671, 'MSB/CB/B-26/HPC(D)', 'Correspondence on HPC(D) B-114', 'Writeup on HPC(D)', '', '2010-01-03');
INSERT INTO "file_list" ("id", "file_no", "category", "title", "doc1", "entry_date_real") VALUES
(1672, 'MSB/CB/B-85/Arms', 'Arms, Smuggling etc.', 'Arms and ammunition seized', '', '2015-05-06');
INSERT INTO "file_list" ("id", "file_no", "category", "title", "doc1", "entry_date_real") VALUES
(1673, 'MSB/CB/B-69/SPL', 'Special Report correspondence', 'Dated 31st July, 2009 (arrest of DHD (J) leader Jewel Gorlossa by Assam Police in Bangalore on 5.6.09)', '', '2015-05-06');
INSERT INTO "file_list" ("id", "file_no", "category", "title", "doc1", "entry_date_real") VALUES
(1674, 'MSB/CB/B-85/Arms', 'Arms, Smuggling etc.', 'INTERROGATION REPORT OF VANNEICHEM6.5.2014', '', '2015-05-06');
INSERT INTO "file_list" ("id", "file_no", "category", "title", "doc1", "entry_date_real") VALUES
(1675, 'MSB/CB/B-72/AQ', 'Assembly Question', 'PERSONS ABDUCTED / KIDNAPPED BY INSURGENT IN MIZORAM 2001 - TILL DATE', '', '2015-05-13');
INSERT INTO "file_list" ("id", "file_no", "category", "title", "doc1", "entry_date_real") VALUES
(1676, 'MSB/CB/B-72/AQ', 'Assembly Question', 'AMBUSH LAID BY HPC(D)', '', '2015-05-13');
INSERT INTO "file_list" ("id", "file_no", "category", "title", "doc1", "entry_date_real") VALUES
(1677, 'MSB/CB/C-95', 'Chakma Affairs', 'Ã‚Â  NOTES ON CHAKMAS OF MIZORAM', '', '2015-03-16');
INSERT INTO "file_list" ("id", "file_no", "category", "title", "doc1", "entry_date_real") VALUES
(1678, 'MSB/CB/B-72/AQ', 'Assembly Question', 'ACHIEVEMENT OF CID(SB) DURING THE PERIOD FROM 1.11.2014 TO 31.3.2015', '', '2015-04-23');
INSERT INTO "file_list" ("id", "file_no", "category", "title", "doc1", "entry_date_real") VALUES
(1679, 'MSB/CB/B-72/AQ', 'Assembly Question', 'ARMS AND AMMUNITION SNATCHED AWAY BY HPC(D) OUTFIT ON 28.03.2015', '', '2015-05-12');
INSERT INTO "file_list" ("id", "file_no", "category", "title", "doc1", "entry_date_real") VALUES
(1680, 'MSB/CB/B-72/AQ', 'Assembly Question', 'SEIZURE BY CID(SB) DURING 1ST APRIL 2014 TO 31ST MARCH 2015', '', '2015-05-29');
INSERT INTO "file_list" ("id", "file_no", "category", "title", "doc1", "entry_date_real") VALUES
(1681, 'MSB/CB/B-72/AQ', 'Assembly Question', 'BORDER PILLAR', '', '2015-05-01');
INSERT INTO "file_list" ("id", "file_no", "category", "title", "doc1", "entry_date_real") VALUES
(1682, 'MSB/CB/B-169', 'Indo-Myanmar Border Trade/KMMTTP', 'India - Myanmar border policing.', '', '2015-05-01');
INSERT INTO "file_list" ("id", "file_no", "category", "title", "doc1", "entry_date_real") VALUES
(1683, 'MSB/CB/B-72/AQ', 'Assembly Question', 'POLICE PERSONNEL, CPMF AND CIVILIANS KILLED DURING 1998 - 2008 BY INSURGENT GROUP', '', '2015-05-11');
INSERT INTO "file_list" ("id", "file_no", "category", "title", "doc1", "entry_date_real") VALUES
(1684, 'MSB/CB/B-72/AQ', 'Assembly Question', 'State where cow slaughter is banned', '', '2015-05-29');
INSERT INTO "file_list" ("id", "file_no", "category", "title", "doc1", "entry_date_real") VALUES
(1685, 'MSB/CB/B-72/AQ', 'Assembly Question', 'Comments/Action takenÃ‚Â  reports/present status of Mizoram Police on DGPs/IGPs ConferenceÃ¢â‚¬â„¢s recommendation', '', '2015-05-19');
INSERT INTO "file_list" ("id", "file_no", "category", "title", "doc1", "entry_date_real") VALUES
(1686, 'MSB/CB/B-72/AQ', 'Assembly Question', 'Action Taken Report:\r\n\r\nTwo militants outfits namely Hmar People''s Convention-Democracy(HPC-D) and Ã‚Â Bru Democratic Front of Mizoram (BDFM) backed by Tripura-based National Liberation Front of Tripura(NLFT', '', '2015-05-14');
INSERT INTO "file_list" ("id", "file_no", "category", "title", "doc1", "entry_date_real") VALUES
(1687, 'MSB/CB/A-118', 'Correspondence on Reng/Bru refugees/Bru repatriation', 'Enquiry Report on Fake Relief Delivery Card.', '', '2015-07-01');
INSERT INTO "file_list" ("id", "file_no", "category", "title", "doc1", "entry_date_real") VALUES
(1688, 'MSB/CB/C-96', 'Hmar Affairs/Hmar Welfare Committee', 'Hmar Inpui 7th Assembly Hmarkhawlien ah nei\r\nVIRTHLI HMARÃ‚Â Ã‚Â ', '', '2015-05-18');
INSERT INTO "file_list" ("id", "file_no", "category", "title", "doc1", "entry_date_real") VALUES
(1689, 'MSB/CB/B-26/HPC(D)', 'Correspondence on HPC(D) B-114', 'INTERROGATION WITH HMARHMASAN HMAR (20)', '', '2009-01-17');
INSERT INTO "file_list" ("id", "file_no", "category", "title", "doc1", "entry_date_real") VALUES
(1690, 'MSB/CB/B-72/AQ', 'Assembly Question', 'Forwarding of Warrant of Arrest issued by CJM, AizawlÃ‚Â  for HPC''D'' Cadres involved in the recent ambush.', '', '2015-05-22');
INSERT INTO "file_list" ("id", "file_no", "category", "title", "doc1", "entry_date_real") VALUES
(1692, 'MSB/CB/B-19(A)', 'Security Threat Perception', 'Assessment of threat perception with regard to Pi L.Tochhawng, State Election Commissioner..', '', '2015-07-17');
INSERT INTO "file_list" ("id", "file_no", "category", "title", "doc1", "entry_date_real") VALUES
(1693, 'MSB/CB/C-275', 'Federation of Govt.School Teacher Association (FMGST)/SSA/SEWC', 'RMSA LABORATORY ASSISTANT AND CLERK (HUNGER STRIKE) PARTICIPANT', '', '2015-04-28');
INSERT INTO "file_list" ("id", "file_no", "category", "title", "doc1", "entry_date_real") VALUES
(1694, 'MSB/CB/B-19(A)', 'Security Threat Perception', 'Verification of character and antecedent - regarding.', '', '2015-07-09');
INSERT INTO "file_list" ("id", "file_no", "category", "title", "doc1", "entry_date_real") VALUES
(1695, 'MSB/CB/A-128', 'Governor Correspondence', 'MIZORAM GOVERNOR NI TAWHTE', '', '2015-03-31');
INSERT INTO "file_list" ("id", "file_no", "category", "title", "doc1", "entry_date_real") VALUES
(1696, 'MSB/CB/B-72/AQ', 'Assembly Question', 'MNF SAWRKAR LAI 1998-2008 CHHUNGA INRUKBONA THLEN DAN', '', '2015-03-24');
INSERT INTO "file_list" ("id", "file_no", "category", "title", "doc1", "entry_date_real") VALUES
(1697, 'MSB/CB/A-84', 'Achievements of CID(SB)', 'Achievement report of CID (SB) during 1.1.2015 to 30.6.2015', '', '2015-07-08');
INSERT INTO "file_list" ("id", "file_no", "category", "title", "doc1", "entry_date_real") VALUES
(1698, 'MSB/CB/B-19(A)', 'Security Threat Perception', 'Verification/ascertainment.( character certificate of Mr. Ngurthantluong S/o Lalsiemlien of Ngurte village, Churachanpur, Manipur duly signed by Emmanuel L. Fimate MPS, Sub-Divisional Police Officer, Churachanpur, Manipu', '', '2015-07-17');
INSERT INTO "file_list" ("id", "file_no", "category", "title", "doc1", "entry_date_real") VALUES
(1699, 'MSB/CB/A-128', 'Governor Correspondence', 'Visit of Pu Zoramthanga, President MNF Party in connectionÃ‚Â  with Peace talk in Myanmar regarding.', '', '2015-03-03');
INSERT INTO "file_list" ("id", "file_no", "category", "title", "doc1", "entry_date_real") VALUES
(1700, 'MSB/CB/A-158', 'Union Territory Demand Committee', 'Special Report regarding formation of Phawngpui UT Demand Committee.', '', '2015-03-17');
INSERT INTO "file_list" ("id", "file_no", "category", "title", "doc1", "entry_date_real") VALUES
(1701, 'MSB/CB/C-67', 'Police Correspondence', 'POLICE LALTE', '', '2015-06-02');
INSERT INTO "file_list" ("id", "file_no", "category", "title", "doc1", "entry_date_real") VALUES
(1702, 'MSB/CB/A-84', 'Achievements of CID(SB)', 'Note on Achievement.', '', '2015-04-23');
INSERT INTO "file_list" ("id", "file_no", "category", "title", "doc1", "entry_date_real") VALUES
(1703, 'MSB/CB/B-26/HPC(D)', 'Correspondence on HPC(D) B-114', 'Proposal to declare Hmar People Convention (Democratic) (HPC ''D'') as  an unlawful organisation.', '', '2015-03-04');
INSERT INTO "file_list" ("id", "file_no", "category", "title", "doc1", "entry_date_real") VALUES
(1704, 'MSB/CB/B-85/Arms', 'Arms, Smuggling etc.', 'Regarding smuggling and movement of illegal arms and ammunitions.', '', '2015-07-10');
INSERT INTO "file_list" ("id", "file_no", "category", "title", "doc1", "entry_date_real") VALUES
(1705, 'MSB/CB/B-72/AQ', 'Assembly Question', 'RUKBONA-A INHNAMHNAWIH MAN TAWH TE :', '', '2015-03-11');
INSERT INTO "file_list" ("id", "file_no", "category", "title", "doc1", "entry_date_real") VALUES
(1706, 'MSB/CB/B-85/Arms', 'Arms, Smuggling etc.', 'Silai man chungchang.', '', '2015-06-04');
INSERT INTO "file_list" ("id", "file_no", "category", "title", "doc1", "entry_date_real") VALUES
(1707, 'MSB/CB/B-26/HPC(D)', 'Correspondence on HPC(D) B-114', 'Statement-Lalrinsanga', '', '2015-06-01');
INSERT INTO "file_list" ("id", "file_no", "category", "title", "doc1", "entry_date_real") VALUES
(1708, 'MSB/CB/B-26/HPC(D)', 'Correspondence on HPC(D) B-114', 'Requirement of necessary documents in relation with HPC(D).', '', '2015-04-20');
INSERT INTO "file_list" ("id", "file_no", "category", "title", "doc1", "entry_date_real") VALUES
(1709, 'MSB/CB/B-19(A)', 'Security Threat Perception', 'Assessment of threat perception Report.', '', '2015-04-20');
INSERT INTO "file_list" ("id", "file_no", "category", "title", "doc1", "entry_date_real") VALUES
(1710, 'MSB/CB/B-158', 'United Democratic Leberation Front/ Army (UDLF)', 'UNITED DEMOCRATIC LIBERATION FRONT RAJESH CHORKHY FACTION (UDLFR)', '', '2015-06-01');
INSERT INTO "file_list" ("id", "file_no", "category", "title", "doc1", "entry_date_real") VALUES
(1711, 'MSB/CB/A-158', 'Union Territory Demand Committee', 'ReportÃ‚Â  RegardingÃ‚Â  formationÃ‚Â  ofÃ‚Â  PhawngpuiÃ‚Â  UTÃ‚Â  DemandÃ‚Â  Committee.', '', '2015-03-17');
INSERT INTO "file_list" ("id", "file_no", "category", "title", "doc1", "entry_date_real") VALUES
(1712, 'MSB/CB/A-128', 'Governor Correspondence', 'Visit of Myanmar by Mr. Zoramthanga, President, MNF Party in connection with Peace talk in Myanmar - regarding.', '', '2015-03-17');
INSERT INTO "file_list" ("id", "file_no", "category", "title", "doc1", "entry_date_real") VALUES
(1713, 'MSB/CB/B-173', 'Bru National Development Liberation Front of Mizoram (BNDLFM)', 'BRU DEMOCRATIC FRONT OF MIZORAM (BDFM)', '', '2015-04-27');
INSERT INTO "file_list" ("id", "file_no", "category", "title", "doc1", "entry_date_real") VALUES
(1714, 'MSB/CB/B-72/AQ', 'Assembly Question', 'SEIZURE OF ARMS & AMMUNITIONS\r\n2008 - 2012', '', '2012-07-03');
INSERT INTO "file_list" ("id", "file_no", "category", "title", "doc1", "entry_date_real") VALUES
(1715, 'MSB/CB/B-72/AQ', 'Assembly Question', 'Assembly Starred Question No. 40.(ADBI Infrastructure hnathawkte June 6th a rukbo)', '', '2012-03-14');
INSERT INTO "file_list" ("id", "file_no", "category", "title", "doc1", "entry_date_real") VALUES
(1716, 'MSB/CB/B-72/AQ', 'Assembly Question', 'Assembly Starred Question No. 45.(Mizoram-ah Pawl Sorkar dodal zawnga khawsa leh mahni a thuneihna in pe chawp an awm em?)', '', '2014-11-16');
INSERT INTO "file_list" ("id", "file_no", "category", "title", "doc1", "entry_date_real") VALUES
(1717, 'MSB/CB/B-72/AQ', 'Assembly Question', 'Kum 2011-2012, 2012-2013, 2013-2014, 2014-2015 chhungin Mizoram-ah Helho/Misual in vawi engzatnge mi an rukbo(kidnap) ?', '', '2014-11-06');
INSERT INTO "file_list" ("id", "file_no", "category", "title", "doc1", "entry_date_real") VALUES
(1718, 'MSB/CB/B-72/AQ', 'Assembly Question', 'HPC(D) ten an Demand Area ah Village Council 12 atangin pawisa an khawn tih hi a dik em?', '', '2012-07-05');
INSERT INTO "file_list" ("id", "file_no", "category", "title", "doc1", "entry_date_real") VALUES
(1719, 'MSB/CB/B-72/AQ', 'Assembly Question', 'Kum 2008-2012 chhung hian Mizoram Police(Sawrkar) hian Arms & Ammuition chi hrang hrang engzatnge an man tawh. Year Wise in min hrilh thei em?', '', '2012-07-04');
INSERT INTO "file_list" ("id", "file_no", "category", "title", "doc1", "entry_date_real") VALUES
(1720, 'MSB/CB/B-72/AQ', 'Assembly Question', 'Mizoram chhungah dan lova pawisa khawn thin an awm tih sawrkarin a hria em?', '', '2014-11-11');
INSERT INTO "file_list" ("id", "file_no", "category", "title", "doc1", "entry_date_real") VALUES
(1721, 'MSB/CB/B-72/AQ', 'Assembly Question', 'SEIZURE OF ARMS & AMMUNITIONS\r\n2008 - 2012', '', '2012-07-03');
INSERT INTO "file_list" ("id", "file_no", "category", "title", "doc1", "entry_date_real") VALUES
(1722, 'MSB/CB/B-72/AQ', 'Assembly Question', 'Kum 2006-2008 chhung khan Mizoram State chhungah kidnap vawi engzat nge thleng?', '', '2011-07-18');
INSERT INTO "file_list" ("id", "file_no", "category", "title", "doc1", "entry_date_real") VALUES
(1723, 'MSB/CB/B-72/AQ', 'Assembly Question', 'MZP in Vairengte thlanga Zo Run an sak kha Mizoram Police in an thiat.', '', '2012-03-15');
INSERT INTO "file_list" ("id", "file_no", "category", "title", "doc1", "entry_date_real") VALUES
(1724, 'MSB/CB/B-72/AQ', 'Assembly Question', 'Ã‚Â  \"HPC(D) te hi Central Sorkar nena direct-a inbia an nih avangin State Sorkar nena inbe tur kan ni lo\" tih Chief Minister-in a sawi kha thudik a ni em?', '', '2012-03-14');
INSERT INTO "file_list" ("id", "file_no", "category", "title", "doc1", "entry_date_real") VALUES
(1725, 'MSB/CB/A-20(A)', 'Explosive recoveries/Bomb Explosion (Monthly Return)', 'Monthly return on recoveries of IEDs from bombing incidents or intended bombing incidents.', '', '2021-08-04');
INSERT INTO "file_list" ("id", "file_no", "category", "title", "doc1", "entry_date_real") VALUES
(1726, 'MSB/CB/A-20(A)', 'Explosive recoveries/Bomb Explosion (Monthly Return)', 'Monthly return on recoveries of IEDs from bombing incidents or intended bombing incidents.', '', '2021-07-01');
INSERT INTO "file_list" ("id", "file_no", "category", "title", "doc1", "entry_date_real") VALUES
(1727, 'MSB/CB/A-20(A)', 'Explosive recoveries/Bomb Explosion (Monthly Return)', 'Monthly return on recoveries of IEDs from bombing incidents or intended bombing incidents.', '', '2021-06-07');
INSERT INTO "file_list" ("id", "file_no", "category", "title", "doc1", "entry_date_real") VALUES
(1728, 'MSB/CB/A-20(A)', 'Explosive recoveries/Bomb Explosion (Monthly Return)', 'Report on Seizure of Explosive Substances at Farkawn, Champhai District', '', '2021-07-17');
INSERT INTO "file_list" ("id", "file_no", "category", "title", "doc1", "entry_date_real") VALUES
(1729, 'MSB/CB/A-155', 'Quarterly FP Record Slip', 'War Book Comments', '', '2021-06-21');
INSERT INTO "file_list" ("id", "file_no", "category", "title", "doc1", "entry_date_real") VALUES
(1730, 'MSB/CB/A-59', 'Arakan Liberation Party(ALP)/Arakan Liberation Army(ALA)/Arakan Army(AA)', 'Reports regarding movements/activities of Arakan Army(AA) within Mizoram :', '', '2021-08-26');
INSERT INTO "file_list" ("id", "file_no", "category", "title", "doc1", "entry_date_real") VALUES
(1731, 'MSB/CB/A-59', 'Arakan Liberation Party(ALP)/Arakan Liberation Army(ALA)/Arakan Army(AA)', 'report regarding movements/activities of Arakan Army (AA) within Mizoram', '', '2021-08-26');
INSERT INTO "file_list" ("id", "file_no", "category", "title", "doc1", "entry_date_real") VALUES
(1732, 'MSB/CB/A-59', 'Arakan Liberation Party(ALP)/Arakan Liberation Army(ALA)/Arakan Army(AA)', 'Reports regarding movements/activities of Arakan Army(AA) within Mizoram :', '', '2021-08-25');
INSERT INTO "file_list" ("id", "file_no", "category", "title", "doc1", "entry_date_real") VALUES
(1733, 'MSB/CB/A-59', 'Arakan Liberation Party(ALP)/Arakan Liberation Army(ALA)/Arakan Army(AA)', 'Reports regarding movements/activities of Arakan Army(AA) within Mizoram :', '', '2021-08-25');
INSERT INTO "file_list" ("id", "file_no", "category", "title", "doc1", "entry_date_real") VALUES
(1734, 'MSB/CB/A-59', 'Arakan Liberation Party(ALP)/Arakan Liberation Army(ALA)/Arakan Army(AA)', 'Hon''ble Governor''s briefing Ã¢â‚¬â€œ regarding', '', '2021-08-23');
INSERT INTO "file_list" ("id", "file_no", "category", "title", "doc1", "entry_date_real") VALUES
(1735, 'MSB/CB/B-49/BOP', 'Border Out Post', 'STRENGTH OF ASSAM RIFLE AND BORDER SECURITY FORCE (BSF) IN MIZORAM AS ON NOVEMBER, 2014', '', '2014-11-20');
INSERT INTO "file_list" ("id", "file_no", "category", "title", "doc1", "entry_date_real") VALUES
(1736, 'MSB/CB/A-118', 'Correspondence on Reng/Bru refugees/Bru repatriation', 'BRU MILITANCY', '', '2014-11-21');
INSERT INTO "file_list" ("id", "file_no", "category", "title", "doc1", "entry_date_real") VALUES
(1737, 'MSB/CB/C-118', 'CADC(Chakma Autonomous District Council)', 'BRIEF HIGHLIGHT OF THE EVENTS OF CHAKMA ETHNIC ISSUE DURING- 2014', '', '2014-11-21');
INSERT INTO "file_list" ("id", "file_no", "category", "title", "doc1", "entry_date_real") VALUES
(1738, 'MSB/CB/B-74(C)', 'DGP concern file/circular', 'WRITE UP FOR DGPs MEETING -2014 AT GUWAHATI', '', '2014-11-24');
INSERT INTO "file_list" ("id", "file_no", "category", "title", "doc1", "entry_date_real") VALUES
(1739, 'MSB/CB/B-74(C)', 'DGP concern file/circular', 'WRITE UP FOR DGPs MEETING -2014 AT GUWAHATI', '', '2014-11-25');
INSERT INTO "file_list" ("id", "file_no", "category", "title", "doc1", "entry_date_real") VALUES
(1740, 'MSB/CB/B-26/HPC(D)', 'Correspondence on HPC(D) B-114', 'Hmar PeopleÃ¢â‚¬â„¢s Convention (Democrats)', '', '2014-11-18');
INSERT INTO "file_list" ("id", "file_no", "category", "title", "doc1", "entry_date_real") VALUES
(1741, 'MSB/CB/B-169', 'Indo-Myanmar Border Trade/KMMTTP', 'KALADAN MULTIMODAL TRANSIT TRANSPORT PROJECT', '', '2014-11-24');
INSERT INTO "file_list" ("id", "file_no", "category", "title", "doc1", "entry_date_real") VALUES
(1742, 'MSB/CB/B-49/BOP', 'Border Out Post', 'LIST OF BOP MANNED BY MAP/IR BN, ASSAM RIFLE & BSF IN MIZORAM ( as on NovemberÃ¢â‚¬â„¢2014)', '', '2014-11-18');
INSERT INTO "file_list" ("id", "file_no", "category", "title", "doc1", "entry_date_real") VALUES
(1743, 'MSB/CB/B-26/HPC(D)', 'Correspondence on HPC(D) B-114', 'MAJOR CRIMINAL ACTIVITIES OF UNDERGROUND GROUPS WITHIN MIZORAM DURING 2004-2014(as on October, 2014)', '', '2014-11-18');
INSERT INTO "file_list" ("id", "file_no", "category", "title", "doc1", "entry_date_real") VALUES
(1744, 'MSB/CB/B-26/HPC(D)', 'Correspondence on HPC(D) B-114', 'BRIEF INFORMATION OF UNDERGROUND GROUPS HAVING ACTVITIES WITHIN MIZORAM', '', '2014-11-21');
INSERT INTO "file_list" ("id", "file_no", "category", "title", "doc1", "entry_date_real") VALUES
(1745, 'MSB/CB/B-169', 'Indo-Myanmar Border Trade/KMMTTP', 'ACT EAST POLICY - SECURITY CHALLENGES AND PREPAREDNESS', '', '2020-06-27');
INSERT INTO "file_list" ("id", "file_no", "category", "title", "doc1", "entry_date_real") VALUES
(1746, 'MSB/CB/B-169', 'Indo-Myanmar Border Trade/KMMTTP', 'ACT EAST POLICY - SECURITY CHALLENGES AND PREPAREDNESS', '', '2020-06-27');
INSERT INTO "file_list" ("id", "file_no", "category", "title", "doc1", "entry_date_real") VALUES
(1747, 'MSB/CB/A-5', 'Indo-Myanmar Border Affairs(Intelligence)', 'Proposed Agenda for 3rd Border Liaison Officer meeting', '', '2019-10-21');
INSERT INTO "file_list" ("id", "file_no", "category", "title", "doc1", "entry_date_real") VALUES
(1748, 'MSB/CB/A-5', 'Indo-Myanmar Border Affairs(Intelligence)', 'INDO-MYANMAR BORDER POLICING', '', '2015-05-01');
INSERT INTO "file_list" ("id", "file_no", "category", "title", "doc1", "entry_date_real") VALUES
(1749, 'MSB/CB/A-5', 'Indo-Myanmar Border Affairs(Intelligence)', 'REGIONAL SECURITY STRATEGIES CONFERENCE - 2021 FOR NORTH EAST', '', '2021-04-06');
INSERT INTO "file_list" ("id", "file_no", "category", "title", "doc1", "entry_date_real") VALUES
(1750, 'MSB/CB/B-169', 'Indo-Myanmar Border Trade/KMMTTP', 'STATUS ON IMPLEMENTATION OF KALADAN MULTI-MODAL TRANSIT TRANSPORT PROJECT (KMMTTP)', '', '2020-07-27');
INSERT INTO "file_list" ("id", "file_no", "category", "title", "doc1", "entry_date_real") VALUES
(1751, 'MSB/CB/B-169', 'Indo-Myanmar Border Trade/KMMTTP', 'Kaladan Multi-Modal Transit Transport Project (KMMTTP)', '', '2018-04-04');
INSERT INTO "file_list" ("id", "file_no", "category", "title", "doc1", "entry_date_real") VALUES
(1752, 'MSB/CB/B-169', 'Indo-Myanmar Border Trade/KMMTTP', 'Agenda Points for the 22nd  National Level Meeting (NLM) between India and Myanmar.', '', '2018-10-03');
INSERT INTO "file_list" ("id", "file_no", "category", "title", "doc1", "entry_date_real") VALUES
(1753, 'MSB/CB/B-169', 'Indo-Myanmar Border Trade/KMMTTP', 'CURRENT STATUS OF KALADAN MULTI-MODAL TRANSIT TRANSPORT PROJECT(KMMTTP) WITHIN MIZORAM\r\nI.E. FROM ZOCHACHHUAH TO LAWNGTLAI', '', '2014-11-19');
INSERT INTO "file_list" ("id", "file_no", "category", "title", "doc1", "entry_date_real") VALUES
(1754, 'MSB/CB/B-169', 'Indo-Myanmar Border Trade/KMMTTP', 'KALADAN MULTIMODAL TRANSIT TRANSPORT PROJECT\r\n\r\nÃ‚Â ', '', '2014-11-24');
INSERT INTO "file_list" ("id", "file_no", "category", "title", "doc1", "entry_date_real") VALUES
(1755, 'MSB/CB/B-169', 'Indo-Myanmar Border Trade/KMMTTP', 'KALADAN MULTI MODAL TRANSIT TRANSPORT PROJECT (KMMTTP)The project has several sections combining multi-modes of transport:', '', '2020-07-27');
INSERT INTO "file_list" ("id", "file_no", "category", "title", "doc1", "entry_date_real") VALUES
(1756, 'MSB/CB/B-169', 'Indo-Myanmar Border Trade/KMMTTP', 'STATUS ON IMPLEMENTATION OF KALADAN MULTI-MODAL TRANSIT TRANSPORT PROJECT (KMMTTP)', '', '2020-07-27');
INSERT INTO "file_list" ("id", "file_no", "category", "title", "doc1", "entry_date_real") VALUES
(1757, 'MSB/CB/B-169', 'Indo-Myanmar Border Trade/KMMTTP', 'Kaladan Multi-Modal Transit Transport Project (KMMTTP)', '', '2018-04-04');
INSERT INTO "file_list" ("id", "file_no", "category", "title", "doc1", "entry_date_real") VALUES
(1758, 'MSB/CB/B-169', 'Indo-Myanmar Border Trade/KMMTTP', 'SECURITY ISSUES (a) Security Cooperation along common order:', '', '2018-10-03');
INSERT INTO "file_list" ("id", "file_no", "category", "title", "doc1", "entry_date_real") VALUES
(1759, 'MSB/CB/B-169', 'Indo-Myanmar Border Trade/KMMTTP', 'CURRENT STATUS OF KALADAN MULTI-MODAL TRANSIT TRANSPORT PROJECT(KMMTTP) WITHIN MIZORAM .E. FROM ZOCHACHHUAH TO LAWNGTLAI', '', '2014-11-19');
INSERT INTO "file_list" ("id", "file_no", "category", "title", "doc1", "entry_date_real") VALUES
(1760, 'MSB/CB/B-169', 'Indo-Myanmar Border Trade/KMMTTP', 'KALADAN MULTIMODAL TRANSIT TRANSPORT PROJECT\r\n\r\nÃ‚Â ', '', '2014-11-24');
INSERT INTO "file_list" ("id", "file_no", "category", "title", "doc1", "entry_date_real") VALUES
(1761, 'MSB/CB/B-169', 'Indo-Myanmar Border Trade/KMMTTP', 'KALADAN MULTI MODAL TRANSIT TRANSPORT PROJECT (KMMTTP)', '', '2014-07-27');
INSERT INTO "file_list" ("id", "file_no", "category", "title", "doc1", "entry_date_real") VALUES
(1762, 'MSB/CB/B-72/AQ', 'Assembly Question', 'Supplementary notes (HPC(D) te hian CYMA)', '', '2012-07-18');
INSERT INTO "file_list" ("id", "file_no", "category", "title", "doc1", "entry_date_real") VALUES
(1763, 'MSB/CB/B-72/AQ', 'Assembly Question', 'Supplementary note', '', '2012-07-04');
INSERT INTO "file_list" ("id", "file_no", "category", "title", "doc1", "entry_date_real") VALUES
(1764, 'MSB/CB/B-72/AQ', 'Assembly Question', 'Supplementary note', '', '2012-03-14');
INSERT INTO "file_list" ("id", "file_no", "category", "title", "doc1", "entry_date_real") VALUES
(1765, 'MSB/CB/B-72/AQ', 'Assembly Question', 'Supplementary notes', '', '2012-07-05');
INSERT INTO "file_list" ("id", "file_no", "category", "title", "doc1", "entry_date_real") VALUES
(1766, 'MSB/CB/B-72/AQ', 'Assembly Question', 'Supplementary notes', '', '2012-03-16');
INSERT INTO "file_list" ("id", "file_no", "category", "title", "doc1", "entry_date_real") VALUES
(1767, 'MSB/CB/B-73/MLA', 'Mizoram Legislative Assembly/ Cabinet Meeting', 'WT MSG (PU LALRINLIANA SAILO, SPEAKER, MIZORAM LEGISLATIVE ASSEMBLY WILL BE ANNOUNCING HIS DECISION/JUDGEMENT TOMORROW, I.E. 27.11.2020, ON COMPLAINT SUBMITTED BY 12(TWELVE) MNF MLAs FOR DISQUALIFICATION OFPU LALDUHAWMA,', '', '2020-11-26');
INSERT INTO "file_list" ("id", "file_no", "category", "title", "doc1", "entry_date_real") VALUES
(1768, 'MSB/CB/B-74(B)', 'Meeting in DGPs Chamber with head of Unit', 'Suggestions for improvement of Mizoram Police', '', '2020-02-14');
INSERT INTO "file_list" ("id", "file_no", "category", "title", "doc1", "entry_date_real") VALUES
(1769, 'MSB/CB/B-74(C)', 'DGP concern file/circular', 'Observation/Directions of Hon''ble Prime minister made during presentation given by Director General, NCB on 30th May, 2020', '', '2020-08-17');
INSERT INTO "file_list" ("id", "file_no", "category", "title", "doc1", "entry_date_real") VALUES
(1770, 'MSB/CB/B-77', 'Look Out Notice', 'Sit-in demonstration organised by students of NIT', '', '2018-04-04');
INSERT INTO "file_list" ("id", "file_no", "category", "title", "doc1", "entry_date_real") VALUES
(1771, 'MSB/CB/B-77', 'Look Out Notice', 'students of National Institute of Technology (NIT)', '', '2018-04-04');
INSERT INTO "file_list" ("id", "file_no", "category", "title", "doc1", "entry_date_real") VALUES
(1772, 'MSB/CB/B-77', 'Look Out Notice', 'students of National Institute of Technology (NIT)', '', '2018-04-09');
INSERT INTO "file_list" ("id", "file_no", "category", "title", "doc1", "entry_date_real") VALUES
(1773, 'MSB/CB/B-77(M)', 'Look Out Notice of Mizoram', 'ALL S0 - Timothy', '', '2020-12-14');
INSERT INTO "file_list" ("id", "file_no", "category", "title", "doc1", "entry_date_real") VALUES
(1774, 'MSB/CB/B-77(M)', 'Look Out Notice of Mizoram', 'Assam Police retired personnel', '', '2020-02-14');
INSERT INTO "file_list" ("id", "file_no", "category", "title", "doc1", "entry_date_real") VALUES
(1775, 'MSB/CB/B-77(M)', 'Look Out Notice of Mizoram', 'conduct discreet enquiry to ascertain whether the below mentioned retired personnel of 6th A.P Bn. Kathal, Cachar, Assam', '', '2020-01-28');
INSERT INTO "file_list" ("id", "file_no", "category", "title", "doc1", "entry_date_real") VALUES
(1776, 'MSB/CB/B-77(M)', 'Look Out Notice of Mizoram', 'ABSCONDER MR. TIMOTHY LALHMUNMAWI CHANGSAN S/O THANGZAKHAM CHANGSAN(L)', '', '2020-12-09');
INSERT INTO "file_list" ("id", "file_no", "category", "title", "doc1", "entry_date_real") VALUES
(1777, 'MSB/CB/B-80/ND', 'Narcotic Drugs', 'DRUGS SEIZED BY MIZORAM POLICE DURINGÃ‚Â  Ã¢â‚¬â€œ 2015 ( Upto August )', '', '2022-09-27');
INSERT INTO "file_list" ("id", "file_no", "category", "title", "doc1", "entry_date_real") VALUES
(1778, 'MSB/CB/B-80/ND', 'Narcotic Drugs', 'DRUGS SEIZED BY MIZORAM POLICE DURINGÃ‚Â  Ã¢â‚¬â€œ 2015 ( Upto August )', '', '2015-10-15');
INSERT INTO "file_list" ("id", "file_no", "category", "title", "doc1", "entry_date_real") VALUES
(1779, 'MSB/CB/B-80/ND', 'Narcotic Drugs', 'Seizure of 53 packets of Methamphetamine regarding', '', '2014-09-02');
INSERT INTO "file_list" ("id", "file_no", "category", "title", "doc1", "entry_date_real") VALUES
(1780, 'MSB/CB/B-82/IR Day', 'Independence/Republic Day', 'Materials for Independence Day Speech of Chief Minister Mizoram to be delivered on 15th August, 2015.', '', '2015-07-15');
INSERT INTO "file_list" ("id", "file_no", "category", "title", "doc1", "entry_date_real") VALUES
(1781, 'MSB/CB/B-82/IR Day', 'Independence/Republic Day', 'Materials for Independence Day Speech of Chief Minister, Mizoram to be delivered on 15th August, 2016.', '', '2016-02-22');
INSERT INTO "file_list" ("id", "file_no", "category", "title", "doc1", "entry_date_real") VALUES
(1782, 'MSB/CB/B-82/IR Day', 'Independence/Republic Day', 'ACHIEVEMENTS OF CID 2014-2015', '', '2014-12-01');
INSERT INTO "file_list" ("id", "file_no", "category", "title", "doc1", "entry_date_real") VALUES
(1783, 'MSB/CB/B-82/IR Day', 'Independence/Republic Day', 'Materials for Independence Day Speech of Chief Minister to be delivered on 15.8.2013.', '', '2013-07-12');
INSERT INTO "file_list" ("id", "file_no", "category", "title", "doc1", "entry_date_real") VALUES
(1784, 'MSB/CB/B-82/IR Day', 'Independence/Republic Day', 'Ã‚Â  Materials for Independence Day Speech of Chief Minister, Mizoram to be delivered on 15.8.2014.', '', '2013-06-18');
INSERT INTO "file_list" ("id", "file_no", "category", "title", "doc1", "entry_date_real") VALUES
(1785, 'MSB/CB/B-82/IR Day', 'Independence/Republic Day', 'Materials for Republic Day Speech of His Excellency the Governor of Mizoram to be delivered on 26.1.2015.', '', '2014-12-01');
INSERT INTO "file_list" ("id", "file_no", "category", "title", "doc1", "entry_date_real") VALUES
(1786, 'MSB/CB/B-82/IR Day', 'Independence/Republic Day', 'Materials for Republic DayÃ‚Â  speech of His Excellency the Governor of Mizoram to be delivered on 26.1.2014.', '', '2013-11-06');
INSERT INTO "file_list" ("id", "file_no", "category", "title", "doc1", "entry_date_real") VALUES
(1787, 'MSB/CB/B-82/IR Day', 'Independence/Republic Day', 'Materials for Republic Day of His Excellency the Governor of MizoramÃ‚Â to be delivered on 26.1.2012.', '', '2011-12-09');
INSERT INTO "file_list" ("id", "file_no", "category", "title", "doc1", "entry_date_real") VALUES
(1788, 'MSB/CB/B-82/IR Day', 'Independence/Republic Day', 'Materials for Republic Day Speech of His Excellency the Governor of Mizoram to be delivered on 26.1.2015.', '', '2014-12-01');
INSERT INTO "file_list" ("id", "file_no", "category", "title", "doc1", "entry_date_real") VALUES
(1789, 'MSB/CB/B-82/IR Day', 'Independence/Republic Day', 'Submission Ã‚Â of Ã‚Â Report Ã‚Â in Ã‚Â connection with the boycott call of Republic Day, 2019 celebrations by the NGOCC', '', '2019-01-29');
INSERT INTO "file_list" ("id", "file_no", "category", "title", "doc1", "entry_date_real") VALUES
(1790, 'MSB/CB/B-82/IR Day', 'Independence/Republic Day', 'ubmission Ã‚Â of Ã‚Â Report Ã‚Â in Ã‚Â connection with the boycott call of  Republic Day, 2019 celebrations by the NGOCC', '', '2019-01-29');
INSERT INTO "file_list" ("id", "file_no", "category", "title", "doc1", "entry_date_real") VALUES
(1791, 'MSB/CB/B-82/IR Day', 'Independence/Republic Day', 'REPORT IN CONNECTION WITH CELEBRATION OF REPUBLIC DAY, 2019 IN MIZORAM AND THE BOYCOTT CALL OF THE NGOCC IN PROTEST AGAINST THE CAB,2016', '', '2019-01-29');
INSERT INTO "file_list" ("id", "file_no", "category", "title", "doc1", "entry_date_real") VALUES
(1792, 'MSB/CB/B-82/IR Day', 'Independence/Republic Day', 'Ã‚Â  Submission of Ã‚Â Report Ã‚Â in Ã‚Â connection with the boycott call of Republic Day, 2019 celebrations by the NGOCC', '', '2019-01-29');
INSERT INTO "file_list" ("id", "file_no", "category", "title", "doc1", "entry_date_real") VALUES
(1793, 'MSB/CB/B-82/IR Day', 'Independence/Republic Day', 'Materials for Independence Day Speech of Chief Minister, Mizoram to be delivered on 15th August, 2020.', '', '2020-05-15');
INSERT INTO "file_list" ("id", "file_no", "category", "title", "doc1", "entry_date_real") VALUES
(1794, 'MSB/CB/B-82/IR Day', 'Independence/Republic Day', 'NEW SYSTEM OF PASSPORT VERIFICATION', '', '2020-05-15');
INSERT INTO "file_list" ("id", "file_no", "category", "title", "doc1", "entry_date_real") VALUES
(1795, 'MSB/CB/B-82/IR Day', 'Independence/Republic Day', 'ARREST OF MILITANTS WEF 16TH AUGUST, 2017 TO TILL DATE', '', '2018-07-11');
INSERT INTO "file_list" ("id", "file_no", "category", "title", "doc1", "entry_date_real") VALUES
(1796, 'MSB/CB/B-82/IR Day', 'Independence/Republic Day', 'SEIZURE OF FAKE INDIAN CURRENCY NOTE', '', '2018-07-11');
INSERT INTO "file_list" ("id", "file_no", "category", "title", "doc1", "entry_date_real") VALUES
(1797, 'MSB/CB/B-82/IR Day', 'Independence/Republic Day', 'Materials Ã‚Â for Ã‚Â Independence Ã‚Â Day Ã‚Â Speech Ã‚Â of Chief Minister, Mizoram to be delivered on 15th August, 2018.', '', '2018-07-11');
INSERT INTO "file_list" ("id", "file_no", "category", "title", "doc1", "entry_date_real") VALUES
(1798, 'MSB/CB/B-82/IR Day', 'Independence/Republic Day', 'PEACE DIALOGUE BETWEEN GOVT. OF MIZORAM AND HPC (D)\r\nAND LAYING OF ARMS BY HPC(D)', '', '2018-07-11');
INSERT INTO "file_list" ("id", "file_no", "category", "title", "doc1", "entry_date_real") VALUES
(1799, 'MSB/CB/B-82/IR Day', 'Independence/Republic Day', 'SEIZURE OF ARMS AND AMMUNITIONS WEF 16TH AUGUST, 2017 TO TILL DATE', '', '2018-07-11');
INSERT INTO "file_list" ("id", "file_no", "category", "title", "doc1", "entry_date_real") VALUES
(1800, 'MSB/CB/B-82/IR Day', 'Independence/Republic Day', 'PEACE DIALOGUE BETWEEN GOVT. OF MIZORAM AND HPC(D)', '', '2018-07-10');
INSERT INTO "file_list" ("id", "file_no", "category", "title", "doc1", "entry_date_real") VALUES
(1801, 'MSB/CB/B-82/IR Day', 'Independence/Republic Day', 'ARREST OF MILITANTS WEF 16.8.2016 TILL DATE', '', '2017-07-16');
INSERT INTO "file_list" ("id", "file_no", "category", "title", "doc1", "entry_date_real") VALUES
(1802, 'MSB/CB/B-82/IR Day', 'Independence/Republic Day', 'Materials for Independence Day Speech of Chief Minister, Mizoram to be delivered on 15th August, 2017.', '', '2017-07-17');
INSERT INTO "file_list" ("id", "file_no", "category", "title", "doc1", "entry_date_real") VALUES
(1803, 'MSB/CB/B-82/IR Day', 'Independence/Republic Day', 'MaterialsÃ‚Â  forÃ‚Â  IndependenceÃ‚Â  DayÃ‚Â  SpeechÃ‚Â  of Chief Minister, Mizoram to be delivered on 15th August, 2017.', '', '2017-07-04');
INSERT INTO "file_list" ("id", "file_no", "category", "title", "doc1", "entry_date_real") VALUES
(1804, 'MSB/CB/B-82/IR Day', 'Independence/Republic Day', 'ALL SsP - REPUBLIC DAY SECURITY', '', '2020-01-24');
INSERT INTO "file_list" ("id", "file_no", "category", "title", "doc1", "entry_date_real") VALUES
(1805, 'MSB/CB/B-82/IR Day', 'Independence/Republic Day', 'Assessment ofÃ‚Â  threat perception.', '', '2020-07-30');
INSERT INTO "file_list" ("id", "file_no", "category", "title", "doc1", "entry_date_real") VALUES
(1806, 'MSB/CB/B-82/IR Day', 'Independence/Republic Day', 'Materials for Independence Day Speech of Chief Minister, Mizoram to be delivered on 15th August, 2020.', '', '2020-05-18');
INSERT INTO "file_list" ("id", "file_no", "category", "title", "doc1", "entry_date_real") VALUES
(1807, 'MSB/CB/B-82/IR Day', 'Independence/Republic Day', 'Materials for Independence Day Speech of Chief Minister, Mizoram to be delivered on 15th August, 2020.', '', '2020-05-12');
INSERT INTO "file_list" ("id", "file_no", "category", "title", "doc1", "entry_date_real") VALUES
(1808, 'MSB/CB/B-82/IR Day', 'Independence/Republic Day', 'Ã‚Â  Brief note on achievement', '', '2020-12-28');
INSERT INTO "file_list" ("id", "file_no", "category", "title", "doc1", "entry_date_real") VALUES
(1809, 'MSB/CB/B-82/IR Day', 'Independence/Republic Day', 'Threat perception assessment of AR Ground and Raj Bhavan and Protected Persons', '', '2020-08-07');
INSERT INTO "file_list" ("id", "file_no", "category", "title", "doc1", "entry_date_real") VALUES
(1810, 'MSB/CB/B-82/IR Day', 'Independence/Republic Day', 'Republic day message to all sp 2', '', '2020-01-24');
INSERT INTO "file_list" ("id", "file_no", "category", "title", "doc1", "entry_date_real") VALUES
(1811, 'MSB/CB/B-82/IR Day', 'Independence/Republic Day', 'Republic day message to all sp', '', '2020-01-24');
INSERT INTO "file_list" ("id", "file_no", "category", "title", "doc1", "entry_date_real") VALUES
(1812, 'MSB/CB/B-82/IR Day', 'Independence/Republic Day', 'Ã‚Â  Republic Day Speech of Hon''ble Governor of Mizoram to be delivered on 26.01.2021.', '', '2020-12-28');
INSERT INTO "file_list" ("id", "file_no", "category", "title", "doc1", "entry_date_real") VALUES
(1813, 'MSB/CB/B-82/IR Day', 'Independence/Republic Day', 'Assessment ofÃ‚Â  threat perception.', '', '2021-01-12');
INSERT INTO "file_list" ("id", "file_no", "category", "title", "doc1", "entry_date_real") VALUES
(1814, 'MSB/CB/A-5(R)', 'MYANMAR REFUGEE', 'Myanmar Refugees detail', '', '2021-04-16');
INSERT INTO "file_list" ("id", "file_no", "category", "title", "doc1", "entry_date_real") VALUES
(1815, 'MSB/CB/A-5(R)', 'MYANMAR REFUGEE', '\"REPORT ON NO. OF PERSONS ENTERING MIZORAM FROM MYANMAR IN THE WAKE OF MILITARY COUP IN MYANMARÃ‚Â \r\nAS ON 16.4.2021 @ Ã‚Â 05:00 PM.', '', '2021-04-16');
INSERT INTO "file_list" ("id", "file_no", "category", "title", "doc1", "entry_date_real") VALUES
(1816, 'MSB/CB/A-5(R)', 'MYANMAR REFUGEE', 'Myanmar Refugee photo', '', '2022-02-03');
INSERT INTO "file_list" ("id", "file_no", "category", "title", "doc1", "entry_date_real") VALUES
(1817, 'MSB/CB/A-5(R)', 'MYANMAR REFUGEE', 'Myanmar Refugee Photo', '', '2022-02-03');
INSERT INTO "file_list" ("id", "file_no", "category", "title", "doc1", "entry_date_real") VALUES
(1819, 'MSB/CB/A-5(R)', 'MYANMAR REFUGEE', 'Myanmar Refugee Champhai', '', '2021-04-15');
INSERT INTO "file_list" ("id", "file_no", "category", "title", "doc1", "entry_date_real") VALUES
(1820, 'MSB/CB/A-5(R)', 'MYANMAR REFUGEE', 'Myanmar Refugee Aizawl', '', '2021-04-12');
INSERT INTO "file_list" ("id", "file_no", "category", "title", "doc1", "entry_date_real") VALUES
(1821, 'MSB/CB/A-5(R)', 'MYANMAR REFUGEE', 'Myanmar Refugee List on 1.4.2021', '', '2021-04-01');
INSERT INTO "file_list" ("id", "file_no", "category", "title", "doc1", "entry_date_real") VALUES
(1822, 'MSB/CB/A-5(R)', 'MYANMAR REFUGEE', 'Myanmar Refugee details on 1.4.2021', '', '2021-04-01');
INSERT INTO "file_list" ("id", "file_no", "category", "title", "doc1", "entry_date_real") VALUES
(1823, 'MSB/CB/A-5(R)', 'MYANMAR REFUGEE', 'Myanmar Refugee details on 2.4.2021', '', '2021-04-02');
INSERT INTO "file_list" ("id", "file_no", "category", "title", "doc1", "entry_date_real") VALUES
(1824, 'MSB/CB/A-5(R)', 'MYANMAR REFUGEE', 'Myanmar Refugee details on 4.4.2021', '', '2021-04-04');
INSERT INTO "file_list" ("id", "file_no", "category", "title", "doc1", "entry_date_real") VALUES
(1825, 'MSB/CB/A-5(R)', 'MYANMAR REFUGEE', 'Myanmar Refugee details on 4.4.2021', '', '2021-04-04');
INSERT INTO "file_list" ("id", "file_no", "category", "title", "doc1", "entry_date_real") VALUES
(1826, 'MSB/CB/A-5(R)', 'MYANMAR REFUGEE', 'Myanmar Refugee details on 4.4.2021', '', '2021-04-04');
INSERT INTO "file_list" ("id", "file_no", "category", "title", "doc1", "entry_date_real") VALUES
(1827, 'MSB/CB/A-5(R)', 'MYANMAR REFUGEE', 'Myanmar Refugee details on 5.4.2021', '', '2021-04-05');
INSERT INTO "file_list" ("id", "file_no", "category", "title", "doc1", "entry_date_real") VALUES
(1828, 'MSB/CB/A-5(R)', 'MYANMAR REFUGEE', 'Myanmar Refugee details on 6.4.2021', '', '2021-04-06');
INSERT INTO "file_list" ("id", "file_no", "category", "title", "doc1", "entry_date_real") VALUES
(1829, 'MSB/CB/A-5(R)', 'MYANMAR REFUGEE', 'Myanmar Refugee details on 7.4.2021', '', '2021-04-07');
INSERT INTO "file_list" ("id", "file_no", "category", "title", "doc1", "entry_date_real") VALUES
(1830, 'MSB/CB/A-5(R)', 'MYANMAR REFUGEE', 'Myanmar Refugee details on 8.4.2021', '', '2021-04-08');
INSERT INTO "file_list" ("id", "file_no", "category", "title", "doc1", "entry_date_real") VALUES
(1831, 'MSB/CB/A-5(R)', 'MYANMAR REFUGEE', 'Myanmar Refugee details on 8.4.2021', '', '2021-04-08');
INSERT INTO "file_list" ("id", "file_no", "category", "title", "doc1", "entry_date_real") VALUES
(1832, 'MSB/CB/A-5(R)', 'MYANMAR REFUGEE', 'Myanmar Refugee details on 9.4.2021', '', '2021-04-09');
INSERT INTO "file_list" ("id", "file_no", "category", "title", "doc1", "entry_date_real") VALUES
(1833, 'MSB/CB/A-5(R)', 'MYANMAR REFUGEE', 'Myanmar Refugee details on 9.4.2021', '', '2021-04-09');
INSERT INTO "file_list" ("id", "file_no", "category", "title", "doc1", "entry_date_real") VALUES
(1834, 'MSB/CB/A-5(R)', 'MYANMAR REFUGEE', 'Myanmar Refugee details on 12.4.2021', '', '2021-04-12');
INSERT INTO "file_list" ("id", "file_no", "category", "title", "doc1", "entry_date_real") VALUES
(1835, 'MSB/CB/A-5(R)', 'MYANMAR REFUGEE', '\"REPORT ON NO. OF PERSONS ENTERING MIZORAM FROM MYANMAR IN THE WAKE OF MILITARY COUP IN MYANMARÃ‚Â \r\nAS ON 12.4.2021 @ 10:00 AM.', '', '2021-04-12');
INSERT INTO "file_list" ("id", "file_no", "category", "title", "doc1", "entry_date_real") VALUES
(1836, 'MSB/CB/A-5(R)', 'MYANMAR REFUGEE', '\"REPORT ON NO. OF PERSONS ENTERING MIZORAM FROM MYANMAR IN THE WAKE OF MILITARY COUP IN MYANMARÃ‚Â \r\nAS ON 13.4.2021 @ 05:00 PM', '', '2021-04-13');
INSERT INTO "file_list" ("id", "file_no", "category", "title", "doc1", "entry_date_real") VALUES
(1837, 'MSB/CB/A-5(R)', 'MYANMAR REFUGEE', '\"REPORT ON NO. OF PERSONS ENTERING MIZORAM FROM MYANMAR IN THE WAKE OF MILITARY COUP IN MYANMARÃ‚Â \r\nAS ON 13.4.2021 @ 10:00 AM.', '', '2021-04-13');
INSERT INTO "file_list" ("id", "file_no", "category", "title", "doc1", "entry_date_real") VALUES
(1838, 'MSB/CB/A-5(R)', 'MYANMAR REFUGEE', 'DistrictÃ‚Â Ã‚Â  Ã‚Â Sl.No.Ã‚Â Ã‚Â  Ã‚Â Name and addressÃ‚Â Ã‚Â  Ã‚Â SexÃ‚Â Ã‚Â  Ã‚Â OccupationÃ‚Â Ã‚Â  Ã‚Â Place of Posting/AddressÃ‚Â Ã‚Â  Ã‚Â Date of arrivalÃ‚Â Ã‚Â  Ã‚Â Present shelter\r\nSiahaÃ‚Â Ã‚Â  Ã‚Â Ã‚Â Ã‚Â  Ã‚Â', '', '2021-04-14');
INSERT INTO "file_list" ("id", "file_no", "category", "title", "doc1", "entry_date_real") VALUES
(1839, 'MSB/CB/A-5(R)', 'MYANMAR REFUGEE', '\"REPORT ON NO. OF PERSONS ENTERING MIZORAM FROM MYANMAR IN THE WAKE OF MILITARY COUP IN MYANMARÃ‚Â \r\nAS ON 14.4.2021 @ 10:00 AM.', '', '2021-04-14');
INSERT INTO "file_list" ("id", "file_no", "category", "title", "doc1", "entry_date_real") VALUES
(1840, 'MSB/CB/A-5', 'Indo-Myanmar Border Affairs(Intelligence)', 'No. MSB/CB/A-5/297(B)\r\nDated 15th April, 2021', '', '2021-04-15');
INSERT INTO "file_list" ("id", "file_no", "category", "title", "doc1", "entry_date_real") VALUES
(1841, 'MSB/CB/A-5(R)', 'MYANMAR REFUGEE', '\"REPORT ON NO. OF PERSONS ENTERING MIZORAM FROM MYANMAR IN THE WAKE OF MILITARY COUP IN MYANMARÃ‚Â \r\nAS ON 15.4.2021 @ 05:00 PM.', '', '2021-04-15');
INSERT INTO "file_list" ("id", "file_no", "category", "title", "doc1", "entry_date_real") VALUES
(1842, 'MSB/CB/A-5(R)', 'MYANMAR REFUGEE', '\"REPORT ON NO. OF PERSONS ENTERING MIZORAM FROM MYANMAR IN THE WAKE OF MILITARY COUP IN MYANMARÃ‚Â \r\nAS ON 15.4.2021 @ 10:00 AM.', '', '2021-04-15');
INSERT INTO "file_list" ("id", "file_no", "category", "title", "doc1", "entry_date_real") VALUES
(1843, 'MSB/CB/A-5', 'Indo-Myanmar Border Affairs(Intelligence)', 'REPORT ON MYANMAR REFUGEE No. MSB/CB/A-5/2021/196 Dated 18th March, 2021', '', '2021-03-19');
INSERT INTO "file_list" ("id", "file_no", "category", "title", "doc1", "entry_date_real") VALUES
(1844, 'MSB/CB/A-5', 'Indo-Myanmar Border Affairs(Intelligence)', 'REPORT ON MYANMAR REFUGEE No. MSB/CB/A-5/187 Dated 16th March, 2021', '', '2021-03-16');
INSERT INTO "file_list" ("id", "file_no", "category", "title", "doc1", "entry_date_real") VALUES
(1845, 'MSB/CB/A-5', 'Indo-Myanmar Border Affairs(Intelligence)', 'REPORT ON NO. OF PERSONS ENTERING MIZORAM FROM MYANMAR IN THE WAKE OF MILITARY COUP IN MYANMAR AS ON 22.4.2021 @ 5:00 PM.', '', '2021-04-22');
INSERT INTO "file_list" ("id", "file_no", "category", "title", "doc1", "entry_date_real") VALUES
(1846, 'MSB/CB/A-5', 'Indo-Myanmar Border Affairs(Intelligence)', 'REPORT ON NO. OF PERSONS ENTERING MIZORAM FROM MYANMAR IN THE WAKE OF MILITARY COUP IN MYANMAR AS ON 21.04.2021 @ 05:00 PM.', '', '2021-04-25');
INSERT INTO "file_list" ("id", "file_no", "category", "title", "doc1", "entry_date_real") VALUES
(1847, 'MSB/CB/A-5', 'Indo-Myanmar Border Affairs(Intelligence)', '\"REPORT ON NO. OF PERSONS ENTERING MIZORAM FROM MYANMAR IN THE WAKE OF MILITARY COUP IN MYANMARÃ‚Â \r\nAS ON 21.04.2021 @ 05:00 PM.', '', '2021-04-21');
INSERT INTO "file_list" ("id", "file_no", "category", "title", "doc1", "entry_date_real") VALUES
(1848, 'MSB/CB/A-5', 'Indo-Myanmar Border Affairs(Intelligence)', '\"REPORT ON NO. OF PERSONS ENTERING MIZORAM FROM MYANMAR IN THE WAKE OF MILITARY COUP IN MYANMARÃ‚Â \r\nAS ON 20.4.2021 @ 5:00 PM.\r\n\"Ã‚Â Ã‚Â  Ã‚Â Ã‚Â Ã‚Â  Ã‚Â Ã‚Â Ã‚Â  Ã‚Â Ã‚Â Ã‚Â  Ã‚Â Ã‚Â Ã‚Â  Ã‚Â ', '', '2021-04-20');
INSERT INTO "file_list" ("id", "file_no", "category", "title", "doc1", "entry_date_real") VALUES
(1849, 'MSB/CB/A-5', 'Indo-Myanmar Border Affairs(Intelligence)', 'REPORT ON NO. OF PERSONS ENTERING MIZORAM FROM MYANMAR IN THE WAKE OF MILITARY COUP IN MYANMAR AS ON 20.4.2021 @ 5:00 PM.', '', '2021-04-20');
INSERT INTO "file_list" ("id", "file_no", "category", "title", "doc1", "entry_date_real") VALUES
(1850, 'MSB/CB/A-5', 'Indo-Myanmar Border Affairs(Intelligence)', '\"REPORT ON NO. OF PERSONS ENTERING MIZORAM FROM MYANMAR IN THE WAKE OF MILITARY COUP IN MYANMARÃ‚Â \r\nAS ON 20.4.2021 @ 5:00 PM.', '', '2021-04-20');
INSERT INTO "file_list" ("id", "file_no", "category", "title", "doc1", "entry_date_real") VALUES
(1851, 'MSB/CB/A-5', 'Indo-Myanmar Border Affairs(Intelligence)', 'REPORT ON NO. OF PERSONS ENTERING MIZORAM FROM MYANMAR IN THE WAKE OF MILITARY COUP IN MYANMAR\r\nAS ON 19.4.2021 @ 05:00 PM.', '', '2021-04-19');
INSERT INTO "file_list" ("id", "file_no", "category", "title", "doc1", "entry_date_real") VALUES
(1852, 'MSB/CB/A-5', 'Indo-Myanmar Border Affairs(Intelligence)', '\"REPORT ON NO. OF PERSONS ENTERING MIZORAM FROM MYANMAR IN THE WAKE OF MILITARY COUP IN MYANMARÃ‚Â \r\nAS ON 19.4.2021 @ 05:00 PM.', '', '2021-04-19');
INSERT INTO "file_list" ("id", "file_no", "category", "title", "doc1", "entry_date_real") VALUES
(1853, 'MSB/CB/A-5', 'Indo-Myanmar Border Affairs(Intelligence)', 'Myanmar Refugee as on 19.4.2021', '', '2021-04-19');
INSERT INTO "file_list" ("id", "file_no", "category", "title", "doc1", "entry_date_real") VALUES
(1854, 'MSB/CB/A-5(R)', 'MYANMAR REFUGEE', 'Myanmar Refugee Details Lawngtlai District', '', '2021-03-25');
INSERT INTO "file_list" ("id", "file_no", "category", "title", "doc1", "entry_date_real") VALUES
(1855, 'MSB/CB/A-5(R)', 'MYANMAR REFUGEE', 'Myanmar Refugees Update as on 8.3.2021', '', '2021-03-08');
INSERT INTO "file_list" ("id", "file_no", "category", "title", "doc1", "entry_date_real") VALUES
(1856, 'MSB/CB/A-5(R)', 'MYANMAR REFUGEE', 'Myanmar Refugees Update as on 8.3.2021', '', '2021-03-08');
INSERT INTO "file_list" ("id", "file_no", "category", "title", "doc1", "entry_date_real") VALUES
(1857, 'MSB/CB/A-5(R)', 'MYANMAR REFUGEE', 'Myanmar Refugees Update as on 14.3.2021', '', '2021-03-14');
INSERT INTO "file_list" ("id", "file_no", "category", "title", "doc1", "entry_date_real") VALUES
(1858, 'MSB/CB/A-5(R)', 'MYANMAR REFUGEE', 'Myanmar Refugees Update as on 15.3.2021', '', '2021-03-16');
INSERT INTO "file_list" ("id", "file_no", "category", "title", "doc1", "entry_date_real") VALUES
(1859, 'MSB/CB/A-5(R)', 'MYANMAR REFUGEE', 'Myanmar Refugees Update as on 16.3.2021', '', '2021-03-16');
INSERT INTO "file_list" ("id", "file_no", "category", "title", "doc1", "entry_date_real") VALUES
(1860, 'MSB/CB/A-5(R)', 'MYANMAR REFUGEE', 'Myanmar Refugees Update as on 17.3.2021', '', '2021-03-17');
INSERT INTO "file_list" ("id", "file_no", "category", "title", "doc1", "entry_date_real") VALUES
(1861, 'MSB/CB/A-5(R)', 'MYANMAR REFUGEE', 'Myanmar Refugees Update as on 18.3.2021', '', '2021-03-18');
INSERT INTO "file_list" ("id", "file_no", "category", "title", "doc1", "entry_date_real") VALUES
(1862, 'MSB/CB/A-5(R)', 'MYANMAR REFUGEE', 'Myanmar Refugees Update as on 18.3.2021', '', '2021-03-18');
INSERT INTO "file_list" ("id", "file_no", "category", "title", "doc1", "entry_date_real") VALUES
(1863, 'MSB/CB/A-5(R)', 'MYANMAR REFUGEE', 'Myanmar Refugees Update as on 19.3.2021', '', '2021-03-19');
INSERT INTO "file_list" ("id", "file_no", "category", "title", "doc1", "entry_date_real") VALUES
(1864, 'MSB/CB/A-5(R)', 'MYANMAR REFUGEE', 'Myanmar Refugees Update as on 19.3.2021', '', '2021-03-19');
INSERT INTO "file_list" ("id", "file_no", "category", "title", "doc1", "entry_date_real") VALUES
(1865, 'MSB/CB/A-5(R)', 'MYANMAR REFUGEE', 'Myanmar Refugees Update as on 19.3.2021', '', '2021-03-19');
INSERT INTO "file_list" ("id", "file_no", "category", "title", "doc1", "entry_date_real") VALUES
(1866, 'MSB/CB/A-5(R)', 'MYANMAR REFUGEE', 'Myanmar Refugees Update as on 20.3.2021', '', '2021-03-20');
INSERT INTO "file_list" ("id", "file_no", "category", "title", "doc1", "entry_date_real") VALUES
(1867, 'MSB/CB/A-5(R)', 'MYANMAR REFUGEE', 'Myanmar Refugees Update as on 21.3.2021', '', '2021-03-21');
INSERT INTO "file_list" ("id", "file_no", "category", "title", "doc1", "entry_date_real") VALUES
(1868, 'MSB/CB/A-5(R)', 'MYANMAR REFUGEE', 'Myanmar Refugees Update as on 21.3.2021', '', '2021-03-21');
INSERT INTO "file_list" ("id", "file_no", "category", "title", "doc1", "entry_date_real") VALUES
(1869, 'MSB/CB/A-5(R)', 'MYANMAR REFUGEE', 'Myanmar Refugees Update as on 22.3.2021', '', '2021-03-22');
INSERT INTO "file_list" ("id", "file_no", "category", "title", "doc1", "entry_date_real") VALUES
(1870, 'MSB/CB/A-5(R)', 'MYANMAR REFUGEE', 'Myanmar Refugees Update as on 15.3.2021', '', '2021-03-15');
INSERT INTO "file_list" ("id", "file_no", "category", "title", "doc1", "entry_date_real") VALUES
(1871, 'MSB/CB/A-5(R)', 'MYANMAR REFUGEE', 'Myanmar Refugees Update as on 5.3.2021', '', '2021-03-05');
INSERT INTO "file_list" ("id", "file_no", "category", "title", "doc1", "entry_date_real") VALUES
(1872, 'MSB/CB/A-5(R)', 'MYANMAR REFUGEE', 'REPORT ON NO. OF PERSONS ENTERING MIZORAM FROM MYANMAR IN THE WAKE OF MILITARY COUP IN MYANMAR AS ON 4.5.2021 @ 5:00 P.M.', '', '2021-05-04');
INSERT INTO "file_list" ("id", "file_no", "category", "title", "doc1", "entry_date_real") VALUES
(1873, 'MSB/CB/A-5(R)', 'MYANMAR REFUGEE', 'Myanmar Refugees Update as on 5.3.2021', '', '2021-03-05');
INSERT INTO "file_list" ("id", "file_no", "category", "title", "doc1", "entry_date_real") VALUES
(1874, 'MSB/CB/A-5(R)', 'MYANMAR REFUGEE', 'REPORT ON NO. OF PERSONS ENTERING MIZORAM FROM MYANMAR IN THE WAKE OF MILITARY COUP IN MYANMAR AS ON 5.3.2021 @ 10:00 A.M.', '', '2021-03-05');
INSERT INTO "file_list" ("id", "file_no", "category", "title", "doc1", "entry_date_real") VALUES
(1875, 'MSB/CB/A-5(R)', 'MYANMAR REFUGEE', 'REPORT ON NO. OF PERSONS ENTERING MIZORAM FROM MYANMAR IN THE WAKE OF MILITARY COUP IN MYANMAR AS ON 5.3.2021 @ 05:00 P.M.', '', '2021-03-05');
INSERT INTO "file_list" ("id", "file_no", "category", "title", "doc1", "entry_date_real") VALUES
(1876, 'MSB/CB/A-5(R)', 'MYANMAR REFUGEE', 'REPORT ON NO. OF PERSONS ENTERING MIZORAM FROM MYANMAR IN THE WAKE OF MILITARY COUP IN MYANMAR AS ON 6.3.2021 @ 10:00 A.M.', '', '2021-03-06');
INSERT INTO "file_list" ("id", "file_no", "category", "title", "doc1", "entry_date_real") VALUES
(1877, 'MSB/CB/A-5(R)', 'MYANMAR REFUGEE', 'REPORT ON NO. OF PERSONS ENTERING MIZORAM FROM MYANMAR IN THE WAKE OF MILITARY COUP IN MYANMAR AS ON 6.3.2021 @ 5:00 P.M.', '', '2021-03-06');
INSERT INTO "file_list" ("id", "file_no", "category", "title", "doc1", "entry_date_real") VALUES
(1878, 'MSB/CB/A-5(R)', 'MYANMAR REFUGEE', 'REPORT ON NO. OF PERSONS ENTERING MIZORAM FROM MYANMAR IN THE WAKE OF MILITARY COUP IN MYANMAR AS ON 7.3.2021 @ 10:00 A.M', '', '2021-03-07');
INSERT INTO "file_list" ("id", "file_no", "category", "title", "doc1", "entry_date_real") VALUES
(1879, 'MSB/CB/A-5(R)', 'MYANMAR REFUGEE', 'REPORT ON NO. OF PERSONS ENTERING MIZORAM FROM MYANMAR IN THE WAKE OF MILITARY COUP IN MYANMAR AS ON 7.3.2021 @ 05:00 P.M.', '', '2021-03-07');
INSERT INTO "file_list" ("id", "file_no", "category", "title", "doc1", "entry_date_real") VALUES
(1880, 'MSB/CB/A-5(R)', 'MYANMAR REFUGEE', 'REPORT ON NO. OF PERSONS ENTERING MIZORAM FROM MYANMAR IN THE WAKE OF MILITARY COUP IN MYANMAR AS ON 8.3.2021 @ 5:00 P.M.', '', '2021-03-08');
INSERT INTO "file_list" ("id", "file_no", "category", "title", "doc1", "entry_date_real") VALUES
(1881, 'MSB/CB/A-5(R)', 'MYANMAR REFUGEE', 'REPORT ON NO. OF PERSONS ENTERING MIZORAM FROM MYANMAR IN THE WAKE OF MILITARY COUP IN MYANMAR AS ON 8.3.2021 @ 10:00 A.M.\r\n\r\nÃ‚Â Ã‚Â Ã‚Â Ã‚Â Ã‚Â Ã‚Â Ã‚Â Ã‚Â Ã‚Â Ã‚Â Ã‚Â Ã‚Â Ã‚Â ', '', '2021-03-08');
INSERT INTO "file_list" ("id", "file_no", "category", "title", "doc1", "entry_date_real") VALUES
(1882, 'MSB/CB/A-5(R)', 'MYANMAR REFUGEE', 'REPORT ON NO. OF PERSONS ENTERING MIZORAM FROM MYANMAR IN THE WAKE OF MILITARY COUP IN MYANMAR AS ON 9.3.2021 @ 10:00 A.M.', '', '2021-03-09');
INSERT INTO "file_list" ("id", "file_no", "category", "title", "doc1", "entry_date_real") VALUES
(1883, 'MSB/CB/A-5', 'Indo-Myanmar Border Affairs(Intelligence)', 'REPORT ON NO. OF PERSONS ENTERING MIZORAM FROM MYANMAR IN THE WAKE OF MILITARY COUP IN MYANMAR AS ON 9.3.2021 @ 5:00 P.M.\r\n\r\nÃ‚Â Ã‚Â Ã‚Â Ã‚Â Ã‚Â Ã‚Â Ã‚Â Ã‚Â Ã‚Â Ã‚Â Ã‚Â Ã‚Â Ã‚Â ', '', '2021-03-09');
INSERT INTO "file_list" ("id", "file_no", "category", "title", "doc1", "entry_date_real") VALUES
(1884, 'MSB/CB/A-5', 'Indo-Myanmar Border Affairs(Intelligence)', 'REPORT ON NO. OF PERSONS ENTERING MIZORAM FROM MYANMAR IN THE WAKE OF MILITARY COUP IN MYANMAR AS ON 10.3.2021 @ 10:00 A.M.', '', '2021-03-10');
INSERT INTO "file_list" ("id", "file_no", "category", "title", "doc1", "entry_date_real") VALUES
(1885, 'MSB/CB/A-5', 'Indo-Myanmar Border Affairs(Intelligence)', 'REPORT ON NO. OF PERSONS ENTERING MIZORAM FROM MYANMAR IN THE WAKE OF MILITARY COUP IN MYANMAR AS ON 10.3.2021 @ 05:00 P.M.', '', '2021-03-10');
INSERT INTO "file_list" ("id", "file_no", "category", "title", "doc1", "entry_date_real") VALUES
(1886, 'MSB/CB/A-5', 'Indo-Myanmar Border Affairs(Intelligence)', 'REPORT ON NO. OF PERSONS ENTERING MIZORAM FROM MYANMAR IN THE WAKE OF MILITARY COUP IN MYANMAR AS ON 11.3.2021 @ 10:00 A.M.', '', '2021-03-11');
INSERT INTO "file_list" ("id", "file_no", "category", "title", "doc1", "entry_date_real") VALUES
(1887, 'MSB/CB/A-5(R)', 'MYANMAR REFUGEE', 'REPORT ON NO. OF PERSONS ENTERING MIZORAM FROM MYANMAR IN THE WAKE OF MILITARY COUP IN MYANMAR AS ON 11.3.2021 @ Ã‚Â 5:00 P.M.', '', '2021-03-11');
INSERT INTO "file_list" ("id", "file_no", "category", "title", "doc1", "entry_date_real") VALUES
(1888, 'MSB/CB/A-5(R)', 'MYANMAR REFUGEE', 'REPORT ON NO. OF PERSONS ENTERING MIZORAM FROM MYANMAR IN THE WAKE OF MILITARY COUP IN MYANMAR AS ON 12.3.2021 @ Ã‚Â 10:00 A.M.', '', '2021-03-12');
INSERT INTO "file_list" ("id", "file_no", "category", "title", "doc1", "entry_date_real") VALUES
(1889, 'MSB/CB/A-5(R)', 'MYANMAR REFUGEE', 'REPORT ON NO. OF PERSONS ENTERING MIZORAM FROM MYANMAR IN THE WAKE OF MILITARY COUP IN MYANMAR AS ON 12.3.2021 @ Ã‚Â 05:00 P.M.', '', '2021-03-12');
INSERT INTO "file_list" ("id", "file_no", "category", "title", "doc1", "entry_date_real") VALUES
(1890, 'MSB/CB/A-5(R)', 'MYANMAR REFUGEE', 'REPORT ON NO. OF PERSONS ENTERING MIZORAM FROM MYANMAR IN THE WAKE OF MILITARY COUP IN MYANMAR AS ON 13.3.2021 @ Ã‚Â 10:00 A.M.', '', '2021-03-13');
INSERT INTO "file_list" ("id", "file_no", "category", "title", "doc1", "entry_date_real") VALUES
(1891, 'MSB/CB/A-5(R)', 'MYANMAR REFUGEE', 'REPORT ON NO. OF PERSONS ENTERING MIZORAM FROM MYANMAR IN THE WAKE OF MILITARY COUP IN MYANMAR AS ON 13.3.2021 @ Ã‚Â 05:00 P.M.', '', '2021-03-13');
INSERT INTO "file_list" ("id", "file_no", "category", "title", "doc1", "entry_date_real") VALUES
(1892, 'MSB/CB/A-5(R)', 'MYANMAR REFUGEE', 'REPORT ON NO. OF PERSONS ENTERING MIZORAM FROM MYANMAR IN THE WAKE OF MILITARY COUP IN MYANMAR AS ON 14.3.2021 @ 10:00 A.M.', '', '2021-03-14');
INSERT INTO "file_list" ("id", "file_no", "category", "title", "doc1", "entry_date_real") VALUES
(1893, 'MSB/CB/A-5(R)', 'MYANMAR REFUGEE', 'REPORT ON NO. OF PERSONS ENTERING MIZORAM FROM MYANMAR IN THE WAKE OF MILITARY COUP IN MYANMAR AS ON 14.3.2021 @ 5:00 P.M.', '', '2021-03-14');
INSERT INTO "file_list" ("id", "file_no", "category", "title", "doc1", "entry_date_real") VALUES
(1894, 'MSB/CB/A-5(R)', 'MYANMAR REFUGEE', 'REPORT ON NO. OF PERSONS ENTERING MIZORAM FROM MYANMAR IN THE WAKE OF MILITARY COUP IN MYANMAR AS ON 15.3.2021 @ 10:00 A.M.', '', '2021-03-15');
INSERT INTO "file_list" ("id", "file_no", "category", "title", "doc1", "entry_date_real") VALUES
(1895, 'MSB/CB/A-5(R)', 'MYANMAR REFUGEE', 'REPORT ON NO. OF PERSONS ENTERING MIZORAM FROM MYANMAR IN THE WAKE OF MILITARY COUP IN MYANMAR AS ON 15.3.2021 @ 05:00 P.M.', '', '2021-03-15');
INSERT INTO "file_list" ("id", "file_no", "category", "title", "doc1", "entry_date_real") VALUES
(1896, 'MSB/CB/A-5(R)', 'MYANMAR REFUGEE', 'REPORT ON NO. OF PERSONS ENTERING MIZORAM FROM MYANMAR IN THE WAKE OF MILITARY COUP IN MYANMAR AS ON 16.3.2021 @ 10:00 A.M.', '', '2021-03-16');
INSERT INTO "file_list" ("id", "file_no", "category", "title", "doc1", "entry_date_real") VALUES
(1897, 'MSB/CB/A-5(R)', 'MYANMAR REFUGEE', 'REPORT ON NO. OF PERSONS ENTERING MIZORAM FROM MYANMAR IN THE WAKE OF MILITARY COUP IN MYANMAR AS ON 16.3.2021 @ 5:00 P.M.\r\n\r\nÃ‚Â Ã‚Â Ã‚Â Ã‚Â Ã‚Â Ã‚Â Ã‚Â Ã‚Â Ã‚Â Ã‚Â Ã‚Â Ã‚Â Ã‚Â ', '', '2021-03-16');
INSERT INTO "file_list" ("id", "file_no", "category", "title", "doc1", "entry_date_real") VALUES
(1898, 'MSB/CB/A-5(R)', 'MYANMAR REFUGEE', 'REPORT ON NO. OF PERSONS ENTERING MIZORAM FROM MYANMAR IN THE WAKE OF MILITARY COUP IN MYANMAR AS ON 17.3.2021 @ 5:00 P.M.', '', '2021-03-17');
INSERT INTO "file_list" ("id", "file_no", "category", "title", "doc1", "entry_date_real") VALUES
(1899, 'MSB/CB/A-5(R)', 'MYANMAR REFUGEE', 'REPORT ON NO. OF PERSONS ENTERING MIZORAM FROM MYANMAR IN THE WAKE OF MILITARY COUP IN MYANMAR AS ON 17.3.2021 @ 05:00 P.M.', '', '2021-03-17');
INSERT INTO "file_list" ("id", "file_no", "category", "title", "doc1", "entry_date_real") VALUES
(1900, 'MSB/CB/A-5(R)', 'MYANMAR REFUGEE', 'REPORT ON NO. OF PERSONS ENTERING MIZORAM FROM MYANMAR IN THE WAKE OF MILITARY COUP IN MYANMAR AS ON 18.3.2021 @ 10:00 A.M.\r\n\r\nÃ‚Â Ã‚Â Ã‚Â Ã‚Â Ã‚Â Ã‚Â ', '', '2021-03-18');
INSERT INTO "file_list" ("id", "file_no", "category", "title", "doc1", "entry_date_real") VALUES
(1901, 'MSB/CB/A-5(R)', 'MYANMAR REFUGEE', 'REPORT ON NO. OF PERSONS ENTERING MIZORAM FROM MYANMAR IN THE WAKE OF MILITARY COUP IN MYANMAR AS ON 18.3.2021 @ 5:00 P.M.\r\n\r\nÃ‚Â ', '', '2021-03-18');
INSERT INTO "file_list" ("id", "file_no", "category", "title", "doc1", "entry_date_real") VALUES
(1902, 'MSB/CB/A-5(R)', 'MYANMAR REFUGEE', 'REPORT ON NO. OF PERSONS ENTERING MIZORAM FROM MYANMAR IN THE WAKE OF MILITARY COUP IN MYANMAR AS ON 19.3.2021 @ 10:00 A.M.\r\n\r\nÃ‚Â Ã‚Â Ã‚Â Ã‚Â Ã‚Â Ã‚Â Ã‚Â Ã‚Â Ã‚Â Ã‚Â Ã‚Â Ã‚Â Ã‚Â ', '', '2021-03-19');
INSERT INTO "file_list" ("id", "file_no", "category", "title", "doc1", "entry_date_real") VALUES
(1903, 'MSB/CB/A-5(R)', 'MYANMAR REFUGEE', 'REPORT ON NO. OF PERSONS ENTERING MIZORAM FROM MYANMAR IN THE WAKE OF MILITARY COUP IN MYANMAR AS ON 19.3.2021 @ 05:00 P.M.', '', '2021-03-19');
INSERT INTO "file_list" ("id", "file_no", "category", "title", "doc1", "entry_date_real") VALUES
(1904, 'MSB/CB/A-5(R)', 'MYANMAR REFUGEE', 'REPORT ON NO. OF PERSONS ENTERING MIZORAM FROM MYANMAR IN THE WAKE OF MILITARY COUP IN MYANMAR AS ON 20.3.2021 @ 10:00 A.M.', '', '2021-03-20');
INSERT INTO "file_list" ("id", "file_no", "category", "title", "doc1", "entry_date_real") VALUES
(1905, 'MSB/CB/A-5(R)', 'MYANMAR REFUGEE', 'REPORT ON NO. OF PERSONS ENTERING MIZORAM FROM MYANMAR IN THE WAKE OF MILITARY COUP IN MYANMAR AS ON 20.3.2021 @ 10:00 A.M.', '', '2021-03-20');
INSERT INTO "file_list" ("id", "file_no", "category", "title", "doc1", "entry_date_real") VALUES
(1906, 'MSB/CB/A-5(R)', 'MYANMAR REFUGEE', 'REPORT ON NO. OF PERSONS ENTERING MIZORAM FROM MYANMAR IN THE WAKE OF MILITARY COUP IN MYANMAR AS ON 20.3.2021 @ 05:00 P.M.', '', '2021-03-20');
INSERT INTO "file_list" ("id", "file_no", "category", "title", "doc1", "entry_date_real") VALUES
(1907, 'MSB/CB/A-5(R)', 'MYANMAR REFUGEE', 'REPORT ON NO. OF PERSONS ENTERING MIZORAM FROM MYANMAR IN THE WAKE OF MILITARY COUP IN MYANMAR AS ON 20.3.2021 @ 10:00 A.M.', '', '2021-03-20');
INSERT INTO "file_list" ("id", "file_no", "category", "title", "doc1", "entry_date_real") VALUES
(1908, 'MSB/CB/A-5(R)', 'MYANMAR REFUGEE', 'REPORT ON NO. OF PERSONS ENTERING MIZORAM FROM MYANMAR IN THE WAKE OF MILITARY COUP IN MYANMAR AS ON 21.3.2021 @ 10:00 A.M.', '', '2021-03-21');
INSERT INTO "file_list" ("id", "file_no", "category", "title", "doc1", "entry_date_real") VALUES
(1909, 'MSB/CB/A-5(R)', 'MYANMAR REFUGEE', 'REPORT ON NO. OF PERSONS ENTERING MIZORAM FROM MYANMAR IN THE WAKE OF MILITARY COUP IN MYANMAR AS ON 21.3.2021 @ 05:00 P.M.', '', '2021-03-21');
INSERT INTO "file_list" ("id", "file_no", "category", "title", "doc1", "entry_date_real") VALUES
(1910, 'MSB/CB/A-5(R)', 'MYANMAR REFUGEE', 'REPORT ON NO. OF PERSONS ENTERING MIZORAM FROM MYANMAR IN THE WAKE OF MILITARY COUP IN MYANMAR AS ON 22.3.2021 @ 10:00 A.M.', '', '2021-03-22');
INSERT INTO "file_list" ("id", "file_no", "category", "title", "doc1", "entry_date_real") VALUES
(1911, 'MSB/CB/A-5(R)', 'MYANMAR REFUGEE', 'Myanmar Refugees Update as on 11.03.2021Ã‚Â ', '', '2021-03-11');
INSERT INTO "file_list" ("id", "file_no", "category", "title", "doc1", "entry_date_real") VALUES
(1912, 'MSB/CB/A-5(R)', 'MYANMAR REFUGEE', 'Myanmar Refugee update', '', '2021-03-06');
INSERT INTO "file_list" ("id", "file_no", "category", "title", "doc1", "entry_date_real") VALUES
(1913, 'MSB/CB/A-5(R)', 'MYANMAR REFUGEE', 'MYANMAR REFUGEES -SAITUAL DISTRICT', '', '2021-04-22');
INSERT INTO "file_list" ("id", "file_no", "category", "title", "doc1", "entry_date_real") VALUES
(1914, 'MSB/CB/B-85/Arms', 'Arms, Smuggling etc.', '26.9.2013', '', '2013-09-26');
INSERT INTO "file_list" ("id", "file_no", "category", "title", "doc1", "entry_date_real") VALUES
(1915, 'MSB/CB/B-85/Arms', 'Arms, Smuggling etc.', 'SEIZURE OF ARMS & AMMUNITION FOR THE YEAR DECEMBER 2008 - 18.11.08', '', '2013-09-03');
INSERT INTO "file_list" ("id", "file_no", "category", "title", "doc1", "entry_date_real") VALUES
(1916, 'MSB/CB/B-85/Arms', 'Arms, Smuggling etc.', 'ARMS/AMMUNITIONS/MAGAZINES/I.E.D.S Ã‚Â Ã‚Â Ã‚Â SEIZED Ã‚Â BY\r\nMIZORAM POLICE IN BETWEEN 2009', '', '2016-07-19');
INSERT INTO "file_list" ("id", "file_no", "category", "title", "doc1", "entry_date_real") VALUES
(1917, 'MSB/CB/B-85/Arms', 'Arms, Smuggling etc.', 'PANGOLIN SCALES SEIZED IN MIZORAM\r\n2000 Ã¢â‚¬â€œ 2016 (UPTO JUNE)', '', '2016-07-19');
INSERT INTO "file_list" ("id", "file_no", "category", "title", "doc1", "entry_date_real") VALUES
(1918, 'MSB/CB/B-85/Arms', 'Arms, Smuggling etc.', '1998-08', '', '2012-11-08');
INSERT INTO "file_list" ("id", "file_no", "category", "title", "doc1", "entry_date_real") VALUES
(1919, 'MSB/CB/B-85/Arms', 'Arms, Smuggling etc.', '2009 - TILL DATE', '', '2012-11-08');
INSERT INTO "file_list" ("id", "file_no", "category", "title", "doc1", "entry_date_real") VALUES
(1920, 'MSB/CB/B-85/Arms', 'Arms, Smuggling etc.', 'COMMENT', '', '2018-02-26');
INSERT INTO "file_list" ("id", "file_no", "category", "title", "doc1", "entry_date_real") VALUES
(1921, 'MSB/CB/B-85/Arms', 'Arms, Smuggling etc.', 'Judgement & Order dt. 28.1.2014 passed by KL Liana, Dist. & SessionÃ‚Â Judge.', '', '2018-03-12');
INSERT INTO "file_list" ("id", "file_no", "category", "title", "doc1", "entry_date_real") VALUES
(1922, 'MSB/CB/B-85/Arms', 'Arms, Smuggling etc.', 'JUDGEMENT & ORDER', '', '2018-02-26');
INSERT INTO "file_list" ("id", "file_no", "category", "title", "doc1", "entry_date_real") VALUES
(1923, 'MSB/CB/B-85/Arms', 'Arms, Smuggling etc.', 'PARA-WISE COMMENTS ON JUDGEMENT ORDER', '', '2018-03-01');
INSERT INTO "file_list" ("id", "file_no", "category", "title", "doc1", "entry_date_real") VALUES
(1924, 'MSB/CB/B-85/Arms', 'Arms, Smuggling etc.', 'Exchange information about illicit drug and the ammunition trafficking', '', '2020-03-16');
INSERT INTO "file_list" ("id", "file_no", "category", "title", "doc1", "entry_date_real") VALUES
(1925, 'MSB/CB/B-85/Arms', 'Arms, Smuggling etc.', 'Floyd Ramfangzauva - VVK PS CASE', '', '2020-09-08');
INSERT INTO "file_list" ("id", "file_no", "category", "title", "doc1", "entry_date_real") VALUES
(1926, 'MSB/CB/B-85/Arms', 'Arms, Smuggling etc.', 'Report of Joint Interrogation Team in connection with Marpara PS Case No. 1/2020 dt. 29.8.2020 u/s 25(1A)/35 Arms Act r/w 120B IPC.', '', '2020-10-06');
INSERT INTO "file_list" ("id", "file_no", "category", "title", "doc1", "entry_date_real") VALUES
(1927, 'MSB/CB/B-85/Arms', 'Arms, Smuggling etc.', 'Information about the case regarding the Arms and Drugs in Mizoram Ã‚Â  state, India.', '', '2020-03-13');
INSERT INTO "file_list" ("id", "file_no", "category", "title", "doc1", "entry_date_real") VALUES
(1928, 'MSB/CB/B-85/Arms', 'Arms, Smuggling etc.', 'Exchange information about illicit drug and the ammunition trafficking (KantFine)', '', '2021-01-12');
INSERT INTO "file_list" ("id", "file_no", "category", "title", "doc1", "entry_date_real") VALUES
