-- PostgreSQL version of MySQL dump
-- Converted by convert_batch_mysql_to_postgres.py

INSERT INTO "file_list" ("id", "file_no", "category", "title", "doc1", "entry_date_real") VALUES
(2018, 'MSB/CB/B-160', 'INTERROGATION STATEMENT', 'STATEMENT OF LALLUNGMUANA, THINGKALHDAWR, MANIPUR', '', '2015-10-01');
INSERT INTO "file_list" ("id", "file_no", "category", "title", "doc1", "entry_date_real") VALUES
(2019, 'MSB/CB/B-160', 'INTERROGATION STATEMENT', 'INTERROGATION STATEMENT Â OF LALTHANGSANGA', '', '2010-05-31');
INSERT INTO "file_list" ("id", "file_no", "category", "title", "doc1", "entry_date_real") VALUES
(2020, 'MSB/CB/B-160', 'INTERROGATION STATEMENT', 'INTERROGATION STATEMENT OF MAYENGBAM MAICHAN MEITEI', '', '2010-06-02');
INSERT INTO "file_list" ("id", "file_no", "category", "title", "doc1", "entry_date_real") VALUES
(2021, 'MSB/CB/B-160', 'INTERROGATION STATEMENT', 'INTERROGATION STATEMENT OF PAULALLIAN SINGSON', '', '2010-05-28');
INSERT INTO "file_list" ("id", "file_no", "category", "title", "doc1", "entry_date_real") VALUES
(2022, 'MSB/CB/B-160', 'INTERROGATION STATEMENT', 'INTERROGATION STATEMENT OF PROBESH CHAKMA', '', '2010-06-02');
INSERT INTO "file_list" ("id", "file_no", "category", "title", "doc1", "entry_date_real") VALUES
(2023, 'MSB/CB/B-160', 'INTERROGATION STATEMENT', 'STATEMENT OF REUBEN LALROMAWIA, SAIPUM', '', '2015-10-05');
INSERT INTO "file_list" ("id", "file_no", "category", "title", "doc1", "entry_date_real") VALUES
(2024, 'MSB/CB/B-160', 'INTERROGATION STATEMENT', 'INTERROGATION STATEMENT Â OF SS Lt. SIMON CHAKMA', '', '2010-06-03');
INSERT INTO "file_list" ("id", "file_no", "category", "title", "doc1", "entry_date_real") VALUES
(2025, 'MSB/CB/B-160', 'INTERROGATION STATEMENT', 'INTERROGATION STATEMENT OF SS Pvt. SUHRAB CHAKMA (31) S/o KOMAL CHAKMA OF DETRINALA (BANGLADESH)', '', '2010-05-31');
INSERT INTO "file_list" ("id", "file_no", "category", "title", "doc1", "entry_date_real") VALUES
(2026, 'MSB/CB/B-160', 'INTERROGATION STATEMENT', 'STATEMENTÂ  OFÂ  ACCUSEDÂ  LALTHACHHUNGA TINGHMUN, MIZORAM', '', '2012-06-26');
INSERT INTO "file_list" ("id", "file_no", "category", "title", "doc1", "entry_date_real") VALUES
(2027, 'MSB/CB/B-160', 'INTERROGATION STATEMENT', 'STATEMENT OF ACCUSED THLAMUANA @ PETO @ PAITHAUH', '', '2014-07-22');
INSERT INTO "file_list" ("id", "file_no", "category", "title", "doc1", "entry_date_real") VALUES
(2028, 'MSB/CB/B-160', 'INTERROGATION STATEMENT', 'STATEMENT OF EDWIN JATIHAM', '', '2011-07-11');
INSERT INTO "file_list" ("id", "file_no", "category", "title", "doc1", "entry_date_real") VALUES
(2029, 'MSB/CB/B-160', 'INTERROGATION STATEMENT', 'STATEMENT OF LALRINAWMA CHORKHY', '', '2011-08-10');
INSERT INTO "file_list" ("id", "file_no", "category", "title", "doc1", "entry_date_real") VALUES
(2030, 'MSB/CB/B-160', 'INTERROGATION STATEMENT', 'STATEMENT OF LALROKIMA (40) @ RINSANGA PA S/O RAMSADUH (L) OF NORTH PHULPUI', '', '2013-03-04');
INSERT INTO "file_list" ("id", "file_no", "category", "title", "doc1", "entry_date_real") VALUES
(2031, 'MSB/CB/B-160', 'INTERROGATION STATEMENT', 'STATEMENT OF LINCOLN ZOSANGLIANA', '', '2011-07-07');
INSERT INTO "file_list" ("id", "file_no", "category", "title", "doc1", "entry_date_real") VALUES
(2032, 'MSB/CB/B-160', 'INTERROGATION STATEMENT', 'STATEMENT OF PAULALLIANA SINGSON\r\n\r\nOF JERIBAM, PHAITUAL, MANIPUR\r\n\r\n\r\n\r\nSTATEMENT OF PAULALLIANA SINGSON OF JERIBAM, PHAITUAL, MANIPUR', '', '2010-05-05');
INSERT INTO "file_list" ("id", "file_no", "category", "title", "doc1", "entry_date_real") VALUES
(2033, 'MSB/CB/B-160', 'INTERROGATION STATEMENT', 'Statement of Rosanga S/o Zasanga(L) of Saipum', '', '2010-04-10');
INSERT INTO "file_list" ("id", "file_no", "category", "title", "doc1", "entry_date_real") VALUES
(2034, 'MSB/CB/B-160', 'INTERROGATION STATEMENT', 'INTERROGATION STATEMENT OF VANLALFELA', '', '2010-06-02');
INSERT INTO "file_list" ("id", "file_no", "category", "title", "doc1", "entry_date_real") VALUES
(2035, 'MSB/CB/B-160', 'INTERROGATION STATEMENT', 'INTERROGATION STATEMENT Â OF VANLALLIANA', '', '2010-06-02');
INSERT INTO "file_list" ("id", "file_no", "category", "title", "doc1", "entry_date_real") VALUES
(2036, 'MSB/CB/B-160', 'INTERROGATION STATEMENT', 'INTERROGATION STATEMENT Â OF VANRAMA', '', '2010-05-31');
INSERT INTO "file_list" ("id", "file_no", "category", "title", "doc1", "entry_date_real") VALUES
(2037, 'MSB/CB/B-160', 'INTERROGATION STATEMENT', 'STATEMENT OF S/S CORPORAL ZUTOVI SEMA, NSCN(IM)', '', '2010-06-03');
INSERT INTO "file_list" ("id", "file_no", "category", "title", "doc1", "entry_date_real") VALUES
(2038, 'MSB/CB/B-166', 'Correspondence on Chief Ministers remark', 'Clarification of the Honâ€™ble Chief Ministerâ€™s remarks on the body of Daily Summary of Information', '', '2017-08-24');
INSERT INTO "file_list" ("id", "file_no", "category", "title", "doc1", "entry_date_real") VALUES
(2039, 'MSB/CB/B-166', 'Correspondence on Chief Ministers remark', 'Chief Minister''s (M) Remark.', '', '2007-10-23');
INSERT INTO "file_list" ("id", "file_no", "category", "title", "doc1", "entry_date_real") VALUES
(2040, 'MSB/CB/B-166', 'Correspondence on Chief Ministers remark', 'Chief Minister''s (M) Remark.', '', '2007-10-23');
INSERT INTO "file_list" ("id", "file_no", "category", "title", "doc1", "entry_date_real") VALUES
(2041, 'MSB/CB/B-166', 'Correspondence on Chief Ministers remark', 'Chief Minister''s Remark.', '', '2011-08-09');
INSERT INTO "file_list" ("id", "file_no", "category", "title", "doc1", "entry_date_real") VALUES
(2042, 'MSB/CB/B-47', 'Scheme for surrender of militant', 'Rehabilitation of BRU armed gang.', '', '2011-10-28');
INSERT INTO "file_list" ("id", "file_no", "category", "title", "doc1", "entry_date_real") VALUES
(2043, 'MSB/CB/B-167', 'Bru Revolutionary Army (BRU)/BRA/BRAM', 'REPORTS ON BRU ARMED GANG', '', '2007-10-23');
INSERT INTO "file_list" ("id", "file_no", "category", "title", "doc1", "entry_date_real") VALUES
(2044, 'MSB/CB/B-167', 'Bru Revolutionary Army (BRU)/BRA/BRAM', 'Rehabilitation of BRU armed gang', '', '2011-10-28');
INSERT INTO "file_list" ("id", "file_no", "category", "title", "doc1", "entry_date_real") VALUES
(2045, 'MSB/CB/B-169', 'Indo-Myanmar Border Trade/KMMTTP', 'STATUS ON IMPLEMENTATION OF KALADAN MULTI-MODAL TRANSIT TRANSPORT PROJECT (KMMTTP)', '', '2020-07-27');
INSERT INTO "file_list" ("id", "file_no", "category", "title", "doc1", "entry_date_real") VALUES
(2046, 'MSB/CB/B-169', 'Indo-Myanmar Border Trade/KMMTTP', 'Kaladan Multi-Modal Transit Transport Project (KMMTTP)', '', '2018-04-04');
INSERT INTO "file_list" ("id", "file_no", "category", "title", "doc1", "entry_date_real") VALUES
(2047, 'MSB/CB/B-169', 'Indo-Myanmar Border Trade/KMMTTP', 'CURRENT STATUS OF KALADAN MULTI-MODAL TRANSIT TRANSPORT PROJECT(KMMTTP) WITHIN MIZORAM\r\nI.E. FROM ZOCHACHHUAH TO LAWNGTLAI', '', '2014-11-19');
INSERT INTO "file_list" ("id", "file_no", "category", "title", "doc1", "entry_date_real") VALUES
(2048, 'MSB/CB/B-169', 'Indo-Myanmar Border Trade/KMMTTP', 'KALADAN MULTIMODAL TRANSIT TRANSPORT PROJECT', '', '2014-11-24');
INSERT INTO "file_list" ("id", "file_no", "category", "title", "doc1", "entry_date_real") VALUES
(2049, 'MSB/CB/B-169', 'Indo-Myanmar Border Trade/KMMTTP', 'KALADAN MULTI MODAL TRANSIT TRANSPORT PROJECT (KMMTTP)', '', '2020-07-27');
INSERT INTO "file_list" ("id", "file_no", "category", "title", "doc1", "entry_date_real") VALUES
(2050, 'MSB/CB/B-169', 'Indo-Myanmar Border Trade/KMMTTP', 'ACT EAST POLICY - SECURITY CHALLENGES AND PREPAREDNESS', '', '2020-06-27');
INSERT INTO "file_list" ("id", "file_no", "category", "title", "doc1", "entry_date_real") VALUES
(2051, 'MSB/CB/B-169', 'Indo-Myanmar Border Trade/KMMTTP', 'ACTIVITIES OF LAWNGTLAI DISTRICT LAND OWNERS'' ASSOCIATION (LDLOA)', '', '2020-03-16');
INSERT INTO "file_list" ("id", "file_no", "category", "title", "doc1", "entry_date_real") VALUES
(2052, 'MSB/CB/B-171', 'Burglaryof Govt.Offices/Bank(Lawngtlai bank robbery SR thenkhat puak tir ani)', 'Arrested Persons of BDO Office Zawlnuam Burglary', '', '2007-10-23');
INSERT INTO "file_list" ("id", "file_no", "category", "title", "doc1", "entry_date_real") VALUES
(2053, 'MSB/CB/B-171', 'Burglaryof Govt.Offices/Bank(Lawngtlai bank robbery SR thenkhat puak tir ani)', 'BURGLARY OF BDO''s OFFICE, ZAWLNUAM, MAMIT DISTRICT', '', '2013-01-22');
INSERT INTO "file_list" ("id", "file_no", "category", "title", "doc1", "entry_date_real") VALUES
(2054, 'MSB/CB/B-171', 'Burglaryof Govt.Offices/Bank(Lawngtlai bank robbery SR thenkhat puak tir ani)', 'BURGLARY OF BDO''s OFFICE, ZAWLNUAM, MAMIT DISTRICT', '', '2007-10-23');
INSERT INTO "file_list" ("id", "file_no", "category", "title", "doc1", "entry_date_real") VALUES
(2055, 'MSB/CB/B-171', 'Burglaryof Govt.Offices/Bank(Lawngtlai bank robbery SR thenkhat puak tir ani)', 'ZAWLNUAM BDO OFFICE BURGLARY CASE A TUN THLENGA\r\nPAWISA RECOVER TAWH REPORT as on 11.9.2012', '', '2012-09-11');
INSERT INTO "file_list" ("id", "file_no", "category", "title", "doc1", "entry_date_real") VALUES
(2056, 'MSB/CB/B-171', 'Burglaryof Govt.Offices/Bank(Lawngtlai bank robbery SR thenkhat puak tir ani)', 'ZAWLNUAM BDO OFFICE BURGLARY', '', '2014-05-09');
INSERT INTO "file_list" ("id", "file_no", "category", "title", "doc1", "entry_date_real") VALUES
(2057, 'MSB/CB/B-173', 'Bru National Development Liberation Front of Mizoram (BNDLFM)', 'NOTES ON THE ISSUES OF BRU MILITANCY & BRU REFUGEES HISTORY', '', '2020-10-26');
INSERT INTO "file_list" ("id", "file_no", "category", "title", "doc1", "entry_date_real") VALUES
(2058, 'MSB/CB/B-173', 'Bru National Development Liberation Front of Mizoram (BNDLFM)', 'PERSONS ABDUCTED / KIDNAPPED BY BNLF,BLFM,UDLA, NLFT, BNCT, BNDLFM, BDFM FOR THE YEAR 2000 - TILL DATE', '', '2020-10-12');
INSERT INTO "file_list" ("id", "file_no", "category", "title", "doc1", "entry_date_real") VALUES
(2059, 'MSB/CB/B-173', 'Bru National Development Liberation Front of Mizoram (BNDLFM)', 'BRU NATIONAL LIBERATION FRONT (BNLF) & BRU LIBERATION FRONT OF MIZORAM(BLFM)', '', '2016-02-10');
INSERT INTO "file_list" ("id", "file_no", "category", "title", "doc1", "entry_date_real") VALUES
(2060, 'MSB/CB/B-173', 'Bru National Development Liberation Front of Mizoram (BNDLFM)', 'HPC&BNLF Surrender', '', '2011-10-13');
INSERT INTO "file_list" ("id", "file_no", "category", "title", "doc1", "entry_date_real") VALUES
(2061, 'MSB/CB/B-173', 'Bru National Development Liberation Front of Mizoram (BNDLFM)', 'BDFM Activities', '', '2014-11-25');
INSERT INTO "file_list" ("id", "file_no", "category", "title", "doc1", "entry_date_real") VALUES
(2062, 'MSB/CB/B-173', 'Bru National Development Liberation Front of Mizoram (BNDLFM)', 'BDFM Activities', '', '2014-11-19');
INSERT INTO "file_list" ("id", "file_no", "category", "title", "doc1", "entry_date_real") VALUES
(2063, 'MSB/CB/B-173', 'Bru National Development Liberation Front of Mizoram (BNDLFM)', 'BRU LIBERATION FRONT OF MIZORAM (BLFM)', '', '2011-12-14');
INSERT INTO "file_list" ("id", "file_no", "category", "title", "doc1", "entry_date_real") VALUES
(2064, 'MSB/CB/B-173', 'Bru National Development Liberation Front of Mizoram (BNDLFM)', 'Activities of Bru Militants', '', '2014-11-25');
INSERT INTO "file_list" ("id", "file_no", "category", "title", "doc1", "entry_date_real") VALUES
(2065, 'MSB/CB/B-173', 'Bru National Development Liberation Front of Mizoram (BNDLFM)', 'BRU LIBERATION FRONT OF MIZORAM (BLFM)\r\nActivities from 2004 till date', '', '2014-11-19');
INSERT INTO "file_list" ("id", "file_no", "category", "title", "doc1", "entry_date_real") VALUES
(2066, 'MSB/CB/B-173', 'Bru National Development Liberation Front of Mizoram (BNDLFM)', 'BRU NATIONAL LIBERATION FRONT (BNLF)', '', '2011-12-14');
INSERT INTO "file_list" ("id", "file_no", "category", "title", "doc1", "entry_date_real") VALUES
(2067, 'MSB/CB/B-173', 'Bru National Development Liberation Front of Mizoram (BNDLFM)', 'ACTIVITIES OF BNLF 2000', '', '2014-11-25');
INSERT INTO "file_list" ("id", "file_no", "category", "title", "doc1", "entry_date_real") VALUES
(2068, 'MSB/CB/B-173', 'Bru National Development Liberation Front of Mizoram (BNDLFM)', 'BRU REVOLUTIONARY UNION/ARMY (BRU/BRA)', '', '2011-12-14');
INSERT INTO "file_list" ("id", "file_no", "category", "title", "doc1", "entry_date_real") VALUES
(2069, 'MSB/CB/B-173', 'Bru National Development Liberation Front of Mizoram (BNDLFM)', 'LIST OF IMPORTANT LEADERS OF BDFM AND THEIR DESIGNATED RANKS', '', '2014-12-22');
INSERT INTO "file_list" ("id", "file_no", "category", "title", "doc1", "entry_date_real") VALUES
(2070, 'MSB/CB/B-173', 'Bru National Development Liberation Front of Mizoram (BNDLFM)', 'NOTES ON BNLF (BRU NATIONAL LIBERATION FRONT) AND\r\nBLFM (BRU LIBERATION FRONT OF MIZORAM)', '', '2008-08-20');
INSERT INTO "file_list" ("id", "file_no", "category", "title", "doc1", "entry_date_real") VALUES
(2071, 'MSB/CB/B-173', 'Bru National Development Liberation Front of Mizoram (BNDLFM)', 'PERSONS ABDUCTED / KIDNAPPED BY BNLF,BLFM,UDLA, NLFT, BNCT, BNDLFM, BDFM FOR THE YEAR 2000 - TILL DATE', '', '2020-02-10');
INSERT INTO "file_list" ("id", "file_no", "category", "title", "doc1", "entry_date_real") VALUES
(2072, 'MSB/CB/B-173', 'Bru National Development Liberation Front of Mizoram (BNDLFM)', 'Statements in connection with activities of Bru Dacoits, etc. in Mamit District.', '', '2014-11-18');
INSERT INTO "file_list" ("id", "file_no", "category", "title", "doc1", "entry_date_real") VALUES
(2073, 'MSB/CB/B-170', 'IGP/DIG Concern file', 'Comments on suggestions relating to insurgency in North East', '', '2018-03-20');
INSERT INTO "file_list" ("id", "file_no", "category", "title", "doc1", "entry_date_real") VALUES
(2074, 'MSB/CB/B-170', 'IGP/DIG Concern file', 'COMMENTS/VIEWS ON INSURGENCY IN NORTH-EAST', '', '2018-03-20');
INSERT INTO "file_list" ("id", "file_no", "category", "title", "doc1", "entry_date_real") VALUES
(2075, 'MSB/CB/B-170', 'IGP/DIG Concern file', 'COMMENTS/VIEWS ON INSURGENCY IN NORTH-EAST', '', '2018-03-20');
INSERT INTO "file_list" ("id", "file_no", "category", "title", "doc1", "entry_date_real") VALUES
(2076, 'MSB/CB/B-170', 'IGP/DIG Concern file', 'Draft DO Letter for Chief Minister of Mizoram.', '', '2014-10-27');
INSERT INTO "file_list" ("id", "file_no", "category", "title", "doc1", "entry_date_real") VALUES
(2077, 'MSB/CB/B-170', 'IGP/DIG Concern file', 'Draft DO', '', '2014-10-27');
INSERT INTO "file_list" ("id", "file_no", "category", "title", "doc1", "entry_date_real") VALUES
(2078, 'MSB/CB/B-170', 'IGP/DIG Concern file', 'BRIEF NOTE ON MIZORAM INSURGENCY PROBLEMS', '', '2018-08-21');
INSERT INTO "file_list" ("id", "file_no", "category", "title", "doc1", "entry_date_real") VALUES
(2079, 'MSB/CB/B-170', 'IGP/DIG Concern file', 'Write up on Border Management Issues-Bangladesh-IndiaÂ  & Â India-Myanmar', '', '2017-01-23');
INSERT INTO "file_list" ("id", "file_no", "category", "title", "doc1", "entry_date_real") VALUES
(2080, 'MSB/CB/B-170', 'IGP/DIG Concern file', 'Write-up in connection with the agenda items for the forthcoming Meeting scheduled to be held on 24.1.2017(Tuesday) under the Chairmanship ofÂ  Pi Renu Sharma, Principal Secretary, Home Department.', '', '2017-01-23');
INSERT INTO "file_list" ("id", "file_no", "category", "title", "doc1", "entry_date_real") VALUES
(2081, 'MSB/CB/B-170', 'IGP/DIG Concern file', '3rd DG level talks between NCB, India and CCDAC, Myanmar.', '', '2017-11-24');
INSERT INTO "file_list" ("id", "file_no", "category", "title", "doc1", "entry_date_real") VALUES
(2082, 'MSB/CB/B-170', 'IGP/DIG Concern file', 'INDO-MYANMAR BORDER POLICING', '', '2015-04-29');
INSERT INTO "file_list" ("id", "file_no", "category", "title", "doc1", "entry_date_real") VALUES
(2083, 'MSB/CB/B-170', 'IGP/DIG Concern file', 'INDO-MYANMAR BORDER POLICING', '', '2015-05-01');
INSERT INTO "file_list" ("id", "file_no", "category", "title", "doc1", "entry_date_real") VALUES
(2084, 'MSB/CB/B-170', 'IGP/DIG Concern file', 'REPORT ON RECENT INCIDENT ALONG INDO-MYANMAR BORDER', '', '2018-03-01');
INSERT INTO "file_list" ("id", "file_no", "category", "title", "doc1", "entry_date_real") VALUES
(2085, 'MSB/CB/B-170', 'IGP/DIG Concern file', 'â€˜Collective approach to resolve insurgency in North East Regionâ€™ â€“regarding.', '', '2018-08-28');
INSERT INTO "file_list" ("id", "file_no", "category", "title", "doc1", "entry_date_real") VALUES
(2086, 'MSB/CB/B-170', 'IGP/DIG Concern file', 'INTERNAL SECURITY WITH FOCUS ON INTELLIGENCE SHARING AND CO-ORDINATION FOR COMBATING TERRORISM/INSURGENCY ETC. IN MIZORAM', '', '2018-08-28');
INSERT INTO "file_list" ("id", "file_no", "category", "title", "doc1", "entry_date_real") VALUES
(2087, 'MSB/CB/B-170', 'IGP/DIG Concern file', 'Insurgency in India''s Northeast Cross-border Links and Strategic Alliances\r\nWasbir Hussain*', '', '2018-08-22');
INSERT INTO "file_list" ("id", "file_no", "category", "title", "doc1", "entry_date_real") VALUES
(2088, 'MSB/CB/B-170', 'IGP/DIG Concern file', 'COLLECTIVE APPROACH TO RESOLVE INSURGENCY\r\nIN NORTH EAST REGION', '', '2018-08-23');
INSERT INTO "file_list" ("id", "file_no", "category", "title", "doc1", "entry_date_real") VALUES
(2089, 'MSB/CB/B-170', 'IGP/DIG Concern file', 'Insurgency in Northeast India', '', '2018-08-22');
INSERT INTO "file_list" ("id", "file_no", "category", "title", "doc1", "entry_date_real") VALUES
(2090, 'MSB/CB/B-170', 'IGP/DIG Concern file', 'KUMIN CHHUNGA MIZORAM A THIL THLENG LANGSAR ZUAL TE', '', '2020-08-24');
INSERT INTO "file_list" ("id", "file_no", "category", "title", "doc1", "entry_date_real") VALUES
(2091, 'MSB/CB/B-170', 'IGP/DIG Concern file', 'ASSAM RIFLES NENA BUAINA CHUNGCHANG', '', '2020-08-24');
INSERT INTO "file_list" ("id", "file_no", "category", "title", "doc1", "entry_date_real") VALUES
(2092, 'MSB/CB/B-170', 'IGP/DIG Concern file', 'RAMRI-A BUAINA CHUNGCHANG', '', '2020-08-24');
INSERT INTO "file_list" ("id", "file_no", "category", "title", "doc1", "entry_date_real") VALUES
(2093, 'MSB/CB/B-170', 'IGP/DIG Concern file', 'TUALCHHUNG-A BUAINA THLENG THENKHATTE', '', '2020-08-24');
INSERT INTO "file_list" ("id", "file_no", "category", "title", "doc1", "entry_date_real") VALUES
(2094, 'MSB/CB/B-170', 'IGP/DIG Concern file', 'CHAMPHAI DISTRICT-A LIRNGHING CHUNGCHANGCHAMPHAI DISTRICT-A LIRNGHING CHUNGCHANG', '', '2020-08-24');
INSERT INTO "file_list" ("id", "file_no", "category", "title", "doc1", "entry_date_real") VALUES
(2095, 'MSB/CB/B-170', 'IGP/DIG Concern file', 'Â  Verification report Mawia Hmar', '', '2016-09-08');
INSERT INTO "file_list" ("id", "file_no", "category", "title", "doc1", "entry_date_real") VALUES
(2096, 'MSB/CB/B-170', 'IGP/DIG Concern file', 'Enquiry Report (Mawia Hmar)', '', '2016-09-06');
INSERT INTO "file_list" ("id", "file_no", "category", "title", "doc1", "entry_date_real") VALUES
(2097, 'MSB/CB/B-170', 'IGP/DIG Concern file', 'Mawia Hmar', '', '2016-09-06');
INSERT INTO "file_list" ("id", "file_no", "category", "title", "doc1", "entry_date_real") VALUES
(2098, 'MSB/CB/B-170', 'IGP/DIG Concern file', 'POINT NO. (viii) :Â Â Â  DETAILSÂ  OFÂ  CEASEFIREÂ  AGREEMENTÂ  ANDÂ  OTHER  AGREEMENTS', '', '2020-12-03');
INSERT INTO "file_list" ("id", "file_no", "category", "title", "doc1", "entry_date_real") VALUES
(2099, 'MSB/CB/B-170', 'IGP/DIG Concern file', 'POINT NO. (ix) : CURRENT LAW & ORDER SITUATION IN THE STATE/BORDER ISSUES:', '', '2020-12-03');
INSERT INTO "file_list" ("id", "file_no", "category", "title", "doc1", "entry_date_real") VALUES
(2100, 'MSB/CB/B-170', 'IGP/DIG Concern file', 'POINT NO. (vii) :Â Â  DETAILSÂ  OFÂ  INSURGENCY/HISTORY AND CURRENT  INSURGENT GROUPS', '', '2020-12-03');
INSERT INTO "file_list" ("id", "file_no", "category", "title", "doc1", "entry_date_real") VALUES
(2101, 'MSB/CB/B-170', 'IGP/DIG Concern file', 'POINT NO. (xvi) : Â ANY OTHER STRATEGIC ISSUES FROM SECURITY  POINT OF VIEW', '', '2020-12-03');
INSERT INTO "file_list" ("id", "file_no", "category", "title", "doc1", "entry_date_real") VALUES
(2102, 'MSB/CB/B-170', 'IGP/DIG Concern file', 'ACT EAST POLICY - SECURITY CHALLENGES AND PREPAREDNESS', '', '2020-06-27');
INSERT INTO "file_list" ("id", "file_no", "category", "title", "doc1", "entry_date_real") VALUES
(2103, 'MSB/CB/B-170', 'IGP/DIG Concern file', 'Agenda points for meeting to be held with representatives from Assam Rifles - regd.', '', '2020-10-09');
INSERT INTO "file_list" ("id", "file_no", "category", "title", "doc1", "entry_date_real") VALUES
(2104, 'MSB/CB/B-170', 'IGP/DIG Concern file', 'Annual work plan for the year 2020-2021', '', '2020-05-01');
INSERT INTO "file_list" ("id", "file_no", "category", "title", "doc1", "entry_date_real") VALUES
(2105, 'MSB/CB/B-170', 'IGP/DIG Concern file', 'Directions of Hon''ble Home Minister during the presentation on drug problem in NE States made by DG, NCB on 22nd July, 2020 - reg.', '', '2020-09-28');
INSERT INTO "file_list" ("id", "file_no", "category", "title", "doc1", "entry_date_real") VALUES
(2106, 'MSB/CB/B-170', 'IGP/DIG Concern file', 'Â  Annual work plan for the year 2020-2021- reg. (Forwarding)', '', '2020-05-01');
INSERT INTO "file_list" ("id", "file_no", "category", "title", "doc1", "entry_date_real") VALUES
(2107, 'MSB/CB/B-170', 'IGP/DIG Concern file', 'The Limited International Special Surveillance List (ISSL)- reg.', '', '2020-09-04');
INSERT INTO "file_list" ("id", "file_no", "category", "title", "doc1", "entry_date_real") VALUES
(2108, 'MSB/CB/C-210', 'Right to Information Act (RTI)', 'Information under RTI Act, 2005. (Number of incidents made by an armed gang inside Mizoram during the year 1991-2011)', '', '2013-08-30');
INSERT INTO "file_list" ("id", "file_no", "category", "title", "doc1", "entry_date_real") VALUES
(2109, 'MSB/CB/C-210', 'Right to Information Act (RTI)', 'Information under RTI Act, 2005 ( Om Prakash (4.12.13))', '', '2013-12-04');
INSERT INTO "file_list" ("id", "file_no", "category", "title", "doc1", "entry_date_real") VALUES
(2110, 'MSB/CB/C-210', 'Right to Information Act (RTI)', 'Â  Information under RTI Act, 2005 (Kum 2011 - 2013 (January) chhungin Silai chi hrang hrang man)', '', '2013-02-21');
INSERT INTO "file_list" ("id", "file_no", "category", "title", "doc1", "entry_date_real") VALUES
(2111, 'MSB/CB/C-210', 'Right to Information Act (RTI)', 'Mizoram police personnel killed in the last 12 (twelve) years.', '', '2014-04-10');
INSERT INTO "file_list" ("id", "file_no", "category", "title", "doc1", "entry_date_real") VALUES
(2112, 'MSB/CB/C-210', 'Right to Information Act (RTI)', 'Soldiers killed in the last 12 (twelve) years.', '', '2013-04-10');
INSERT INTO "file_list" ("id", "file_no", "category", "title", "doc1", "entry_date_real") VALUES
(2113, 'MSB/CB/C-210', 'Right to Information Act (RTI)', 'RTI -RB SINGH', '', '2013-02-27');
INSERT INTO "file_list" ("id", "file_no", "category", "title", "doc1", "entry_date_real") VALUES
(2114, 'MSB/CB/C-210', 'Right to Information Act (RTI)', 'Tripura Transit Camp Mizoram a inrukbonaah Tuikuk inhnamhnawihna', '', '2014-07-14');
INSERT INTO "file_list" ("id", "file_no", "category", "title", "doc1", "entry_date_real") VALUES
(2115, 'MSB/CB/C-210', 'Right to Information Act (RTI)', 'No information has been received in relation to the working of the internal complaints committee during 2012-2013 and 2013-2014.', '', '2015-08-04');
INSERT INTO "file_list" ("id", "file_no", "category", "title", "doc1", "entry_date_real") VALUES
(2116, 'MSB/CB/C-210', 'Right to Information Act (RTI)', 'Kum 1998 leh 2008 inkar kum sawm chhunga hel kut tuara Mizoram Police thi zat', '', '2015-11-04');
INSERT INTO "file_list" ("id", "file_no", "category", "title", "doc1", "entry_date_real") VALUES
(2117, 'MSB/CB/C-210', 'Right to Information Act (RTI)', 'Silai man chungchang', '', '2015-07-17');
INSERT INTO "file_list" ("id", "file_no", "category", "title", "doc1", "entry_date_real") VALUES
(2118, 'MSB/CB/C-210', 'Right to Information Act (RTI)', 'RTI exempted nih avang a information pek loh na', '', '2015-10-27');
INSERT INTO "file_list" ("id", "file_no", "category", "title", "doc1", "entry_date_real") VALUES
(2119, 'MSB/CB/C-210', 'Right to Information Act (RTI)', 'CID(SB) Operation Team apprehended the following cadres of HPC-D(Zosangbera faction) on 16.4.2015 @ 11:00 AM at Ramnagar, Silchar, Assam.', '', '2015-11-04');
INSERT INTO "file_list" ("id", "file_no", "category", "title", "doc1", "entry_date_real") VALUES
(2120, 'MSB/CB/C-210', 'Right to Information Act (RTI)', 'Unlawful Activities Prevention Act (UAPA) is not enforced in theÂ  State of Mizoram,', '', '2015-03-26');
INSERT INTO "file_list" ("id", "file_no", "category", "title", "doc1", "entry_date_real") VALUES
(2121, 'MSB/CB/C-210', 'Right to Information Act (RTI)', 'Insurgency related incidents', '', '2016-02-10');
INSERT INTO "file_list" ("id", "file_no", "category", "title", "doc1", "entry_date_real") VALUES
(2122, 'MSB/CB/C-210', 'Right to Information Act (RTI)', 'PERSONS ABDUCTED / KIDNAPPED BY INSURGENT IN MIZORAM\r\n1999 - TILL DATE', '', '2013-04-01');
INSERT INTO "file_list" ("id", "file_no", "category", "title", "doc1", "entry_date_real") VALUES
(2123, 'MSB/CB/C-210', 'Right to Information Act (RTI)', 'SEIZURE OF ARMS & AMMUNITIONS1999 - TILL DATE', '', '2012-02-22');
INSERT INTO "file_list" ("id", "file_no", "category", "title", "doc1", "entry_date_real") VALUES
(2124, 'MSB/CB/C-210', 'Right to Information Act (RTI)', 'Kum 2008 hnu a prohibited firearms Mizoram sorkar in a man zat leh a man te', '', '2011-11-08');
INSERT INTO "file_list" ("id", "file_no", "category", "title", "doc1", "entry_date_real") VALUES
(2125, 'MSB/CB/C-210', 'Right to Information Act (RTI)', 'natural disaster', '', '2012-03-05');
INSERT INTO "file_list" ("id", "file_no", "category", "title", "doc1", "entry_date_real") VALUES
(2126, 'MSB/CB/C-210', 'Right to Information Act (RTI)', 'Tuikuk/Bru hel chungchang', '', '2012-07-24');
INSERT INTO "file_list" ("id", "file_no", "category", "title", "doc1", "entry_date_real") VALUES
(2127, 'MSB/CB/C-210', 'Right to Information Act (RTI)', 'Reply to RTI application submitted by Zobiakkima Ralte regarding.', '', '2012-10-31');
INSERT INTO "file_list" ("id", "file_no", "category", "title", "doc1", "entry_date_real") VALUES
(2128, 'MSB/CB/C-210', 'Right to Information Act (RTI)', 'Encounters done by Mizoram Police, CRPF and Assam Rifles in Mizoram since 1.1.2002 to 1.1.2014', '', '2014-09-04');
INSERT INTO "file_list" ("id", "file_no", "category", "title", "doc1", "entry_date_real") VALUES
(2129, 'MSB/CB/C-76', 'CIRCULAR/ORDER', 'Order (two missing persons)', '', '2007-10-24');
INSERT INTO "file_list" ("id", "file_no", "category", "title", "doc1", "entry_date_real") VALUES
(2130, 'MSB/CB/C-95', 'Chakma Affairs', 'BRIEF HIGHLIGHT OF THE EVENT OF CHAKMA ETHNIC ISSUE', '', '2020-10-26');
INSERT INTO "file_list" ("id", "file_no", "category", "title", "doc1", "entry_date_real") VALUES
(2131, 'MSB/CB/C-95', 'Chakma Affairs', 'CHAKMA ETHNIC ISSUE', '', '2020-10-26');
INSERT INTO "file_list" ("id", "file_no", "category", "title", "doc1", "entry_date_real") VALUES
(2132, 'MSB/CB/C-95', 'Chakma Affairs', 'Court Case of Chakma Student Union of Mizoram August 2018', '', '2018-08-20');
INSERT INTO "file_list" ("id", "file_no", "category", "title", "doc1", "entry_date_real") VALUES
(2133, 'MSB/CB/C-95', 'Chakma Affairs', 'Court Case of Chakma Student Union of Mizoram FINAL-May, 2018', '', '2018-08-10');
INSERT INTO "file_list" ("id", "file_no", "category", "title", "doc1", "entry_date_real") VALUES
(2134, 'MSB/CB/C-95', 'Chakma Affairs', 'CENTRAL YOUNG LAI ASSOCIATION (CYLA) ON CHAKMA CENSUS', '', '2019-07-16');
INSERT INTO "file_list" ("id", "file_no", "category", "title", "doc1", "entry_date_real") VALUES
(2135, 'MSB/CB/C-95', 'Chakma Affairs', 'Joint Memorandum of BJP&INC submitted to Governor', '', '2019-01-16');
INSERT INTO "file_list" ("id", "file_no", "category", "title", "doc1", "entry_date_real") VALUES
(2136, 'MSB/CB/C-95', 'Chakma Affairs', 'MBBS - Court Case of Chakma Student Union of Mizoram - CHRONOLOGY OF EVENT or ISSUES RELATING TO MIZORAM (SELECTION OF CANDIDATES FOR HIGHER TECHNICAL COURSES ) RULES', '', '2020-10-26');
INSERT INTO "file_list" ("id", "file_no", "category", "title", "doc1", "entry_date_real") VALUES
(2137, 'MSB/CB/C-95', 'Chakma Affairs', 'Stay Order', '', '2018-08-10');
INSERT INTO "file_list" ("id", "file_no", "category", "title", "doc1", "entry_date_real") VALUES
(2138, 'MSB/CB/C-95', 'Chakma Affairs', 'Stay Order', '', '2018-08-10');
INSERT INTO "file_list" ("id", "file_no", "category", "title", "doc1", "entry_date_real") VALUES
(2139, 'MSB/CB/C-95', 'Chakma Affairs', 'Stay Order', '', '2018-08-10');
INSERT INTO "file_list" ("id", "file_no", "category", "title", "doc1", "entry_date_real") VALUES
(2140, 'MSB/CB/C-95', 'Chakma Affairs', 'Stay Order', '', '2018-08-10');
INSERT INTO "file_list" ("id", "file_no", "category", "title", "doc1", "entry_date_real") VALUES
(2141, 'MSB/CB/C-95', 'Chakma Affairs', 'Stay Order', '', '2018-08-10');
INSERT INTO "file_list" ("id", "file_no", "category", "title", "doc1", "entry_date_real") VALUES
(2142, 'MSB/CB/C-101', 'Paihte Affairs/PTC/PNC', 'PAITE TRIBE COUNCILâ€™s MIZORAM SUPPORT FOR MNF IN 2018 MLA ELECTION', '', '2018-11-27');
INSERT INTO "file_list" ("id", "file_no", "category", "title", "doc1", "entry_date_real") VALUES
(2143, 'MSB/CB/C-106', 'LC/VC', '03 Party wise 2015', '', '2020-08-25');
INSERT INTO "file_list" ("id", "file_no", "category", "title", "doc1", "entry_date_real") VALUES
(2144, 'MSB/CB/C-106', 'LC/VC', 'GENERAL ELECTIONS TO AIZAWL MUNICIPAL CORPORATION, 2015', '', '2020-08-25');
INSERT INTO "file_list" ("id", "file_no", "category", "title", "doc1", "entry_date_real") VALUES
(2145, 'MSB/CB/C-106', 'LC/VC', 'FINAL RESULTS OF AIZAWL MUNICIPAL CORPORATION ELECTION - 2015', '', '2015-11-30');
INSERT INTO "file_list" ("id", "file_no", "category", "title", "doc1", "entry_date_real") VALUES
(2146, 'MSB/CB/C-106', 'LC/VC', 'List of Contesting Candidates for\r\nGeneral Election to Aizawl Municipal Corporation, 2015', '', '2015-11-12');
INSERT INTO "file_list" ("id", "file_no", "category", "title", "doc1", "entry_date_real") VALUES
(2147, 'MSB/CB/C-106', 'LC/VC', 'LIST OF CONTESTING CANDIDATES FOR\r\nGENERAL ELECTION TO MDC UNDER LADC, 2015.', '', '2015-11-11');
INSERT INTO "file_list" ("id", "file_no", "category", "title", "doc1", "entry_date_real") VALUES
(2148, 'MSB/CB/C-106', 'LC/VC', 'Municipal Polling Station List', '', '2015-11-13');
INSERT INTO "file_list" ("id", "file_no", "category", "title", "doc1", "entry_date_real") VALUES
(2149, 'MSB/CB/C-106', 'LC/VC', 'Press Note-Schedule of Election', '', '2015-10-29');
INSERT INTO "file_list" ("id", "file_no", "category", "title", "doc1", "entry_date_real") VALUES
(2150, 'MSB/CB/C-106', 'LC/VC', 'FINAL RESULTS OF AIZAWL MUNICIPAL CORPORATION ELECTION - 2015', '', '2015-11-30');
INSERT INTO "file_list" ("id", "file_no", "category", "title", "doc1", "entry_date_real") VALUES
(2151, 'MSB/CB/C-106', 'LC/VC', 'List of Contesting Candidates for\r\nGeneral Election to Aizawl Municipal Corporation, 2015', '', '2015-11-12');
INSERT INTO "file_list" ("id", "file_no", "category", "title", "doc1", "entry_date_real") VALUES
(2152, 'MSB/CB/C-106', 'LC/VC', 'LIST OF CONTESTING CANDIDATES FOR\r\nGENERAL ELECTION TO MDC UNDER LADC, 2015.', '', '2015-11-11');
INSERT INTO "file_list" ("id", "file_no", "category", "title", "doc1", "entry_date_real") VALUES
(2153, 'MSB/CB/C-106', 'LC/VC', 'Municipal PS List', '', '2015-11-13');
INSERT INTO "file_list" ("id", "file_no", "category", "title", "doc1", "entry_date_real") VALUES
(2154, 'MSB/CB/C-106', 'LC/VC', 'Schedule for 10th General Election to Lai Autonomous District Council, 2015.', '', '2015-10-29');
INSERT INTO "file_list" ("id", "file_no", "category", "title", "doc1", "entry_date_real") VALUES
(2155, 'MSB/CB/C-106', 'LC/VC', 'AMC 2010 Final Result Sheet', '', '2015-10-09');
INSERT INTO "file_list" ("id", "file_no", "category", "title", "doc1", "entry_date_real") VALUES
(2156, 'MSB/CB/C-106', 'LC/VC', 'List of Contesting Candidates for\r\nGeneral Election to Aizawl Municipal Corporation, 2015', '', '2015-11-12');
INSERT INTO "file_list" ("id", "file_no", "category", "title", "doc1", "entry_date_real") VALUES
(2157, 'MSB/CB/C-106', 'LC/VC', 'LIST OF CONTESTING CANDIDATES FOR\r\nGENERAL ELECTION TO MDC UNDER LADC, 2015.', '', '2015-11-11');
INSERT INTO "file_list" ("id", "file_no", "category", "title", "doc1", "entry_date_real") VALUES
(2158, 'MSB/CB/C-106', 'LC/VC', 'AIZAWL MUNICIPAL COUNCIL ELECTION DUTY DETAILMENT', '', '2007-10-23');
INSERT INTO "file_list" ("id", "file_no", "category", "title", "doc1", "entry_date_real") VALUES
(2159, 'MSB/CB/C-106', 'LC/VC', 'ASSESSMENTÂ  FORÂ  AMC ELECTION 2010 WARD NO. 1 & WARD NO. 11', '', '2007-10-23');
INSERT INTO "file_list" ("id", "file_no", "category", "title", "doc1", "entry_date_real") VALUES
(2161, 'MSB/CB/C-106', 'LC/VC', 'Identification of Sensitive/Critical Polling Stations', '', '2020-07-30');
INSERT INTO "file_list" ("id", "file_no", "category", "title", "doc1", "entry_date_real") VALUES
(2162, 'MSB/CB/C-106', 'LC/VC', 'List of Elected Candidates VC', '', '2020-08-25');
INSERT INTO "file_list" ("id", "file_no", "category", "title", "doc1", "entry_date_real") VALUES
(2163, 'MSB/CB/C-106', 'LC/VC', 'MIZORAM VC & LC PUMPUIA PARTY HRANG HRANG TE DINHMUN', '', '2020-08-25');
INSERT INTO "file_list" ("id", "file_no", "category", "title", "doc1", "entry_date_real") VALUES
(2164, 'MSB/CB/C-106', 'LC/VC', 'PARTY-WISE RESULTS OF THE GENERAL ELECTIONS TO\r\nLOCAL COUNCILS', '', '2020-08-25');
INSERT INTO "file_list" ("id", "file_no", "category", "title", "doc1", "entry_date_real") VALUES
(2165, 'MSB/CB/C-106', 'LC/VC', 'LOCAL COUNCIL ELECTION 2012 RESULT', '', '2012-02-24');
INSERT INTO "file_list" ("id", "file_no", "category", "title", "doc1", "entry_date_real") VALUES
(2166, 'MSB/CB/C-106', 'LC/VC', 'LOCAL COUNCIL ELECTION 2012 RESULT', '', '2012-02-24');
INSERT INTO "file_list" ("id", "file_no", "category", "title", "doc1", "entry_date_real") VALUES
(2167, 'MSB/CB/C-106', 'LC/VC', 'FINAL RESULTS OF AIZAWL LOCAL COUNCIL ELECTION 2012', '', '2012-02-27');
INSERT INTO "file_list" ("id", "file_no", "category", "title", "doc1", "entry_date_real") VALUES
(2168, 'MSB/CB/C-106', 'LC/VC', 'FINAL RESULTS OF AIZAWL LOCAL COUNCIL ELECTION 2012', '', '2012-02-27');
INSERT INTO "file_list" ("id", "file_no", "category", "title", "doc1", "entry_date_real") VALUES
(2169, 'MSB/CB/C-106', 'LC/VC', 'TOTAL NO. OF VILLAGE COUNCILS WON BY\r\nDIFFERENT POLITICAL PARTIES', '', '2012-02-27');
INSERT INTO "file_list" ("id", "file_no", "category", "title", "doc1", "entry_date_real") VALUES
(2170, 'MSB/CB/C-106', 'LC/VC', 'Notification (Result of LC 2020)', '', '2020-09-08');
INSERT INTO "file_list" ("id", "file_no", "category", "title", "doc1", "entry_date_real") VALUES
(2171, 'MSB/CB/C-106', 'LC/VC', 'Aizawl Municipality huam chhunga Local Council 23 ah te tluang taka Inthlanna neih a ni.', '', '2020-09-08');
INSERT INTO "file_list" ("id", "file_no", "category", "title", "doc1", "entry_date_real") VALUES
(2172, 'MSB/CB/C-106', 'LC/VC', 'GENERAL ELECTION TO LOCAL COUNCILS, 2020 FINAL REPORT', '', '2020-09-08');
INSERT INTO "file_list" ("id", "file_no", "category", "title", "doc1", "entry_date_real") VALUES
(2173, 'MSB/CB/C-106', 'LC/VC', 'ANNEXURE-II\r\nGENERAL ELECTION TO VILLAGE COUNCILS, 2020 VC FINAL', '', '2020-09-08');
INSERT INTO "file_list" ("id", "file_no", "category", "title", "doc1", "entry_date_real") VALUES
(2174, 'MSB/CB/C-106', 'LC/VC', 'NOTIFICATION Dated Aizawl, the 5th September, 2020', '', '2020-09-08');
INSERT INTO "file_list" ("id", "file_no", "category", "title", "doc1", "entry_date_real") VALUES
(2175, 'MSB/CB/C-106', 'LC/VC', 'Aizawl District huam chhunga Village Council 8 (Pariat) te inthlanna tluang taka neih zawh a ni.', '', '2020-09-08');
INSERT INTO "file_list" ("id", "file_no", "category", "title", "doc1", "entry_date_real") VALUES
(2176, 'MSB/CB/C-106', 'LC/VC', 'Â  Identification of Sensitive/Critical Polling Stations.Â Â Â Â Â ', '', '2020-07-30');
INSERT INTO "file_list" ("id", "file_no", "category", "title", "doc1", "entry_date_real") VALUES
(2177, 'MSB/CB/C-106', 'LC/VC', 'PORTFOLIOS OF AIZAWL MUNICIPAL COUNCILLORS', '', '2011-03-14');
INSERT INTO "file_list" ("id", "file_no", "category", "title", "doc1", "entry_date_real") VALUES
(2178, 'MSB/CB/C-106', 'LC/VC', 'Security assessment report.', '', '2015-10-21');
INSERT INTO "file_list" ("id", "file_no", "category", "title", "doc1", "entry_date_real") VALUES
(2179, 'MSB/CB/C-116', 'MADC(Mara Autonomous District Council)', 'Renaming of the following villages, lakes and river within Mara Autonomous District Council (MADC) area', '', '2018-04-13');
INSERT INTO "file_list" ("id", "file_no", "category", "title", "doc1", "entry_date_real") VALUES
(2180, 'MSB/CB/C-117', 'LADC(Lai Autonomous District Council)', 'GENERAL ELECTION TO LAI AUTONOMOUS DISTRICT COUNCIL 2020\r\nConsolidated Result', '', '2020-12-11');
INSERT INTO "file_list" ("id", "file_no", "category", "title", "doc1", "entry_date_real") VALUES
(2181, 'MSB/CB/C-117', 'LADC(Lai Autonomous District Council)', 'GENERAL ELECTION TO LAI AUTONOMOUS DISTRICT COUNCIL 2020\r\nList of Elected Candidates', '', '2020-12-11');
INSERT INTO "file_list" ("id", "file_no", "category", "title", "doc1", "entry_date_real") VALUES
(2182, 'MSB/CB/C-117', 'ladc', 'GENERAL ELECTION TO LAI AUTONOMOUS DISTRICT COUNCIL 2020\r\nParty-Wise Result', '', '2020-12-11');
INSERT INTO "file_list" ("id", "file_no", "category", "title", "doc1", "entry_date_real") VALUES
(2183, 'MSB/CB/C-117', 'LADC(Lai Autonomous District Council)', 'Final Result of General Election to Lai Autonomous District Council, 2015', '', '2015-11-28');
INSERT INTO "file_list" ("id", "file_no", "category", "title", "doc1", "entry_date_real") VALUES
(2184, 'MSB/CB/C-118', 'CADC(Chakma Autonomous District Council)', 'Election Chakma Autonomous District Council 2018 Consolidated Result', '', '2018-04-24');
INSERT INTO "file_list" ("id", "file_no", "category", "title", "doc1", "entry_date_real") VALUES
(2185, 'MSB/CB/C-118', 'CADC(Chakma Autonomous District Council)', 'Â Â  Chakma Issue/Chakma Autonomous District Council (CADC).', '', '2018-04-13');
INSERT INTO "file_list" ("id", "file_no", "category", "title", "doc1", "entry_date_real") VALUES
(2186, 'MSB/CB/C-118', 'CADC(Chakma Autonomous District Council)', 'CHAKMA AUTONOMOUS DISTRICT COUNCIL (CADC)', '', '2018-04-13');
INSERT INTO "file_list" ("id", "file_no", "category", "title", "doc1", "entry_date_real") VALUES
(2187, 'MSB/CB/C-119', 'Mizo Zirlai Pawl(MZP)', 'Mizo Zirlai PawlÂ ', '', '2018-03-13');
INSERT INTO "file_list" ("id", "file_no", "category", "title", "doc1", "entry_date_real") VALUES
(2188, 'MSB/CB/C-119', 'Mizo Zirlai Pawl(MZP)', 'MZP AGITATIONÂ Â Â Â Â Â Â Â Â Â Â Â ', '', '2014-11-03');
INSERT INTO "file_list" ("id", "file_no", "category", "title", "doc1", "entry_date_real") VALUES
(2189, 'MSB/CB/C-119', 'Mizo Zirlai Pawl(MZP)', 'MZP AGITATION', '', '2014-10-21');
INSERT INTO "file_list" ("id", "file_no", "category", "title", "doc1", "entry_date_real") VALUES
(2190, 'MSB/CB/C-187', 'Land Revenue & Settlement', 'Enquiry report in connection with alleged production of Fake/bogus LSC by Land Revenue & Settlement Department staff.', '', '2017-12-07');
INSERT INTO "file_list" ("id", "file_no", "category", "title", "doc1", "entry_date_real") VALUES
(2191, 'MSB/CB/A-75', 'Chin National Council(CNC)', 'Training of Chin National Council regarding.', '', '2011-09-15');
INSERT INTO "file_list" ("id", "file_no", "category", "title", "doc1", "entry_date_real") VALUES
(2192, 'MSB/CB/C-202', 'Chin Welfare Association', 'Training in the office of Women League of Chinland at Hrangthanga  Colney''s building, Zarkawt, Aizawl.', '', '2010-08-31');
INSERT INTO "file_list" ("id", "file_no", "category", "title", "doc1", "entry_date_real") VALUES
(2193, 'MSB/CB/A-75', 'Chin National Council(CNC)', 'Training of Chin National Council regarding.', '', '2011-09-15');
INSERT INTO "file_list" ("id", "file_no", "category", "title", "doc1", "entry_date_real") VALUES
(2194, 'MSB/CB/A-75', 'Chin National Council(CNC)', 'Training of CNC and FBR regarding.', '', '2011-09-15');
INSERT INTO "file_list" ("id", "file_no", "category", "title", "doc1", "entry_date_real") VALUES
(2195, 'MSB/CB/A-75', 'Chin National Council(CNC)', 'Â  CNC held a meeting on 16.8.2010', '', '2010-08-24');
INSERT INTO "file_list" ("id", "file_no", "category", "title", "doc1", "entry_date_real") VALUES
(2196, 'MSB/CB/C-202', 'Chin Welfare Association', 'Sending of Enquiry Report.', '', '2011-03-03');
INSERT INTO "file_list" ("id", "file_no", "category", "title", "doc1", "entry_date_real") VALUES
(2197, 'MSB/CB/C-211', 'Mizoram Peoples Forum(MPF)', 'AGREEMENT BETWEEN POLITICAL PARTIES AND MIZORAM PEOPLE FORUM (MPF)', '', '2013-10-31');
INSERT INTO "file_list" ("id", "file_no", "category", "title", "doc1", "entry_date_real") VALUES
(2198, 'MSB/CB/C-211', 'Mizoram Peoples Forum(MPF)', 'Â  Mizoram People Forum â€“ regd.', '', '2017-11-15');
INSERT INTO "file_list" ("id", "file_no", "category", "title", "doc1", "entry_date_real") VALUES
(2199, 'MSB/CB/C-211', 'Mizoram Peoples Forum(MPF)', 'MIZORAM PEOPLE FORUM\r\nGENERAL HEADQUARTERS', '', '2017-11-15');
INSERT INTO "file_list" ("id", "file_no", "category", "title", "doc1", "entry_date_real") VALUES
(2200, 'MSB/CB/C-211', 'Mizoram Peoples Forum(MPF)', 'WORK SCHEDULE OF MIZORAM PEOPLE FORUM', '', '2018-08-13');
INSERT INTO "file_list" ("id", "file_no", "category", "title", "doc1", "entry_date_real") VALUES
(2201, 'MSB/CB/C-211', 'Mizoram Peoples Forum(MPF)', 'GENESIS OF THE FORMATION OF MIZORAM PEOPLE FORUM(MPF)', '', '2022-01-19');
INSERT INTO "file_list" ("id", "file_no", "category", "title", "doc1", "entry_date_real") VALUES
(2202, 'MSB/CB/C-211', 'Mizoram Peoples Forum(MPF)', 'WORK SCHEDULE OF MIZORAM PEOPLE FORUM', '', '2018-09-03');
INSERT INTO "file_list" ("id", "file_no", "category", "title", "doc1", "entry_date_real") VALUES
(2203, 'MSB/CB/C-211', 'Mizoram Peoples Forum(MPF)', 'Mizoram People Forum â€“ regd.', '', '2017-11-14');
INSERT INTO "file_list" ("id", "file_no", "category", "title", "doc1", "entry_date_real") VALUES
(2204, 'MSB/CB/C-212', 'Demand Committee Saitual', 'HNAHTHIAL DISTRICT IMPLEMENTING DEMAND COMMITTEE (HDIDC)', '', '2018-05-01');
INSERT INTO "file_list" ("id", "file_no", "category", "title", "doc1", "entry_date_real") VALUES
(2205, 'MSB/CB/C-212', 'Demand Committee Saitual', 'HNAHTHIAL DISTRICT IMPLEMENTING DEMAND COMMITTEE (HDIDC)', '', '2018-08-14');
INSERT INTO "file_list" ("id", "file_no", "category", "title", "doc1", "entry_date_real") VALUES
(2206, 'MSB/CB/C-212', 'Demand Committee Saitual', 'A MEMORUNDUM\r\n\r\nSUBMITTED TO\r\n\r\nTHE HONâ€™BLE CHIEF MINISTER OF MIZORAM\r\nFOR THE IMPLEMENTATION OF KHAWZAWL DISTRICT', '', '2018-04-25');
INSERT INTO "file_list" ("id", "file_no", "category", "title", "doc1", "entry_date_real") VALUES
(2207, 'MSB/CB/C-212', 'Demand Committee Saitual', 'KHAWZAWL DISTRICT IMPLEMENTING DEMAND COMMITTEE (KDIDC)', '', '2018-09-05');
INSERT INTO "file_list" ("id", "file_no", "category", "title", "doc1", "entry_date_real") VALUES
(2208, 'MSB/CB/C-212', 'Demand Committee Saitual', 'Submission of Memorandum for implementation of Khawzawl District.', '', '2016-07-25');
INSERT INTO "file_list" ("id", "file_no", "category", "title", "doc1", "entry_date_real") VALUES
(2209, 'MSB/CB/C-212', 'Demand Committee Saitual', 'MAP OF PROPOSED KHAWZAWL DISTRICT', '', '2018-04-25');
INSERT INTO "file_list" ("id", "file_no", "category", "title", "doc1", "entry_date_real") VALUES
(2210, 'MSB/CB/C-212', 'Demand Committee Saitual', 'DARLAWN DISTRICT DEMAND COMMITTEE', '', '2018-04-18');
INSERT INTO "file_list" ("id", "file_no", "category", "title", "doc1", "entry_date_real") VALUES
(2211, 'MSB/CB/C-212', 'Demand Committee Saitual', 'dist demand from DSI', '', '2018-09-05');
INSERT INTO "file_list" ("id", "file_no", "category", "title", "doc1", "entry_date_real") VALUES
(2212, 'MSB/CB/C-212', 'Demand Committee Saitual', 'HNAHTHIAL DISTRICT IMPLEMENTING DEMAND COMMITTEE (HDIDC)', '', '2018-09-05');
INSERT INTO "file_list" ("id", "file_no", "category", "title", "doc1", "entry_date_real") VALUES
(2213, 'MSB/CB/C-212', 'Demand Committee Saitual', 'KHAWZAWL DISTRICT IMPLEMENTING DEMAND COMMITTEE (KDIDC)', '', '2018-09-05');
INSERT INTO "file_list" ("id", "file_no", "category", "title", "doc1", "entry_date_real") VALUES
(2214, 'MSB/CB/C-212', 'Demand Committee Saitual', 'SAITUAL DISTRICT IMPLEMENTING DEMAND COMMITTEE', '', '2019-02-26');
INSERT INTO "file_list" ("id", "file_no", "category", "title", "doc1", "entry_date_real") VALUES
(2215, 'MSB/CB/C-212', 'Demand Committee Saitual', 'SAITUAL DISTRICT IMPLEMENTING DEMAND COMMITTEE', '', '2018-09-05');
INSERT INTO "file_list" ("id", "file_no", "category", "title", "doc1", "entry_date_real") VALUES
(2216, 'MSB/CB/C-212', 'Demand Committee Saitual', 'Â Â  TLABUNG RD BLOCK DEMAND COMMITTEE', '', '2018-09-05');
INSERT INTO "file_list" ("id", "file_no", "category", "title", "doc1", "entry_date_real") VALUES
(2217, 'MSB/CB/Covid-19/2020', 'COVID 19', 'List of 17 Stranded foreigners at Berawtlang ,Aizawl', '', '2020-04-24');
INSERT INTO "file_list" ("id", "file_no", "category", "title", "doc1", "entry_date_real") VALUES
(2218, 'MSB/CB/Covid-19/2020', 'COVID 19', 'CHIN REFUGEE DELHI A AWMTE', '', '2020-04-20');
INSERT INTO "file_list" ("id", "file_no", "category", "title", "doc1", "entry_date_real") VALUES
(2219, 'MSB/CB/Covid-19/2020', 'COVID 19', 'Details of stranded foreigners - regarding.', '', '2020-04-21');
INSERT INTO "file_list" ("id", "file_no", "category", "title", "doc1", "entry_date_real") VALUES
(2220, 'MSB/CB/Covid-19/2020', 'COVID 19', 'Details of Stranded foreigners & status of Rerfugees', '', '2020-04-20');
INSERT INTO "file_list" ("id", "file_no", "category", "title", "doc1", "entry_date_real") VALUES
(2221, 'MSB/CB/Covid-19/2020', 'COVID 19', 'CHIN REFUGEE RESIDING AT DELHI', '', '2020-04-20');
INSERT INTO "file_list" ("id", "file_no", "category", "title", "doc1", "entry_date_real") VALUES
(2222, 'MSB/CB/Covid-19/2020', 'COVID 19', 'STRANDED MYANMARESE FOREIGNERS', '', '2020-04-16');
INSERT INTO "file_list" ("id", "file_no", "category", "title", "doc1", "entry_date_real") VALUES
(2223, 'MSB/CB/Covid-19/2020', 'COVID 19', 'all SO to prevent communal violence', '', '2020-05-11');
INSERT INTO "file_list" ("id", "file_no", "category", "title", "doc1", "entry_date_real") VALUES
(2224, 'MSB/CB/Covid-19/2020', 'COVID 19', 'ALL SOs to furnish the list of returnees of Mizo stranded at other State', '', '2020-05-20');
INSERT INTO "file_list" ("id", "file_no", "category", "title", "doc1", "entry_date_real") VALUES
(2225, 'MSB/CB/Covid-19/2020', 'COVID 19', 'CORONAVIRUS : COVID-19', '', '2020-03-24');
INSERT INTO "file_list" ("id", "file_no", "category", "title", "doc1", "entry_date_real") VALUES
(2226, 'MSB/CB/Covid-19/2020', 'COVID 19', 'Covid verification', '', '2020-04-07');
INSERT INTO "file_list" ("id", "file_no", "category", "title", "doc1", "entry_date_real") VALUES
(2227, 'MSB/CB/Covid-19/2020', 'COVID 19', 'FOREIGNERS PRESENTLY STAYING IN MIZORAM(as per office records Dt. 15.04.2020)', '', '2020-04-16');
INSERT INTO "file_list" ("id", "file_no", "category", "title", "doc1", "entry_date_real") VALUES
(2228, 'MSB/CB/Covid-19/2020', 'COVID 19', 'INFORMATION TO FOREIGNERS', '', '2020-04-23');
INSERT INTO "file_list" ("id", "file_no", "category", "title", "doc1", "entry_date_real") VALUES
(2229, 'MSB/CB/Covid-19/2020', 'COVID 19', 'Dosier/Profile of Shri CH.Manoranjan Khuman - regd.', '', '2020-04-17');
INSERT INTO "file_list" ("id", "file_no", "category", "title", "doc1", "entry_date_real") VALUES
(2230, 'MSB/CB/D-2', 'LENGPUI AIRPORT', 'COUNTER TERRORISM CONTINGENCY PLAN FOR LENGPUI AIRPORT, MIZORAM', '', '2017-04-12');
INSERT INTO "file_list" ("id", "file_no", "category", "title", "doc1", "entry_date_real") VALUES
(2231, 'MSB/CB/D-2', 'LENGPUI AIRPORT', 'Preparation of Counter Terrorism Contingency Plan for the Airports - regd.', '', '2017-04-12');
INSERT INTO "file_list" ("id", "file_no", "category", "title", "doc1", "entry_date_real") VALUES
(2232, 'MSB/CB/B-61/Misc', 'Miscellaneous', 'The Mizoram Private Placement Agencies (Regultion) Rules, 2017- Reg.', '', '2021-05-03');
INSERT INTO "file_list" ("id", "file_no", "category", "title", "doc1", "entry_date_real") VALUES
(2233, 'MSB/CB/B-61/Misc', 'Miscellaneous', 'All SO (Kuhva/Panhnah)', '', '2021-09-03');
INSERT INTO "file_list" ("id", "file_no", "category", "title", "doc1", "entry_date_real") VALUES
(2234, 'MSB/CB/B-61/Misc', 'Miscellaneous', 'Study of the subject \"Police-training, modernization and Reforms\"by the Department-related Parliamentary Standing Committee on  Home Affairs -Reg.', '', '2021-11-11');
INSERT INTO "file_list" ("id", "file_no", "category", "title", "doc1", "entry_date_real") VALUES
(2235, 'MSB/CB/B-61/Misc', 'Miscellaneous', 'Enquiry report in regard to problems faced by B.ed courseÂ  Mizo students of NMR college of Education, Kanoor, Andhra Pradesh', '', '2021-06-28');
INSERT INTO "file_list" ("id", "file_no", "category", "title", "doc1", "entry_date_real") VALUES
(2236, 'MSB/CB/B-61/Misc', 'Miscellaneous', 'Extract of whatsapp messages (Enquiry report in connection with employment of three (3) Mizo workers at Mowthi Nursing Home, Vandavali, Coimbatore vis-Ã -vis Fabian Zothansanga, alleged owner of private placement agenc', '', '2021-06-28');
INSERT INTO "file_list" ("id", "file_no", "category", "title", "doc1", "entry_date_real") VALUES
(2237, 'MSB/CB/B-61/Misc', 'Miscellaneous', 'NO ACTIVIST OF INDIAN YOUTH CONGRESS FROM MIZORAM', '', '2021-08-11');
INSERT INTO "file_list" ("id", "file_no", "category", "title", "doc1", "entry_date_real") VALUES
(2238, 'MSB/CB/B-61/Misc', 'Miscellaneous', 'National Intelligence GridÂ (NATGRID) Â - regarding', '', '2021-10-28');
INSERT INTO "file_list" ("id", "file_no", "category", "title", "doc1", "entry_date_real") VALUES
(2239, 'MSB/CB/B-61/Misc', 'Miscellaneous', 'NATGRID - regarding', '', '2021-10-26');
INSERT INTO "file_list" ("id", "file_no", "category", "title", "doc1", "entry_date_real") VALUES
(2240, 'MSB/CB/B-61/Misc', 'Miscellaneous', 'The Mizoram Private Placement Agencies (Regulation) Rules -Reg.', '', '2021-06-28');
INSERT INTO "file_list" ("id", "file_no", "category", "title", "doc1", "entry_date_real") VALUES
(2241, 'MSB/CB/B-4', 'Mizoram-Cachar Border Dispute/Boundary Committee/Boundary incidents', 'Vairengte BSF ho awmna bul a chhungkaw 70 hnena ram leh house bulding assistance pek chungchang', '', '2021-04-12');
INSERT INTO "file_list" ("id", "file_no", "category", "title", "doc1", "entry_date_real") VALUES
(2242, 'MSB/CB/B-4', 'Mizoram-Cachar Border Dispute/Boundary Committee/Boundary incidents', 'Border Report 1.04.2021', '', '2021-04-01');
INSERT INTO "file_list" ("id", "file_no", "category", "title", "doc1", "entry_date_real") VALUES
(2243, 'MSB/CB/B-4', 'Mizoram-Cachar Border Dispute/Boundary Committee/Boundary incidents', 'Border Report 5.04.2021.docx', '', '2021-04-05');
INSERT INTO "file_list" ("id", "file_no", "category", "title", "doc1", "entry_date_real") VALUES
(2244, 'MSB/CB/B-4', 'Mizoram-Cachar Border Dispute/Boundary Committee/Boundary incidents', 'Border Report 6.04.2021', '', '2021-04-06');
INSERT INTO "file_list" ("id", "file_no", "category", "title", "doc1", "entry_date_real") VALUES
(2245, 'MSB/CB/B-4', 'Mizoram-Cachar Border Dispute/Boundary Committee/Boundary incidents', 'Border Report 7.04.2021', '', '2021-04-07');
INSERT INTO "file_list" ("id", "file_no", "category", "title", "doc1", "entry_date_real") VALUES
(2246, 'MSB/CB/B-4', 'Mizoram-Cachar Border Dispute/Boundary Committee/Boundary incidents', 'Border Report 8.04.2021', '', '2021-04-08');
INSERT INTO "file_list" ("id", "file_no", "category", "title", "doc1", "entry_date_real") VALUES
(2247, 'MSB/CB/B-4', 'Mizoram-Cachar Border Dispute/Boundary Committee/Boundary incidents', 'Border Report 9.04.2021', '', '2021-04-09');
INSERT INTO "file_list" ("id", "file_no", "category", "title", "doc1", "entry_date_real") VALUES
(2248, 'MSB/CB/B-4', 'Mizoram-Cachar Border Dispute/Boundary Committee/Boundary incidents', 'Border Report 12.04.2021', '', '2021-04-12');
INSERT INTO "file_list" ("id", "file_no", "category", "title", "doc1", "entry_date_real") VALUES
(2249, 'MSB/CB/B-4', 'Mizoram-Cachar Border Dispute/Boundary Committee/Boundary incidents', 'Border Report 13.04.2021', '', '2021-04-13');
INSERT INTO "file_list" ("id", "file_no", "category", "title", "doc1", "entry_date_real") VALUES
(2250, 'MSB/CB/B-4', 'Mizoram-Cachar Border Dispute/Boundary Committee/Boundary incidents', 'Border Report 14.04.2021', '', '2021-04-14');
INSERT INTO "file_list" ("id", "file_no", "category", "title", "doc1", "entry_date_real") VALUES
(2251, 'MSB/CB/B-4', 'Mizoram-Cachar Border Dispute/Boundary Committee/Boundary incidents', 'Border Report 15.04.2021', '', '2021-04-15');
INSERT INTO "file_list" ("id", "file_no", "category", "title", "doc1", "entry_date_real") VALUES
(2252, 'MSB/CB/B-4', 'Mizoram-Cachar Border Dispute/Boundary Committee/Boundary incidents', 'VAIRENGTE VC-I TEN CHHUNGKAW 70 (SAWMSARIH) HNENA RAM LEH HOUSE BUILDING ASSISTANCE AN PEK CHUNGCHANG', '', '2021-04-12');
INSERT INTO "file_list" ("id", "file_no", "category", "title", "doc1", "entry_date_real") VALUES
(2253, 'MSB/CB/B-4', 'Mizoram-Cachar Border Dispute/Boundary Committee/Boundary incidents', 'Border Report 1.04.2021', '', '2021-04-01');
INSERT INTO "file_list" ("id", "file_no", "category", "title", "doc1", "entry_date_real") VALUES
(2254, 'MSB/CB/B-4', 'Mizoram-Cachar Border Dispute/Boundary Committee/Boundary incidents', 'Border Report 5.04.2021', '', '2021-04-05');
INSERT INTO "file_list" ("id", "file_no", "category", "title", "doc1", "entry_date_real") VALUES
(2255, 'MSB/CB/B-4', 'Mizoram-Cachar Border Dispute/Boundary Committee/Boundary incidents', 'Border Report 6.04.2021', '', '2021-04-06');
INSERT INTO "file_list" ("id", "file_no", "category", "title", "doc1", "entry_date_real") VALUES
(2256, 'MSB/CB/B-4', 'Mizoram-Cachar Border Dispute/Boundary Committee/Boundary incidents', 'Border Report 7.04.2021', '', '2021-04-07');
INSERT INTO "file_list" ("id", "file_no", "category", "title", "doc1", "entry_date_real") VALUES
(2257, 'MSB/CB/B-4', 'Mizoram-Cachar Border Dispute/Boundary Committee/Boundary incidents', 'Border Report 8.04.2021', '', '2021-04-08');
INSERT INTO "file_list" ("id", "file_no", "category", "title", "doc1", "entry_date_real") VALUES
(2258, 'MSB/CB/B-4', 'Mizoram-Cachar Border Dispute/Boundary Committee/Boundary incidents', 'Border Report 9.04.2021', '', '2021-04-09');
INSERT INTO "file_list" ("id", "file_no", "category", "title", "doc1", "entry_date_real") VALUES
(2259, 'MSB/CB/B-4', 'Mizoram-Cachar Border Dispute/Boundary Committee/Boundary incidents', 'Border Report 12.04.2021', '', '2021-04-12');
INSERT INTO "file_list" ("id", "file_no", "category", "title", "doc1", "entry_date_real") VALUES
(2260, 'MSB/CB/B-4', 'Mizoram-Cachar Border Dispute/Boundary Committee/Boundary incidents', 'Border report 13.4.2021', '', '2021-04-13');
INSERT INTO "file_list" ("id", "file_no", "category", "title", "doc1", "entry_date_real") VALUES
(2261, 'MSB/CB/B-4', 'Mizoram-Cachar Border Dispute/Boundary Committee/Boundary incidents', 'Border Report 15.04.2021', '', '2021-04-15');
INSERT INTO "file_list" ("id", "file_no", "category", "title", "doc1", "entry_date_real") VALUES
(2262, 'MSB/CB/B-4', 'Mizoram-Cachar Border Dispute/Boundary Committee/Boundary incidents', 'Border Report 16.04.2021', '', '2021-04-16');
INSERT INTO "file_list" ("id", "file_no", "category", "title", "doc1", "entry_date_real") VALUES
(2263, 'MSB/CB/B-4', 'Mizoram-Cachar Border Dispute/Boundary Committee/Boundary incidents', 'Border Report 19.04.2021', '', '2021-04-09');
INSERT INTO "file_list" ("id", "file_no", "category", "title", "doc1", "entry_date_real") VALUES
(2264, 'MSB/CB/B-4', 'Mizoram-Cachar Border Dispute/Boundary Committee/Boundary incidents', 'Border Report 20.04.2021', '', '2021-04-20');
INSERT INTO "file_list" ("id", "file_no", "category", "title", "doc1", "entry_date_real") VALUES
(2265, 'MSB/CB/B-4', 'Mizoram-Cachar Border Dispute/Boundary Committee/Boundary incidents', 'Border Report 21.4.2021', '', '2021-04-21');
INSERT INTO "file_list" ("id", "file_no", "category", "title", "doc1", "entry_date_real") VALUES
(2266, 'MSB/CB/B-4', 'Mizoram-Cachar Border Dispute/Boundary Committee/Boundary incidents', 'Border Report 22.4.2021', '', '2021-04-22');
INSERT INTO "file_list" ("id", "file_no", "category", "title", "doc1", "entry_date_real") VALUES
(2267, 'MSB/CB/B-4', 'Mizoram-Cachar Border Dispute/Boundary Committee/Boundary incidents', 'Border Report 23.4.2021', '', '2021-04-23');
INSERT INTO "file_list" ("id", "file_no", "category", "title", "doc1", "entry_date_real") VALUES
(2268, 'MSB/CB/B-4', 'Mizoram-Cachar Border Dispute/Boundary Committee/Boundary incidents', 'Border Report 26.4.2021', '', '2021-04-26');
INSERT INTO "file_list" ("id", "file_no", "category", "title", "doc1", "entry_date_real") VALUES
(2269, 'MSB/CB/B-4', 'Mizoram-Cachar Border Dispute/Boundary Committee/Boundary incidents', 'Border Report 27.4.2021', '', '2021-04-27');
INSERT INTO "file_list" ("id", "file_no", "category", "title", "doc1", "entry_date_real") VALUES
(2270, 'MSB/CB/B-4', 'Mizoram-Cachar Border Dispute/Boundary Committee/Boundary incidents', 'Border Report 28.4.2021', '', '2021-04-28');
INSERT INTO "file_list" ("id", "file_no", "category", "title", "doc1", "entry_date_real") VALUES
(2271, 'MSB/CB/B-4', 'Mizoram-Cachar Border Dispute/Boundary Committee/Boundary incidents', 'Border Report 29.4.2021', '', '2021-04-29');
INSERT INTO "file_list" ("id", "file_no", "category", "title", "doc1", "entry_date_real") VALUES
(2272, 'MSB/CB/B-4', 'Mizoram-Cachar Border Dispute/Boundary Committee/Boundary incidents', 'Border Report 30.4.2021', '', '2021-04-30');
INSERT INTO "file_list" ("id", "file_no", "category", "title", "doc1", "entry_date_real") VALUES
(2273, 'MSB/CB/B-4', 'Mizoram-Cachar Border Dispute/Boundary Committee/Boundary incidents', 'Border Report 2.8.2021', '', '2021-08-02');
INSERT INTO "file_list" ("id", "file_no", "category", "title", "doc1", "entry_date_real") VALUES
(2274, 'MSB/CB/B-4', 'Mizoram-Cachar Border Dispute/Boundary Committee/Boundary incidents', 'Border Report 4.8.2021', '', '2021-08-04');
INSERT INTO "file_list" ("id", "file_no", "category", "title", "doc1", "entry_date_real") VALUES
(2275, 'MSB/CB/B-4', 'Mizoram-Cachar Border Dispute/Boundary Committee/Boundary incidents', 'Border Report 6.8.2021', '', '2021-08-06');
INSERT INTO "file_list" ("id", "file_no", "category", "title", "doc1", "entry_date_real") VALUES
(2276, 'MSB/CB/B-4', 'Mizoram-Cachar Border Dispute/Boundary Committee/Boundary incidents', 'Border Report 12.8.2021', '', '2021-08-12');
INSERT INTO "file_list" ("id", "file_no", "category", "title", "doc1", "entry_date_real") VALUES
(2277, 'MSB/CB/B-4', 'Mizoram-Cachar Border Dispute/Boundary Committee/Boundary incidents', 'Border Report 1.2.2021', '', '2021-02-01');
INSERT INTO "file_list" ("id", "file_no", "category", "title", "doc1", "entry_date_real") VALUES
(2278, 'MSB/CB/B-4', 'Mizoram-Cachar Border Dispute/Boundary Committee/Boundary incidents', 'Border Report 2.2.2021', '', '2021-02-02');
INSERT INTO "file_list" ("id", "file_no", "category", "title", "doc1", "entry_date_real") VALUES
(2279, 'MSB/CB/B-4', 'Mizoram-Cachar Border Dispute/Boundary Committee/Boundary incidents', 'Border Report 3.2.2021', '', '2021-02-03');
INSERT INTO "file_list" ("id", "file_no", "category", "title", "doc1", "entry_date_real") VALUES
(2280, 'MSB/CB/B-4', 'Mizoram-Cachar Border Dispute/Boundary Committee/Boundary incidents', 'Border Report 4.2.2021', '', '2021-02-04');
INSERT INTO "file_list" ("id", "file_no", "category", "title", "doc1", "entry_date_real") VALUES
(2281, 'MSB/CB/B-4', 'Mizoram-Cachar Border Dispute/Boundary Committee/Boundary incidents', 'Border Report 5.2.2021', '', '2021-02-05');
INSERT INTO "file_list" ("id", "file_no", "category", "title", "doc1", "entry_date_real") VALUES
(2282, 'MSB/CB/B-4', 'Mizoram-Cachar Border Dispute/Boundary Committee/Boundary incidents', 'Border Report 8.2.2021', '', '2021-02-08');
INSERT INTO "file_list" ("id", "file_no", "category", "title", "doc1", "entry_date_real") VALUES
(2283, 'MSB/CB/B-4', 'Mizoram-Cachar Border Dispute/Boundary Committee/Boundary incidents', 'Border Report 9.2.2021', '', '2021-02-09');
INSERT INTO "file_list" ("id", "file_no", "category", "title", "doc1", "entry_date_real") VALUES
(2284, 'MSB/CB/B-4', 'Mizoram-Cachar Border Dispute/Boundary Committee/Boundary incidents', 'Border Report 10.2.2022', '', '2021-02-10');
INSERT INTO "file_list" ("id", "file_no", "category", "title", "doc1", "entry_date_real") VALUES
(2285, 'MSB/CB/B-4', 'Mizoram-Cachar Border Dispute/Boundary Committee/Boundary incidents', 'Border Report 11.2.2021', '', '2021-02-11');
INSERT INTO "file_list" ("id", "file_no", "category", "title", "doc1", "entry_date_real") VALUES
(2286, 'MSB/CB/B-4', 'Mizoram-Cachar Border Dispute/Boundary Committee/Boundary incidents', 'Border Report 12.2.2021', '', '2021-02-12');
INSERT INTO "file_list" ("id", "file_no", "category", "title", "doc1", "entry_date_real") VALUES
(2287, 'MSB/CB/B-4', 'Mizoram-Cachar Border Dispute/Boundary Committee/Boundary incidents', 'Border Report 13.2.2021', '', '2021-02-13');
INSERT INTO "file_list" ("id", "file_no", "category", "title", "doc1", "entry_date_real") VALUES
(2288, 'MSB/CB/B-4', 'Mizoram-Cachar Border Dispute/Boundary Committee/Boundary incidents', 'Border Report 14.2.2021', '', '2021-02-14');
INSERT INTO "file_list" ("id", "file_no", "category", "title", "doc1", "entry_date_real") VALUES
(2289, 'MSB/CB/B-4', 'Mizoram-Cachar Border Dispute/Boundary Committee/Boundary incidents', 'Border Report 15.2.2021', '', '2021-02-15');
INSERT INTO "file_list" ("id", "file_no", "category", "title", "doc1", "entry_date_real") VALUES
(2290, 'MSB/CB/B-4', 'Mizoram-Cachar Border Dispute/Boundary Committee/Boundary incidents', 'Border Report 17.2.2021', '', '2021-02-17');
INSERT INTO "file_list" ("id", "file_no", "category", "title", "doc1", "entry_date_real") VALUES
(2291, 'MSB/CB/B-4', 'Mizoram-Cachar Border Dispute/Boundary Committee/Boundary incidents', 'Border Report 18.2.2021', '', '2021-02-18');
INSERT INTO "file_list" ("id", "file_no", "category", "title", "doc1", "entry_date_real") VALUES
(2292, 'MSB/CB/B-4', 'Mizoram-Cachar Border Dispute/Boundary Committee/Boundary incidents', 'Border Report 19.2.2021', '', '2021-02-19');
INSERT INTO "file_list" ("id", "file_no", "category", "title", "doc1", "entry_date_real") VALUES
(2293, 'MSB/CB/B-4', 'Mizoram-Cachar Border Dispute/Boundary Committee/Boundary incidents', 'Border Report 22.2.2021', '', '2021-02-22');
INSERT INTO "file_list" ("id", "file_no", "category", "title", "doc1", "entry_date_real") VALUES
(2294, 'MSB/CB/B-4', 'Mizoram-Cachar Border Dispute/Boundary Committee/Boundary incidents', 'Border Report 23.2.2021', '', '2021-02-23');
INSERT INTO "file_list" ("id", "file_no", "category", "title", "doc1", "entry_date_real") VALUES
(2295, 'MSB/CB/B-4', 'Mizoram-Cachar Border Dispute/Boundary Committee/Boundary incidents', 'Border Report 24.2.2021', '', '2021-02-24');
INSERT INTO "file_list" ("id", "file_no", "category", "title", "doc1", "entry_date_real") VALUES
(2296, 'MSB/CB/B-4', 'Mizoram-Cachar Border Dispute/Boundary Committee/Boundary incidents', 'Border REport 25.2.2021', '', '2021-02-25');
INSERT INTO "file_list" ("id", "file_no", "category", "title", "doc1", "entry_date_real") VALUES
(2297, 'MSB/CB/B-4', 'Mizoram-Cachar Border Dispute/Boundary Committee/Boundary incidents', 'Border Report 26.2.2021', '', '2021-02-26');
INSERT INTO "file_list" ("id", "file_no", "category", "title", "doc1", "entry_date_real") VALUES
(2298, 'MSB/CB/B-4', 'Mizoram-Cachar Border Dispute/Boundary Committee/Boundary incidents', 'Border Report 5.1.2021', '', '2021-01-05');
INSERT INTO "file_list" ("id", "file_no", "category", "title", "doc1", "entry_date_real") VALUES
(2299, 'MSB/CB/B-4', 'Mizoram-Cachar Border Dispute/Boundary Committee/Boundary incidents', 'Border Report 18.1.2021', '', '2021-01-18');
INSERT INTO "file_list" ("id", "file_no", "category", "title", "doc1", "entry_date_real") VALUES
(2300, 'MSB/CB/B-4', 'Mizoram-Cachar Border Dispute/Boundary Committee/Boundary incidents', 'Border Report 19.1.2021', '', '2021-01-19');
INSERT INTO "file_list" ("id", "file_no", "category", "title", "doc1", "entry_date_real") VALUES
(2301, 'MSB/CB/B-4', 'Mizoram-Cachar Border Dispute/Boundary Committee/Boundary incidents', 'Border Report 20.1.2021', '', '2021-01-20');
INSERT INTO "file_list" ("id", "file_no", "category", "title", "doc1", "entry_date_real") VALUES
(2302, 'MSB/CB/B-4', 'Mizoram-Cachar Border Dispute/Boundary Committee/Boundary incidents', 'Border Report 21.1.2021', '', '2021-01-21');
INSERT INTO "file_list" ("id", "file_no", "category", "title", "doc1", "entry_date_real") VALUES
(2303, 'MSB/CB/B-4', 'Mizoram-Cachar Border Dispute/Boundary Committee/Boundary incidents', 'Border Report 22.1.2021', '', '2021-01-22');
INSERT INTO "file_list" ("id", "file_no", "category", "title", "doc1", "entry_date_real") VALUES
(2304, 'MSB/CB/B-4', 'Mizoram-Cachar Border Dispute/Boundary Committee/Boundary incidents', 'Border Report 25.1.2021', '', '2021-01-25');
INSERT INTO "file_list" ("id", "file_no", "category", "title", "doc1", "entry_date_real") VALUES
(2305, 'MSB/CB/B-4', 'Mizoram-Cachar Border Dispute/Boundary Committee/Boundary incidents', 'Border Report 27.1.2021', '', '2021-01-27');
INSERT INTO "file_list" ("id", "file_no", "category", "title", "doc1", "entry_date_real") VALUES
(2306, 'MSB/CB/B-4', 'Mizoram-Cachar Border Dispute/Boundary Committee/Boundary incidents', 'Border Report 28.1.2021', '', '2021-01-28');
INSERT INTO "file_list" ("id", "file_no", "category", "title", "doc1", "entry_date_real") VALUES
(2307, 'MSB/CB/B-4', 'Mizoram-Cachar Border Dispute/Boundary Committee/Boundary incidents', 'Border Report 29.1.2021', '', '2021-01-29');
INSERT INTO "file_list" ("id", "file_no", "category", "title", "doc1", "entry_date_real") VALUES
(2308, 'MSB/CB/B-4', 'Mizoram-Cachar Border Dispute/Boundary Committee/Boundary incidents', 'Border Report 4.1.2021', '', '2021-01-04');
INSERT INTO "file_list" ("id", "file_no", "category", "title", "doc1", "entry_date_real") VALUES
(2309, 'MSB/CB/B-4', 'Mizoram-Cachar Border Dispute/Boundary Committee/Boundary incidents', 'Border Report 6.1.2021', '', '2021-01-06');
INSERT INTO "file_list" ("id", "file_no", "category", "title", "doc1", "entry_date_real") VALUES
(2310, 'MSB/CB/B-4', 'Mizoram-Cachar Border Dispute/Boundary Committee/Boundary incidents', 'Border Report 7.1.2021', '', '2021-01-07');
INSERT INTO "file_list" ("id", "file_no", "category", "title", "doc1", "entry_date_real") VALUES
(2311, 'MSB/CB/B-4', 'Mizoram-Cachar Border Dispute/Boundary Committee/Boundary incidents', 'Border Report 8.1.2021', '', '2021-01-08');
INSERT INTO "file_list" ("id", "file_no", "category", "title", "doc1", "entry_date_real") VALUES
(2312, 'MSB/CB/B-4', 'Mizoram-Cachar Border Dispute/Boundary Committee/Boundary incidents', 'Border Report 12.1.2021', '', '2021-01-12');
INSERT INTO "file_list" ("id", "file_no", "category", "title", "doc1", "entry_date_real") VALUES
(2313, 'MSB/CB/B-4', 'Mizoram-Cachar Border Dispute/Boundary Committee/Boundary incidents', 'Border Report 13.1.2021', '', '2021-01-13');
INSERT INTO "file_list" ("id", "file_no", "category", "title", "doc1", "entry_date_real") VALUES
(2314, 'MSB/CB/B-4', 'Mizoram-Cachar Border Dispute/Boundary Committee/Boundary incidents', 'Border Report 14.1.2021', '', '2021-01-14');
INSERT INTO "file_list" ("id", "file_no", "category", "title", "doc1", "entry_date_real") VALUES
(2315, 'MSB/CB/B-4', 'Mizoram-Cachar Border Dispute/Boundary Committee/Boundary incidents', 'Border Report 18.1.2021', '', '2021-01-18');
INSERT INTO "file_list" ("id", "file_no", "category", "title", "doc1", "entry_date_real") VALUES
(2316, 'MSB/CB/B-4', 'Mizoram-Cachar Border Dispute/Boundary Committee/Boundary incidents', 'Border Report 1.7.2021', '', '2021-07-01');
INSERT INTO "file_list" ("id", "file_no", "category", "title", "doc1", "entry_date_real") VALUES
(2317, 'MSB/CB/B-4', 'Mizoram-Cachar Border Dispute/Boundary Committee/Boundary incidents', 'Border Report 2.7.2021', '', '2021-07-02');
INSERT INTO "file_list" ("id", "file_no", "category", "title", "doc1", "entry_date_real") VALUES
(2318, 'MSB/CB/B-4', 'Mizoram-Cachar Border Dispute/Boundary Committee/Boundary incidents', 'Border Report 5.7.2021', '', '2021-07-05');
INSERT INTO "file_list" ("id", "file_no", "category", "title", "doc1", "entry_date_real") VALUES
(2319, 'MSB/CB/B-4', 'Mizoram-Cachar Border Dispute/Boundary Committee/Boundary incidents', 'Border Report 7.7.2021', '', '2021-07-07');
INSERT INTO "file_list" ("id", "file_no", "category", "title", "doc1", "entry_date_real") VALUES
(2320, 'MSB/CB/B-4', 'Mizoram-Cachar Border Dispute/Boundary Committee/Boundary incidents', 'Border Report 8.7.2021', '', '2021-07-08');
INSERT INTO "file_list" ("id", "file_no", "category", "title", "doc1", "entry_date_real") VALUES
(2321, 'MSB/CB/B-4', 'Mizoram-Cachar Border Dispute/Boundary Committee/Boundary incidents', 'Border Report 9.7.2021', '', '2021-07-09');
INSERT INTO "file_list" ("id", "file_no", "category", "title", "doc1", "entry_date_real") VALUES
(2322, 'MSB/CB/B-4', 'Mizoram-Cachar Border Dispute/Boundary Committee/Boundary incidents', 'Border Report 12.7.2021', '', '2021-07-12');
INSERT INTO "file_list" ("id", "file_no", "category", "title", "doc1", "entry_date_real") VALUES
(2323, 'MSB/CB/B-4', 'Mizoram-Cachar Border Dispute/Boundary Committee/Boundary incidents', 'Border Report 13.7.2021', '', '2021-07-13');
INSERT INTO "file_list" ("id", "file_no", "category", "title", "doc1", "entry_date_real") VALUES
(2324, 'MSB/CB/B-4', 'Mizoram-Cachar Border Dispute/Boundary Committee/Boundary incidents', 'Border Report 14.7.2021', '', '2021-07-14');
INSERT INTO "file_list" ("id", "file_no", "category", "title", "doc1", "entry_date_real") VALUES
(2325, 'MSB/CB/B-4', 'Mizoram-Cachar Border Dispute/Boundary Committee/Boundary incidents', 'Border Report 16.7.2021', '', '2021-07-16');
INSERT INTO "file_list" ("id", "file_no", "category", "title", "doc1", "entry_date_real") VALUES
(2326, 'MSB/CB/B-4', 'Mizoram-Cachar Border Dispute/Boundary Committee/Boundary incidents', 'Border Report 19.7.2021', '', '2021-07-19');
INSERT INTO "file_list" ("id", "file_no", "category", "title", "doc1", "entry_date_real") VALUES
(2327, 'MSB/CB/B-4', 'Mizoram-Cachar Border Dispute/Boundary Committee/Boundary incidents', 'Border Report 27.7.2021', '', '2021-07-27');
INSERT INTO "file_list" ("id", "file_no", "category", "title", "doc1", "entry_date_real") VALUES
(2328, 'MSB/CB/B-4', 'Mizoram-Cachar Border Dispute/Boundary Committee/Boundary incidents', 'Border Report 29.7.2021', '', '2021-07-29');
INSERT INTO "file_list" ("id", "file_no", "category", "title", "doc1", "entry_date_real") VALUES
(2329, 'MSB/CB/B-4', 'Mizoram-Cachar Border Dispute/Boundary Committee/Boundary incidents', 'Border Report 1.6.2021', '', '2021-06-01');
INSERT INTO "file_list" ("id", "file_no", "category", "title", "doc1", "entry_date_real") VALUES
(2330, 'MSB/CB/B-4', 'Mizoram-Cachar Border Dispute/Boundary Committee/Boundary incidents', 'Border Report 2.6.2021', '', '2021-06-02');
INSERT INTO "file_list" ("id", "file_no", "category", "title", "doc1", "entry_date_real") VALUES
(2331, 'MSB/CB/B-4', 'Mizoram-Cachar Border Dispute/Boundary Committee/Boundary incidents', 'Border Report 3.6.2021', '', '2021-06-03');
INSERT INTO "file_list" ("id", "file_no", "category", "title", "doc1", "entry_date_real") VALUES
(2332, 'MSB/CB/B-4', 'Mizoram-Cachar Border Dispute/Boundary Committee/Boundary incidents', 'Border Report 4.6.2021', '', '2021-06-04');
INSERT INTO "file_list" ("id", "file_no", "category", "title", "doc1", "entry_date_real") VALUES
(2333, 'MSB/CB/B-4', 'Mizoram-Cachar Border Dispute/Boundary Committee/Boundary incidents', 'Border Report 7.6.2021', '', '2021-06-07');
INSERT INTO "file_list" ("id", "file_no", "category", "title", "doc1", "entry_date_real") VALUES
(2334, 'MSB/CB/B-4', 'Mizoram-Cachar Border Dispute/Boundary Committee/Boundary incidents', 'Border Report 8.6.2021', '', '2021-06-08');
INSERT INTO "file_list" ("id", "file_no", "category", "title", "doc1", "entry_date_real") VALUES
(2335, 'MSB/CB/B-4', 'Mizoram-Cachar Border Dispute/Boundary Committee/Boundary incidents', 'Border Report 9.6.2021', '', '2021-06-09');
INSERT INTO "file_list" ("id", "file_no", "category", "title", "doc1", "entry_date_real") VALUES
(2336, 'MSB/CB/B-4', 'Mizoram-Cachar Border Dispute/Boundary Committee/Boundary incidents', 'Border Report 10.6.2021', '', '2021-06-10');
INSERT INTO "file_list" ("id", "file_no", "category", "title", "doc1", "entry_date_real") VALUES
(2337, 'MSB/CB/B-4', 'Mizoram-Cachar Border Dispute/Boundary Committee/Boundary incidents', 'Border Report 11.6.2021', '', '2021-06-11');
INSERT INTO "file_list" ("id", "file_no", "category", "title", "doc1", "entry_date_real") VALUES
(2338, 'MSB/CB/B-4', 'Mizoram-Cachar Border Dispute/Boundary Committee/Boundary incidents', 'Border Report 12.6.2021', '', '2021-06-12');
INSERT INTO "file_list" ("id", "file_no", "category", "title", "doc1", "entry_date_real") VALUES
(2339, 'MSB/CB/B-4', 'Mizoram-Cachar Border Dispute/Boundary Committee/Boundary incidents', 'Border Report 14.6.2021', '', '2021-06-14');
INSERT INTO "file_list" ("id", "file_no", "category", "title", "doc1", "entry_date_real") VALUES
(2340, 'MSB/CB/B-4', 'Mizoram-Cachar Border Dispute/Boundary Committee/Boundary incidents', 'Border Report 16.6.2021', '', '2021-06-16');
INSERT INTO "file_list" ("id", "file_no", "category", "title", "doc1", "entry_date_real") VALUES
(2341, 'MSB/CB/B-4', 'Mizoram-Cachar Border Dispute/Boundary Committee/Boundary incidents', 'Border Report 17.6.2021', '', '2021-06-17');
INSERT INTO "file_list" ("id", "file_no", "category", "title", "doc1", "entry_date_real") VALUES
(2342, 'MSB/CB/B-4', 'Mizoram-Cachar Border Dispute/Boundary Committee/Boundary incidents', 'Border Report 18.6.2021', '', '2021-06-18');
INSERT INTO "file_list" ("id", "file_no", "category", "title", "doc1", "entry_date_real") VALUES
(2343, 'MSB/CB/B-4', 'Mizoram-Cachar Border Dispute/Boundary Committee/Boundary incidents', 'Border Report 21.6.2021', '', '2021-06-21');
INSERT INTO "file_list" ("id", "file_no", "category", "title", "doc1", "entry_date_real") VALUES
(2344, 'MSB/CB/B-4', 'Mizoram-Cachar Border Dispute/Boundary Committee/Boundary incidents', 'Border Report 22.6.2021', '', '2021-06-22');
INSERT INTO "file_list" ("id", "file_no", "category", "title", "doc1", "entry_date_real") VALUES
(2345, 'MSB/CB/B-4', 'Mizoram-Cachar Border Dispute/Boundary Committee/Boundary incidents', 'Border Report 23.6.2021', '', '2021-06-23');
INSERT INTO "file_list" ("id", "file_no", "category", "title", "doc1", "entry_date_real") VALUES
(2346, 'MSB/CB/B-4', 'Mizoram-Cachar Border Dispute/Boundary Committee/Boundary incidents', 'Border Report 24.6.2021', '', '2021-06-24');
INSERT INTO "file_list" ("id", "file_no", "category", "title", "doc1", "entry_date_real") VALUES
(2347, 'MSB/CB/B-4', 'Mizoram-Cachar Border Dispute/Boundary Committee/Boundary incidents', 'Border Report 25.6.2021', '', '2021-06-25');
INSERT INTO "file_list" ("id", "file_no", "category", "title", "doc1", "entry_date_real") VALUES
(2348, 'MSB/CB/B-4', 'Mizoram-Cachar Border Dispute/Boundary Committee/Boundary incidents', 'Border Report 28.6.2021', '', '2021-06-28');
INSERT INTO "file_list" ("id", "file_no", "category", "title", "doc1", "entry_date_real") VALUES
(2349, 'MSB/CB/B-4', 'Mizoram-Cachar Border Dispute/Boundary Committee/Boundary incidents', 'Border Report 29.6.2021', '', '2021-06-29');
INSERT INTO "file_list" ("id", "file_no", "category", "title", "doc1", "entry_date_real") VALUES
(2350, 'MSB/CB/B-4', 'Mizoram-Cachar Border Dispute/Boundary Committee/Boundary incidents', 'Border Report 1.3.2021', '', '2021-03-01');
INSERT INTO "file_list" ("id", "file_no", "category", "title", "doc1", "entry_date_real") VALUES
(2351, 'MSB/CB/B-4', 'Mizoram-Cachar Border Dispute/Boundary Committee/Boundary incidents', 'Border Report 2.3.2021', '', '2021-03-02');
INSERT INTO "file_list" ("id", "file_no", "category", "title", "doc1", "entry_date_real") VALUES
(2352, 'MSB/CB/B-4', 'Mizoram-Cachar Border Dispute/Boundary Committee/Boundary incidents', 'Border REport 3.3.2021', '', '2021-03-03');
INSERT INTO "file_list" ("id", "file_no", "category", "title", "doc1", "entry_date_real") VALUES
(2353, 'MSB/CB/B-4', 'Mizoram-Cachar Border Dispute/Boundary Committee/Boundary incidents', 'Border Report 4.3.2021', '', '2021-03-04');
INSERT INTO "file_list" ("id", "file_no", "category", "title", "doc1", "entry_date_real") VALUES
(2354, 'MSB/CB/B-4', 'Mizoram-Cachar Border Dispute/Boundary Committee/Boundary incidents', 'Border Report 8.3.2021', '', '2021-03-08');
INSERT INTO "file_list" ("id", "file_no", "category", "title", "doc1", "entry_date_real") VALUES
(2355, 'MSB/CB/B-4', 'Mizoram-Cachar Border Dispute/Boundary Committee/Boundary incidents', 'Border Report 9.3.2021', '', '2021-03-09');
INSERT INTO "file_list" ("id", "file_no", "category", "title", "doc1", "entry_date_real") VALUES
(2356, 'MSB/CB/B-4', 'Mizoram-Cachar Border Dispute/Boundary Committee/Boundary incidents', 'Border Report 10.3.2021', '', '2021-03-10');
INSERT INTO "file_list" ("id", "file_no", "category", "title", "doc1", "entry_date_real") VALUES
(2357, 'MSB/CB/B-4', 'Mizoram-Cachar Border Dispute/Boundary Committee/Boundary incidents', 'Border Report 11.3.2021', '', '2021-03-11');
INSERT INTO "file_list" ("id", "file_no", "category", "title", "doc1", "entry_date_real") VALUES
(2358, 'MSB/CB/B-4', 'Mizoram-Cachar Border Dispute/Boundary Committee/Boundary incidents', 'Border Report 12.3.2021', '', '2021-03-12');
INSERT INTO "file_list" ("id", "file_no", "category", "title", "doc1", "entry_date_real") VALUES
(2359, 'MSB/CB/B-4', 'Mizoram-Cachar Border Dispute/Boundary Committee/Boundary incidents', 'Border Report 15.3.2021', '', '2021-03-15');
INSERT INTO "file_list" ("id", "file_no", "category", "title", "doc1", "entry_date_real") VALUES
(2360, 'MSB/CB/B-4', 'Mizoram-Cachar Border Dispute/Boundary Committee/Boundary incidents', 'Border Report 16.3.2021', '', '2021-03-16');
INSERT INTO "file_list" ("id", "file_no", "category", "title", "doc1", "entry_date_real") VALUES
(2361, 'MSB/CB/B-4', 'Mizoram-Cachar Border Dispute/Boundary Committee/Boundary incidents', 'Border Report 17.3.2021', '', '2021-03-17');
INSERT INTO "file_list" ("id", "file_no", "category", "title", "doc1", "entry_date_real") VALUES
(2362, 'MSB/CB/B-4', 'Mizoram-Cachar Border Dispute/Boundary Committee/Boundary incidents', 'Border Report 18.3.2021', '', '2021-03-18');
INSERT INTO "file_list" ("id", "file_no", "category", "title", "doc1", "entry_date_real") VALUES
(2363, 'MSB/CB/B-4', 'Mizoram-Cachar Border Dispute/Boundary Committee/Boundary incidents', 'Border Report 19.3.2021', '', '2021-03-19');
INSERT INTO "file_list" ("id", "file_no", "category", "title", "doc1", "entry_date_real") VALUES
(2364, 'MSB/CB/B-4', 'Mizoram-Cachar Border Dispute/Boundary Committee/Boundary incidents', 'Border Report 22.3.2021', '', '2021-03-22');
INSERT INTO "file_list" ("id", "file_no", "category", "title", "doc1", "entry_date_real") VALUES
(2365, 'MSB/CB/B-4', 'Mizoram-Cachar Border Dispute/Boundary Committee/Boundary incidents', 'Border Report 23.3.2021', '', '2021-03-23');
INSERT INTO "file_list" ("id", "file_no", "category", "title", "doc1", "entry_date_real") VALUES
(2366, 'MSB/CB/B-4', 'Mizoram-Cachar Border Dispute/Boundary Committee/Boundary incidents', 'Border Report 24.3.2021', '', '2021-03-24');
INSERT INTO "file_list" ("id", "file_no", "category", "title", "doc1", "entry_date_real") VALUES
(2367, 'MSB/CB/B-4', 'Mizoram-Cachar Border Dispute/Boundary Committee/Boundary incidents', 'Border Report 25.3.2021', '', '2021-03-25');
INSERT INTO "file_list" ("id", "file_no", "category", "title", "doc1", "entry_date_real") VALUES
(2368, 'MSB/CB/B-4', 'Mizoram-Cachar Border Dispute/Boundary Committee/Boundary incidents', 'Border Report 26.3.2021', '', '2021-03-26');
INSERT INTO "file_list" ("id", "file_no", "category", "title", "doc1", "entry_date_real") VALUES
(2369, 'MSB/CB/B-4', 'Mizoram-Cachar Border Dispute/Boundary Committee/Boundary incidents', 'Border Report 30.3.2021', '', '2021-03-30');
INSERT INTO "file_list" ("id", "file_no", "category", "title", "doc1", "entry_date_real") VALUES
(2370, 'MSB/CB/B-4', 'Mizoram-Cachar Border Dispute/Boundary Committee/Boundary incidents', 'Border REport 31.3.2021', '', '2021-03-31');
INSERT INTO "file_list" ("id", "file_no", "category", "title", "doc1", "entry_date_real") VALUES
(2371, 'MSB/CB/B-4', 'Mizoram-Cachar Border Dispute/Boundary Committee/Boundary incidents', 'MIZORAM-ASSAM BORDER SITUATION REPORT', '', '2021-05-03');
INSERT INTO "file_list" ("id", "file_no", "category", "title", "doc1", "entry_date_real") VALUES
(2372, 'MSB/CB/B-4', 'Mizoram-Cachar Border Dispute/Boundary Committee/Boundary incidents', 'MIZORAM-ASSAM BORDER SITUATION REPORT', '', '2021-05-04');
INSERT INTO "file_list" ("id", "file_no", "category", "title", "doc1", "entry_date_real") VALUES
(2373, 'MSB/CB/B-4', 'Mizoram-Cachar Border Dispute/Boundary Committee/Boundary incidents', 'MIZORAM-ASSAM BORDER SITUATION REPORT', '', '2021-05-05');
INSERT INTO "file_list" ("id", "file_no", "category", "title", "doc1", "entry_date_real") VALUES
(2374, 'MSB/CB/B-4', 'Mizoram-Cachar Border Dispute/Boundary Committee/Boundary incidents', 'MIZORAM-ASSAM BORDER SITUATION REPORT', '', '2021-05-06');
INSERT INTO "file_list" ("id", "file_no", "category", "title", "doc1", "entry_date_real") VALUES
(2375, 'MSB/CB/B-4', 'Mizoram-Cachar Border Dispute/Boundary Committee/Boundary incidents', 'MIZORAM-ASSAM BORDER SITUATION REPORT', '', '2021-05-07');
INSERT INTO "file_list" ("id", "file_no", "category", "title", "doc1", "entry_date_real") VALUES
(2376, 'MSB/CB/B-4', 'Mizoram-Cachar Border Dispute/Boundary Committee/Boundary incidents', 'MIZORAM-ASSAM BORDER SITUATION REPORT', '', '2021-05-10');
INSERT INTO "file_list" ("id", "file_no", "category", "title", "doc1", "entry_date_real") VALUES
(2377, 'MSB/CB/B-4', 'Mizoram-Cachar Border Dispute/Boundary Committee/Boundary incidents', 'MIZORAM-ASSAM BORDER SITUATION REPORT', '', '2021-05-11');
INSERT INTO "file_list" ("id", "file_no", "category", "title", "doc1", "entry_date_real") VALUES
(2378, 'MSB/CB/B-4', 'Mizoram-Cachar Border Dispute/Boundary Committee/Boundary incidents', 'MIZORAM-ASSAM BORDER SITUATION REPORT', '', '2021-05-12');
INSERT INTO "file_list" ("id", "file_no", "category", "title", "doc1", "entry_date_real") VALUES
(2379, 'MSB/CB/B-4', 'Mizoram-Cachar Border Dispute/Boundary Committee/Boundary incidents', 'MIZORAM-ASSAM BORDER SITUATION REPORT', '', '2021-05-13');
INSERT INTO "file_list" ("id", "file_no", "category", "title", "doc1", "entry_date_real") VALUES
(2380, 'MSB/CB/B-4', 'Mizoram-Cachar Border Dispute/Boundary Committee/Boundary incidents', 'MIZORAM-ASSAM BORDER SITUATION REPORT', '', '2021-05-17');
INSERT INTO "file_list" ("id", "file_no", "category", "title", "doc1", "entry_date_real") VALUES
(2381, 'MSB/CB/B-4', 'Mizoram-Cachar Border Dispute/Boundary Committee/Boundary incidents', 'MIZORAM-ASSAM BORDER SITUATION REPORT', '', '2021-05-18');
INSERT INTO "file_list" ("id", "file_no", "category", "title", "doc1", "entry_date_real") VALUES
(2382, 'MSB/CB/B-4', 'Mizoram-Cachar Border Dispute/Boundary Committee/Boundary incidents', 'MIZORAM-ASSAM BORDER SITUATION REPORT', '', '2021-05-19');
INSERT INTO "file_list" ("id", "file_no", "category", "title", "doc1", "entry_date_real") VALUES
(2383, 'MSB/CB/B-4', 'Mizoram-Cachar Border Dispute/Boundary Committee/Boundary incidents', 'MIZORAM-ASSAM BORDER SITUATION REPORT', '', '2021-05-20');
INSERT INTO "file_list" ("id", "file_no", "category", "title", "doc1", "entry_date_real") VALUES
(2384, 'MSB/CB/B-4', 'Mizoram-Cachar Border Dispute/Boundary Committee/Boundary incidents', 'MIZORAM-ASSAM BORDER SITUATION REPORT', '', '2021-05-21');
INSERT INTO "file_list" ("id", "file_no", "category", "title", "doc1", "entry_date_real") VALUES
(2385, 'MSB/CB/B-4', 'Mizoram-Cachar Border Dispute/Boundary Committee/Boundary incidents', 'MIZORAM-ASSAM BORDER SITUATION REPORT', '', '2021-05-24');
INSERT INTO "file_list" ("id", "file_no", "category", "title", "doc1", "entry_date_real") VALUES
(2386, 'MSB/CB/B-4', 'Mizoram-Cachar Border Dispute/Boundary Committee/Boundary incidents', 'MIZORAM-ASSAM BORDER SITUATION REPORT', '', '2021-05-25');
INSERT INTO "file_list" ("id", "file_no", "category", "title", "doc1", "entry_date_real") VALUES
(2387, 'MSB/CB/B-4', 'Mizoram-Cachar Border Dispute/Boundary Committee/Boundary incidents', 'MIZORAM-ASSAM BORDER SITUATION REPORT', '', '2021-05-27');
INSERT INTO "file_list" ("id", "file_no", "category", "title", "doc1", "entry_date_real") VALUES
(2388, 'MSB/CB/B-4', 'Mizoram-Cachar Border Dispute/Boundary Committee/Boundary incidents', 'MIZORAM-ASSAM BORDER SITUATION REPORT', '', '2021-05-28');
INSERT INTO "file_list" ("id", "file_no", "category", "title", "doc1", "entry_date_real") VALUES
(2389, 'MSB/CB/B-4', 'Mizoram-Cachar Border Dispute/Boundary Committee/Boundary incidents', 'MIZORAM-ASSAM BORDER SITUATION REPORT', '', '2021-05-31');
INSERT INTO "file_list" ("id", "file_no", "category", "title", "doc1", "entry_date_real") VALUES
(2390, 'MSB/CB/B-4', 'Mizoram-Cachar Border Dispute/Boundary Committee/Boundary incidents', 'MIZORAM-ASSAM BORDER SITUATION REPORT', '', '2021-09-09');
INSERT INTO "file_list" ("id", "file_no", "category", "title", "doc1", "entry_date_real") VALUES
(2391, 'MSB/CB/B-4', 'Mizoram-Cachar Border Dispute/Boundary Committee/Boundary incidents', 'Â Â  BORDER ISSUES WITH ASSAM', '', '2021-07-06');
INSERT INTO "file_list" ("id", "file_no", "category", "title", "doc1", "entry_date_real") VALUES
(2392, 'MSB/CB/B-4', 'Mizoram-Cachar Border Dispute/Boundary Committee/Boundary incidents', 'BORDER ISSUES WITH ASSAM', '', '2021-07-06');
INSERT INTO "file_list" ("id", "file_no", "category", "title", "doc1", "entry_date_real") VALUES
(2393, 'MSB/CB/B-4', 'Mizoram-Cachar Border Dispute/Boundary Committee/Boundary incidents', 'Letter to JS HME 06.07.21( interstate border area under contention', '', '2021-07-06');
INSERT INTO "file_list" ("id", "file_no", "category", "title", "doc1", "entry_date_real") VALUES
(2394, 'MSB/CB/B-4', 'Mizoram-Cachar Border Dispute/Boundary Committee/Boundary incidents', 'Mizoram Assam Border edited', '', '2021-07-06');
INSERT INTO "file_list" ("id", "file_no", "category", "title", "doc1", "entry_date_real") VALUES
(2395, 'MSB/CB/B-4', 'Mizoram-Cachar Border Dispute/Boundary Committee/Boundary incidents', 'BORDER ISSUES WITH ASSAM', '', '2018-09-16');
INSERT INTO "file_list" ("id", "file_no", "category", "title", "doc1", "entry_date_real") VALUES
(2396, 'MSB/CB/B-4', 'Mizoram-Cachar Border Dispute/Boundary Committee/Boundary incidents', 'Mizoram-Assam Writeup notes on 27.8.2019', '', '2019-08-30');
INSERT INTO "file_list" ("id", "file_no", "category", "title", "doc1", "entry_date_real") VALUES
(2397, 'MSB/CB/B-4', 'Mizoram-Cachar Border Dispute/Boundary Committee/Boundary incidents', 'BORDER ISSUES WITH ASSAM\r\n\r\n	Assam and Mizoram share a 164.6 km inter-state boundary. There have been skirmishes on both sides earlier as well as both sides claiming portions of land along the boundary as theirs. Residen', '', '2021-08-24');
INSERT INTO "file_list" ("id", "file_no", "category", "title", "doc1", "entry_date_real") VALUES
(2398, 'MSB/CB/B-4', 'Mizoram-Cachar Border Dispute/Boundary Committee/Boundary incidents', 'BORDER ISSUES WITH ASSAM', '', '2022-02-02');
INSERT INTO "file_list" ("id", "file_no", "category", "title", "doc1", "entry_date_real") VALUES
(2399, 'MSB/CB/B-4', 'Mizoram-Cachar Border Dispute/Boundary Committee/Boundary incidents', 'MIZORAM-ASSAM BORDER SITUATION REPORT', '', '2021-04-01');
INSERT INTO "file_list" ("id", "file_no", "category", "title", "doc1", "entry_date_real") VALUES
(2400, 'MSB/CB/B-4', 'Mizoram-Cachar Border Dispute/Boundary Committee/Boundary incidents', 'MIZORAM-ASSAM BORDER SITUATION REPORT', '', '2021-04-09');
INSERT INTO "file_list" ("id", "file_no", "category", "title", "doc1", "entry_date_real") VALUES
(2401, 'MSB/CB/B-4', 'Mizoram-Cachar Border Dispute/Boundary Committee/Boundary incidents', 'MIZORAM-ASSAM BORDER SITUATION REPORT', '', '2021-04-20');
INSERT INTO "file_list" ("id", "file_no", "category", "title", "doc1", "entry_date_real") VALUES
(2402, 'MSB/CB/B-4', 'Mizoram-Cachar Border Dispute/Boundary Committee/Boundary incidents', 'MIZORAM-ASSAM BORDER SITUATION REPORT', '', '2021-04-23');
INSERT INTO "file_list" ("id", "file_no", "category", "title", "doc1", "entry_date_real") VALUES
(2403, 'MSB/CB/B-4', 'Mizoram-Cachar Border Dispute/Boundary Committee/Boundary incidents', 'MIZORAM-ASSAM BORDER SITUATION REPORT', '', '2021-04-29');
INSERT INTO "file_list" ("id", "file_no", "category", "title", "doc1", "entry_date_real") VALUES
(2404, 'MSB/CB/B-4', 'Mizoram-Cachar Border Dispute/Boundary Committee/Boundary incidents', 'MIZORAM-ASSAM BORDER SITUATION REPORT', '', '2021-02-01');
INSERT INTO "file_list" ("id", "file_no", "category", "title", "doc1", "entry_date_real") VALUES
(2405, 'MSB/CB/B-4', 'Mizoram-Cachar Border Dispute/Boundary Committee/Boundary incidents', 'MIZORAM-ASSAM BORDER SITUATION REPORT', '', '2021-02-03');
INSERT INTO "file_list" ("id", "file_no", "category", "title", "doc1", "entry_date_real") VALUES
(2406, 'MSB/CB/B-4', 'Mizoram-Cachar Border Dispute/Boundary Committee/Boundary incidents', 'MIZORAM-ASSAM BORDER SITUATION REPORT', '', '2021-02-04');
INSERT INTO "file_list" ("id", "file_no", "category", "title", "doc1", "entry_date_real") VALUES
(2407, 'MSB/CB/B-4', 'Mizoram-Cachar Border Dispute/Boundary Committee/Boundary incidents', 'MIZORAM-ASSAM BORDER SITUATION REPORT', '', '2021-02-05');
INSERT INTO "file_list" ("id", "file_no", "category", "title", "doc1", "entry_date_real") VALUES
(2408, 'MSB/CB/B-4', 'Mizoram-Cachar Border Dispute/Boundary Committee/Boundary incidents', 'MIZORAM-ASSAM BORDER SITUATION REPORT', '', '2021-02-09');
INSERT INTO "file_list" ("id", "file_no", "category", "title", "doc1", "entry_date_real") VALUES
(2409, 'MSB/CB/B-4', 'Mizoram-Cachar Border Dispute/Boundary Committee/Boundary incidents', 'MIZORAM-ASSAM BORDER SITUATION REPORT', '', '2021-02-10');
INSERT INTO "file_list" ("id", "file_no", "category", "title", "doc1", "entry_date_real") VALUES
(2410, 'MSB/CB/B-4', 'Mizoram-Cachar Border Dispute/Boundary Committee/Boundary incidents', 'MIZORAM-ASSAM BORDER SITUATION REPORT', '', '2021-02-10');
INSERT INTO "file_list" ("id", "file_no", "category", "title", "doc1", "entry_date_real") VALUES
(2411, 'MSB/CB/B-4', 'Mizoram-Cachar Border Dispute/Boundary Committee/Boundary incidents', 'MIZORAM-ASSAM BORDER SITUATION REPORT', '', '2021-02-12');
INSERT INTO "file_list" ("id", "file_no", "category", "title", "doc1", "entry_date_real") VALUES
(2412, 'MSB/CB/B-4', 'Mizoram-Cachar Border Dispute/Boundary Committee/Boundary incidents', 'MIZORAM-ASSAM BORDER SITUATION REPORT', '', '2021-02-13');
INSERT INTO "file_list" ("id", "file_no", "category", "title", "doc1", "entry_date_real") VALUES
(2413, 'MSB/CB/B-4', 'Mizoram-Cachar Border Dispute/Boundary Committee/Boundary incidents', 'MIZORAM-ASSAM BORDER SITUATION REPORT', '', '2021-02-14');
INSERT INTO "file_list" ("id", "file_no", "category", "title", "doc1", "entry_date_real") VALUES
(2414, 'MSB/CB/B-4', 'Mizoram-Cachar Border Dispute/Boundary Committee/Boundary incidents', 'MIZORAM-ASSAM BORDER SITUATION REPORT', '', '2021-02-15');
INSERT INTO "file_list" ("id", "file_no", "category", "title", "doc1", "entry_date_real") VALUES
(2415, 'MSB/CB/B-4', 'Mizoram-Cachar Border Dispute/Boundary Committee/Boundary incidents', 'MIZORAM-ASSAM BORDER SITUATION REPORT', '', '2021-02-17');
INSERT INTO "file_list" ("id", "file_no", "category", "title", "doc1", "entry_date_real") VALUES
(2416, 'MSB/CB/B-4', 'Mizoram-Cachar Border Dispute/Boundary Committee/Boundary incidents', 'MIZORAM-ASSAM BORDER SITUATION REPORT', '', '2021-02-18');
INSERT INTO "file_list" ("id", "file_no", "category", "title", "doc1", "entry_date_real") VALUES
(2417, 'MSB/CB/B-4', 'Mizoram-Cachar Border Dispute/Boundary Committee/Boundary incidents', 'MIZORAM-ASSAM BORDER SITUATION REPORT', '', '2021-02-19');
INSERT INTO "file_list" ("id", "file_no", "category", "title", "doc1", "entry_date_real") VALUES
(2418, 'MSB/CB/B-4', 'Mizoram-Cachar Border Dispute/Boundary Committee/Boundary incidents', 'MIZORAM-ASSAM BORDER SITUATION REPORT', '', '2021-02-25');
INSERT INTO "file_list" ("id", "file_no", "category", "title", "doc1", "entry_date_real") VALUES
(2419, 'MSB/CB/B-4', 'Mizoram-Cachar Border Dispute/Boundary Committee/Boundary incidents', 'MIZORAM-ASSAM BORDER SITUATION REPORT', '', '2021-02-26');
INSERT INTO "file_list" ("id", "file_no", "category", "title", "doc1", "entry_date_real") VALUES
(2420, 'MSB/CB/B-4', 'Mizoram-Cachar Border Dispute/Boundary Committee/Boundary incidents', 'MIZORAM-ASSAM BORDER SITUATION REPORT', '', '2021-01-27');
INSERT INTO "file_list" ("id", "file_no", "category", "title", "doc1", "entry_date_real") VALUES
(2421, 'MSB/CB/B-4', 'Mizoram-Cachar Border Dispute/Boundary Committee/Boundary incidents', 'MIZORAM-ASSAM BORDER SITUATION REPORT', '', '2021-01-27');
INSERT INTO "file_list" ("id", "file_no", "category", "title", "doc1", "entry_date_real") VALUES
(2422, 'MSB/CB/B-4', 'Mizoram-Cachar Border Dispute/Boundary Committee/Boundary incidents', 'MIZORAM-ASSAM BORDER SITUATION REPORT', '', '2021-01-29');
INSERT INTO "file_list" ("id", "file_no", "category", "title", "doc1", "entry_date_real") VALUES
(2423, 'MSB/CB/B-4', 'Mizoram-Cachar Border Dispute/Boundary Committee/Boundary incidents', 'MIZORAM-ASSAM BORDER SITUATION REPORT', '', '2021-01-04');
INSERT INTO "file_list" ("id", "file_no", "category", "title", "doc1", "entry_date_real") VALUES
(2424, 'MSB/CB/B-4', 'Mizoram-Cachar Border Dispute/Boundary Committee/Boundary incidents', 'MIZORAM-ASSAM BORDER SITUATION REPORT', '', '2021-01-06');
INSERT INTO "file_list" ("id", "file_no", "category", "title", "doc1", "entry_date_real") VALUES
(2425, 'MSB/CB/B-4', 'Mizoram-Cachar Border Dispute/Boundary Committee/Boundary incidents', 'MIZORAM-ASSAM BORDER SITUATION REPORT', '', '2021-01-07');
INSERT INTO "file_list" ("id", "file_no", "category", "title", "doc1", "entry_date_real") VALUES
(2426, 'MSB/CB/B-4', 'Mizoram-Cachar Border Dispute/Boundary Committee/Boundary incidents', 'MIZORAM-ASSAM BORDER SITUATION REPORT', '', '2021-01-08');
INSERT INTO "file_list" ("id", "file_no", "category", "title", "doc1", "entry_date_real") VALUES
(2427, 'MSB/CB/B-4', 'Mizoram-Cachar Border Dispute/Boundary Committee/Boundary incidents', 'MIZORAM-ASSAM BORDER SITUATION REPORT', '', '2021-01-12');
INSERT INTO "file_list" ("id", "file_no", "category", "title", "doc1", "entry_date_real") VALUES
(2428, 'MSB/CB/B-4', 'Mizoram-Cachar Border Dispute/Boundary Committee/Boundary incidents', 'MIZORAM-ASSAM BORDER SITUATION REPORT', '', '2021-01-18');
INSERT INTO "file_list" ("id", "file_no", "category", "title", "doc1", "entry_date_real") VALUES
(2429, 'MSB/CB/B-4', 'Mizoram-Cachar Border Dispute/Boundary Committee/Boundary incidents', 'MIZORAM-ASSAM BORDER SITUATION REPORT', '', '2021-01-05');
INSERT INTO "file_list" ("id", "file_no", "category", "title", "doc1", "entry_date_real") VALUES
(2430, 'MSB/CB/B-4', 'Mizoram-Cachar Border Dispute/Boundary Committee/Boundary incidents', 'MIZORAM-ASSAM BORDER SITUATION REPORT', '', '2021-07-01');
INSERT INTO "file_list" ("id", "file_no", "category", "title", "doc1", "entry_date_real") VALUES
(2431, 'MSB/CB/B-4', 'Mizoram-Cachar Border Dispute/Boundary Committee/Boundary incidents', 'MIZORAM-ASSAM BORDER SITUATION REPORT', '', '2021-07-02');
INSERT INTO "file_list" ("id", "file_no", "category", "title", "doc1", "entry_date_real") VALUES
(2432, 'MSB/CB/B-4', 'Mizoram-Cachar Border Dispute/Boundary Committee/Boundary incidents', 'MIZORAM-ASSAM BORDER SITUATION REPORT', '', '2021-06-01');
INSERT INTO "file_list" ("id", "file_no", "category", "title", "doc1", "entry_date_real") VALUES
(2433, 'MSB/CB/B-4', 'Mizoram-Cachar Border Dispute/Boundary Committee/Boundary incidents', 'MIZORAM-ASSAM BORDER SITUATION REPORT', '', '2021-06-03');
INSERT INTO "file_list" ("id", "file_no", "category", "title", "doc1", "entry_date_real") VALUES
(2434, 'MSB/CB/B-4', 'Mizoram-Cachar Border Dispute/Boundary Committee/Boundary incidents', 'MIZORAM-ASSAM BORDER SITUATION REPORT', '', '2021-06-10');
INSERT INTO "file_list" ("id", "file_no", "category", "title", "doc1", "entry_date_real") VALUES
(2435, 'MSB/CB/B-4', 'Mizoram-Cachar Border Dispute/Boundary Committee/Boundary incidents', 'MIZORAM-ASSAM BORDER SITUATION REPORT', '', '2021-06-11');
INSERT INTO "file_list" ("id", "file_no", "category", "title", "doc1", "entry_date_real") VALUES
(2436, 'MSB/CB/B-4', 'Mizoram-Cachar Border Dispute/Boundary Committee/Boundary incidents', 'MIZORAM-ASSAM BORDER SITUATION REPORT', '', '2021-06-12');
INSERT INTO "file_list" ("id", "file_no", "category", "title", "doc1", "entry_date_real") VALUES
(2437, 'MSB/CB/B-4', 'Mizoram-Cachar Border Dispute/Boundary Committee/Boundary incidents', 'MIZORAM-ASSAM BORDER SITUATION REPORT', '', '2021-06-14');
INSERT INTO "file_list" ("id", "file_no", "category", "title", "doc1", "entry_date_real") VALUES
(2438, 'MSB/CB/B-4', 'Mizoram-Cachar Border Dispute/Boundary Committee/Boundary incidents', 'MIZORAM-ASSAM BORDER SITUATION REPORT', '', '2021-06-16');
INSERT INTO "file_list" ("id", "file_no", "category", "title", "doc1", "entry_date_real") VALUES
(2439, 'MSB/CB/B-4', 'Mizoram-Cachar Border Dispute/Boundary Committee/Boundary incidents', 'MIZORAM-ASSAM BORDER SITUATION REPORT', '', '2021-06-21');
INSERT INTO "file_list" ("id", "file_no", "category", "title", "doc1", "entry_date_real") VALUES
(2440, 'MSB/CB/B-4', 'Mizoram-Cachar Border Dispute/Boundary Committee/Boundary incidents', 'MIZORAM-ASSAM BORDER SITUATION REPORT', '', '2021-06-28');
INSERT INTO "file_list" ("id", "file_no", "category", "title", "doc1", "entry_date_real") VALUES
(2441, 'MSB/CB/B-4', 'Mizoram-Cachar Border Dispute/Boundary Committee/Boundary incidents', 'MIZORAM-ASSAM BORDER SITUATION REPORT', '', '2021-06-29');
INSERT INTO "file_list" ("id", "file_no", "category", "title", "doc1", "entry_date_real") VALUES
(2442, 'MSB/CB/B-4', 'Mizoram-Cachar Border Dispute/Boundary Committee/Boundary incidents', 'MIZORAM-ASSAM BORDER SITUATION REPORT', '', '2021-03-01');
INSERT INTO "file_list" ("id", "file_no", "category", "title", "doc1", "entry_date_real") VALUES
(2443, 'MSB/CB/B-4', 'Mizoram-Cachar Border Dispute/Boundary Committee/Boundary incidents', 'MIZORAM-ASSAM BORDER SITUATION REPORT', '', '2021-03-03');
INSERT INTO "file_list" ("id", "file_no", "category", "title", "doc1", "entry_date_real") VALUES
(2444, 'MSB/CB/B-4', 'Mizoram-Cachar Border Dispute/Boundary Committee/Boundary incidents', 'MIZORAM-ASSAM BORDER SITUATION REPORT', '', '2021-03-12');
INSERT INTO "file_list" ("id", "file_no", "category", "title", "doc1", "entry_date_real") VALUES
