

INSERT INTO `file_list` (`id`, `file_no`, `category`, `title`, `doc1`, `entry_date_real`) VALUES
(2519, 'MSB/CB/B-4', 'Mizoram-Cachar Border Dispute/Boundary Committee/Boundary incidents', 'SPECIAL REPORT', '', '2021-06-05'),
(2520, 'MSB/CB/B-4', 'Mizoram-Cachar Border Dispute/Boundary Committee/Boundary incidents', 'SPECIAL REPORT', '', '2021-06-11'),
(2521, 'MSB/CB/B-4', 'Mizoram-Cachar Border Dispute/Boundary Committee/Boundary incidents', 'SPECIAL REPORT', '', '2021-06-16'),
(2522, 'MSB/CB/B-4', 'Mizoram-Cachar Border Dispute/Boundary Committee/Boundary incidents', 'SPECIAL REPORT', '', '2021-06-26'),
(2523, 'MSB/CB/B-4', 'Mizoram-Cachar Border Dispute/Boundary Committee/Boundary incidents', 'SPECIAL REPORT', '', '2021-06-30'),
(2524, 'MSB/CB/B-4', 'Mizoram-Cachar Border Dispute/Boundary Committee/Boundary incidents', 'SPECIAL REPORT', '', '2021-03-08'),
(2525, 'MSB/CB/B-4', 'Mizoram-Cachar Border Dispute/Boundary Committee/Boundary incidents', 'SPECIAL REPORT', '', '2021-03-16'),
(2526, 'MSB/CB/B-4', 'Mizoram-Cachar Border Dispute/Boundary Committee/Boundary incidents', 'SPECIAL REPORT', '', '2021-05-14'),
(2527, 'MSB/CB/B-4', 'Mizoram-Cachar Border Dispute/Boundary Committee/Boundary incidents', 'Vairengte Enquiry Report', '', '2021-04-16'),
(2528, 'MSB/CB/B-4', 'Mizoram-Cachar Border Dispute/Boundary Committee/Boundary incidents', 'List of recipients of land allotted by Vairengte VC-I', '', '2021-05-12'),
(2529, 'MSB/CB/B-4', 'Mizoram-Cachar Border Dispute/Boundary Committee/Boundary incidents', 'Allocation of Land by VC-I, Vairengte.', '', '2021-05-10'),
(2530, 'MSB/CB/B-4', 'Mizoram-Cachar Border Dispute/Boundary Committee/Boundary incidents', 'Inquiry Report Vairengte', '', '2021-05-12'),
(2531, 'MSB/CB/B-4', 'Mizoram-Cachar Border Dispute/Boundary Committee/Boundary incidents', 'Vairengte huam chhung a Ram leh House Assistance pek chungchang enquiry', '', '2021-04-12'),
(2532, 'MSB/CB/B-4', 'Mizoram-Cachar Border Dispute/Boundary Committee/Boundary incidents', 'BORDER ISSUES WITH ASSAM', '', '2021-07-05'),
(2533, 'MSB/CB/B-4', 'Mizoram-Cachar Border Dispute/Boundary Committee/Boundary incidents', 'BORDERÃ‚Â  ISSUES WITHÃ‚Â  ASSAM 2', '', '2021-07-12'),
(2534, 'MSB/CB/B-4', 'Mizoram-Cachar Border Dispute/Boundary Committee/Boundary incidents', 'BORDER ISSUES WITH ASSAM 3', '', '2021-07-03'),
(2535, 'MSB/CB/B-4', 'Mizoram-Cachar Border Dispute/Boundary Committee/Boundary incidents', 'BORDER ISSUES WITH ASSAM', '', '2021-07-05'),
(2536, 'MSB/CB/B-4', 'Mizoram-Cachar Border Dispute/Boundary Committee/Boundary incidents', 'Assam Mizoram Border for AIG(Hqrs)', '', '2021-07-12'),
(2537, 'MSB/CB/B-4', 'Mizoram-Cachar Border Dispute/Boundary Committee/Boundary incidents', 'Mizoram-Assam border write up  2.7.2021', '', '2021-07-03'),
(2538, 'MSB/CB/B-4', 'Mizoram-Cachar Border Dispute/Boundary Committee/Boundary incidents', 'Boundary committee thutkhawm vawi 2 na', '', '2021-09-02'),
(2539, 'MSB/CB/B-4', 'Mizoram-Cachar Border Dispute/Boundary Committee/Boundary incidents', 'Boundary committee thutkhawm vawi 2 na', '', '2021-09-02'),
(2540, 'MSB/CB/B-4', 'Mizoram-Cachar Border Dispute/Boundary Committee/Boundary incidents', 'Boundary committee thutkhawm vawi 2 na', '', '2021-09-02'),
(2541, 'MSB/CB/B-4', 'Mizoram-Cachar Border Dispute/Boundary Committee/Boundary incidents', 'Assam Mizoram Border (1)', '', '2021-07-05'),
(2542, 'MSB/CB/B-4', 'Mizoram-Cachar Border Dispute/Boundary Committee/Boundary incidents', 'Assam Mizoram Border (1)', '', '2021-07-05'),
(2543, 'MSB/CB/B-4', 'Mizoram-Cachar Border Dispute/Boundary Committee/Boundary incidents', 'Assam Mizoram Border incidents', '', '2021-07-03'),
(2544, 'MSB/CB/B-4', 'Mizoram-Cachar Border Dispute/Boundary Committee/Boundary incidents', 'Assam Police PR No.323', '', '2021-07-30'),
(2545, 'MSB/CB/B-4', 'Mizoram-Cachar Border Dispute/Boundary Committee/Boundary incidents', 'Inter-state border under contention', '', '2021-07-06'),
(2546, 'MSB/CB/B-4', 'Mizoram-Cachar Border Dispute/Boundary Committee/Boundary incidents', 'MIZORAM-ASSAM BORDER SITUATION REPORT', '', '2021-07-02'),
(2547, 'MSB/CB/B-4', 'Mizoram-Cachar Border Dispute/Boundary Committee/Boundary incidents', 'BORDER OUT POSTS OF CRPF IN MIZORAM (As on 31.8.21)', '', '2021-08-31'),
(2548, 'MSB/CB/B-4', 'Mizoram-Cachar Border Dispute/Boundary Committee/Boundary incidents', 'Vairengte inkah case registered', '', '2021-07-26'),
(2549, 'MSB/CB/B-4', 'Mizoram-Cachar Border Dispute/Boundary Committee/Boundary incidents', 'Vairengte inkah case registered', '', '2021-07-26'),
(2550, 'MSB/CB/B-4', 'Mizoram-Cachar Border Dispute/Boundary Committee/Boundary incidents', 'HISTORY OF ASSAM - MIZORAM BORDER', '', '2019-08-14'),
(2551, 'MSB/CB/B-4', 'Mizoram-Cachar Border Dispute/Boundary Committee/Boundary incidents', 'Kum 1979 ah Silchar leh Mizoram Buaina', '', '2020-11-09'),
(2552, 'MSB/CB/B-4', 'Mizoram-Cachar Border Dispute/Boundary Committee/Boundary incidents', 'Major Mizoram- Assam border incidents ( Dt. 5.8.2021 - 22.8.2021 )', '', '2021-08-22'),
(2553, 'MSB/CB/B-4', 'Mizoram-Cachar Border Dispute/Boundary Committee/Boundary incidents', 'Mizoram-Assam border write up  2.7.2021', '', '2021-07-03'),
(2554, 'MSB/CB/B-4', 'Mizoram-Cachar Border Dispute/Boundary Committee/Boundary incidents', 'Mz- Assam CS meeting minutes', '', '2021-07-28'),
(2555, 'MSB/CB/B-4', 'Mizoram-Cachar Border Dispute/Boundary Committee/Boundary incidents', 'Mz- Assam CS meeting minutes', '', '2021-07-28'),
(2556, 'MSB/CB/B-4', 'Mizoram-Cachar Border Dispute/Boundary Committee/Boundary incidents', 'Govt of Assam - Order', '', '2021-07-30'),
(2557, 'MSB/CB/B-4', 'Mizoram-Cachar Border Dispute/Boundary Committee/Boundary incidents', 'PIL 68 of 2020', '', '2021-07-30'),
(2558, 'MSB/CB/B-4', 'Mizoram-Cachar Border Dispute/Boundary Committee/Boundary incidents', 'Press Statement Govt of Assam 26 July 2021', '', '2021-07-30'),
(2559, 'MSB/CB/B-4', 'Mizoram-Cachar Border Dispute/Boundary Committee/Boundary incidents', 'Govt of Assam Travel advisory', '', '2021-07-30'),
(2560, 'MSB/CB/B-4', 'Mizoram-Cachar Border Dispute/Boundary Committee/Boundary incidents', 'Govt of Assam Travel advisory', '', '2021-07-30'),
(2561, 'MSB/CB/B-16/BOR', 'Mizoram-Tripura Border Affairs/Manipur Border Affairs', 'MIZORAM-MANIPUR BORDER ROAD ISSUE', '', '2019-06-21'),
(2562, 'MSB/CB/B-16/BOR', 'Mizoram-Tripura Border Affairs/Manipur Border Affairs', 'MIZORAM- TRIPURA', '', '2021-07-03'),
(2563, 'MSB/CB/B-16/BOR', 'Mizoram-Tripura Border Affairs/Manipur Border Affairs', 'Enquiry report regarding inter-state boundary dispute vis-ÃƒÂ -vis opinion of NGOsÃ¢â‚¬â„¢ and other stake holders of Phuldungsei (Mizoram)', '', '2020-09-22'),
(2564, 'MSB/CB/B-16/BOR', 'Mizoram-Tripura Border Affairs/Manipur Border Affairs', 'SR Tripura', '', '2021-08-26'),
(2565, 'MSB/CB/B-16/BOR', 'Mizoram-Tripura Border Affairs/Manipur Border Affairs', 'MIZORAM - TRIPURA BORDER INCIDENT', '', '2021-08-27'),
(2566, 'MSB/CB/B-16/BOR', 'Mizoram-Tripura Border Affairs/Manipur Border Affairs', 'Tripura Border final (Prepared by Pu Hlutea DSP)', '', '2021-08-26'),
(2567, 'MSB/CB/B-19', 'Categorisation of Protected Persons in the State of Mizoram and others', 'Ã‚Â  List of categorized protected persons of Mizoram.', '', '2021-09-06'),
(2568, 'MSB/CB/B-19', 'Categorisation of Protected Persons in the State of Mizoram and others', 'VIP Security Intelligence Digest', '', '2021-11-09'),
(2569, 'MSB/CB/B-19(A)', 'Security Threat Perception', 'assessment of threat perception of Pu Lalrinliana Sailo, Hon\'ble Speaker, Mizoram Legislative Assembly', '', '2021-01-29'),
(2570, 'MSB/CB/B-19(A)', 'Security Threat Perception', 'FDD (assessment of security threat perception in respect of Pu Lalrinliana Sailo, Hon\'ble Speaker, Mizoram Legislative Assembly)', '', '2021-02-01'),
(2571, 'MSB/CB/B-19(A)', 'Security Threat Perception', 'PU F.ROHLUPUIA LUNGLEI ADDITIONAL DISTRICT AND SESSION JUDGE Threat assessment', '', '2021-03-25'),
(2572, 'MSB/CB/B-19(A)', 'Security Threat Perception', 'assessment of Lunglei NDPS judge', '', '2021-07-08'),
(2573, 'MSB/CB/B-19(A)', 'Security Threat Perception', 'assessment of Lunglei NDPS judge', '', '2021-07-08'),
(2574, 'MSB/CB/B-19(A)', 'Security Threat Perception', 'assessment of Lunglei NDPS judge', '', '2021-07-08'),
(2575, 'MSB/CB/B-19(A)', 'Security Threat Perception', 'assessment of Lunglei NDPS judge', '', '2021-07-08'),
(2576, 'MSB/CB/B-19(A)', 'Security Threat Perception', 'threat perception assessment in respect ofÃ‚Â  Presiding Officer, MACT, Aizawl', '', '2021-12-20'),
(2577, 'MSB/CB/B-19(A)', 'Security Threat Perception', 'security threat perception assessment Ã‚Â of Pu F.Rohlupuia MJS, Addl. District & Session Judge , Lunglei', '', '2021-07-08'),
(2578, 'MSB/CB/B-19(A)', 'Security Threat Perception', 'assessment of Security threat perception towards Pu Liansangzuala, Presiding Officer, MACT ( SI Lalrokima)', '', '2021-12-23'),
(2579, 'MSB/CB/B-19(A)', 'Security Threat Perception', 'Endorsement Assessment of Security threat perception  Vanlalenmawia, Special Judge (Prevention of Corruption Act), Aizawl.', '', '2021-12-30'),
(2580, 'MSB/CB/B-19(A)', 'Security Threat Perception', 'assessment of threat perception in respect of Presiding Officer, MACT Aizawl', '', '2021-12-29'),
(2581, 'MSB/CB/B-26/HPC(D)', 'Correspondence on HPC(D) B-114', 'Abstract of HPCD,KMMTTP,BRU', '', '2021-10-27'),
(2582, 'MSB/CB/B-26/HPC(D)', 'Correspondence on HPC(D) B-114', 'Abstract of HPCD,KMMTTP,BRU', '', '2021-10-27'),
(2583, 'MSB/CB/B-26/HPC(D)', 'Correspondence on HPC(D) B-114', 'Abstract of HPCD,KMMTTP,BRU', '', '2021-10-27'),
(2584, 'MSB/CB/B-26/HPC(D)', 'Correspondence on HPC(D) B-114', 'Abstract of HPCD,KMMTTP,BRU', '', '2021-10-27'),
(2585, 'MSB/CB/B-26/HPC(D)', 'Correspondence on HPC(D) B-114', 'Abstract of HPCD,KMMTTP,BRU', '', '2021-10-27'),
(2586, 'MSB/CB/B-26/HPC(D)', 'Correspondence on HPC(D) B-114', 'Details of HPC and HPC(D) leaders - regarding', '', '2021-02-05'),
(2587, 'MSB/CB/B-26/HPC(D)', 'Correspondence on HPC(D) B-114', 'HPC (D) - List Chhut thar (Din tirh a member te)', '', '2021-01-28'),
(2588, 'MSB/CB/B-41', 'Zoram Chhantu', 'Para wise comments - Ashwini Kumar Upandhyay - vrs-Union of India and Ors  reg', '', '2023-03-02'),
(2589, 'MSB/CB/B-49/BOP', 'Border Out Post', 'BORDER OUT POSTS OF ASSAM RIFLES AND BORDER SECURITY FORCE Ã‚Â IN MIZORAM : (As on 27.8.2021)', '', '2021-08-27'),
(2590, 'MSB/CB/B-49/BOP', 'Border Out Post', 'ASSAMÃ‚Â  RIFLES/ BSF/CRPF OUT POST WITHIN LAWNGTLAI DISTRICT (As on 27.8.2021)', '', '2021-09-03'),
(2591, 'MSB/CB/B-49/BOP', 'Border Out Post', 'CRPF  duty na Vairengte', '', '2021-08-30'),
(2592, 'MSB/CB/B-49/BOP', 'Border Out Post', 'BSF/AR OUT POST WITHIN CHAWNGTE SB JURISDICTION Ã‚Â  Dt. 27.7.2021', '', '2021-09-02'),
(2593, 'MSB/CB/B-59/Visit', 'VVIP Visit to Mizoram', 'Vice President visit Mizoram', '', '2021-09-14'),
(2594, 'MSB/CB/B-59', 'VVIP Visit to Mizoram', 'vice president visit WT message', '', '2021-10-04'),
(2595, 'MSB/CB/B-59(A)', 'President visit to Mizoram', 'Visit of the Hon\'ble Vice-President of India to the State of Mizoram on 7 to 8 October 2021', '', '2021-10-04'),
(2596, 'MSB/CB/B-59/Visit', 'VVIP Visit to Mizoram', 'WhatsApp Image 2021-10-04 at 12.28.34 PM', '', '2021-10-04'),
(2597, 'MSB/CB/B-69/SPL', 'Special Report correspondence', 'Ã‚Â  Special Report - regarding.', '', '2021-09-02'),
(2598, 'MSB/CB/B-69/SPL', 'Special Report correspondence', 'STATEMENT OF ACCUSED A-1 IN CON WITH SPL. NARCOTICS PS\r\nCASE No. 10/21Ã‚Â  dt.18.3.2021 u/s 22(c)/29/25/62 ND & PS Act, 1985.', '', '2021-08-31'),
(2599, 'MSB/CB/B-69/SPL', 'Special Report correspondence', 'STATEMENT OF ACCUSED A-1 IN CON WITH SPL. NARCOTICS PS\r\nCASE No. 10/21Ã‚Â  dt.18.3.2021 u/s 22(c)/29/25/62 ND & PS Act, 1985.', '', '2021-09-02'),
(2600, 'MSB/CB/B-69/SPL', 'Special Report correspondence', 'Special Report - regarding', '', '2021-08-27'),
(2601, 'MSB/CB/B-70/FC', 'Fake Currency correspondence(FICN)', 'FICN SEIZED BY POLICE IN THE STATE OF MIZORAM W.E.F 2010 to 2020', '', '2021-06-21'),
(2602, 'MSB/CB/B-70/FC', 'Fake Currency correspondence(FICN)', 'FICN CASES REGISTERED IN MIZORAM DURING THE LAST 10 YEARS (2010 - 2020)', '', '2021-06-10'),
(2603, 'MSB/CB/B-70/FC', 'Fake Currency correspondence(FICN)', 'Meeting minute SLC', '', '2021-03-12'),
(2604, 'MSB/CB/B-70/FC', 'Fake Currency correspondence(FICN)', 'I day speech for AIG(Hqrs.) enclosure', '', '2021-06-21'),
(2605, 'MSB/CB/B-82/IR Day', 'Independence/Republic Day', 'Independence Day Speech of Hon\'ble Chief Minister of Mizoram to be Ã‚Â delivered on 15.08.2021.Ã‚Â Ã‚Â ', '', '2021-06-22'),
(2606, 'MSB/CB/B-82/IR Day', 'Independence/Republic Day', 'I day speech for DIG', '', '2021-06-21'),
(2607, 'MSB/CB/B-82/IR Day', 'Independence/Republic Day', 'I Day 2021 threat perception assessment', '', '2021-08-01'),
(2608, 'MSB/CB/B-82/IR Day', 'Independence/Republic Day', 'I Day assessment 2021', '', '2021-08-10'),
(2609, 'MSB/CB/B-82/IR Day', 'Independence/Republic Day', 'I day speech for AIG(Hqrs.) enclosure', '', '2021-06-23'),
(2610, 'MSB/CB/B-82/IR Day', 'Independence/Republic Day', 'I day threat assessment for entire state', '', '2021-08-06'),
(2611, 'MSB/CB/B-82/IR Day', 'Independence/Republic Day', 'REPLY FOR THREAT ASSESSMENT - INDEPENDENCE DAY, 2020', '', '2020-08-07'),
(2612, 'MSB/CB/B-82/IR Day', 'Independence/Republic Day', 'REPLY FOR THREAT ASSESSMENT - REPUBLIC DAY, 2021.docx', '', '2021-01-19'),
(2613, 'MSB/CB/B-82/IR Day', 'Independence/Republic Day', 'SP Aizawl threat assessment for I Day 2021', '', '2021-08-11'),
(2614, 'MSB/CB/B-85/Arms', 'Arms, Smuggling etc.', 'JH John Lalngunmanga', '', '2007-10-23'),
(2615, 'MSB/CB/B-85/Arms', 'Arms, Smuggling etc.', 'KAPKHENPAU', '', '2007-10-23'),
(2616, 'MSB/CB/B-85/Arms', 'Arms, Smuggling etc.', 'Khupkhanawla', '', '2007-10-23'),
(2617, 'MSB/CB/B-85/Arms', 'Arms, Smuggling etc.', 'Lalhlupuia', '', '2007-10-23'),
(2618, 'MSB/CB/B-85/Arms', 'Arms, Smuggling etc.', 'LALLIANA', '', '2009-09-04'),
(2619, 'MSB/CB/B-85/Arms', 'Arms, Smuggling etc.', 'LALMUANKIMA', '', '2007-10-23'),
(2620, 'MSB/CB/B-85/Arms', 'Arms, Smuggling etc.', 'LALRINCHHANA', '', '2009-09-04'),
(2621, 'MSB/CB/B-85/Arms', 'Arms, Smuggling etc.', 'Thangchina', '', '2007-10-23'),
(2622, 'MSB/CB/B-85/Arms', 'Arms, Smuggling etc.', 'Thangliana', '', '2007-10-23'),
(2623, 'MSB/CB/B-85/Arms', 'Arms, Smuggling etc.', 'UNKNOWN', '', '2007-10-23'),
(2624, 'MSB/CB/B-85/Arms', 'Arms, Smuggling etc.', 'Vanlalmawia', '', '2023-03-10'),
(2625, 'MSB/CB/B-85/Arms', 'Arms, Smuggling etc.', 'ammunition recovered by serchhip PS', '', '2021-04-19'),
(2626, 'MSB/CB/B-85/Arms', 'Arms, Smuggling etc.', 'Arms Seized- Huapzauva', '', '2020-09-30'),
(2627, 'MSB/CB/B-85/Arms', 'Arms, Smuggling etc.', '5 Myanmar Nationals all of Arakan Liberation Army (Insurgent groups of Myanmar) were apprehended', '', '2021-06-16'),
(2628, 'MSB/CB/B-85/Arms', 'Arms, Smuggling etc.', '5 Myanmar Nationals all of Arakan Liberation Army (Insurgent groups of Myanmar) were apprehended', '', '2021-06-16'),
(2629, 'MSB/CB/B-85/Arms', 'Arms, Smuggling etc.', 'SEIZURE OF ARMS & AMMUNITIONS IN CONNECTION WITH HUAPZAUVA', '', '2020-10-13'),
(2630, 'MSB/CB/B-85/Arms', 'Arms, Smuggling etc.', 'SEIZURE OF ARMS AND AMMUNITIONS', '', '2020-10-13'),
(2631, 'MSB/CB/B-85/Arms', 'Arms, Smuggling etc.', 'SEIZURE OF ARMS ROHMINGLIANA.docx', '', '2020-10-01'),
(2632, 'MSB/CB/B-85/Arms', 'Arms, Smuggling etc.', 'SEIZURE OF ARMS', '', '2020-09-08'),
(2633, 'MSB/CB/B-85/Arms', 'Arms, Smuggling etc.', 'The arrested accused Floyd Ramfangzauva and the alleged owner of the weapons Lallaizauva are close relatives (cousins).', '', '2020-09-08'),
(2634, 'MSB/CB/B-104', 'Zomi Revolutionary Army', 'REPORT ON THE ACTIVITIES OF ZOMI REVOLUTIONARY ARMY(ZRA) EASTERN COMMAND', '', '2021-12-20'),
(2635, 'MSB/CB/B-104', 'Zomi Revolutionary Army', 'ZOMI REVOLUTIONARY ARMY (ZRA) EASTERN COMMAND\r\nCHUNGCHANG REPORT', '', '2021-12-16'),
(2636, 'MSB/CB/B-104', 'Zomi Revolutionary Army', 'ACTIVITIES of ZRA, ALA etc (1)', '', '2021-06-24'),
(2637, 'MSB/CB/B-104', 'Zomi Revolutionary Army', 'ACTIVITIES of ZRA, ALA etc (2)', '', '2021-07-17'),
(2638, 'MSB/CB/B-104', 'Zomi Revolutionary Army', 'ACTIVITIES of ZRA, ALA etc', '', '2021-06-24'),
(2639, 'MSB/CB/B-104', 'Zomi Revolutionary Army', 'Zomi Revolutionary Army (ZRA)/Eastern Command (EC) activities', '', '2021-12-16'),
(2640, 'MSB/CB/B-144', 'Intelligence/Inputs received from other agencies/ ISIST', 'SO INPUT RECEIVED NO 4', '', '2021-09-20'),
(2641, 'MSB/CB/B-144', 'Intelligence/Inputs received from other agencies/ ISIST', 'WT message to all SP (Independent Day)', '', '2021-07-23'),
(2642, 'MSB/CB/B-170', 'IGP/DIG Concern file', 'Status/Feedback on Various Projects of National Police Mission.', '', '2021-09-07'),
(2643, 'MSB/CB/C-95', 'Chakma Affairs', 'MBBS - Court Case of Chakma Student Union of Mizoram - CHRONOLOGY OF EVENT or ISSUES RELATING TO MIZORAM (SELECTION OF CANDIDATES FOR HIGHER TECHNICAL COURSES ) RULES', '', '2020-10-26'),
(2644, 'MSB/CB/B-106', 'Profile of Criminals', 'Ã‚Â  Identification of Sensitive/Critical Polling Stations.', '', '2021-02-03'),
(2645, 'MSB/CB/B-106', 'Profile of Criminals', 'Identification of Sensitive/Critical Polling Stations.', '', '2021-02-04'),
(2646, 'MSB/CB/B-106', 'Profile of Criminals', 'AMC - 2015 VOTERS TURNOUT', '', '2021-02-17'),
(2647, 'MSB/CB/B-106', 'Profile of Criminals', 'AMC 2021 Result', '', '2021-02-18'),
(2648, 'MSB/CB/B-106', 'Profile of Criminals', 'AMC, 2021 Booth wise Votes', '', '2021-02-18'),
(2649, 'MSB/CB/B-106', 'Profile of Criminals', 'AIZAWL MUNICIPAL CORPORATION RESULT- 1', '', '2021-03-02'),
(2650, 'MSB/CB/B-106', 'Profile of Criminals', 'AIZAWL MUNICIPAL CORPORATION', '', '2021-02-03'),
(2651, 'MSB/CB/B-106', 'Profile of Criminals', 'AMC New', '', '2021-01-25'),
(2652, 'MSB/CB/53', 'UNION WAR BOOK', 'Preparation of Police War Instruction', '', '2022-02-03'),
(2653, 'MSB/CB/Covid-19/2020', 'COVID 19', 'COVID - 19 POSITIVE CASES IN MIZORAM', '', '2021-04-16'),
(2654, 'MSB/CB/Covid-19/2020', 'COVID 19', 'Fake COVID-19 Free Certificate - regarding.', '', '2021-02-24'),
(2655, 'MSB/CB/Covid-19/2020', 'COVID 19', 'Ã‚Â  Fake Covid-19 Free Certificate - regarding.', '', '2021-03-19'),
(2656, 'MSB/CB/Covid-19/2020', 'COVID 19', 'Fake COVID-19 Free Certificate - regarding.', '', '2021-03-15'),
(2657, 'MSB/CB/C-95', 'Chakma Affairs', 'BRIEF HIGHLIGHT OF THE EVENT OF CHAKMA ETHNIC ISSUE', '', '2020-10-26'),
(2658, 'MSB/CB/C-95', 'Chakma Affairs', 'CHAKMA ETHNIC ISSUE', '', '2020-10-26'),
(2659, 'MSB/CB/C-95', 'Chakma Affairs', 'CENTRAL YOUNG LAI ASSOCIATION (CYLA) ON CHAKMA CENSUS', '', '2019-07-16'),
(2661, 'MSB/CB/A-118', 'Correspondence on Reng/Bru refugees/Bru repatriation', 'BLFM SURRENDER TAWH TE LEH BRU REPATRIATE TUR LIST-A HMING IN ANG AWM TE\r\nMAMIT DISTRICT', '', '2019-06-28'),
(2662, 'MSB/CB/A-118', 'Correspondence on Reng/Bru refugees/Bru repatriation', 'BLFM SURRENDER TAWH TE LEH BRU REPATRIATE TUR LIST-A HMING AWM IN ANG TE\r\nLUNGLEI DISTRICT', '', '2019-06-28'),
(2663, 'MSB/CB/A-118', 'Correspondence on Reng/Bru refugees/Bru repatriation', 'BLFM SURRENDER TAWH TE LEH BRU REPATRIATE TUR LIST-A HMING AWM IN ANG TE\r\nKOLASIB DISTRICT', '', '2019-06-28'),
(2664, 'MSB/CB/A-118', 'Correspondence on Reng/Bru refugees/Bru repatriation', 'BLFM SURRENDER TAWH TE LEH BRU REPATRIATE TUR LIST-A HMING AWM IN ANG TE\r\nOUTSIDE MIZORAM', '', '2019-06-28'),
(2665, 'MSB/CB/A-118', 'Correspondence on Reng/Bru refugees/Bru repatriation', 'BLFM SURRENDER TAWH TE LEH BRU REPATRIATE TUR LIST-A HMING AWM IN ANG TE LAWNGTLAI DISTRICT', '', '2019-06-28'),
(2666, 'MSB/CB/A-118', 'Correspondence on Reng/Bru refugees/Bru repatriation', 'BLFM SURRENDER TAWH TE LEH BRU REPATRIATE TUR LIST-A HMING AWM IN ANG TE ADDITIONAL PAGE', '', '2019-06-28'),
(2667, 'MSB/CB/A-118', 'Correspondence on Reng/Bru refugees/Bru repatriation', 'BNLF SURRENDER TAWH TE LEH BRU REPATRIATE TUR LIST-A HMING AWM IN ANG TE', '', '2019-06-28'),
(2668, 'MSB/CB/A-1', 'DSI Corrrespondence', 'Forwarding of Hon\'ble Governor\'s directions', '', '2021-02-28'),
(2669, 'MSB/CB/A-118', 'Correspondence on Reng/Bru refugees/Bru repatriation', 'Forwarding on list of Bru families for 2nd Phase of Identification', '', '2019-06-28'),
(2670, 'MSB/CB/A-118', 'Correspondence on Reng/Bru refugees/Bru repatriation', 'BNLF SURRENDER TAWH TE LEH BRU REPATRIATE TUR LIST-A HMING AWM IN ANG TE', '', '2019-06-18'),
(2671, 'MSB/CB/A-118', 'Correspondence on Reng/Bru refugees/Bru repatriation', 'REPATRIATION OF BRU & Displaced Bru families who returned on their own  (self repatriated)', '', '2019-03-12'),
(2672, 'MSB/CB/A-118', 'Correspondence on Reng/Bru refugees/Bru repatriation', 'REPORT ON PERMANENT BRU RESETTLEMENT IN TRIPURA IN THE AFTERMATH OF AGREEMENT BETWEEN GOVERNMENT OF INDIA, GOVERNMENT OF TRIPURA, GOVERNMENT OF MIZORAM AND BRU REPRESENTATIVE ORGANISATIONS VIS-Ãƒâ‚¬-VIS PROTEST AND OBSTR', '', '2020-06-04'),
(2673, 'MSB/CB/A-118', 'Correspondence on Reng/Bru refugees/Bru repatriation', 'NO. OF Ã‚Â BRU Ã‚Â FAMILIES/MEMBERS Ã‚Â REPATRIATED Ã‚Â TO Ã‚Â MIZORAM Ã‚Â DURING 2010-2019', '', '2020-02-17'),
(2674, 'MSB/CB/A-118', 'Correspondence on Reng/Bru refugees/Bru repatriation', 'PROFORMA FOR MILITANT ORGANISATIONS', '', '2013-09-25'),
(2675, 'MSB/CB/A-118', 'Correspondence on Reng/Bru refugees/Bru repatriation', 'NO. OF Ã‚Â BRU Ã‚Â FAMILIES/MEMBERS Ã‚Â REPATRIATED Ã‚Â TO Ã‚Â MIZORAM Ã‚Â DURING 2010-2019', '', '2020-02-17'),
(2676, 'MSB/CB/A-118', 'Correspondence on Reng/Bru refugees/Bru repatriation', 'Mizoram Bru Returnees\' Peace Accords Implementing Demand Committee (MBRPAIDC)', '', '2023-03-21'),
(2677, 'MSB/CB/A-118', 'Correspondence on Reng/Bru refugees/Bru repatriation', 'issues concerning the state', '', '2021-10-27'),
(2678, 'MSB/CB/A-118', 'Correspondence on Reng/Bru refugees/Bru repatriation', 'COMMENTS ON MEMORANDUM/ PUBLIC CONSENSUS SUBMITTED BY REPRESENTATIVES OF REANG (BRU) MIGRANTS', '', '2015-09-02'),
(2679, 'MSB/CB/A-5', 'Indo-Myanmar Border Affairs(Intelligence)', 'REPORT ON RECENT INCIDENT ALONG INDO-MYANMAR BORDER', '', '2018-01-13'),
(2680, 'MSB/CB/A-118', 'Correspondence on Reng/Bru refugees/Bru repatriation', 'BRIEF NOTE ON THE ISSUES OF BRU REFUGEES', '', '2018-01-13'),
(2681, 'MSB/CB/A-118', 'Correspondence on Reng/Bru refugees/Bru repatriation', 'BRU VOTERS IN TRIPURA TRANSIT CAMPS AS ON 2.4.2019', '', '2019-04-03'),
(2682, 'MSB/CB/A-112', 'Conference of DGP/IGP/ADGP', 'Recommendations of the DGsP/IGsP Conference 2021', '', '2022-05-12'),
(2683, 'MSB/CB/A-1', 'DSI Corrrespondence', 'DGP Remarks', '', '2022-10-10'),
(2684, 'MSB/CB/A-5', 'Indo-Myanmar Border Affairs(Intelligence)', 'ORDER-Temporary suspension of Free Movement Regime (FMR) Ã¢â‚¬â€œ regarding', '', '2022-11-09'),
(2685, 'MSB/CB/A-5', 'Indo-Myanmar Border Affairs(Intelligence)', 'WRITE-UP ON FREE MOVEMENT REGIME (FMR) INSIDE MIZORAM ALONG INDO-MYANMAR BORDER', '', '2022-04-25'),
(2686, 'MSB/CB/A-5', 'Indo-Myanmar Border Affairs(Intelligence)', '27thÃ‚Â  Conference of DGsP/IGsP and Heads of CAPFS and CPOs in Ã‚Â Ã‚Â Ã‚Â Ã‚Â Ã‚Â Ã‚Â Ã‚Â Ã‚Â Ã‚Â Ã‚Â Ã‚Â Ã‚Â Ã‚Â Ã‚Â Ã‚Â Ã‚Â Ã‚Â Ã‚Â Ã‚Â Ã‚Â Ã‚Â Ã‚Â Ã‚Â Ã‚Â Ã‚Â Ã‚Â  the North East to be held at Agartala - reg.', '', '2023-02-08'),
(2687, 'MSB/CB/A-5', 'Indo-Myanmar Border Affairs(Intelligence)', 'AGENDA POINTS FOR THE FORTHCOMING NORTH EASTERN REGIONAL POLICE COORDINATION COMMITTEE (NERPCC) MEETING OF THE DsGP OF NORTH-EASTERN STATES PROPOSED TO BE HELD TENTATIVELY ON 3rd Week of March, 2022', '', '2023-02-08'),
(2688, 'MSB/CB/A-5', 'Indo-Myanmar Border Affairs(Intelligence)', 'Ã‚Â  Indo-Myanmar border Security in relation with current development in  Myanmar and impact/ Status of influx of Myanmar Nationals', '', '2023-02-08'),
(2689, 'MSB/CB/A-5', 'Indo-Myanmar Border Affairs(Intelligence)', 'INDO-MYANMAR/INDO-BANGLADESH BORDER SECURITY', '', '2023-02-08'),
(2690, 'MSB/CB/A-5', 'Indo-Myanmar Border Affairs(Intelligence)', 'Indo Myanmar and Indo-Bangladesh border security in relation with current development', '', '2023-02-08'),
(2691, 'MSB/CB/A-5', 'Indo-Myanmar Border Affairs(Intelligence)', 'Writeup notes on April 2022', '', '2023-02-08'),
(2692, 'MSB/CB/A-5(A)', 'ROHINGYA', 'Fake documents kumkum ahmed', '', '2022-01-28'),
(2693, 'MSB/CB/A-5(A)', 'ROHINGYA', 'SUSPECTED ROHINGYA ARRESTED AT CHAMPHAI', '', '2019-06-18'),
(2694, 'MSB/CB/A-5(R)', 'MYANMAR REFUGEE', 'MYANMARESE WOUNDED BY MYANMAR ARMY HOSPITALIZED IN MIZORAM (EBENEAR HOSPITAL, AIZAWL).Ã‚Â Ã‚Â Ã‚Â Ã‚Â Ã‚Â Ã‚Â ', '', '2022-02-18'),
(2695, 'MSB/CB/A-5(R)', 'MYANMAR REFUGEE', 'MYANMARESE WOUNDED BY MYANMAR ARMY HOSPITALIZED IN MIZORAM (TRINITY HOSPITAL, AIZAWL).Ã‚Â Ã‚Â Ã‚Â Ã‚Â Ã‚Â Ã‚Â ', '', '2022-02-18'),
(2696, 'MSB/CB/A-5(R)', 'MYANMAR REFUGEE', 'MYANMAR REFUGEE MAINBOOK', '', '2022-03-30'),
(2697, 'MSB/CB/A-5(R)', 'MYANMAR REFUGEE', 'REPORT ON INCIDENT AT BORDER AREASÃ‚Â Ã‚Â Ã‚Â Ã‚Â Ã‚Â Ã‚Â ', '', '2022-01-31'),
(2698, 'MSB/CB/A-5(R)', 'MYANMAR REFUGEE', '2nd Meeting of the High Level Committee on Myanmar Refugees.', '', '2022-02-15'),
(2699, 'MSB/CB/A-5(R)', 'MYANMAR REFUGEE', 'Report on Myanmar National who obtained Aadhar Card in Mizoram reg.(Inspr Maliana report)', '', '2022-08-10'),
(2700, 'MSB/CB/A-5(R)', 'MYANMAR REFUGEE', 'Myanmar nationals obtaining Aadhar Card by using documents issued by Churches in Mizoram - reg.', '', '2022-08-12'),
(2701, 'MSB/CB/A-5(R)', 'MYANMAR REFUGEE', 'Enquiry on Myanmar Nationals who obtained Aadhar Card in Mizoram - reg.', '', '2022-07-28'),
(2704, 'MSB/CB/A-118', 'Correspondence on Reng/Bru refugees/Bru repatriation', 'ACTIVITIES OF BRU NGOs (wef 1st January, 2019 till date)', '', '2019-03-25'),
(2705, 'MSB/CB/A-118', 'Correspondence on Reng/Bru refugees/Bru repatriation', 'BRIEF NOTE ON THE ISSUES OF BRU REFUGEES &REPATRIATION PROCESS', '', '2019-03-29'),
(2706, 'MSB/CB/A-10', 'Kidnapping/Abduction', 'Joint interrogation statement in c/w Lawngtlai PS C/No.73 dt.8.11.2022 u/s 364A IPC r/w 27 Arms Act', '', '2022-11-15'),
(2707, 'MSB/CB/A-118', 'Correspondence on Reng/Bru refugees/Bru repatriation', 'LOK SABHA MP ELECTIONS BOYCOTTED BY NGOCC', '', '2019-08-16'),
(2708, 'MSB/CB/A-118', 'Correspondence on Reng/Bru refugees/Bru repatriation', 'LOK SABHA MP ELECTIONS BOYCOTTED BY NGOCC', '', '2019-08-16'),
(2709, 'MSB/CB/A-118', 'Correspondence on Reng/Bru refugees/Bru repatriation', 'LOK SABHA MP ELECTIONS BOYCOTTED BY NGOCC', '', '2019-08-16'),
(2710, 'MSB/CB/A-10', 'Kidnapping/Abduction', 'Joint interrogation statement in c/w Lawngtlai PS C/No.73 dt.8.11.2022 u/s 364A IPC r/w 27 Arms Act', '', '2022-11-15'),
(2711, 'MSB/CB/A-13', 'Law and Order', 'All SO Social Media Platform', '', '2022-02-15'),
(2712, 'MSB/CB/A-10', 'Kidnapping/Abduction', 'IOC Ltd - Reg. (THREAT PERCEPTION IN CONNECTION WITH A STRIKE TO BE ORGANISED ON 28TH & 29TH MARCH,2022)', '', '2022-03-25'),
(2714, 'MSB/CB/A-118', 'Correspondence on Reng/Bru refugees/Bru repatriation', 'BRU MILITANCY', '', '2023-03-22'),
(2715, 'MSB/CB/A-20(A)', 'Explosive recoveries/Bomb Explosion (Monthly Return)', 'Bomb Enquiry', '', '2022-03-25'),
(2716, 'MSB/CB/A-118', 'Correspondence on Reng/Bru refugees/Bru repatriation', 'BRU REFUGEES / BRU REPATRIATION', '', '2018-09-14'),
(2717, 'MSB/CB/A-20(A)', 'Explosive recoveries/Bomb Explosion (Monthly Return)', 'Action taken report Bomb blast at Durtlang Mual veng, Aizawl', '', '2022-03-21'),
(2718, 'MSB/CB/B-4', 'Mizoram-Cachar Border Dispute/Boundary Committee/Boundary incidents', 'SEQUENCE OF INCIDENT AT ZOPHAI NEAR BAIRABI (ACTIVITIES OF MZP) AT MIZORAM-ASSAM BORDER', '', '2018-04-11'),
(2719, 'MSB/CB/A-20(A)', 'Explosive recoveries/Bomb Explosion (Monthly Return)', 'Comments.(explosion incident Ã‚Â at an automobile Workshop on 18.03.2022)', '', '2022-03-30'),
(2720, 'MSB/CB/B-4', 'Mizoram-Cachar Border Dispute/Boundary Committee/Boundary incidents', 'INCIDENT AT ZOPHAI NEAR BAIRABI AT MIZORAM-ASSAM BORDER', '', '2018-09-15'),
(2721, 'MSB/CB/B-4', 'Mizoram-Cachar Border Dispute/Boundary Committee/Boundary incidents', 'INCIDENT AT ZOPHAI NEAR BAIRABI AT MIZORAM-ASSAM BORDER5.9.2018', '', '2019-09-05'),
(2722, 'MSB/CB/A-20(A)', 'Explosive recoveries/Bomb Explosion (Monthly Return)', 'Request to verify the news -Ã‚Â  regarding.(REPORT ON SEIZURE OF EXPLOSIVES)', '', '2022-03-24'),
(2723, 'MSB/CB/B-4', 'Mizoram-Cachar Border Dispute/Boundary Committee/Boundary incidents', 'BORDER ISSUE', '', '2018-09-06'),
(2724, 'MSB/CB/A-41', 'Indo Bangladesh Affairs', 'BORDER ISSUE', '', '2018-09-06'),
(2725, 'MSB/CB/A-5', 'Indo-Myanmar Border Affairs(Intelligence)', 'BORDER ISSUE\r\nMizoram is having approximately 404 kms. and 318 kms. porous international borders with Myanmar and Bangladesh respectively. It has boundary of 123 kms with Assam, 66 Kms with Tripura and 95 Kms with Manipu', '', '2018-09-06'),
(2726, 'MSB/CB/B-4', 'Mizoram-Cachar Border Dispute/Boundary Committee/Boundary incidents', 'NATIONAL REGISTER OF CITIZENS (NRC)', '', '2018-09-05'),
(2727, 'MSB/CB/B-26/HPC(D)', 'Correspondence on HPC(D) B-114', 'HMAR PEOPLES CONVENTION (DEMOCRATIC) [HPC(D)]', '', '2018-03-14'),
(2728, 'MSB/CB/B-26/HPC(D)', 'Correspondence on HPC(D) B-114', 'HMAR PEOPLES CONVENTION (DEMOCRATIC) [HPC(D)]', '', '2018-03-14'),
(2729, 'MSB/CB/B-26/HPC(D)', 'Correspondence on HPC(D) B-114', 'PEACE DIALOGUE BETWEEN GOVT. OF MIZORAM AND HPC(D)', '', '2018-09-15'),
(2730, 'MSB/CB/A-5(A)', 'ROHINGYA', 'W/T MESSAGE For  ALL SO CID(SB), FAKE INDIAN DOCUMENTS', '', '2022-01-28'),
(2731, 'MSB/CB/B-4', 'Mizoram-Cachar Border Dispute/Boundary Committee/Boundary incidents', 'BORDER ISSUES WITH ASSAM', '', '2021-08-24'),
(2732, 'MSB/CB/B-4', 'Mizoram-Cachar Border Dispute/Boundary Committee/Boundary incidents', 'BORDER ISSUES WITH ASSAM', '', '2022-02-07'),
(2733, 'MSB/CB/B-4', 'Mizoram-Cachar Border Dispute/Boundary Committee/Boundary incidents', 'REPORT ON ARREST OF JACOB HRANGKHAWL, PRESIDENT NATIONAL LIBERATION FRONT OF TRIPURA (NLFT', '', '2022-07-11'),
(2734, 'MSB/CB/B-5/NLFT', 'National Liberation Front of Tripura', 'REPORT ON ARREST OF JACOB HRANGKHAWL, PRESIDENT NATIONAL LIBERATION FRONT OF TRIPURA (NLFT)', '', '2022-07-11'),
(2735, 'MSB/CB/B-14(B) KCNA/KNA', 'KCNA/KNA Bangladesh', 'DETAIL REPORT ON KNA/AA CONFLICT', '', '2022-07-11'),
(2736, 'MSB/CB/B-14(B) KCNA/KNA', 'KCNA/KNA Bangladesh', 'Leaked-out signing of secret agreement between Bangladesh government army - RAB and Arakan Army (AA) for joint military operation against Kuki-Chin National Front (KNF) -', '', '2022-11-22'),
(2737, 'MSB/CB/B-15', 'Insurgency in North East India', 'Details of Insurgent groups operating in Mizoram.Ã‚Â ', '', '2022-07-13'),
(2738, 'MSB/CB/B-15', 'Insurgency in North East India', 'REPORT ON INTENDED CONSTRUCTION OF SHIV MANDIR AT THAIDAWR TLANG, MIZORAM-TRIPURA BORDER:', '', '2022-07-09'),
(2739, 'MSB/CB/B-26/HPC(D)', 'Correspondence on HPC(D) B-114', 'HMAR PEOPLES CONVENTION (HPC) & HMAR PEOPLES CONVENTION (DEMOCRATIC) [HPC(D)]', '', '2018-09-16'),
(2740, 'MSB/CB/B-16/BOR', 'Mizoram-Tripura Border Affairs/Manipur Border Affairs', 'REPORT ON INFRASTRUCTURE DEVELOPMENT PROJECT UNDERTAKEN BY TRIPURA TOURISM DEPARTMENT AT THAIDAWR TLANG, PHULDUNGSEI MIZORAM', '', '2022-05-05'),
(2741, 'MSB/CB/B-4', 'Mizoram-Cachar Border Dispute/Boundary Committee/Boundary incidents', 'BORDER ISSUES WITH ASSAM', '', '2018-09-16'),
(2742, 'MSB/CB/B-19(A)', 'Security Threat Perception', 'No.E/PHQ/SEC/1/210Ã‚Â  Ã‚Â Dt. 19.07.2022.', '', '2022-07-26'),
(2743, 'MSB/CB/B-19(A)', 'Security Threat Perception', 'IN CONNECTION WITH THE PROPOSED G-20 MEETINGS TO BE HELD ON 31.1.2023 AND 2.2.2023 AT CHENNAI', '', '2022-12-30'),
(2744, 'MSB/CB/B-19(A)', 'Security Threat Perception', 'Assessment of threat perception. Pu K.ZoramthangaÃ‚Â  who was alleged to be responsible in connection with the death of Capt. Lalhleia in the year 1975', '', '2022-08-18'),
(2745, 'MSB/CB/B-19(A)', 'Security Threat Perception', 'threat perception assessment in respect ofÃ‚Â  Pu Lalrinenga Sailo, Mayor, Aizawl Municipal Corporation', '', '2022-02-09'),
(2746, 'MSB/CB/B-19(A)', 'Security Threat Perception', 'Assessment of Security threat perception Pu Lalrinsanga Ralte, MLA, Vice Chairman, Rubber & Allied Corps Development Board,', '', '2022-02-18'),
(2747, 'MSB/CB/B-19(A)', 'Security Threat Perception', 'No.E/PHQ/SEC/1/205Ã‚Â  Dt.15.7.2022.', '', '2022-07-22'),
(2748, 'MSB/CB/B-19(A)', 'Security Threat Perception', 'Assessment of Threat perception Pu Vanlalenmawia, Special Judge (Prevention of Corruption Act)', '', '2022-01-05'),
(2749, 'MSB/CB/A-118', 'Correspondence on Reng/Bru refugees/Bru repatriation', 'STATISTICS OF REPATRIATION OF BRU 1st to 6th Batch', '', '2018-08-07'),
(2750, 'MSB/CB/A-118', 'Correspondence on Reng/Bru refugees/Bru repatriation', 'REPATRIATION OF DISPLACED BRUSÃ¢â‚¬â„¢ VIS A VIS MBDPF ACTIVITIES', '', '2018-01-13'),
(2751, 'MSB/CB/B-19(A)', 'Security Threat Perception', 'PU JAMES LALRINCHHANA PERSONAL SECURITY OFFICER (PSO) PEK BELH TUR A DILNA', '', '2022-07-21'),
(2752, 'MSB/CB/A-118', 'Correspondence on Reng/Bru refugees/Bru repatriation', 'BRU REFUGEES', '', '2018-09-18'),
(2753, 'MSB/CB/B-19(A)', 'Security Threat Perception', 'PU HC LALMALSAWMA ZASAI, DY. CHIEF EXECUTIVE MEMBER, MADCÃ‚Â   PERSONAL SECURITY OFFICER (PSO) PE TUR A DILNA', '', '2022-07-20'),
(2755, 'MSB/CB/B-19(A)', 'Security Threat Perception', 'MARA AUTONOMOUS DISTRICT COUNCIL CHAIRMANÃ‚Â  NI LAI Ã‚Â IN PERSONAL SECURITY OFFICER (PSO) PE TUR A DILNA', '', '2022-07-22'),
(2756, 'MSB/CB/B-19(A)', 'Security Threat Perception', 'No. CB/PHQ/C/204/2022(Loose)/7 Ã‚Â Ã‚Â Ã‚Â Ã‚Â Ã‚Â Ã‚Â Dt. 2nd December, 2022 Sri Shankar Bharati Swamiji', '', '2022-12-20'),
(2757, 'MSB/CB/B-19(A)', 'Security Threat Perception', 'Assessment of threat perception Sri Shankara Bharati Swamiji', '', '2022-12-06'),
(2758, 'MSB/CB/A-118', 'Correspondence on Reng/Bru refugees/Bru repatriation', 'DATE AND TIME OF BRU REPATRIATION', '', '2018-10-03'),
(2759, 'MSB/CB/B-19(A)', 'Security Threat Perception', 'Threat Perception Report. Pu Vanlalenmawia, Special Judge (Prevention of Corruption Act, 1988).', '', '2022-01-07'),
(2760, 'MSB/CB/B-19(A)', 'Security Threat Perception', 'Assessment of Threat perception Pu K.Zoramthanga', '', '2022-08-25'),
(2761, 'MSB/CB/B-19(A)', 'Security Threat Perception', 'List of categorized protecteesÃ‚Â  - regarding', '', '2022-12-28'),
(2762, 'MSB/CB/B-19', 'Categorisation of Protected Persons in the State of Mizoram and others', 'Intelligence, VVIP/VIP Security - Contact numbers and address of officers.', '', '2023-03-22'),
(2763, 'MSB/CB/B-19', 'Categorisation of Protected Persons in the State of Mizoram and others', 'MESSAGE NO. SBS / SBN-3 / SEC-01/2022 DATE 16.04.2022 OFFICERS OF THE RANK OF SP/DCP AND ABOVE', '', '2022-04-20'),
(2764, 'MSB/CB/C-210', 'Right to Information Act (RTI)', 'No.CB/PHQ/Meeting/Misc/2021/58 Dt. 2.3.2022  Meeting of the Task Group on Implementation of Agreement made by Central Government- Reg.', '', '2022-03-03'),
(2765, 'MSB/CB/B-26/HPC(D)', 'Correspondence on HPC(D) B-114', 'HPC List', '', '2022-03-02'),
(2766, 'MSB/CB/B-26/HPC(D)', 'Correspondence on HPC(D) B-114', 'List of HPC(D) Cadres, who received Rehabilitation Package', '', '2022-03-02'),
(2767, 'MSB/CB/B-26/HPC(D)', 'Correspondence on HPC(D) B-114', 'PAYMENT & RECEIPT OF ADVANCE REHABILITATION PACKAGE(Rs. 20,000/-)', '', '2018-04-06'),
(2768, 'MSB/CB/A-76(A)', 'PCJSS/Santi Bahini', 'IsG BSF-REGION COMDRS BGB LEVEL BORDER COORDINATION CONFERENCE HELD FROM 30 MAY TO 02 JUNE 2022.', '', '2022-08-02'),
(2769, 'A-3', 'Sinlung Hills Development Council SHDC', 'IG BSF-REGION COMMANDERS BGB LEVEL BORDER CO-ORDINATION CONFERENCE HELD FROM 27-29 NOV\'2021 AT SHILLONGÃ‚Â  - VERIFICATION THEREOF.', '', '2022-01-24'),
(2770, 'A-3', 'Sinlung Hills Development Council SHDC', 'Bangladshi miscrient and insurgent camp (SO LLI/TLB/LTI/CTE)', '', '2022-08-02'),
(2771, 'A-3', 'Sinlung Hills Development Council SHDC', 'Bangladesh miscreants and insurgent camps Ã‚Â - Regarding', '', '2022-08-23'),
(2772, 'A-3', 'Sinlung Hills Development Council SHDC', 'Request to provide Data.(seizure ofÃ‚Â  Rohingya, drugs, narcotics and psychotropic substances.)', '', '2022-07-08'),
(2773, 'A-3', 'Sinlung Hills Development Council SHDC', 'SO Lli, Tlb,Lti,Cte -Bangladeshi insurgent camp and miscrient.docx', '', '2022-01-14'),
(2774, 'A-3', 'Sinlung Hills Development Council SHDC', 'Veracity Report of BGB Booklet.', '', '2022-09-12'),
(2775, 'MSB/CB/A-41', 'Indo Bangladesh Affairs', 'Data for Ops Presentation.', '', '2022-01-20'),
(2776, 'MSB/CB/A-59', 'Arakan Army', 'Leaked-out signing of secret agreement between Bangladesh government army - RAB and Arakan Army (AA) for joint military operation against Kuki-Chin National Front (KNF)', '', '2022-11-21'),
(2777, 'MSB/CB/A-84', 'Achievements of CID(SB)', 'REPORT ON ACTIVITIES OF ZOMI REVOLUTIONARY ARMY (ZRA), ARAKAN LIBERATION ARMY (ALA) / ARAKAN LIBERATION PARTY (ALP) AND REPORT ON SEIZURE OF EXPLOSIVE SUBSTANCES AT FARKAWN, CHAMPHAI DISTRICT.', '', '2021-06-24'),
(2778, 'MSB/CB/A-84', 'Achievements of CID(SB)', 'CONFIDENTIAL REPORT ON NLFT (PD) ACTIVITIES', '', '2021-05-21'),
(2779, 'MSB/CB/A-84', 'Achievements of CID(SB)', 'Detail Report In Connection with Seizure of Arms & Ammunitions by BSF', '', '2019-12-27'),
(2780, 'MSB/CB/A-84', 'Achievements of CID(SB)', 'Detail Report in Connection With Seizure of Arms & Ammunitions by BSF', '', '2019-12-25'),
(2781, 'MSB/CB/A-84', 'Achievements of CID(SB)', 'REPORT ON SEIZURE OFÃ‚Â EXPLOSIVES', '', '2022-01-22'),
(2782, 'MSB/CB/A-84', 'Achievements of CID(SB)', 'REPORT ON ALLEGED SETTING UP OF CAMP(S) BY ARAKAN ARMY (AA) INSIDE MIZORAM', '', '2020-12-27'),
(2783, 'MSB/CB/A-84', 'Achievements of CID(SB)', 'REPORT ON SEEKING OF ASYLUM BY CHIN NATIONAL ARMY (CNA) DUE TO MILITARY COUP IN MYANMAR', '', '2021-02-11'),
(2784, 'MSB/CB/A-84', 'Achievements of CID(SB)', 'REPORT ON INTENDED CONSTRUCTION OF SHIV MANDIR AT THAIDAWR TLANG, MIZORAM-TRIPURA BORDER', '', '2022-07-09'),
(2785, 'MSB/CB/A-84', 'Achievements of CID(SB)', 'REPORT ON INCIDENT AT BORDER AREASÃ‚Â Ã‚Â ', '', '2022-01-31'),
(2786, 'MSB/CB/A-84', 'Achievements of CID(SB)', 'REPORT ON INFRASTRUCTURE DEVELOPMENT PROJECT UNDERTAKEN BY TRIPURA TOURISM DEPARTMENT AT THAIDAWR TLANG, PHULDUNGSEI MIZORAM', '', '2022-05-05'),
(2787, 'MSB/CB/A-84', 'Achievements of CID(SB)', 'SPECIAL REPORT', '', '2022-02-25'),
(2788, 'MSB/CB/A-84', 'Achievements of CID(SB)', 'SPECIAL REPORT', '', '2022-01-10'),
(2789, 'MSB/CB/A-84', 'Achievements of CID(SB)', 'SPECIAL REPORT', '', '2022-01-19'),
(2790, 'MSB/CB/A-84', 'Achievements of CID(SB)', 'SPECIAL REPORT', '', '2022-03-02'),
(2791, 'MSB/CB/A-84', 'Achievements of CID(SB)', 'SPECIAL REPORT', '', '2022-03-11'),
(2792, 'MSB/CB/A-84', 'Achievements of CID(SB)', 'SPECIAL REPORT Arrest of 6 (six) KNF Cadres by the BSF', '', '2022-03-25'),
(2793, 'MSB/CB/A-84', 'Achievements of CID(SB)', 'SPECIAL REPORT', '', '2022-05-29'),
(2794, 'MSB/CB/A-84', 'Achievements of CID(SB)', 'President of India\'s Police Colour- reg(Ã‚Â ACHIEVEMENT OF CID (SB) FOR THE LAST 50 (FIFTY) YEARS)', '', '2022-03-17'),
(2795, 'MSB/CB/A-84', 'Achievements of CID(SB)', 'Achievements of Ã‚Â CID(SB) during the year 2021 (1st Jan. 2021 -17th Jan. 2022)', '', '2022-01-17'),
(2797, 'MSB/CB/A-84', 'Achievements of CID(SB)', 'ACHIEVEMENT OF CID(SB) 2022', '', '2022-11-15'),
(2798, 'MSB/CB/A-84', 'Achievements of CID(SB)', 'Ã‚Â ACHIEVEMENT OF CID (SB) FOR THE LAST 50 (FIFTY) YEARS', '', '2022-03-17'),
(2799, 'MSB/CB/A-84', 'Achievements of CID(SB)', 'ACHIEVEMENT MAIN BOOK', '', '2022-11-29'),
(2800, 'MSB/CB/A-88', 'Restructuring and strengthening of State Unit', 'ENGAGEMENT CARD FOR SPECIAL POLICE OFFICER (M.R)', '', '2022-07-22'),
(2801, 'MSB/CB/A-88', 'Restructuring and strengthening of State Unit', 'Renewal permission for engagement of 15 (fifteen) nos. of Special Police Officers.', '', '2022-12-02'),
(2802, 'MSB/CB/A-88', 'Restructuring and strengthening of State Unit', 'Renewal permission for engagement of 15 (fifteen) nos. of Special Police Ã‚Â  Officers.', '', '2022-02-18'),
(2803, 'MSB/CB/A-90', 'National Foundation for Communal Harmony', 'SIX MONTHLY REPORTS ON POSTING OF MUSLIM PERSONNEL IN THANAS\r\nIN THE STATE/UT', '', '2022-01-21'),
(2804, 'MSB/CB/A-90', 'National Foundation for Communal Harmony', 'Six monthly reports for the period ending December, 2021 on implementation of the recommendation contained in Sachar Committee Report involving posting of Muslim Police personnel in thanas in the State.', '', '2022-01-21'),
(2805, 'MSB/CB/A-90', 'National Foundation for Communal Harmony', 'HALF YEARLY (Muslim)', '', '2022-01-21'),
(2806, 'MSB/CB/A-90', 'National Foundation for Communal Harmony', 'POSTING OF MUSLIM PERSONNEL IN POLICE STATIONS', '', '2022-07-04'),
(2807, 'MSB/CB/A-90', 'National Foundation for Communal Harmony', 'Six monthly reports for the period ending June, 2022 on implementation of the recommendation contained in Sachar Committee Report involving posting of Muslim Police personnel in thanas in the State.', '', '2022-07-15'),
(2808, 'MSB/CB/A-112', 'Conference of DGP/IGP/ADGP', 'Recommendation of DGsP/IGsP conference 2021 - reg. SMAC', '', '2023-02-08'),
(2809, 'MSB/CB/A-112', 'Conference of DGP/IGP/ADGP', 'Recommendation No.3 of DGsP/IGsP Conference-2021 regarding avenues to use Drone Technology for effective policing and helping citizens in delivery of Services - reg.', '', '2022-09-30'),
(2810, 'MSB/CB/A-112', 'Conference of DGP/IGP/ADGP', '27th Ã‚Â Conference of DGsP/IGsP and Heads of CAPFS and CPOs in  the North East to be held at Agartala - reg.', '', '2022-10-17'),
(2811, 'MSB/CB/A-112', 'Conference of DGP/IGP/ADGP', 'Agenda Items for the forthcoming North-Eastern Regional Police Coordination Committee (NERPCC).', '', '2022-03-07'),
(2812, 'MSB/CB/A-112', 'Conference of DGP/IGP/ADGP', 'Meeting Chaired by the Hon\'ble Union Home Minister on 24th Ã‚Â July, 2021 at Shillong, Meghalaya - regarding', '', '2021-11-02'),
(2813, 'MSB/CB/A-112', 'Conference of DGP/IGP/ADGP', 'Recommendations of the DGsP/IGsP Conference 2021', '', '2022-05-12'),
(2814, 'MSB/CB/A-120', 'Declaration/proposal for unlawful activities of militant', 'Report in connection with PFI.', '', '2022-11-01'),
(2815, 'MSB/CB/B-26/HPC(D)', 'Correspondence on HPC(D)', 'Write-up on HPC(D) - to AIG-II on HMAR PEOPLES CONVENTION (DEMOCRATIC) [HPC(D)]', '', '2018-06-26'),
(2816, 'MSB/CB/B-26(B)', 'HPC(D)  Lalhmingthanga Sanate faction', 'SPECIAL REPORT Dated: 10th January, 2022', '', '2022-01-10'),
(2817, 'MSB/CB/B-26(B)', 'HPC(D)  Lalhmingthanga Sanate faction', 'SAIPHAIÃ‚Â  AREA CHHUNGA HPCD/MBDA INCHHAL TE CHET DAN LEH POLICE TEN AN MAN DAN CHUNGCHANG', '', '2022-01-31'),
(2818, 'MSB/CB/B-59/Visit', 'VVIP Visit to Mizoram', 'visit of Hon\'ble Vice President of India to Mizoram on 9th Ã¢â‚¬â€œ 11thÃ‚Â  March, 2022', '', '2022-03-07'),
(2819, 'MSB/CB/B-59/Visit', 'VVIP Visit to Mizoram', 'THE HON\'BLE VICE PRESIDENT OF INDIA IS SCHEDULED TO VISIT MIZORAM AIZAWL ON 9th Ã¢â‚¬â€œ 11th MARCH, 2022', '', '2022-03-07'),
(2820, 'MSB/CB/B-26(B)', 'HPC(D)  Lalhmingthanga Sanate faction', 'REPORT ON MIZORAM BORDER DEFENCE ARMY(MBDA)', '', '2022-02-03'),
(2821, 'MSB/CB/B-26(B)', 'HPC(D)  Lalhmingthanga Sanate faction', 'REPORT ON MIZORAM BORDER DEFENCE ARMY(MBDA)', '', '2022-02-02'),
(2822, 'MSB/CB/A-90 (A)', 'Quarterly return', 'PERIOD OF REPORT/QUARTER ENDING: DECEMBER, 2021', '', '2022-01-10'),
(2823, 'MSB/CB/A-90', 'National Foundation for Communal Harmony', 'Quarterly reports on implementation of revised Communal Harmony Guidelines for the period ending December, 2021.', '', '2022-01-01'),
(2824, 'MSB/CB/B-26(B)', 'HPC(D)  Lalhmingthanga Sanate faction', 'REPORT ON MIZORAM BORDER DEFENCE ARMY(MBDA)', '', '2022-12-09'),
(2825, 'MSB/CB/A-90', 'National Foundation for Communal Harmony', 'PERIOD OF REPORT/QUARTER ENDING: DECEMBER, 2021', '', '2022-01-01'),
(2826, 'MSB/CB/B-26(B)', 'HPC(D)  Lalhmingthanga Sanate faction', 'DRAFT REPORT ON MIZORAM BORDER DEFENCE ARMY(MBDA) TO BE SENT TO ASSAM POLICE', '', '2022-02-02'),
(2827, 'MSB/CB/B-59/Visit', 'VVIP Visit to Mizoram', 'O R D E R Hon\'ble Vice President of India to Mizoram on 9th Ã¢â‚¬â€œ 11thÃ‚Â  March, 2022', '', '2022-03-07'),
(2828, 'MSB/CB/B-59(A)', 'President visit to Mizoram', 'W.T.Ã‚Â  MESSAGE PRESIDENT OF INDIA CHUAN NI 5th - 6th MAY, 2022 NI HIAN AIZAWL, MIZORAM A RAWN TLAWH DAWN', '', '2022-04-28'),
(2829, 'MSB/CB/B-26(B)', 'HPC(D)  Lalhmingthanga Sanate faction', 'LALHMINGTHANGA SANATE\'S FACTION OF HPC(D)', '', '2020-05-08'),
(2830, 'MSB/CB/B-59(A)', 'President visit to Mizoram', 'Assessment of Threat perception. in view of the visit of Hon\'ble President Droupadi Murmu scheduled during 3rd to 4th November 2022', '', '2022-11-01'),
(2831, 'MSB/CB/B-59(A)', 'President visit to Mizoram', 'Security threat perception. security threat perception of Hon\'ble President of India Smt.Droupadi Murmu visit to Mizoram', '', '2022-11-01'),
(2832, 'MSB/CB/B-26/HPC(D)', 'Correspondence on HPC(D)', 'HISTORY OF HMAR PEOPLES CONVENTION (DEMOCRATIC)', '', '2022-12-21'),
(2833, 'MSB/CB/B-59(A)', 'President visit to Mizoram', 'ASSESSMENT OF THREAT PERCEPTION IN CONNECTION WITH HON\'BLE PRESIDENT OF INDIA VISIT TO MIZORAM', '', '2022-05-12'),
(2834, 'MSB/CB/B-26(B)', 'HPC(D)  Lalhmingthanga Sanate faction', 'HISTORY OF HMAR PEOPLES CONVENTION (DEMOCRATIC)', '', '2022-12-21'),
(2835, 'MSB/CB/SR/', 'Special Report', 'Special Report NGO Coordination Committee (NGOCC) meeting was held today, i.e. 1.4.2019 @ 11:00 a.m at CYMA Office', '', '2019-04-01'),
(2836, 'MSB/CB/SR/', 'Special Report', 'Continuation of Special Report  dated 1.4.2019.', '', '2019-04-01'),
(2837, 'MSB/CB/SR/', 'Special Report', 'Continuation of Special Report No.MSB/CB/SR/2019/226 dated 1.4.2019.', '', '2019-04-02'),
(2838, 'MSB/CB/SR/', 'Special Report', 'Reference to our Special Report No.MSB/CB/SR/2019/225 dated 1.4.2019.', '', '2019-04-02'),
(2839, 'MSB/CB/SR/', 'Special Report', 'Special Report No. MSB/CB/SR/2019/207 dated 25.3.2019.', '', '2019-04-03'),
(2840, 'MSB/CB/SR/', 'Special Report', 'Continuation of  Special Report No.MSB/CB/SR/2019/229 dated 2.4.2019.', '', '2019-04-03'),
(2841, 'MSB/CB/SR/', 'Special Report', 'Continuation of  Special Report No.MSB/CB/SR/2019/234 dated 3.4.2019.', '', '2019-04-04'),
(2842, 'MSB/CB/SR/', 'Special Report', 'SPECIAL REPORT (Incident of assault on one Pu Lalhmingmawia, resident of Phaisen at Dolchhora, Assam on 7.4.2019 @ 4:00 p.m)', '', '2019-04-08'),
(2843, 'MSB/CB/SR/', 'Special Report', 'Ã¢â‚¬ËœSerhmun Relocation CommitteeÃ¢â‚¬â„¢ (SRC) had a meeting on 7.4.2019 @ 8:00 p.m', '', '2019-04-08'),
(2844, 'MSB/CB/SR/', 'Special Report', '25 Assam Rifles have apprehended  11 (eleven) members of splinter group of HPC-D', '', '2019-04-11'),
(2845, 'MSB/CB/SR/', 'Special Report', 'Election to 17th Lok Sabha and Bye-election to 15-Aizawl West-I Constituency started on. 11.4.2019 @ 7:00 a.m', '', '2019-04-11'),
(2846, 'MSB/CB/SR/', 'Special Report', 'Pi Vanlalchami, Senior Civil Judge-I had issued an order Memo No. 250/SR.CJ-I(A)/2019 dated 05.04.2019 for eviction of 11 families', '', '2019-04-24'),
(2847, 'MSB/CB/SR/', 'Special Report', 'Recovered 1.092 Kgs. of suspected Heroin No.4 contained in 78 (seventy eight) soap cases.', '', '2019-08-22'),
(2848, 'MSB/CB/SR/', 'Special Report', '3 (three) unidentified armed personnel were sighted at Chamdurtlang, Lawngtlai District on. 23.8.2019 @ 3:30 p.m', '', '2019-08-24'),
(2849, 'MSB/CB/SR/', 'Special Report', 'DC to DC Meeting was held between DC Kolasib and DC Hailakandi on. 26.8.2019', '', '2019-08-26'),
(2850, 'MSB/CB/SR/', 'Special Report', 'Lai Students Association (LSA) and StudentsÃ¢â‚¬â„¢ Union of Govt. Lawngtlai College continued their agitationon 4.12.2019', '', '2019-12-04'),
(2851, 'MSB/CB/SR/', 'Special Report', 'Continuation of SR No. 879 dated 4th December, 2019, Lai Students Association (LSA) and StudentsÃ¢â‚¬â„¢ Union of Govt. Lawngtlai College continue their agitation on 5.12.2019', '', '2019-12-05'),
(2852, 'MSB/CB/SR/', 'Special Report', 'North East Students\' Organization (NESO), the umbrella organization of different Students Unions of the region, held a meeting on 6.12.2019 at Guwahati', '', '2019-12-07'),
(2853, 'MSB/CB/SR/', 'Special Report', 'MZP Gen. Hqrs. Emergency Executive Meeting held on 7.12.2019 wherein they have decided to organise total bandh on 10.12.2019 in protest against CAB-2019', '', '2019-12-09'),
(2854, 'MSB/CB/SR/', 'Special Report', 'Continuation of our Special Report dated 9.12.2019. MZP Gen. Hqrs. organised Total Bandh', '', '2019-12-10'),
(2855, 'MSB/CB/SR/', 'Special Report', 'Mizo Zirlai Pawl (MZP) Gen. Hqrs.,  annual closing of their office', '', '2019-12-12'),
(2856, 'MSB/CB/SR/', 'Special Report', 'Objections of the alleged illegal villages, which are mainly inhabited by Chakmas, among the localities in Tlabung area', '', '2019-12-12'),
(2857, 'MSB/CB/SR/', 'Special Report', 'Earlier on 13.12.2019 @ 1:00 a.m there was a blast inside the fencing of Aizawl Centenary Monument near Raj Bhavan, Aizawl.', '', '2019-12-13'),
(2858, 'MSB/CB/SR/', 'Special Report', 'Emergency Joint meeting was held on. 28.12.2019 @ 11:00 a.m. at MZP Conference Hall', '', '2019-12-28'),
(2859, 'MSB/CB/A-132', 'Terrorist related matters', 'Confessional Statements of accused in terror - reg.', '', '2022-04-20'),
(2860, 'MSB/CB/A-132', 'Terrorist related matters', 'Regional Security Strategies Conference - 2022 for NE.', '', '2022-04-22'),
(2861, 'MSB/CB/A-137', 'Recommendation on good government(group of Minister)(Lead Intelligence Agency)LIA', '49th Directional Level Co-ordination meeting of LIA.', '', '2022-12-12'),
(2862, 'MSB/CB/A-137', 'Recommendation on good government(group of Minister)(Lead Intelligence Agency)LIA', 'Directional Level Co-ordination Meeting - LIA.', '', '2022-02-15'),
(2863, 'MSB/CB/A-137', 'Recommendation on good government(group of Minister)(Lead Intelligence Agency)LIA', 'Holding of Online/Virtual Directional Level Co-ordination meeting Ã‚Â Ã‚Â Ã‚Â Ã‚Â Ã‚Â Ã‚Â Ã‚Â Ã‚Â Ã‚Â Ã‚Â Ã‚Â  Ã‚Â Ã‚Â Ã‚Â Ã‚Â Ã‚Â Ã‚Â Ã‚Â Ã‚Â Ã‚Â Ã‚Â Ã‚Â  Ã‚Â Ã‚Â Ã‚Â Ã‚Â Ã‚Â Ã‚Â Ã‚Â Ã‚Â Ã‚Â Ã‚Â Ã‚Â  of LIA.', '', '2022-05-04'),
(2864, 'MSB/CB/A-137', 'Recommendation on good government(group of Minister)(Lead Intelligence Agency)LIA', 'write up for SP for Directional Level LIA meeting on 3.8.22', '', '2022-08-01');
INSERT INTO `file_list` (`id`, `file_no`, `category`, `title`, `doc1`, `entry_date_real`) VALUES
(2865, 'MSB/CB/A-148', 'Fencing the Mizoram along Indo-Bangladesh Border', 'Submission of related documents for meeting of the 3rd State Level Standing Committee to Monitor Border Security on 21.06.2022', '', '2022-06-20'),
(2866, 'MSB/CB/A-149', 'SMAC- Subsidiary Multi Agency Centre', 'SMAC Quarterly/Monthly meeting for December 2022- Reg', '', '2022-12-19'),
(2867, 'MSB/CB/A-149', 'SMAC- Subsidiary Multi Agency Centre', 'SMAC Invitation- reg.', '', '2022-03-31'),
(2868, 'MSB/CB/A-149', 'SMAC- Subsidiary Multi Agency Centre', 'SMAC MEETING AUG 2021', '', '2021-08-30'),
(2869, 'MSB/CB/A-149', 'SMAC- Subsidiary Multi Agency Centre', 'smac meeting on 25 nov 21', '', '2021-11-23'),
(2870, 'MSB/CB/A-149', 'SMAC- Subsidiary Multi Agency Centre', 'Smac Meeting on 31.3.2022', '', '2022-03-30'),
(2871, 'MSB/CB/A-159', 'Special Cell', 'News paper 1.10.2012', '', '2007-10-23'),
(2872, 'MSB/CB/A-156', 'Translation of Local Newspapers', 'Newspaper. Dt. 3.10.2012', '', '2012-10-03'),
(2873, 'MSB/CB/A-156', 'Translation of Local Newspapers', 'Newspaper. Dt. 5.10.2012', '', '2012-10-05'),
(2874, 'MSB/CB/A-156', 'Translation of Local Newspapers', 'Newspaper.Dt.05.12.2012', '', '2022-12-05'),
(2875, 'MSB/CB/A-156', 'Translation of Local Newspapers', 'Newspaper.Dt.06.12.2012', '', '2012-12-06'),
(2876, 'MSB/CB/A-156', 'Translation of Local Newspapers', 'Newspaper.Dt.07.12.2012', '', '2012-12-07'),
(2877, 'MSB/CB/A-156', 'Translation of Local Newspapers', 'newspaper. Dt. 10.10.2012', '', '2012-10-10'),
(2878, 'MSB/CB/C-210', 'Right to Information Act (RTI)', 'Meeting of the Task Group on Implementation of Agreement made by Central Government- Reg.', '', '2022-03-03'),
(2879, 'MSB/CB/C-210', 'Right to Information Act (RTI)', 'PAYMENT & RECEIPT OF ADVANCE REHABILITATION PACKAGE(Rs. 20,000/-)', '', '2018-04-06'),
(2880, 'MSB/CB/C-210', 'Right to Information Act (RTI)', 'Directory of its Officers and employees', '', '2016-01-01'),
(2881, 'MSB/CB/C-210', 'Right to Information Act (RTI)', 'Monthly remunerationreceived by each of its officerss and employees', '', '2022-02-13'),
(2882, 'MSB/CB/C-210', 'Right to Information Act (RTI)', 'The budget allocated to each of its agency, indicating the particulars of all plans, proposed expenditure and reports on disbursement made', '', '2022-02-13'),
(2883, 'MSB/CB/C-210', 'Right to Information Act (RTI)', 'BRIEF NOTE ON CID (SB)', '', '2022-01-19'),
(2884, 'MSB/CB/C-210', 'Right to Information Act (RTI)', 'FOREIGNERS REGISTRATION OFFICE Ã‚Â (FRO)/VERIFICATION BRANCH', '', '2022-02-18'),
(2885, 'MSB/CB/C-210', 'Right to Information Act (RTI)', 'Implementation of Suo Moto disclosure under section 4 of RTI Act, 2005 - reg.', '', '2023-01-04'),
(2886, 'MSB/CB/C-210', 'Right to Information Act (RTI)', 'RTI Act final (CID (Special Branch)', '', '2022-02-10'),
(2887, 'MSB/CB/C-210', 'Right to Information Act (RTI)', 'RIGHT TO INFORMATION ACT,2005\r\n(RTI MANUAL OF CID(SB)', '', '2022-02-15'),
(2888, 'MSB/CB/C-210', 'Right to Information Act (RTI)', 'Implementation of Suo Moto disclosure under section 4 of RTI Act, 2005 - reg. (RTI Fdd)', '', '2022-02-10'),
(2889, 'MSB/CB/C-210', 'Right to Information Act (RTI)', 'SECTION 4 (1) (b) of RTI Act.', '', '2022-02-08'),
(2890, 'MSB/CB/53', 'UNION WAR BOOK', 'Union War Book/Preparation of Suspect List for the period ending 30.06.2022.', '', '2022-07-13'),
(2891, 'MSB/CB/53', 'UNION WAR BOOK', 'Preparation of Police War Instruction-reg.', '', '2021-06-26'),
(2892, 'MSB/CB/53', 'UNION WAR BOOK', 'Preparation of Police War Instruction-reg.', '', '2021-06-26'),
(2893, 'MSB/CB/53', 'UNION WAR BOOK', 'Preparation of Police War Instruction-reg.', '', '2021-06-26'),
(2894, 'MSB/CB/53', 'UNION WAR BOOK', 'Preparation of Police War Instruction-reg.', '', '2021-06-26'),
(2895, 'MSB/CB/53', 'UNION WAR BOOK', 'Preparation of Police War Instruction-reg.', '', '2021-06-26'),
(2896, 'MSB/CB/53', 'UNION WAR BOOK', 'Preparation of Police War Instruction-reg.', '', '2021-06-26'),
(2897, 'MSB/CB/53', 'UNION WAR BOOK', 'Preparation of Police War Instruction-reg.', '', '2021-06-26'),
(2898, 'MSB/CB/53', 'UNION WAR BOOK', 'UNION WAR BOOK - JAN, 2022', '', '2022-01-25'),
(2899, 'MSB/CB/53', 'UNION WAR BOOK', 'Union War Book/Preparation of Suspect List for the period ending 31.12.2021.', '', '2022-01-18'),
(2900, 'MSB/CB/A-156', 'Translation of Local Newspapers', 'Newspaper .Dt.8.12.2012', '', '2012-12-08'),
(2901, 'MSB/CB/A-156', 'Translation of Local Newspapers', 'Newspaper Dt. 13.12.2012', '', '2012-12-13'),
(2902, 'MSB/CB/A-156', 'Translation of Local Newspapers', 'Newspaper Dt. 14.12.2012', '', '2012-12-14'),
(2903, 'MSB/CB/A-156', 'Translation of Local Newspapers', 'Newspaper. Dt. 15.10.2012', '', '2012-10-15'),
(2904, 'MSB/CB/A-156', 'Translation of Local Newspapers', 'Newspaper. Dt. 16.10.2012', '', '2012-10-16'),
(2905, 'MSB/CB/A-156', 'Translation of Local Newspapers', 'Newspaper. Dt. 17.10.2012', '', '2012-10-17'),
(2906, 'MSB/CB/A-156', 'Translation of Local Newspapers', 'Newspaper Dt. 17.12.2012', '', '2012-12-17'),
(2907, 'MSB/CB/A-156', 'Translation of Local Newspapers', 'Newspaper. Dt. 18.10.2012', '', '2012-10-18'),
(2908, 'MSB/CB/A-156', 'Translation of Local Newspapers', 'Newspaper. Dt. 19.10.2012', '', '2012-10-19'),
(2909, 'MSB/CB/A-156', 'Translation of Local Newspapers', 'newspaper. Dt. 22.10.2012', '', '2012-10-22'),
(2910, 'MSB/CB/A-156', 'Translation of Local Newspapers', 'Newspaper, Dt. 28.9.2012.', '', '2012-09-28'),
(2911, 'MSB/CB/A-156', 'Translation of Local Newspapers', 'Newspaper Dt. 27.9.2012.', '', '2012-09-27'),
(2912, 'MSB/CB/A-156', 'Translation of Local Newspapers', 'Newspaper, Dt. 25.9.2012.', '', '2012-09-25'),
(2913, 'MSB/CB/SR/', 'Special Report', 'SPECIAL REPORT 7th February, 2019 Mizoram Bru Displaced PeoplesÃ¢â‚¬â„¢ Forum (MBDPF) organised a meeting of all Bru NGOs from the 6 (six) Bru Transit Camps', '', '2019-02-07'),
(2914, 'MSB/CB/SR/', 'Special Report', 'SPECIAL REPORT 7th February, 2019 The newly appointed 14 (fourteen) Interim Council Members of Sinlung Hills Council took an Ã¢â‚¬ËœOath of AffirmationÃ¢â‚¬â„¢', '', '2019-02-07'),
(2915, 'MSB/CB/SR/', 'Special Report', 'All NGOCC, Kolasib intended to submit an FIR at Kolasib PS against Dr. Arun T, IAS, District Election Officer (DEO), Kolasib on 9.2.2019 (Saturday).', '', '2019-02-08'),
(2916, 'MSB/CB/SR/', 'Special Report', 'SPECIAL REPORT 9th February, 2019.', '', '2019-02-09'),
(2917, 'MSB/CB/SR/', 'Special Report', 'SPECIAL REPORT 11th February, 2019. National Trade Union of Mizoram (NTUM) is intending to hold a peaceful Sit-in Demonstration.', '', '2019-02-11'),
(2918, 'MSB/CB/SR/', 'Special Report', '11th February, 2019 All NGO Coordination Committee (NGOCC) held a meeting.', '', '2019-02-11'),
(2919, 'MSB/CB/SR/', 'Special Report', '12th February, 2019. 12th February, 2019.\r\n\r\n\r\n\r\nIn continuation of our Special Report No.MSB/CB/SR/2019/89 Dated 11.2.2019. NGOCC organised Ã¢â‚¬Å“Protest DayÃ¢â‚¬Â in protest against the Citizenship (Amendment) Bill, ', '', '2019-02-12'),
(2920, 'MSB/CB/SR/', 'Special Report', '12th February, 2019 National Trade Union of Mizoram (NTUM) held a peaceful Sit-in demonstration outside the main entry gate of New Secretariat Office', '', '2019-02-12'),
(2921, 'MSB/CB/SR/', 'Special Report', '14th February, 2019 4 (four) leaders of All Bru NGOs of Tripura camps headed by A. Sawibunga', '', '2019-02-14'),
(2922, 'MSB/CB/SR/', 'Special Report', '15th February, 2019 uneasy tension at Bairabi (Zophai) area following hassles between Mizo landowners and Bengali tenant farmers over non-payment of rents during recent harvest period.', '', '2019-02-15'),
(2923, 'MSB/CB/SR/', 'Special Report', '18th February, 2019. Mizoram Bru Displaced People Coordination Committee (MBDPCC), Pu Laldingliana, President and Pu George-a, Secretary arrived Aizawl on 14.2.2019 from Bru Transit Camp, Tripura.', '', '2019-02-18'),
(2924, 'MSB/CB/SR/', 'Special Report', '18th February, 2019 slight tension at Zophai', '', '2019-02-18'),
(2925, 'MSB/CB/SR/', 'Special Report', '19th February, 2019 a meeting between SP, Kolasib and All NGOs, Bairabi', '', '2019-02-19'),
(2926, 'MSB/CB/SR/', 'Special Report', '20th February, 2019 meeting between Pu Vanlalfaka Ralte, SP, Kolasib and Shri. Mohneesh Mishra, IPS, SP, Hailakandi', '', '2019-02-19'),
(2927, 'MSB/CB/SR/', 'Special Report', '20th February, 2019. 1st Bn. Assam Rifles duty at Lopu village, Siaha District produced 2 (two) persons namely, (i) Haolin (20) s/o Saikhin of Konbi and (ii) Thuanthun (18) s/o Aunju, both belonging to Paletwa District, ', '', '2019-02-20'),
(2928, 'MSB/CB/SR/', 'Special Report', '21st February, 2019. leaders of Mizoram Bru Displaced PeoplesÃ¢â‚¬â„¢ Forum (MBDPF) namely, A. Sawibunga, President; R. Laldawngliana, Vice President and Bruno Msha, General Secretary arrived at Aizawl from Bru Transit C', '', '2019-02-21'),
(2929, 'MSB/CB/SR/', 'Special Report', '28th February, 2019 hat 4 (four) Bru NGOs, viz. Mizoram Bru Displaced PeoplesÃ¢â‚¬â„¢ Forum (MBDPF), Mizoram Bru Displaced PeoplesÃ¢â‚¬â„¢ Coordination Committee (MBDPCC), Mizoram Bru Indigenous Democratic Movement (MBID', '', '2019-02-28'),
(2930, 'MSB/CB/SR/', 'Special Report', '4th July, 2019  L. Ramdinliana Renthlei, President, MZP Gen. Hqrs. alongwith 3 (three) others met officials of Higher & Technical Education Department', '', '2019-07-04'),
(2931, 'MSB/CB/SR/', 'Special Report', '5th July, 2019 Mizoram Bru Displaced PeopleÃ¢â‚¬â„¢s Forum (MBDPF), namely, Pu A. Sawibunga, President; Pu R. Laldawngliana, Vice President and\r\nPu Bruno Msha, General Secretary met Pu Lalchamliana, HonÃ¢â‚¬â„¢ble Home M', '', '2019-07-05'),
(2932, 'MSB/CB/SR/', 'Special Report', '6th July, 2019 Forest Department officials of Assam (around 10 in number) headed by a Forest Range Officer has started renovation work of one building located at the disputed Mizoram-Assam Forest Reserve area along the A', '', '2019-07-06'),
(2933, 'MSB/CB/SR/', 'Special Report', '8th July, 2019 Mizo Zirlai Pawl (MZP) General Headquarters, Aizawl issued a Press Release highlighting its Executive Meeting held', '', '2019-07-08'),
(2934, 'MSB/CB/SR/', 'Special Report', '8th July, 2019 Technical Wing of Higher & Technical Department, Chaltlang, Aizawl that altogether 84 (eighty four) MBBS seats, 137 (one hundred thirty seven) Engineering seats and 7 (seven) BDS seats are allotted to Mizo', '', '2019-07-08'),
(2935, 'MSB/CB/SR/', 'Special Report', '11th July, 2019 members of Ex-Hmar Volunteer Association (Ex-HVA) had strongly deplored the recent extension of the interim office of Sinlung Hills Council (SHC) and spread rumours indicative of their readiness to take u', '', '2019-07-11'),
(2936, 'MSB/CB/SR/', 'Special Report', '17th July, 2019 Mizoram Police conducted discreet enquiry on Fake Driving License', '', '2019-07-17'),
(2937, 'MSB/CB/SR/', 'Special Report', '23rd July, 2019 Ngopa PS staff of Champhai District intercepted 3 (three) Myanmarese along with 2 (two) foreign bikes (125 Kenbo) at Kawlbem Road (about 15 kms from Ngopa). One of the bike riders was found to be in posse', '', '2019-07-23'),
(2938, 'MSB/CB/SR/', 'Special Report', '29th July, 2019 2 (two) organizations, namely Mizoram Bru Displaced PeopleÃ¢â‚¬â„¢s Coordination Committee (MBDPCC) and Mizoram Bru Indigenous Democratic Movement (MBIDM) convened a meeting', '', '2019-07-29'),
(2939, 'MSB/CB/SR/', 'Special Report', '30th July, 2019 2 (two) apprehended Bangladeshi nationals, namely (i) Mahmud Hassan (25) s/o Gulbarg Ali, Magura, Bangladesh and (ii) Mohamad Sayad Hussain (35) s/o Shayaib Hussain, Magura, Bangladesh alongwith the escor', '', '2019-07-30'),
(2940, 'MSB/CB/SR/', 'Special Report', '5th June, 2019 Mizoram Police seized 1,10,000 (one lakh, ten thousand) Methamphitamine tablets worth Rs. 165 Lakhs at Champhai.', '', '2019-06-05'),
(2941, 'MSB/CB/SR/', 'Special Report', '5th June, 2019. 5th June, 2019.\r\n\r\n\r\n\r\n\r\n\r\n\r\n\r\nChamphai Police, who were on Anti-Drug operation at Zote crossing point on Indo-Myanmar border apprehended one ZRA (Zomi Revolutionary Army)', '', '2019-06-05'),
(2942, 'MSB/CB/SR/', 'Special Report', '6th June, 2019 Joint NGOs Core Committee, comprising Mizoram Bru Displaced PeoplesÃ¢â‚¬â„¢ Co-ordination Committee (MBDPCC), Mizoram Bru Indigenous Democratic Movement (MBIDM) and Bru Tribal Development Society (BTDS), h', '', '2019-06-06'),
(2943, 'MSB/CB/SR/', 'Special Report', '11th June, 2019 Central Young Mizo Association (CYMA) is convening an Emergency CEC meeting', '', '2019-06-11'),
(2944, 'MSB/CB/SR/', 'Special Report', '11th June, 2019 Village Council, Zote, Champhai District is convening a public meeting', '', '2019-06-11'),
(2945, 'MSB/CB/SR/', 'Special Report', '12th June, 2019 Public Meeting was held last night, i.e. 11.6.2019 @ 7:30 p.m at Zote Community Hall which was presided over by Pu R. Hrangthanga, VC President and attended by about 300 (three hundred) villagers.', '', '2019-06-12'),
(2946, 'MSB/CB/SR/', 'Special Report', '13th June, 2019 Central Young Lai Association (CYLA) issued an appeal to all its branches to select volunteers (5-10 members from each branch) to carry out the final phase of drive on identification of illegal Chakma for', '', '2019-06-13'),
(2947, 'MSB/CB/SR/', 'Special Report', '6th January, 2019 North East StudentsÃ¢â‚¬â„¢ Organisation (NESO) is intending to organise a North East wide Total Bandh on 8.1.2019 (Tuesday) in protest against the Citizenship (Amendment) Bill, 2016 purportedly to be p', '', '2019-01-06'),
(2948, 'MSB/CB/SR/', 'Special Report', '12th January, 2019. various Chakma civil society organisations namely, the All India Chakma StudentsÃ¢â‚¬â„¢ Union (AICSU)', '', '2019-02-12'),
(2949, 'MSB/CB/SR/', 'Special Report', '14th January, 2019. Mizoram Bru Displaced PeoplesÃ¢â‚¬â„¢ Forum (MBDPF) leaders namely, A. Sawibunga, President; R. Laldawngliana, Vice President and Bruno Msha, General Secretary met Shri. Mahesh Kumar Singla, Adviser (', '', '2019-01-14'),
(2950, 'MSB/CB/SR/', 'Special Report', '16th January, 2019  joint Press Release by various Chakma civil society organisations, the HonÃ¢â‚¬â„¢ble Gauhati High Court, Aizawl Bench', '', '2019-01-17'),
(2951, 'MSB/CB/SR/', 'Special Report', '16th January, 2019 Lawngtlai District Land OwnersÃ¢â‚¬â„¢ Association (LDLOA) Gen. Hqrs. held an Executive Meeting', '', '2019-12-16'),
(2952, 'MSB/CB/SR/', 'Special Report', '16th January, 2019 Pu Ianga, S/o Singkili of Tlangnuam Veng, Vairengte had not been allowed to undergo cultivation work at his paddy field at Mautui Zau (agricultural land on Assam-Mizoram border', '', '2019-01-16'),
(2953, 'MSB/CB/SR/', 'Special Report', '20th January, 2019 the impending stay of all construction works under Kaladan Multi Modal Transit Transport Project (KMMTTP) by Lawngtlai District Land OwnersÃ¢â‚¬â„¢ Association (LDLOA)', '', '2019-01-20'),
(2954, 'MSB/CB/SR/', 'Special Report', '22nd January, 2019 The Notification issued by Government of Mizoram with regard to appointment and extension of the term of Interim Sinlung Hills Council (SHC)', '', '2019-01-23'),
(2955, 'MSB/CB/SR/', 'Special Report', '22nd January, 2019 NGO Coordination Committee (NGOCC), comprising of Central YMA (CYMA), Mizoram Upa Pawl (MUP), Mizo Hmeichhe Insuihkhawm Pawl (MHIP), Mizo Zirlai Pawl (MZP) and Mizo StudentsÃ¢â‚¬â„¢ Union (MSU) held a ', '', '2019-01-22'),
(2956, 'MSB/CB/SR/', 'Special Report', '23rd January, 2019 Pu Lalchamliana, HonÃ¢â‚¬â„¢ble Home Minister held a meeting with leaders of all NGOCC', '', '2019-01-23'),
(2957, 'MSB/CB/SR/', 'Special Report', '23rd January, 2019', '', '2019-01-23'),
(2958, 'MSB/CB/SR/', 'Special Report', '24th January, 2019. A meeting with Mizoram Kohhran Hruaitute Committee (MKHC) was convened by\r\nPu Lalchamliana, HonÃ¢â‚¬Ëœble Home Minister at his office chamber', '', '2019-01-24'),
(2959, 'MSB/CB/SR/', 'Special Report', '25th January, 2019 A meeting between the Government and NGOCC was held', '', '2019-01-31'),
(2960, 'MSB/CB/SR/', 'Special Report', '26th January, 2019 70th Republic Day celebration, 2019 was held peacefully', '', '2019-01-26'),
(2961, 'MSB/CB/SR/', 'Special Report', '29th January, 2019 Mizoram Bru Displaced PeoplesÃ¢â‚¬â„¢ Forum (MBDPF) namely, A. Sawibunga, President; R. Laldawngliana, Vice President and Bruno Msha, General Secretary had been visiting Bru Transit Camps in Tripura', '', '2019-01-29'),
(2962, 'MSB/CB/B-26(B)', 'HPC(D)  Lalhmingthanga Sanate faction', 'Report on MBDA', '', '2022-02-02'),
(2963, 'MSB/CB/SR/', 'Special Report', '29th January, 2019 Consequent upon their meeting with Pu Neihchungnunga, IPS, DIG (CID/SR) on 19.01.2019', '', '2019-01-29'),
(2964, 'MSB/CB/SR/', 'Special Report', '31st January, 2019 Lalruatpuia (25) S/o F. Laldinliana of Siahatla, who was convicted under POCSO Act and sentenced to a term of 15 (fifteen) years imprisonment', '', '2019-01-31'),
(2965, 'MSB/CB/SR/', 'Special Report', '4th March, 2019 9 (nine) members from Chawngte Group YMA and Mualbu visited Chengkawllui (an alleged illegal Chakma settlement), Lunglei District', '', '2019-03-04'),
(2966, 'MSB/CB/B-26(B)', 'HPC(D)  Lalhmingthanga Sanate faction', 'Draft report on MBDA', '', '2022-02-02'),
(2967, 'MSB/CB/SR/', 'Special Report', '4th March, 2019 three Bru NGOÃ¢â‚¬â„¢s namely Mizoram Bru Displaced PeoplesÃ¢â‚¬â„¢ Forum (MBDPF), Mizoram Bru Displaced PeoplesÃ¢â‚¬â„¢ Coordination Committee (MBDPCC) and Mizoram Bru Indigenous Democratic Movement (MBI', '', '2019-03-04'),
(2968, 'MSB/CB/SR/', 'Special Report', '4th March, 2019 movement of 3rd Bn. Assam Regiment and Assam Rifles towards Southern Lawngtlai District from around 14/15.02.2019 onwards.', '', '2019-03-04'),
(2969, 'MSB/CB/B-26(B)', 'HPC(D)  Lalhmingthanga Sanate faction', 'Demand Letter', '', '2022-12-30'),
(2970, 'MSB/CB/B-26(B)', 'HPC(D)  Lalhmingthanga Sanate faction', 'case registered against HPCD', '', '2023-01-03'),
(2971, 'MSB/CB/SR/', 'Special Report', '8th March, 2019 Police party from Bunghmun Police Station proceeded towards Tleu village by Police Gypsy', '', '2019-03-08'),
(2972, 'MSB/CB/SR/', 'Special Report', '13th March, 2019. CEO, Mizoram had instructed DEOs of Kolasib, Mamit and Lunglei', '', '2019-03-13'),
(2973, 'MSB/CB/SR/', 'Special Report', '14th March, 2019 Mizoram Bru Displaced PeoplesÃ¢â‚¬â„¢ Forum (MBDPF) held an Executive Meeting', '', '2019-03-15'),
(2974, 'MSB/CB/SR/', 'Special Report', '15th March, 2019 Bru Displaced PeoplesÃ¢â‚¬â„¢ Forum (MBDPF) submitted a Memorandum dated 14.3.2019 to Shri. Rajiv Gauba, Union Home Secretary', '', '2019-03-15'),
(2975, 'MSB/CB/B-26(B)', 'HPC(D)  Lalhmingthanga Sanate faction', 'write up on Lalhmingthanga Sanate faction of HPC(D) : (As on 30.5.2018)', '', '0000-00-00'),
(2976, 'MSB/CB/B-26(B)', 'HPC(D)  Lalhmingthanga Sanate faction', 'LIST OF HPC(D), LALHMINGTHANGA SANATEÃ¢â‚¬â„¢S FACTION  AS ON 16th July, 2018', '', '2018-07-16'),
(2977, 'MSB/CB/B-26(B)', 'HPC(D)  Lalhmingthanga Sanate faction', 'KNOWN CADRES OF LALHMINGTHANGA SANATEÃ¢â‚¬â„¢S FACTION', '', '2017-08-23'),
(2978, 'MSB/CB/SR/', 'Special Report', '15th March, 2019 obvious manifestation of dissent in the HPC(D) organisation,', '', '2019-03-15'),
(2979, 'MSB/CB/B-26(B)', 'HPC(D)  Lalhmingthanga Sanate faction', 'KNOWN CADRES OF LALHMINGTHANGA SANATEÃ¢â‚¬â„¢S FACTION', '', '2017-08-23'),
(2980, 'MSB/CB/B-26(B)', 'HPC(D)  Lalhmingthanga Sanate faction', 'KNOWN CADRES OF LALHMINGTHANGA SANATEÃ¢â‚¬â„¢S FACTION', '', '2017-08-23'),
(2981, 'MSB/CB/SR/', 'Special Report', '15th March, 2019 an obvious manifestation of dissent in the HPC(D) organisation', '', '2019-03-15'),
(2982, 'MSB/CB/B-26(B)', 'HPC(D)  Lalhmingthanga Sanate faction', 'HPC(D) Presidents Group', '', '2018-12-05'),
(2983, 'MSB/CB/SR/', 'Special Report', '19th March, 2019 Joint Meeting of Village Councils, YMA, MHIP, MUP, MZP Sub-Hqrs. and MSU Sub-Hqrs. within Bairabi was held at Bairabi North YMA Hall', '', '2019-03-20'),
(2984, 'MSB/CB/B-26(B)', 'HPC(D)  Lalhmingthanga Sanate faction', 'ARREST OF LAHMINGTHANGA SANATE', '', '2019-05-28'),
(2985, 'MSB/CB/SR/', 'Special Report', '20th March, 2019 Ministry of Home Affairs, Govt. of India vide F.No.7/32/97-NE dt. 13.3.2019, has extended the deadline for repatriation of Bru refugees in Tripura Transit Camps to Mizoram', '', '2019-03-20'),
(2986, 'MSB/CB/SR/', 'Special Report', '25th March, 2019 Land OwnersÃ¢â‚¬â„¢ Association Sub-Committee, Rulkual village, Lawngtlai District issued a stay order to RDS Project Ltd', '', '2019-03-25'),
(2987, 'MSB/CB/B-26(B)', 'HPC(D)  Lalhmingthanga Sanate faction', 'ARMS HOLDING OF HMINGTEA\'S FACTION  AS ON 16th July, 2018', '', '0000-00-00'),
(2988, 'MSB/CB/SR/', 'Special Report', '25th March, 2019 joint meeting among Village Councils and NGOs of Tuichawng and Belpei (Matrisora) villages, Lunglei District', '', '2019-03-25'),
(2989, 'MSB/CB/SR/', 'Special Report', '30th March, 2019 CYMA Central Executive Committee (CEC) meeting was held today', '', '2019-09-30'),
(2990, 'MSB/CB/B-26(B)', 'HPC(D)  Lalhmingthanga Sanate faction', 'Arrest of Hmingtea - 10.5.2019', '', '2019-05-10'),
(2991, 'MSB/CB/SR/', 'Special Report', '8th May, 2019  ICFAI StudentsÃ¢â‚¬â„¢ Action Committee held a meeting at their campus', '', '2019-05-08'),
(2992, 'MSB/CB/B-26(B)', 'HPC(D)  Lalhmingthanga Sanate faction', 'BRIEF NOTE ON HPCD/MBDA', '', '2022-12-30'),
(2993, 'MSB/CB/SR/', 'Special Report', '9th May, 2019 ICFAI StudentsÃ¢â‚¬â„¢ Action Committee (ICFAISAC) held a meeting', '', '2019-05-09'),
(2994, 'MSB/CB/SR/', 'Special Report', '10th May, 2019 Lalhmingthanga Sanate (53) s/o V.L.Ramliana, President, HPC Ã¢â‚¬ËœDÃ¢â‚¬â„¢ (P) has been apprehended by 37th Assam Rifles', '', '2019-05-10'),
(2995, 'MSB/CB/B-26(B)', 'HPC(D)  Lalhmingthanga Sanate faction', 'Factionalism amongst the Hmar UGs', '', '2011-12-30'),
(2996, 'MSB/CB/SR/', 'Special Report', '6th May, 2019  MZP President L. Ramdinliana Renthlei accompanied by B. Vanlaltana, Vice President and two Secretaries went to Bairabi (Zophai)', '', '2019-05-06'),
(2997, 'MSB/CB/SR/', 'Special Report', '7th May, 2019. the Ã¢â‚¬Å“Site BannerÃ¢â‚¬Å“ put up by MZP at Zophai', '', '2019-05-07'),
(2998, 'MSB/CB/SR/', 'Special Report', '7th May, 2019 Around 35 employees of ICFAI University Mizoram gathered outside the main gate of the Chief MinisterÃ¢â‚¬â„¢s Office (CMO)', '', '2019-05-07'),
(2999, 'MSB/CB/B-26(B)', 'HPC(D)  Lalhmingthanga Sanate faction', 'STRENGTH Ã‚Â AND Ã‚Â STATUSÃ‚Â  OFÃ‚Â  HPC(D) Ã‚Â OUTFITS', '', '2022-12-30'),
(3000, 'MSB/CB/SR/', 'Special Report', '17th May, 2019 3 (three) Bru Organisations, namely; Mizoram Bru Displaced PeopleÃ¢â‚¬â„¢s Co-ordination Committee (MBDPCC), Mizoram Bru Indigenous Democratic Movement (MBIDM) and Bru Tribal Development Society (BTDS), wh', '', '2019-05-07'),
(3001, 'MSB/CB/SR/', 'Special Report', '24th April, 2019 Pi Vanlalchami, Senior Civil Judge-I had issued an order Memo No. 250/SR.CJ-I(A)/2019 dated 05.04.2019 for eviction of 11 families', '', '2019-04-24'),
(3002, 'MSB/CB/SR/', 'Special Report', '24th May, 2019 bomb blast at a mosque named Ã¢â‚¬ËœBhaithul Mukharram Jamma MasjidÃ¢â‚¬â„¢ located near Zophai', '', '2019-05-24'),
(3003, 'MSB/CB/SR/', 'Special Report', '4th November, 2019 leaders of Bru NGOs claimed the following persons to have died due to starvation as a result of stoppage of free ration and cash dole by the Central Government:-', '', '2019-11-04'),
(3004, 'MSB/CB/SR/', 'Special Report', '5th November, 2019 The on-going roadblock organised by Bru NGOs in between Kanchanpur and Ananda Bazar, Tripura', '', '2019-11-05'),
(3005, 'MSB/CB/SR/', 'Special Report', '18th November, 2019 A sit-in demonstration organised by North East StudentsÃ¢â‚¬â„¢ Organisation (NESO) in protest of Central GovernmentÃ¢â‚¬â„¢s intention to reintroduce the Citizenship (Amendment) Bill', '', '2019-11-18'),
(3006, 'MSB/CB/SR/', 'Special Report', '20th November, 2019 Leaders of Bru NGOs, viz., A. Sawibunga, President, MBDPF; Phillip Apeto, General Secretary, MBIDM; Chohsarai, Spokeperson, MBIDM and Vipin Kumar, President, BTDS, who have gone to New Delhi on 7.11.2', '', '2019-11-20'),
(3007, 'MSB/CB/SR/', 'Special Report', '28th November, 2019 The ongoing stand-off between Mizoram Truck DriversÃ¢â‚¬â„¢ Association (MTDA) and Mizoram Carrying Contractors Association (MCCA)', '', '2019-11-28'),
(3008, 'MSB/CB/SR/', 'Special Report', '1st October, 2019 Pu A. Sawibunga, President, MBDPF (Mizoram Bru Displaced PeoplesÃ¢â‚¬â„¢ Forum) and Pu Chauhsarai, Spokesperson of MBIDM (Mizoram Bru Indigenous Democratic Movement) convened a Public Meeting', '', '2019-10-01'),
(3009, 'MSB/CB/SR/', 'Special Report', '2nd October, 2019 Central Young Mizo Association (CYMA) convened its Executive Committee Meeting', '', '2019-10-02'),
(3010, 'MSB/CB/SR/', 'Special Report', '2nd October, 2019 rumours of attempt to kidnap Mizo children in 3 (three) different locations', '', '2019-10-02'),
(3011, 'MSB/CB/SR/', 'Special Report', '2nd October, 2019 Central Young Mizo Association (CYMA) convened its Executive Committee Meeting', '', '2019-10-02'),
(3012, 'MSB/CB/SR/', 'Special Report', '3rd October, 2019. The 9th & Final Phase of the repatriation process of Brus living in Tripura Relief Camps commenced', '', '2019-10-03'),
(3013, 'MSB/CB/SR/', 'Special Report', '4th October, 2019 PRISM party and MPC party are intending to organize a programme', '', '2019-10-04'),
(3014, 'MSB/CB/SR/', 'Special Report', '5th October, 2019 HPC party made an appeal to other political parties not to field their party candidates in the upcoming Sinlung Hills Council (SHC) Election', '', '2019-10-05'),
(3015, 'MSB/CB/SR/', 'Special Report', '5th October, 2019 Shri. Amit Shah, HonÃ¢â‚¬â„¢ble Union Home Minister visited Aizawl', '', '2019-10-05'),
(3016, 'MSB/CB/SR/', 'Special Report', '7th October, 2019 Ã‚Â  The Repatriation process of Brus living in Tripura Transit Camps was continued', '', '2019-10-07'),
(3017, 'MSB/CB/SR/', 'Special Report', '9th October, 2019 The Repatriation process of Brus living in Tripura Relief Camps continued for the fifth day', '', '2019-10-09'),
(3018, 'MSB/CB/SR/', 'Special Report', '11th October, 2019 An organisation named Ã¢â‚¬ËœHPC(D) General Headquarters SinlungÃ¢â‚¬â„¢, held its Council Meeting', '', '2019-10-11'),
(3019, 'MSB/CB/SR/', 'Special Report', '12th October, 2019 Vairengte Police seized suspected FICN amounting to Rs.41,01,500/-', '', '2019-10-12'),
(3020, 'MSB/CB/SR/', 'Special Report', '12th October, 2019 Mizo persons namely, i) Debu Pal (60) s/o Debendra Pal of Singua Fultali Village, PS-Ratabari, Karimganj District, Assam and ii) Doya Moy Nath @ Joy (35) s/o Hemanta Nath of Lala Village, Hailakandi, A', '', '2019-10-12'),
(3021, 'MSB/CB/SR/', 'Special Report', '16th October, 2019 A meeting between MHA Officials including officials from Governments of Mizoram and Tripura and various Bru NGOs was held in Agartala', '', '2019-10-16'),
(3022, 'MSB/CB/SR/', 'Special Report', '21st October, 2019 In protest of the ongoing repatriation process and demand for the implementation of their various grievances, Bru people living in Tripura Transit Camps held a Mass Rally', '', '2019-10-21'),
(3023, 'MSB/CB/SR/', 'Special Report', '2nd September, 2019 Tlabung Branch YMA held its Executive Meeting on 31.8.2019 @ 7:00 a.m at YMA Run, Tlabung.', '', '2019-09-02'),
(3024, 'MSB/CB/SR/', 'Special Report', '6th September, 2019 about 130 (one hundred thirty) persons comprises of members of Bharat Hit Raksha Abhiyan (BHRA) and Bru NGO leaders proceeded to Mizoram', '', '2019-09-06');

