-- PostgreSQL version of MySQL dump
-- Converted by convert_batch_mysql_to_postgres.py

INSERT INTO "file_list" ("id", "file_no", "category", "title", "doc1", "entry_date_real") VALUES
(3025, 'MSB/CB/SR/', 'Special Report', '6th September, 2019 Â  Joint Monitoring Group (JMG) meeting was held today, i.e. 6.9.2019 at New Delhi under the chairmanship of Pu A.P. Maheshwari, Spl. Secretary (Internal Security)', '', '2019-09-06');
INSERT INTO "file_list" ("id", "file_no", "category", "title", "doc1", "entry_date_real") VALUES
(3026, 'MSB/CB/SR/', 'Special Report', '10th September, 2019 MZP Hqrs., Kolasib highlighted their intention to commence the construction ofÂ  â€˜Chawlhbukâ€™, i.e. waiting shed at Phaisen, Kolasib', '', '2019-09-10');
INSERT INTO "file_list" ("id", "file_no", "category", "title", "doc1", "entry_date_real") VALUES
(3027, 'MSB/CB/SR/', 'Special Report', '12th September, 2019 Mizoram Bru Displaced Peoples Forum (MBDPF) convened a joint meeting with leaders of other Bru NGOs', '', '2019-09-12');
INSERT INTO "file_list" ("id", "file_no", "category", "title", "doc1", "entry_date_real") VALUES
(3028, 'MSB/CB/SR/', 'Special Report', '13th September, 2019 Adjutant, 8 Assam Rifles submitted a letter to the Superintendent of Police, Champhai giving intimation on an incident at Zokhawthar.', '', '2019-09-13');
INSERT INTO "file_list" ("id", "file_no", "category", "title", "doc1", "entry_date_real") VALUES
(3029, 'MSB/CB/SR/', 'Special Report', '17th September, 2019 final repatriation of Brus residing in 6 (six) Relief Camps of Tripura', '', '2019-09-17');
INSERT INTO "file_list" ("id", "file_no", "category", "title", "doc1", "entry_date_real") VALUES
(3030, 'MSB/CB/SR/', 'Special Report', '18th September, 2019 Mizoram Police deployed 2 (two) Platoons of Force from 1st IR Bn., Khawzawl', '', '2019-09-18');
INSERT INTO "file_list" ("id", "file_no", "category", "title", "doc1", "entry_date_real") VALUES
(3031, 'MSB/CB/SR/', 'Special Report', '20th September, 2019 boundary issues between 2 (two) localities of Aizawl', '', '2019-09-20');
INSERT INTO "file_list" ("id", "file_no", "category", "title", "doc1", "entry_date_real") VALUES
(3032, 'MSB/CB/SR/', 'Special Report', '25th September, 2019 NGOs of Bru Relief Camps in North Tripura, viz. MBDPF, MBDPCC and MBIDM are secretly lobbying with some unknown persons in an attempt to influence the Government to concede', '', '2019-09-25');
INSERT INTO "file_list" ("id", "file_no", "category", "title", "doc1", "entry_date_real") VALUES
(3033, 'MSB/CB/SR/', 'Special Report', '26th September, 2019 Mizoram Bru Displaced Peoplesâ€™ Forum (MBDPF) sent a letter to Shri. A.P. Maheshwari, IPS, Special Secretary (IS);
INSERT INTO "file_list" ("id", "file_no", "category", "title", "doc1", "entry_date_real") VALUES
(MHA,', '', '2019-09-26');
INSERT INTO "file_list" ("id", "file_no", "category", "title", "doc1", "entry_date_real") VALUES
(3034, 'MSB/CB/SR/', 'Special Report', '27th September, 2019 NGO Co-Ordination Committee (CYMA, MUP, MHIP, MZP & MSU) convened its meeting today, i.e. 27.9.2019 @ 3:00 p.m under the chairmanship of Pu Vanlalruata, President', '', '2019-09-27');
INSERT INTO "file_list" ("id", "file_no", "category", "title", "doc1", "entry_date_real") VALUES
(3035, 'MSB/CB/SR/', 'Special Report', '30th September, 2019 3 (three) NGOs of Bru Relief Camps, Tripura, viz. MBDPF (Mizoram Bru Displaced Peoplesâ€™ Forum);
INSERT INTO "file_list" ("id", "file_no", "category", "title", "doc1", "entry_date_real") VALUES
(BTDS (Bru Tribal Development Society) and MBIDM (Mizoram Bru Indigenous Democratic Movement);
INSERT INTO "file_list" ("id", "file_no", "category", "title", "doc1", "entry_date_real") VALUES
(wr', '', '2019-09-30');
INSERT INTO "file_list" ("id", "file_no", "category", "title", "doc1", "entry_date_real") VALUES
(3036, 'MSB/CB/SR/', 'Special Report', '12th April, 2020 Sub-Headquarters YMA, Champhai will convene its Executive Emergency Meeting tomorrow', '', '2020-04-12');
INSERT INTO "file_list" ("id", "file_no", "category", "title", "doc1", "entry_date_real") VALUES
(3037, 'MSB/CB/SR/', 'Special Report', '19th April, 2020 2 (two) police personnel of 5th IR Bn.', '', '2020-04-19');
INSERT INTO "file_list" ("id", "file_no", "category", "title", "doc1", "entry_date_real") VALUES
(3038, 'MSB/CB/SR/', 'Special Report', '20th April, 2020 NGOs and individuals visited New Kawnpui area of Mamit District in protest against physical assault of 2 (two) 5th IR Bn. personnel deployed on Covid-19 duty by Chakmas of Tripura on 18.4.2020 :', '', '2020-04-20');
INSERT INTO "file_list" ("id", "file_no", "category", "title", "doc1", "entry_date_real") VALUES
(3039, 'MSB/CB/SR/', 'Special Report', '6th August, 2020 Joint Young Mizo Association, Chawngte, in its demand for immediate repair of dilapidated road condition between Chawngte to Rualalung', '', '2020-08-06');
INSERT INTO "file_list" ("id", "file_no", "category", "title", "doc1", "entry_date_real") VALUES
(3040, 'MSB/CB/SR/', 'Special Report', '13th August, 2020 A joint meeting of leaders of the 3 (three) Autonomous District Councils of Mizoram (LADC, MADC & CADC);
INSERT INTO "file_list" ("id", "file_no", "category", "title", "doc1", "entry_date_real") VALUES
(All Party and All NGOs was held', '', '2020-08-13');
INSERT INTO "file_list" ("id", "file_no", "category", "title", "doc1", "entry_date_real") VALUES
(3041, 'MSB/CB/SR/', 'Special Report', '19th August, 2020 1 (one) Assam Rifles personnel of 8th AR was alleged to have perpetrated sexual misconduct against 2 (two) women of Sesih village, Champhai District', '', '2020-08-19');
INSERT INTO "file_list" ("id", "file_no", "category", "title", "doc1", "entry_date_real") VALUES
(3042, 'MSB/CB/SR/', 'Special Report', '3rd February, 2020 Press Conference jointly called by Mizo Students Union (MSU) and Aizawl City College Joint Students Union (ACCJSU) Â was held', '', '2020-02-04');
INSERT INTO "file_list" ("id", "file_no", "category", "title", "doc1", "entry_date_real") VALUES
(3043, 'MSB/CB/SR/', 'Special Report', '11th February, 2020 group of 5 to 6 unidentified masked men, allegedly armed with 2 (two) local made Guns and Dao, threatened and robbed 3(three) families', '', '2020-02-11');
INSERT INTO "file_list" ("id", "file_no", "category", "title", "doc1", "entry_date_real") VALUES
(3044, 'MSB/CB/SR/', 'Special Report', '3rd February, 2020 Press Conference jointly called by Mizo Students Union (MSU) and Aizawl City College Joint Students Union (ACCJSU) Â was held', '', '2023-02-03');
INSERT INTO "file_list" ("id", "file_no", "category", "title", "doc1", "entry_date_real") VALUES
(3045, 'MSB/CB/SR/', 'Special Report', '11th February, 2020 group of 5 to 6 unidentified masked men, allegedly armed with 2 (two) local made Guns and Dao, threatened and robbed 3(three) families who are employed as caretakers of WRC (Wet Rice Cultivation)', '', '2020-02-11');
INSERT INTO "file_list" ("id", "file_no", "category", "title", "doc1", "entry_date_real") VALUES
(3046, 'MSB/CB/SR/', 'Special Report', '25th February, 2020 Misael Lalremruatpuia (13) s/o Vanlalmawia of W.Lungdar, Mamit District was alleged to have been abducted by 3 (three) unidentified non-Mizos', '', '2020-02-25');
INSERT INTO "file_list" ("id", "file_no", "category", "title", "doc1", "entry_date_real") VALUES
(3047, 'MSB/CB/SR/', 'Special Report', '6th January, 2020. Mizo Zirlai Pawl (MZP) and North East Students Organization (NESO) are planning to go ahead', '', '2020-01-06');
INSERT INTO "file_list" ("id", "file_no", "category", "title", "doc1", "entry_date_real") VALUES
(3048, 'MSB/CB/SR/', 'Special Report', '13th January, 2020 NGOs of Bungtlang South and Nghalimlui are intending to organize procession on 14.1.2020 @ 9:00 a.m at Vaseikai, Lawngtlai District', '', '2020-01-13');
INSERT INTO "file_list" ("id", "file_no", "category", "title", "doc1", "entry_date_real") VALUES
(3049, 'MSB/CB/SR/', 'Special Report', '14th January, 2020 NGOs of Bungtlang South organized procession today, i.e. 14.1.2020 @ 2:30 p.m from Vaseikai to Nghalimlui, Lawngtlai District in protest against the alleged murder of Lalrawnliana (32) S/o A. Lalhmuaka', '', '2020-01-14');
INSERT INTO "file_list" ("id", "file_no", "category", "title", "doc1", "entry_date_real") VALUES
(3050, 'MSB/CB/SR/', 'Special Report', '20th January, 2020 Assam Rifles (AR) personnel posted at Zokhawthar resumed detention of trucks carrying areca nut at Zokhawthar', '', '2020-01-20');
INSERT INTO "file_list" ("id", "file_no", "category", "title", "doc1", "entry_date_real") VALUES
(3051, 'MSB/CB/SR/', 'Special Report', '31st January, 2020 MSU leaders are understood to be furious for being booked in a criminal case in connection with vandalism of Chakma House, Aizawl', '', '2020-01-31');
INSERT INTO "file_list" ("id", "file_no", "category", "title", "doc1", "entry_date_real") VALUES
(3052, 'MSB/CB/SR/', 'Special Report', '31st Â July, 2020 various business and transport associations of Champhai as well as Chhungte village community are having resentment and appears to be developing an anti-Assam Rifles (AR) sentiment mainly due to vario', '', '2020-07-31');
INSERT INTO "file_list" ("id", "file_no", "category", "title", "doc1", "entry_date_real") VALUES
(3053, 'MSB/CB/SR/', 'Special Report', '11.3.2020 CID (SB) had seized 5 (five) numbers of .22 Caliber Rifle A.K model (made in China) along with 10 (ten) nos. of magazine', '', '2020-03-11');
INSERT INTO "file_list" ("id", "file_no", "category", "title", "doc1", "entry_date_real") VALUES
(3054, 'MSB/CB/SR/', 'Special Report', '16th March, 2020 13.3.2020 an altercation occurred between some youths of Lungpuk, Siaha District and Ralie (Myanmar)', '', '2020-03-16');
INSERT INTO "file_list" ("id", "file_no", "category", "title", "doc1", "entry_date_real") VALUES
(3055, 'MSB/CB/SR/', 'Special Report', '16th March, 2020 13.3.2020 an altercation occurred between some youths of Lungpuk, Siaha District and Ralie (Myanmar).', '', '2020-03-16');
INSERT INTO "file_list" ("id", "file_no", "category", "title", "doc1", "entry_date_real") VALUES
(3056, 'MSB/CB/SR/', 'Special Report', '17th March, 2020 MZP is learnt to be extremely disappointed and unhappy over recent resumption of construction works of Masjid at Zophai, Bairabi by the Kachurthal Masjid Committee.', '', '2020-03-17');
INSERT INTO "file_list" ("id", "file_no", "category", "title", "doc1", "entry_date_real") VALUES
(3057, 'MSB/CB/SR/', 'Special Report', '19th May, 2020 Pu Vanlalrova @ Marova, Ex VCP Bairabi, Kolasib District visited his paddy field at Zophai near Mizoram-Assam border', '', '2020-05-19');
INSERT INTO "file_list" ("id", "file_no", "category", "title", "doc1", "entry_date_real") VALUES
(3058, 'MSB/CB/SR/', 'Special Report', '9th May, 2020 members of South Chawilung Branch YMA who perform border guard duty at Chandarabighat, a sub-village under Khojoisury VC, Lunglei District', '', '2020-05-09');
INSERT INTO "file_list" ("id", "file_no", "category", "title", "doc1", "entry_date_real") VALUES
(3059, 'MSB/CB/SR/', 'Special Report', '19.11.2020', '', '2020-11-19');
INSERT INTO "file_list" ("id", "file_no", "category", "title", "doc1", "entry_date_real") VALUES
(3060, 'MSB/CB/SR/', 'Special Report', '1st November, 2020 MSU General Headquarters convened its Executive Meeting today, i.e., 1.11.2020 @ 10:00 a.m. at Zirlaite Run, MSU Pisa Pui, Aizawl', '', '2020-11-01');
INSERT INTO "file_list" ("id", "file_no", "category", "title", "doc1", "entry_date_real") VALUES
(3061, 'MSB/CB/SR/', 'Special Report', '9th October, 2020 Babujoy, Vice President, SONGRONGMA (Conglomerate of various Bru NGOs) held a Press Conference', '', '2020-10-09');
INSERT INTO "file_list" ("id", "file_no", "category", "title", "doc1", "entry_date_real") VALUES
(3062, 'MSB/CB/SR/', 'Special Report', '10th October, 2020 MZP General Headquarters Executive Meeting was held at MZP Conference Hall, Aizawl.', '', '2020-10-10');
INSERT INTO "file_list" ("id", "file_no", "category", "title", "doc1", "entry_date_real") VALUES
(3063, 'MSB/CB/SR/', 'Special Report', '11th October, 2020 around 15 (fifteen) Assam Police personnel came with 2 (two) LMVsÂ  (Sumo and Gypsy) near Pu John Zolawma''s Jhum Hut which was burnt down on 10.10.2020 at Mizoram-Assam border', '', '2020-10-11');
INSERT INTO "file_list" ("id", "file_no", "category", "title", "doc1", "entry_date_real") VALUES
(3064, 'MSB/CB/SR/', 'Special Report', '14th October, 2020 Press Conference was held by JAC on Inner Line Forest Demand Committee (A conglomerate of 18 (eighteen) NGOs', '', '2020-10-27');
INSERT INTO "file_list" ("id", "file_no", "category", "title", "doc1", "entry_date_real") VALUES
(3065, 'MSB/CB/SR/', 'Special Report', '17th October, 2020  (seven) Assam Police and Forest officials visited COVID-19 duty post set up at the outskirt of Saihapui ''V'' Village, Kolasib District', '', '2020-10-17');
INSERT INTO "file_list" ("id", "file_no", "category", "title", "doc1", "entry_date_real") VALUES
(3066, 'MSB/CB/SR/', 'Special Report', '19th October, 2020 A meeting regarding maintenance of peace and tranquility in Assam-Mizoram Inter-State Border was held', '', '2020-10-19');
INSERT INTO "file_list" ("id", "file_no", "category", "title", "doc1", "entry_date_real") VALUES
(3067, 'MSB/CB/SR/', 'Special Report', '22nd October, 2020Â  Mizo IR Bn. Duty Post set up in the wake of COVID-19 pandemic at Vairengte Auto rickshaw Stand, Vairengte-Assam borderÂ Â Â Â Â Â Â Â ', '', '2020-10-22');
INSERT INTO "file_list" ("id", "file_no", "category", "title", "doc1", "entry_date_real") VALUES
(3068, 'MSB/CB/SR/', 'Special Report', '28th October, 2020 Shri. Mevar Kumar Jamatia, Tripura Forest Minister); District Magistrate, North Tripura; SP, North Tripura; SDM, Kanchanpur; SDPO, Kanchanpur; DFO, Kanchanpur; SDFO, Kanchanpur and Leaders of Bru Hindu ', '', '2020-10-28'),
(3069, 'MSB/CB/SR/', 'Special Report', '4th September, 2020Â Â Â Â Â  Krawshmingthanga (29) s/o Nghakliana of Saizawh West, Lawngtlai District and his two Mizo friends went to Saizawh West High School site (located at around one km from Saizawh villa', '', '2020-09-04'),
(3070, 'MSB/CB/SR/', 'Special Report', '14th September, 2020 COVID-19 Rapid Antigen Test (RAT) was conducted among stranded truckers of Kolasib District', '', '2020-09-14'),
(3071, 'MSB/CB/SR/', 'Special Report', '25th September, 2020. Mizoram Oil Tanker Driversâ€™ Association (MOTDA) halted ferrying of Oil and preparation of Challan\r\n\r\nÂ Â Â Â Â Â Â Â Â Â Â ', '', '2020-09-25'),
(3072, 'MSB/CB/SR/', 'Special Report', '2nd August, 2021 road blockade was organized by civilians of Assam at Tripura-Assam border at Loirpowa, Karimganj district, Assam', '', '2020-08-02'),
(3073, 'MSB/CB/SR/', 'Special Report', '4th August, 2021 Lalmuanawma (25) S/o R Lalrintluanga, Bungthuam, Mamit district, who proceeded for Kanhmun', '', '2021-08-04'),
(3074, 'MSB/CB/SR/', 'Special Report', '13th Aug, 2021 Assam started construction of bridge\r\n(which appears to be Bailey bridge) near the existing bamboo bridge across Saihapui V river w.e.f. 11.8.2021 which will connect Pu Chalchhunga farm', '', '2021-08-13'),
(3075, 'MSB/CB/SR/', 'Special Report', '26th Aug., 2021 Joint Operation team of CID (SB) and SIB, Mizoram recovered and seized 5 lakhs tablets of Methamphetamine', '', '2021-08-26'),
(3076, 'MSB/CB/A-156', 'Translation of Local Newspapers', 'Dt. 1.4.2013', '', '2023-04-01'),
(3077, 'MSB/CB/A-156', 'Translation of Local Newspapers', '2.4.2013', '', '2013-04-02'),
(3078, 'MSB/CB/A-156', 'Translation of Local Newspapers', '3.4.2013', '', '2013-04-02'),
(3079, 'MSB/CB/A-156', 'Translation of Local Newspapers', '4.4.2013', '', '2013-04-04'),
(3080, 'MSB/CB/A-156', 'Translation of Local Newspapers', '5.4.2013', '', '2013-04-05'),
(3081, 'MSB/CB/A-156', 'Translation of Local Newspapers', '8.4.2013', '', '2013-04-08'),
(3082, 'MSB/CB/A-156', 'Translation of Local Newspapers', '9.4.2013', '', '2013-04-09'),
(3083, 'MSB/CB/A-156', 'Translation of Local Newspapers', '10.4.2013', '', '2013-04-10'),
(3084, 'MSB/CB/A-156', 'Translation of Local Newspapers', '11.4.2013', '', '2013-04-11'),
(3085, 'MSB/CB/A-156', 'Translation of Local Newspapers', '12.4.2013', '', '2013-04-12'),
(3086, 'MSB/CB/A-156', 'Translation of Local Newspapers', '15.4.2013', '', '2013-04-15'),
(3087, 'MSB/CB/A-156', 'Translation of Local Newspapers', '16.4.2013', '', '2013-04-16'),
(3088, 'MSB/CB/A-156', 'Translation of Local Newspapers', '17.4.2013', '', '2013-04-17'),
(3089, 'MSB/CB/A-156', 'Translation of Local Newspapers', '18.4.2013', '', '2013-04-18'),
(3090, 'MSB/CB/A-156', 'Translation of Local Newspapers', '19.4.2013', '', '2013-04-19'),
(3091, 'MSB/CB/A-156', 'Translation of Local Newspapers', '23.4.2013', '', '2013-04-23'),
(3092, 'MSB/CB/A-156', 'Translation of Local Newspapers', '25.4.2013', '', '2013-04-25'),
(3093, 'MSB/CB/A-156', 'Translation of Local Newspapers', '26.4.2013', '', '2013-04-26'),
(3094, 'MSB/CB/A-156', 'Translation of Local Newspapers', '29.4.2013', '', '2013-04-29'),
(3095, 'MSB/CB/A-156', 'Translation of Local Newspapers', '30.4.2013', '', '2013-04-30'),
(3096, 'MSB/CB/A-156', 'Translation of Local Newspapers', '1.8.2013', '', '2013-08-01'),
(3097, 'MSB/CB/A-156', 'Translation of Local Newspapers', '2.8.2013', '', '2013-08-02'),
(3098, 'MSB/CB/A-156', 'Translation of Local Newspapers', '5.8.2013', '', '2013-08-05'),
(3099, 'MSB/CB/A-156', 'Translation of Local Newspapers', '6.8.2013', '', '2013-08-06'),
(3100, 'MSB/CB/A-156', 'Translation of Local Newspapers', '7.8.2013', '', '2013-08-07'),
(3101, 'MSB/CB/A-156', 'Translation of Local Newspapers', '8.8.2013', '', '2013-08-08'),
(3102, 'MSB/CB/A-156', 'Translation of Local Newspapers', '12.8.2013', '', '2013-08-12'),
(3103, 'MSB/CB/A-156', 'Translation of Local Newspapers', '13.8.2013', '', '2013-08-13'),
(3104, 'MSB/CB/A-156', 'Translation of Local Newspapers', '14.8.2013', '', '2013-08-14'),
(3105, 'MSB/CB/A-156', 'Translation of Local Newspapers', '16.8.2013', '', '2013-08-16'),
(3106, 'MSB/CB/A-156', 'Translation of Local Newspapers', '19.8.2013', '', '2013-08-19'),
(3107, 'MSB/CB/A-156', 'Translation of Local Newspapers', '20.8.2013', '', '2013-08-20'),
(3108, 'MSB/CB/A-156', 'Translation of Local Newspapers', '21.8.2013', '', '2013-08-21'),
(3109, 'MSB/CB/A-156', 'Translation of Local Newspapers', '22.8.2013', '', '2013-08-22'),
(3110, 'MSB/CB/A-156', 'Translation of Local Newspapers', '23.8.2013', '', '2013-08-23'),
(3111, 'MSB/CB/A-156', 'Translation of Local Newspapers', '26.8.2013', '', '2013-08-26'),
(3112, 'MSB/CB/A-156', 'Translation of Local Newspapers', '27.8.2013', '', '2013-08-27'),
(3113, 'MSB/CB/A-156', 'Translation of Local Newspapers', '29.8.2013', '', '2013-08-29'),
(3114, 'MSB/CB/A-156', 'Translation of Local Newspapers', '30.8.2013', '', '2013-08-30'),
(3115, 'MSB/CB/SR/', 'Special Report', 'REPORT OF FIRE INCIDENT AT DC OFFICE, AIZAWL ON 17.12.2021', '', '2021-12-17'),
(3116, 'MSB/CB/SR/', 'Special Report', 'All Institution CR (Class Representative) Committee (Inside Mizoram & Outside Mizoram) in its Notice issued', '', '2021-12-02'),
(3117, 'MSB/CB/SR/', 'Special Report', 'A fire broke out from Election Branch, DC Office, Aizawl', '', '2021-12-17'),
(3118, 'MSB/CB/SR/', 'Special Report', '5 (five) youths from Laisawral village, Lunglei District who went to Marpara North, Mamit District for shopping were disturbed by 3 (three) Chakma youths', '', '2021-12-27'),
(3119, 'MSB/CB/SR/', 'Special Report', 'road widening work under Pradhan Mantri Gramin Sadhak Yojana (PMGSY) was started by Assam at Assam - Mizoram border', '', '2021-02-09'),
(3120, 'MSB/CB/SR/', 'Special Report', 'Bairabi All NGO Emergency Meeting was held', '', '2021-02-11'),
(3121, 'MSB/CB/SR/', 'Special Report', 'around 20 (twenty) youths from Vairengte under the aegis of Joint VC, Vairengte and Mizoram Police constructed makeshift camp for Mizoram Police', '', '2021-07-01'),
(3122, 'MSB/CB/SR/', 'Special Report', 'Assam Government intended to construct road up to Upper Phainuam Lower Primary School', '', '2021-07-09'),
(3123, 'MSB/CB/SR/', 'Special Report', 'Assam government started construction of road from Pu Chalchhunga of Buarchep, Kolasib District paddy field, near Hawaithang Junction', '', '2021-07-10'),
(3124, 'MSB/CB/SR/', 'Special Report', '11.7.2021 @ 2:40 a.m. and 2:43 a.m. 2 (two) loud explosions were heard inside the forest at the disputed area by Mizoram Police', '', '2021-07-11'),
(3125, 'MSB/CB/SR/', 'Special Report', 'Assam intended to enter into Mizoram and take new initiative by setting up camp near Tuikhuahlian Bridge', '', '2021-07-17'),
(3126, 'MSB/CB/SR/', 'Special Report', 'around 200 (two hundred) Assam Police led by Shri. Anurag Agarwal, IGP, Assam arrived at Vairengte Auto Stand, near Vairengte (inside Mizoram territory)', '', '2021-07-26'),
(3127, 'MSB/CB/SR/', 'Special Report', 'railway tracks connecting to Bairabi, Mizoram was uprooted by local people in between Mohammadpur, Katlicherra and Lala Bazar, Assam', '', '2021-07-28'),
(3128, 'MSB/CB/SR/', 'Special Report', 'a group of Assam Police Commando arrived at Assam Temporary Duty Post, opposite to Mizoram Temporary Duty Post at Bilpadawp Tlang, Chuhvel,', '', '2021-07-30'),
(3129, 'MSB/CB/SR/', 'Special Report', 'Assam Police constructed Sentry Duty Post using sand bags in the middle of the road (KDZKT Road) at the edge of Medili Bridge, Mizoram-Assam border, o', '', '2021-07-31'),
(3130, 'MSB/CB/SR/', 'Special Report', '1 (one) Bolero believed to be carrying officials of Assam entered Chuhvel village, Mamit distric', '', '2021-06-03'),
(3131, 'MSB/CB/SR/', 'Special Report', '2 (two) unoccupied farm huts located at approximately 1.1 km north of Zophai Mizoram Police BOP, Kolasib district,', '', '2021-06-05'),
(3132, 'MSB/CB/SR/', 'Special Report', 'Shri. Rohan Kumar Jha, DC, Hailakandi, Assam; Smt. Ramandeep Kaur, SP, Hailakandi; Assam Forest Officials and around 70 (seventy) Assam Police personnel and civilians from Gutguti village', '', '2021-06-11'),
(3133, 'MSB/CB/SR/', 'Special Report', 'Pu C. Vanlalzawma of Bairabi, Kolasib district (ph-8974419602) has seen 5 (five) small motorized boats boarded by around 50 (fifty) Assam Police personnel and proceeded upstream at Tlawng River', '', '2021-06-16'),
(3134, 'MSB/CB/SR/', 'Special Report', '9.6.2021 @ 7:00 a.m. around 120 (one hundred twenty) Assam Police led by Mr. Nirmal Gosh, Dy. SP (Border), Hailakandi District visited the farm land owned by Pu Ramhluna of Vairengte Chhim Veng, located at around 5 km No', '', '2021-06-29'),
(3135, 'MSB/CB/SR/', 'Special Report', 'around 60 (sixty) youths of Vairengte who were proceeding towards\r\nPu Ramhluna''s farm land', '', '2021-06-30'),
(3136, 'MSB/CB/SR/', 'Special Report', 'Mizo Studentsâ€™ Union General Headquarters held its extended OB Meeting today, i.e., 8.3.2021 @ 11:00 a.m. at MSU Office.', '', '2021-03-08'),
(3137, 'MSB/CB/SR/', 'Special Report', 'MPCC called a Press Conference today, i.e., 16.3.2021 @ 2:00 p.m. at Aizawl Press Club under the guidance of Dr. Lallianchhunga, Media Chairman and 17 (seventeen) persons', '', '2021-03-16'),
(3138, 'MSB/CB/SR/', 'Special Report', 'All NGOs of Champhai held a meeting today, i.e., 14.5.2021 under the aegis of Sub-Headquarters YMA Champhai', '', '2021-05-14'),
(3139, 'MSB/CB/SR/', 'Special Report', '6.11.2021 @10:25 a.m. a suspicious packet attached with wire (approx. 2 kgs) was found by Assam Police near the construction site of Bridge connecting Pu Chalchhungaâ€™s farm land', '', '2021-11-08'),
(3140, 'MSB/CB/SR/', 'Special Report', '6.11.2021 @10:25 a.m. a suspicious packet attached with wire (approx. 2 kgs) was found by Assam Police near the construction site of Bridge connecting Pu Chalchhungaâ€™s farm', '', '2021-11-08'),
(3141, 'MSB/CB/SR/', 'Special Report', 'around 500 (five hundred) residents of Dulte and Kawlkulh, Khawzawl District, gathered at DBL Construction Camp, Dulte', '', '2022-03-01'),
(3142, 'MSB/CB/SR/', 'Special Report', 'Pu Lalfakawma (25) S/o Hunlawma of Chuhvel, Mamit District; Pu Lalmuanthanga (20) S/o Lalrinmawia of Chuhvel; Pu Baniram(18) S/o Lalthara and Pu Lalduhawma (28) S/o Ramoni both of Bawngva, Mamit District, left Chuhvel la', '', '2021-10-29'),
(3143, 'MSB/CB/SR/', 'Special Report', 'there are more than 600 (six) Bru Voters (who are presently residing in Tripura Bru Transit camps) having votes at Zodin (Rastali) and Hortoki Polling Stations and out of which, around 150 (one hundred fifty) Brus voters', '', '2021-10-29'),
(3144, 'MSB/CB/SR/', 'Special Report', '40 (forty) Assam Armed Police personnel physically assaulted, intimidated and wrongfully detained Lalnarammawia (42) S/o Biakmawia (L) of Kolasib Vengthar', '', '2021-09-02'),
(3145, 'MSB/CB/SR/', 'Special Report', 'there has been a large-scale influx of Myanmar refugees into Mizoram after the recent intense fighting between the Chinland Defense Force (CDF) comprising of armed civilians led by Chin National Army (CNA) and Myanmar ar', '', '2021-09-15'),
(3146, 'MSB/CB/SR/', 'Special Report', 'the bridge constructed across Tlawngte River, situated in between Thinghlun, Mizoram and Kalagang, Assam, and around 1 km from Mizoram Police camp at Thinghlun, Mamit District, Mizoram, was reportedly burnt', '', '2022-02-25'),
(3147, 'MSB/CB/SR/', 'Special Report', 'Demand Letters using HPC (D) official Letter Head demanding money (ranging from Rs. 30,000/- to Rs. 1,60,000/-) was served to non-Mizos', '', '2022-01-10'),
(3148, 'MSB/CB/SR/', 'Special Report', 'NGO Coordination Committee (NGOCC) held a meeting in connection with their demand for cancellation of the Transfer Order of Pi Maria CT Zuali, DC, Champhai', '', '2022-01-19'),
(3149, 'MSB/CB/SR/', 'Special Report', 'the bridge across Tlawngte river, situated in between Thinghlun, Mizoram and Kalagang, Assam, and around 1 km from Mizoram Police Camp at Thinghlun, Mamit District, Mizoram, which was burnt down on 24.2.2022', '', '2022-03-02'),
(3150, 'MSB/CB/SR/', 'Special Report', '15 (fifteen) Assam Police and Forest Department personnel led byShri. N. Lahan, OC, Ramnathpur PS, Assam, came to the farm house of\r\nPu Laldinpuia Ralte, Ramthar Veng, Bairabi', '', '2022-03-11'),
(3151, 'MSB/CB/SR/', 'Special Report', '6 (six) cadres of Kuki-Chin National Front (KNF) have been apprehended near Parva-II, Lawngtlai district by the BSF deployed at BOP Parva', '', '2022-03-25'),
(3152, 'MSB/CB/SR/', 'Special Report', 'NGO Coordination Committee (NGOCC) held its Emergency Meeting on 27.5.2022 @ 8:00 p.m. at CYMA Office, Tuikhuahtlang, Aizawl.', '', '2022-05-29'),
(3153, 'MSB/CB/B-170', 'IGP/DIG Concern file', '48th All India Police Science Congress - reg', '', '2022-10-04'),
(3154, 'MSB/CB/B-170', 'IGP/DIG Concern file', 'SEIZURE OF ARMS AND AMMUNITIONS BY VARIOUS LAW ENFORCEMENT AGENCIES OF THE STATE', '', '2022-07-25'),
(3155, 'MSB/CB/B-144', 'Intelligence/Inputs received from other agencies/ ISIST', 'Enquiry on Facebook Post.', '', '2022-09-08'),
(3156, 'MSB/CB/B-85/Arms', 'Arms, Smuggling etc.', 'Pu H.Lalengmawia Letter', '', '2022-11-15'),
(3157, 'MSB/CB/B-85/Arms', 'Arms, Smuggling etc.', 'TO WHOM IT MAY CONCERN', '', '2022-09-13'),
(3158, 'MSB/CB/B-85/Arms', 'Arms, Smuggling etc.', 'Action taken report in connection with sale of arms license in Social media', '', '2022-11-07'),
(3159, 'MSB/CB/B-85/Arms', 'Arms, Smuggling etc.', 'Mizoram share international border with MyanmarÂ  and Bangladesh, the length of which are 496.531 kms and 319.791 kms respectively', '', '2022-11-15'),
(3160, 'MSB/CB/A-156', 'Translation of Local Newspapers', '11.12.2013', '', '2013-12-11'),
(3161, 'MSB/CB/A-156', 'Translation of Local Newspapers', '12.12.2013', '', '2013-12-12'),
(3162, 'MSB/CB/A-156', 'Translation of Local Newspapers', '13.12.2013', '', '2013-12-13'),
(3163, 'MSB/CB/A-156', 'Translation of Local Newspapers', '16.12.2013', '', '2013-12-16'),
(3164, 'MSB/CB/A-156', 'Translation of Local Newspapers', '17.12.2013', '', '2013-12-17'),
(3165, 'MSB/CB/A-156', 'Translation of Local Newspapers', '18.12.2013', '', '2013-12-18'),
(3166, 'MSB/CB/A-156', 'Translation of Local Newspapers', '19.12.2013', '', '2013-12-19'),
(3167, 'MSB/CB/A-156', 'Translation of Local Newspapers', '20.12.2013', '', '2013-12-20'),
(3168, 'MSB/CB/A-156', 'Translation of Local Newspapers', '01.02.2013', '', '2013-02-01'),
(3169, 'MSB/CB/A-156', 'Translation of Local Newspapers', '04.02.2013', '', '2013-02-04'),
(3170, 'MSB/CB/A-156', 'Translation of Local Newspapers', '05.02.2013', '', '2013-02-05'),
(3171, 'MSB/CB/A-156', 'Translation of Local Newspapers', '06.02.2013', '', '2013-02-06'),
(3172, 'MSB/CB/A-156', 'Translation of Local Newspapers', '7.2.2013', '', '2013-02-07'),
(3173, 'MSB/CB/A-156', 'Translation of Local Newspapers', '8.2.2013', '', '2013-02-08'),
(3174, 'MSB/CB/A-156', 'Translation of Local Newspapers', '11.2.2013', '', '2013-02-11'),
(3175, 'MSB/CB/A-156', 'Translation of Local Newspapers', '12.2.2013', '', '2013-02-12'),
(3176, 'MSB/CB/A-156', 'Translation of Local Newspapers', '13.2.2013', '', '2013-02-13'),
(3177, 'MSB/CB/A-156', 'Translation of Local Newspapers', '14.2.2013', '', '2013-02-14'),
(3178, 'MSB/CB/A-156', 'Translation of Local Newspapers', '15.2.2013', '', '2013-02-15'),
(3179, 'MSB/CB/A-156', 'Translation of Local Newspapers', '18.2.2013', '', '2013-02-18'),
(3180, 'MSB/CB/A-156', 'Translation of Local Newspapers', '19.02.2013', '', '2013-02-19'),
(3181, 'MSB/CB/A-156', 'Translation of Local Newspapers', '21.2.2013', '', '2013-02-21'),
(3182, 'MSB/CB/A-156', 'Translation of Local Newspapers', '22.2.2013', '', '2013-02-22'),
(3183, 'MSB/CB/A-156', 'Translation of Local Newspapers', '25.2.2013', '', '2013-02-25'),
(3184, 'MSB/CB/A-156', 'Translation of Local Newspapers', '26.2.2013', '', '2013-02-26'),
(3185, 'MSB/CB/A-156', 'Translation of Local Newspapers', '27.02.2013', '', '2013-02-27'),
(3186, 'MSB/CB/A-156', 'Translation of Local Newspapers', '10.1.2013', '', '2013-01-10'),
(3187, 'MSB/CB/A-156', 'Translation of Local Newspapers', '14.1.2013', '', '2013-01-14'),
(3188, 'MSB/CB/A-156', 'Translation of Local Newspapers', '15.1.2013', '', '2013-01-15'),
(3189, 'MSB/CB/A-156', 'Translation of Local Newspapers', '16.1.2013', '', '2013-01-16'),
(3190, 'MSB/CB/A-156', 'Translation of Local Newspapers', '17.1.2013', '', '2013-01-17'),
(3191, 'MSB/CB/A-156', 'Translation of Local Newspapers', '22.1.2013', '', '2013-01-22'),
(3192, 'MSB/CB/A-156', 'Translation of Local Newspapers', '23.1.2013', '', '2013-01-23'),
(3193, 'MSB/CB/A-156', 'Translation of Local Newspapers', '24.1.2013', '', '2013-01-24'),
(3194, 'MSB/CB/A-156', 'Translation of Local Newspapers', '27 & 28.1.2013', '', '2013-01-28'),
(3195, 'MSB/CB/A-156', 'Translation of Local Newspapers', '29.1.2013', '', '2013-01-29'),
(3196, 'MSB/CB/A-156', 'Translation of Local Newspapers', '30.1.2013', '', '2013-01-30'),
(3197, 'MSB/CB/A-156', 'Translation of Local Newspapers', '30.1.2013', '', '2013-01-30'),
(3198, 'MSB/CB/A-156', 'Translation of Local Newspapers', '1.7.2013', '', '2013-07-01'),
(3199, 'MSB/CB/A-156', 'Translation of Local Newspapers', '2.7.2013', '', '2013-07-02'),
(3200, 'MSB/CB/A-156', 'Translation of Local Newspapers', '3.7.2013', '', '2013-07-03'),
(3201, 'MSB/CB/A-156', 'Translation of Local Newspapers', '4.7.2013', '', '2013-07-04'),
(3202, 'MSB/CB/A-156', 'Translation of Local Newspapers', '5.7.2013', '', '2013-07-05'),
(3203, 'MSB/CB/A-156', 'Translation of Local Newspapers', '8.7.2013', '', '2013-07-08'),
(3204, 'MSB/CB/A-156', 'Translation of Local Newspapers', '9.7.2013', '', '2013-07-09'),
(3205, 'MSB/CB/A-156', 'Translation of Local Newspapers', '10.7.2013', '', '2013-07-10'),
(3206, 'MSB/CB/A-156', 'Translation of Local Newspapers', '11.7.2013', '', '2013-07-11'),
(3207, 'MSB/CB/A-156', 'Translation of Local Newspapers', '12.7.2013', '', '2013-07-12'),
(3208, 'MSB/CB/A-156', 'Translation of Local Newspapers', '15.7.2013', '', '2013-07-15'),
(3209, 'MSB/CB/A-156', 'Translation of Local Newspapers', '16.7.2013', '', '2013-07-16'),
(3210, 'MSB/CB/A-156', 'Translation of Local Newspapers', '17.7.2013', '', '2013-07-17'),
(3211, 'MSB/CB/A-156', 'Translation of Local Newspapers', '18.7.2013', '', '2013-07-18'),
(3212, 'MSB/CB/A-156', 'Translation of Local Newspapers', '19.7.2013', '', '2013-07-19'),
(3213, 'MSB/CB/A-156', 'Translation of Local Newspapers', 'Â 22.7.2013', '', '2013-07-22'),
(3214, 'MSB/CB/A-156', 'Translation of Local Newspapers', 'Â 23.7.2013', '', '2013-07-23'),
(3215, 'MSB/CB/A-156', 'Translation of Local Newspapers', '24.7.2013', '', '2013-07-24'),
(3216, 'MSB/CB/A-156', 'Translation of Local Newspapers', '25.7.2013', '', '2013-07-25'),
(3217, 'MSB/CB/A-156', 'Translation of Local Newspapers', '26.7.2013', '', '2013-07-26'),
(3218, 'MSB/CB/A-156', 'Translation of Local Newspapers', '29.7.2013', '', '2013-07-29'),
(3219, 'MSB/CB/A-156', 'Translation of Local Newspapers', '30.7.2013', '', '2013-07-30'),
(3220, 'MSB/CB/A-156', 'Translation of Local Newspapers', '31.7.2013', '', '2013-07-31'),
(3221, 'MSB/CB/B-71/L&S', 'Lok Sabha/Rajya Sabha Question', 'RajyaÂ  SabhaÂ  UnstarredÂ  QuestionÂ  Dy.No. U3598', '', '2022-12-29'),
(3222, 'MSB/CB/B-71/L&S', 'Lok Sabha/Rajya Sabha Question', 'Rajya Sabha Starred/Unstarred Question Dy.No.S3103 regarding \"Illegal migration through border\".', '', '2022-07-29'),
(3223, 'MSB/CB/B-73/MLA', 'Mizoram Legislative Assembly/ Cabinet Meeting', 'Cabinet Meeting was held under the chairmanship of Pu Zoramthanga, Chief Minister of Mizoram Â on 1.2.2022', '', '2022-02-02'),
(3224, 'MSB/CB/B-74(C)', 'DGP concern file/circular', 'DSI Corespondent', '', '2022-07-21'),
(3225, 'MSB/CB/B-74(C)', 'DGP concern file/circular', 'REPORT ON INTENDED CONSTRUCTION OF SHIV MANDIR AT THAIDAWR TLANG, MIZORAM-TRIPURA BORDER:', '', '2022-07-09'),
(3226, 'MSB/CB/B-74(C)', 'DGP concern file/circular', 'REPORT ON INFRASTRUCTURE DEVELOPMENT PROJECT UNDERTAKEN BY TRIPURA TOURISM DEPARTMENT AT THAIDAWR TLANG, PHULDUNGSEI MIZORAM', '', '2022-05-05'),
(3227, 'MSB/CB/B-74(C)', 'DGP concern file/circular', 'NOTES ON PREVAILING DRUG SITUATION IN MIZORAM', '', '2022-07-21'),
(3228, 'MSB/CB/B-74(C)', 'DGP concern file/circular', 'Urea from Tripura : Kanhmun PS C/No.10/2022 dt.10/5/2022 U/S 7(1)(a) Essential Commodities Act was registered on the basis of FIR submitted by ASI H. Lalthasanga (41 yrs, s/o Vanlalfaka(L)) of Zawlnuam Police Outpost', '', '2022-07-21'),
(3229, 'MSB/CB/B-74(C)', 'DGP concern file/circular', 'Â  Please find enclosed herewith a write-up notes for perusal of DGP(M), as per your instruction.', '', '2022-07-21'),
(3230, 'MSB/CB/B-74(C)', 'DGP concern file/circular', 'Action taken report on the meeting minutes of Task Group on Second Line of Defence - Point No.10.', '', '2022-05-11'),
(3231, 'MSB/CB/B-74(C)', 'DGP concern file/circular', 'Names and addresses of NGOs leaders and prominent social activists.', '', '2022-04-19'),
(3232, 'MSB/CB/B-74(C)', 'DGP concern file/circular', 'NOTES Â FOR Â REGIONAL Â MEETING Â ON Â DRUG Â TRAFFICKING Â AND NATIONAL Â SECURITY :', '', '2022-09-30'),
(3233, 'MSB/CB/B-77(M)', 'Look Out Notice of Mizoram', 'VERIFICATION ON 15448790XÂ  SEP(AMBASST) JOHNY LALMALSAWMA WHO WAS FOUND ABSENT', '', '2022-12-07'),
(3234, 'MSB/CB/B-81/Misc', 'Miscellaneous', 'Comments on Draft Standing Order No. 1/2022.', '', '2022-07-20'),
(3235, 'MSB/CB/B-81/Misc', 'Miscellaneous', 'Compilation of data on Terror Financing and Terror incident cases under Â Â Â Â Â Â Â Â Â Â Â Â Â Â Â Â Â Â Â  UAPA - reg.', '', '2022-04-05'),
(3236, 'MSB/CB/B-82/IR Day', 'Independence/Republic Day', 'Independence Day Speech of Hon''ble Chief Minister of Mizoram to be delivered on 15.08.2022.', '', '2022-06-21'),
(3237, 'MSB/CB/B-82/IR Day', 'Independence/Republic Day', 'Assessment of Threat perception.', '', '2022-08-10'),
(3238, 'MSB/CB/B-82/IR Day', 'Independence/Republic Day', 'CADRES(5-7) OF NLFT/BM EQUIPPED WITH AK-47 RIFLES ARE REPORTEDLY PRESENT IN PS-DIGHINALA, DISTRICT KHAGRACHARI, BANGLADESH OPPOSITE AREAS OF PS-CHAWMANU', '', '2022-01-25'),
(3239, 'MSB/CB/B-82/IR Day', 'Independence/Republic Day', 'Republic Day Speech of His Excellency The Governor of Mizoram to be delivered on 26.01.2023.', '', '2022-11-29'),
(3240, 'MSB/CB/B-82/IR Day', 'Independence/Republic Day', 'Republic Day Celebration 2022 - Security vetting of Home Guard personnel, NCC Cadet and individuals in the cultural troupes.', '', '2022-01-19'),
(3241, 'MSB/CB/B-82/IR Day', 'Independence/Republic Day', 'Republic Day Celebration 2022 - Security vetting of Home Guard personnel, NCC Cadet and individuals in the cultural troupes.', '', '2022-01-17'),
(3242, 'MSB/CB/B-82/IR Day', 'Independence/Republic Day', 'Assessment ofÂ  threat perception.', '', '2022-08-05'),
(3243, 'MSB/CB/B-82/IR Day', 'Independence/Republic Day', 'REPORT ON PARTICIPANTS FROM MIZORAM FOR THE REPUBLIC DAY CELEBRATIONS 2022 VIZ-A-VIS SECURITY VETTING/CHARACTER AND ANTECEDENTS IS HEREBY FURNISHED AS BELOW:', '', '2022-01-19'),
(3244, 'MSB/CB/B-144', 'Intelligence/Inputs received from other agencies/ ISIST', 'Enquiry on Facebook Post.', '', '2022-09-08'),
(3245, 'MSB/CB/B-170', 'IGP/DIG Concern file', '48th All India Police Science Congress - reg.', '', '2022-10-04'),
(3246, 'MSB/CB/B-170', 'IGP/DIG Concern file', 'SEIZURE OF ARMS AND AMMUNITIONS BY VARIOUS LAW ENFORCEMENT AGENCIES OF THE STATE', '', '2022-07-25'),
(3247, 'MSB/CB/B-61/Misc', 'Miscellaneous', 'Asteria Aero space', '', '2022-05-09'),
(3248, 'MSB/CB/B-61/Misc', 'Miscellaneous', 'Asteria Aerospace', '', '2022-05-09'),
(3249, 'MSB/CB/B-61/Misc', 'Miscellaneous', 'Asteria Aero Space', '', '2022-05-09'),
(3250, 'MSB/CB/B-61/Misc', 'Miscellaneous', 'A400', '', '2017-08-02'),
(3251, 'MSB/CB/B-61/Misc', 'Miscellaneous', 'A400', '', '2017-08-02'),
(3252, 'MSB/CB/B-61/Misc', 'Miscellaneous', 'Atom auto Pilot', '', '2017-08-02'),
(3254, 'MSB/CB/B-61/Misc', 'Miscellaneous', 'Asteria Aero space', '', '2017-08-02'),
(3255, 'MSB/CB/B-61/Misc', 'Miscellaneous', 'Drone', '', '2017-08-02'),
(3256, 'MSB/CB/B-61/Misc', 'Miscellaneous', 'Drone', '', '2017-08-02'),
(3257, 'MSB/CB/B-61/Misc', 'Miscellaneous', 'Examination of Drone', '', '2017-08-02'),
(3258, 'MSB/CB/B-61/Misc', 'Miscellaneous', 'Drone Founder', '', '2017-08-02'),
(3259, 'MSB/CB/B-61/Misc', 'Miscellaneous', 'Quality of Drone', '', '2017-08-02'),
(3260, 'MSB/CB/B-61/Misc', 'Miscellaneous', 'Services of Drone', '', '2017-08-02'),
(3261, 'MSB/CB/B-61/Misc', 'Miscellaneous', 'Categorization of districts in Mizoram.', '', '2022-12-22'),
(3262, 'MSB/CB/B-61/Misc', 'Miscellaneous', 'Communally sensitive areas in Mizoram - Reg.', '', '2022-07-15'),
(3263, 'MSB/CB/B-61/Misc', 'Miscellaneous', 'Â  Details of communally sensitive areas in Mizoram.', '', '2022-07-26'),
(3264, 'MSB/CB/B-61/Misc', 'Miscellaneous', 'Details of communally sensitive areas in Mizoram.', '', '2022-07-26'),
(3265, 'MSB/CB/B-61/Misc', 'Miscellaneous', 'Enquiry report NK Thangtea s/o Nangngaihliana of Ramhlun South', '', '2022-08-22'),
(3266, 'MSB/CB/B-61/Misc', 'Miscellaneous', 'Â  National Convention of AIKS, CITU and AIAWU', '', '2022-09-01'),
(3267, 'MSB/CB/B-61/Misc', 'Miscellaneous', 'UNIONS OR ORGANISATIONS RELATING TO TRADE AND AGRICULTURAL SECTORS IN MIZORAM', '', '2022-09-02'),
(3268, 'MSB/CB/B-61/Misc', 'Miscellaneous', 'Enquiry report on the arrest of NK Thangtea S/o. Nangngaihliana of Ramhlun South, Aizawl.', '', '2022-08-19'),
(3269, 'MSB/CB/B-61/Misc', 'Miscellaneous', 'No. MCID/A-3/2019/74Â Â Â Â Â Â Â Â Â Â Â Â  dt.13.3.2022.', '', '2022-03-25'),
(3270, 'MSB/CB/B-61/Misc', 'Miscellaneous', 'Â  No. MCID/A-3/2019/74Â Â Â Â Â Â Â Â Â Â Â Â  Dt.23.3.2022.', '', '2022-03-25'),
(3271, 'MSB/CB/B-61/Misc', 'Miscellaneous', 'SO, CID (SB) - LLI, SHA, CPI, TLB, CWTE, SCRP, VRTE,Â WPLG, BBI, SKDI, ZLN, KLB, LTI, MMT, STL, KHLN,Â HNTLÂ  (.) Â DT. 04.07.2022 (.)', '', '2022-07-04'),
(3272, 'MSB/CB/A-156', 'Translation of Local Newspapers', '3.6.2013', '', '2013-06-03'),
(3273, 'MSB/CB/A-156', 'Translation of Local Newspapers', '4.6.2013', '', '2013-06-04'),
(3274, 'MSB/CB/A-156', 'Translation of Local Newspapers', '5.6.2013', '', '2013-06-05'),
(3275, 'MSB/CB/A-156', 'Translation of Local Newspapers', '6.6.2013', '', '2013-06-06'),
(3276, 'MSB/CB/A-156', 'Translation of Local Newspapers', '7.6.2013', '', '2013-06-07'),
(3277, 'MSB/CB/A-156', 'Translation of Local Newspapers', '10.6.2013', '', '2013-06-10'),
(3278, 'MSB/CB/A-156', 'Translation of Local Newspapers', '11.6.2013', '', '2013-06-11'),
(3279, 'MSB/CB/A-156', 'Translation of Local Newspapers', '12.6.2013', '', '2013-06-12'),
(3280, 'MSB/CB/A-156', 'Translation of Local Newspapers', '13.6.2013', '', '2013-06-13'),
(3281, 'MSB/CB/A-156', 'Translation of Local Newspapers', '14.6.2013', '', '2013-06-14'),
(3282, 'MSB/CB/A-156', 'Translation of Local Newspapers', '17.6.2013', '', '2013-06-17'),
(3283, 'MSB/CB/A-156', 'Translation of Local Newspapers', '19.6.2013', '', '2013-06-19'),
(3284, 'MSB/CB/A-156', 'Translation of Local Newspapers', '20.6.2013', '', '2013-06-20'),
(3285, 'MSB/CB/A-156', 'Translation of Local Newspapers', '21.6.2013', '', '2013-06-21'),
(3286, 'MSB/CB/A-156', 'Translation of Local Newspapers', '24.6.2013', '', '2013-06-24'),
(3287, 'MSB/CB/A-156', 'Translation of Local Newspapers', '25.6.2013', '', '2013-06-25'),
(3288, 'MSB/CB/A-156', 'Translation of Local Newspapers', '26.6.2013', '', '2013-06-26'),
(3289, 'MSB/CB/A-156', 'Translation of Local Newspapers', '27.6.2013', '', '2013-06-27'),
(3290, 'MSB/CB/A-156', 'Translation of Local Newspapers', '28.6.2013', '', '2013-06-28'),
(3291, 'MSB/CB/A-156', 'Translation of Local Newspapers', '4.3.2013', '', '2013-03-04'),
(3292, 'MSB/CB/A-156', 'Translation of Local Newspapers', '5.3.2013', '', '2013-03-05'),
(3293, 'MSB/CB/A-156', 'Translation of Local Newspapers', '6.3.2013', '', '2013-03-06'),
(3294, 'MSB/CB/A-156', 'Translation of Local Newspapers', '7.3.2013', '', '2013-03-07'),
(3295, 'MSB/CB/A-156', 'Translation of Local Newspapers', '8.3.2013', '', '2013-03-08'),
(3296, 'MSB/CB/A-156', 'Translation of Local Newspapers', '11.3.2013', '', '2013-03-11'),
(3297, 'MSB/CB/A-156', 'Translation of Local Newspapers', '12.3.2013', '', '2013-03-12'),
(3298, 'MSB/CB/A-156', 'Translation of Local Newspapers', '13.3.2013', '', '2013-03-13'),
(3299, 'MSB/CB/A-156', 'Translation of Local Newspapers', '14.3.2013', '', '2013-03-14'),
(3300, 'MSB/CB/A-156', 'Translation of Local Newspapers', '15.3.2013', '', '2013-03-15'),
(3301, 'MSB/CB/A-156', 'Translation of Local Newspapers', '18.3.2013', '', '2013-03-18'),
(3302, 'MSB/CB/A-156', 'Translation of Local Newspapers', '19.3.2013', '', '2013-03-19'),
(3303, 'MSB/CB/A-156', 'Translation of Local Newspapers', '20.3.2013', '', '2013-03-20'),
(3304, 'MSB/CB/A-156', 'Translation of Local Newspapers', '21.3.2013', '', '2013-03-21'),
(3305, 'MSB/CB/A-156', 'Translation of Local Newspapers', '22.3.2013', '', '2013-03-22'),
(3306, 'MSB/CB/A-156', 'Translation of Local Newspapers', '25.3.2013', '', '2013-03-25'),
(3307, 'MSB/CB/A-156', 'Translation of Local Newspapers', '28.3.2013', '', '2013-03-28'),
(3308, 'MSB/CB/A-156', 'Translation of Local Newspapers', '1.5.2013', '', '2013-05-01'),
(3309, 'MSB/CB/A-156', 'Translation of Local Newspapers', '2.5.2013', '', '2013-05-02'),
(3310, 'MSB/CB/A-156', 'Translation of Local Newspapers', '3.5.2013', '', '2013-05-03'),
(3311, 'MSB/CB/A-156', 'Translation of Local Newspapers', '6.5.2013', '', '2013-05-06'),
(3312, 'MSB/CB/A-156', 'Translation of Local Newspapers', '7.5.2013', '', '2013-05-07'),
(3313, 'MSB/CB/A-156', 'Translation of Local Newspapers', '8.5.2013', '', '2013-05-08'),
(3314, 'MSB/CB/A-156', 'Translation of Local Newspapers', '9.5.2013', '', '2013-05-09'),
(3315, 'MSB/CB/A-156', 'Translation of Local Newspapers', '10.5.2013', '', '2013-05-10'),
(3316, 'MSB/CB/A-156', 'Translation of Local Newspapers', '13.5.2013', '', '2013-05-13'),
(3317, 'MSB/CB/A-156', 'Translation of Local Newspapers', '14.5.2013', '', '2013-05-14'),
(3318, 'MSB/CB/A-156', 'Translation of Local Newspapers', '15.5.2013', '', '2013-05-15'),
(3319, 'MSB/CB/A-156', 'Translation of Local Newspapers', '16.5.2013', '', '2013-05-16'),
(3320, 'MSB/CB/A-156', 'Translation of Local Newspapers', '17.5.2013', '', '2013-05-17'),
(3321, 'MSB/CB/A-156', 'Translation of Local Newspapers', '18.6.2013', '', '2013-06-18'),
(3322, 'MSB/CB/A-156', 'Translation of Local Newspapers', '20.5.2013', '', '2013-05-20'),
(3323, 'MSB/CB/A-156', 'Translation of Local Newspapers', '21.5.2013', '', '2013-05-21'),
(3324, 'MSB/CB/A-156', 'Translation of Local Newspapers', '22.5.2013', '', '2013-05-22'),
(3325, 'MSB/CB/A-156', 'Translation of Local Newspapers', '23.05.2013', '', '2013-05-23'),
(3326, 'MSB/CB/A-156', 'Translation of Local Newspapers', '24.5.2013', '', '2013-05-24'),
(3327, 'MSB/CB/A-156', 'Translation of Local Newspapers', '27.5.2013', '', '2013-05-27'),
(3328, 'MSB/CB/A-156', 'Translation of Local Newspapers', '28.5.2013', '', '2013-05-28'),
(3329, 'MSB/CB/A-156', 'Translation of Local Newspapers', '29.5.2013', '', '2013-05-29'),
(3330, 'MSB/CB/A-156', 'Translation of Local Newspapers', '30.5.2013', '', '2013-05-30'),
(3331, 'MSB/CB/A-156', 'Translation of Local Newspapers', '31.5.2013', '', '2013-05-31'),
(3332, 'MSB/CB/A-156', 'Translation of Local Newspapers', '2.9.2013', '', '2013-09-02'),
(3333, 'MSB/CB/A-156', 'Translation of Local Newspapers', '3.9.2013', '', '2013-09-03'),
(3334, 'MSB/CB/A-156', 'Translation of Local Newspapers', '4.9.2013', '', '2013-09-04'),
(3335, 'MSB/CB/A-156', 'Translation of Local Newspapers', '5.9.2013', '', '2013-09-05'),
(3336, 'MSB/CB/A-156', 'Translation of Local Newspapers', '6.9.2013', '', '2013-09-06'),
(3337, 'MSB/CB/A-156', 'Translation of Local Newspapers', '09.09.2013', '', '2013-09-09'),
(3338, 'MSB/CB/A-156', 'Translation of Local Newspapers', '10.09.2013', '', '2013-09-10'),
(3339, 'MSB/CB/A-156', 'Translation of Local Newspapers', '11.09.2013', '', '2013-09-11'),
(3340, 'MSB/CB/A-156', 'Translation of Local Newspapers', '12.9.2013', '', '2013-09-12'),
(3341, 'MSB/CB/A-156', 'Translation of Local Newspapers', '13.9.2013', '', '2013-09-13'),
(3342, 'MSB/CB/A-156', 'Translation of Local Newspapers', '16.9.2013', '', '2013-09-16'),
(3343, 'MSB/CB/A-156', 'Translation of Local Newspapers', '17.9.2013', '', '2013-09-17'),
(3344, 'MSB/CB/A-156', 'Translation of Local Newspapers', '18.9.2013', '', '2013-09-18'),
(3345, 'MSB/CB/A-156', 'Translation of Local Newspapers', '19.9.2013', '', '2013-09-19'),
(3346, 'MSB/CB/A-156', 'Translation of Local Newspapers', '20.9.2013', '', '2013-09-20'),
(3347, 'MSB/CB/A-156', 'Translation of Local Newspapers', '23.9.2013', '', '2013-09-23'),
(3348, 'MSB/CB/A-156', 'Translation of Local Newspapers', '24.9.2013', '', '2013-09-24'),
(3349, 'MSB/CB/A-156', 'Translation of Local Newspapers', '25.9.2013', '', '2013-09-25'),
(3350, 'MSB/CB/C-210', 'Right to Information Act (RTI)', 'Meeting of the Task Group on Implementation of Agreement made by Central Government- Reg.', '', '2023-03-03'),
(3351, 'MSB/CB/C-210', 'Right to Information Act (RTI)', 'PAYMENT & RECEIPT OF ADVANCE REHABILITATION PACKAGE(Rs. 20,000/-)', '', '2018-04-06'),
(3352, 'MSB/CB/C-210', 'Right to Information Act (RTI)', 'Directory of its Officers and employees :', '', '2016-01-01'),
(3353, 'MSB/CB/C-210', 'Right to Information Act (RTI)', 'Monthly remunerationreceived by each of its officerss and employees :', '', '2022-02-13'),
(3354, 'MSB/CB/C-210', 'Right to Information Act (RTI)', 'The budget allocated to each of its agency, indicating the particulars of all plans, proposed expenditure and reports on disbursement made :', '', '2022-02-13'),
(3355, 'MSB/CB/C-210', 'Right to Information Act (RTI)', 'BRIEF NOTE ON CID (SB)', '', '2022-01-19'),
(3356, 'MSB/CB/C-210', 'Right to Information Act (RTI)', 'FOREIGNERS REGISTRATION OFFICE Â (FRO)/VERIFICATION BRANCH :Â Â Â Â Â Â Â Â ', '', '2022-02-18'),
(3357, 'MSB/CB/C-210', 'Right to Information Act (RTI)', 'Implementation of Suo Moto disclosure under section 4 of RTI Act, 2005 - reg.', '', '2023-01-04'),
(3358, 'MSB/CB/C-210', 'Right to Information Act (RTI)', 'Implementation of Suo Moto disclosure under section 4 of RTI Act, 2005 - reg.', '', '2023-01-04'),
(3359, 'MSB/CB/C-210', 'Right to Information Act (RTI)', 'BRIEF HISTORY OF THE UNIT :', '', '2022-02-10'),
(3360, 'MSB/CB/C-210', 'Right to Information Act (RTI)', 'BRIEF HISTORY OF THE UNIT :(CID SB)', '', '2022-02-08'),
(3361, 'MSB/CB/C-210', 'Right to Information Act (RTI)', 'RIGHT TO INFORMATION ACT,2005 (RTI MANUAL OF CID(SB)', '', '2022-02-15'),
(3362, 'MSB/CB/C-210', 'Right to Information Act (RTI)', 'Implementation of Suo Moto disclosure under section 4 of RTI Act, 2005 - reg.', '', '2022-02-10'),
(3363, 'MSB/CB/C-210', 'Right to Information Act (RTI)', 'SECTION 4 (1) (b) of RTI Act.', '', '2022-02-08'),
(3364, 'MSB/CB/C-210', 'Right to Information Act (RTI)', 'BRIEF NOTE ON CID (SB) Disposition of StaffÂ  (as on 17.01.2022)', '', '2022-01-19'),
(3365, 'MSB/CB/A-137', 'Recommendation on good government(group of Minister)(Lead Intelligence Agency)LIA', '49th Directional Level Co-ordination meeting of LIA.', '', '2022-12-12'),
(3366, 'MSB/CB/A-112', 'Conference of DGP/IGP/ADGP', 'Agenda Items for the forthcoming North-Eastern Regional Police Coordination Committee (NERPCC).', '', '2022-03-07'),
(3367, 'MSB/CB/A-137', 'Recommendation on good government(group of Minister)(Lead Intelligence Agency)LIA', 'SECURITY SCENERIO OF MIZORAM :Â ', '', '2022-02-15'),
(3368, 'MSB/CB/A-137', 'Recommendation on good government(group of Minister)(Lead Intelligence Agency)LIA', 'Holding of Online/Virtual Directional Level Co-ordination meeting of LIA.', '', '2022-05-04'),
(3369, 'MSB/CB/A-132', 'Terrorist related matters', 'Regional Security Strategies Conference - 2022 for NE', '', '2022-04-22'),
(3370, 'MSB/CB/A-137', 'Recommendation on good government(group of Minister)(Lead Intelligence Agency)LIA', 'MYANMAR REFUGEES :', '', '2022-08-01'),
(3371, 'MSB/CB/A-137', 'Recommendation on good government(group of Minister)(Lead Intelligence Agency)LIA', 'NOTES Â FOR Â REGIONAL Â MEETING Â ON Â DRUG Â TRAFFICKING Â AND NATIONAL Â SECURITY :', '', '2022-11-23'),
(3372, 'MSB/CB/A-156', 'Translation of Local Newspapers', '1.4.2014', '', '2014-04-01'),
(3373, 'MSB/CB/A-156', 'Translation of Local Newspapers', '2.4.2014', '', '2014-04-02'),
(3374, 'MSB/CB/A-156', 'Translation of Local Newspapers', '6&7.4.2014', '', '2014-04-07'),
(3375, 'MSB/CB/A-156', 'Translation of Local Newspapers', '4.4.2014', '', '2014-04-04'),
(3376, 'MSB/CB/A-156', 'Translation of Local Newspapers', '9.4.2014', '', '2014-04-09'),
(3377, 'MSB/CB/A-156', 'Translation of Local Newspapers', '10.4.2014', '', '2014-04-10'),
(3378, 'MSB/CB/A-156', 'Translation of Local Newspapers', '15.4.2014', '', '2014-04-15'),
(3379, 'MSB/CB/A-156', 'Translation of Local Newspapers', '16.4.2014', '', '2014-04-16'),
(3380, 'MSB/CB/A-156', 'Translation of Local Newspapers', '17.4.2014', '', '2014-04-17'),
(3381, 'MSB/CB/A-156', 'Translation of Local Newspapers', '21.4.2014', '', '2014-04-21'),
(3382, 'MSB/CB/A-156', 'Translation of Local Newspapers', '21.4.2014', '', '2014-04-21'),
(3383, 'MSB/CB/A-156', 'Translation of Local Newspapers', '22.4.2014', '', '2014-04-22'),
(3384, 'MSB/CB/A-156', 'Translation of Local Newspapers', '23.4.2014', '', '2014-04-23'),
(3385, 'MSB/CB/A-156', 'Translation of Local Newspapers', '24.4.2014', '', '2014-04-24'),
(3386, 'MSB/CB/A-156', 'Translation of Local Newspapers', '25.4.2014', '', '2014-04-25'),
(3387, 'MSB/CB/A-156', 'Translation of Local Newspapers', '28.4.2014', '', '2014-04-28'),
(3388, 'MSB/CB/A-156', 'Translation of Local Newspapers', '29.4.2014', '', '2014-04-29'),
(3389, 'MSB/CB/A-156', 'Translation of Local Newspapers', '30.4.2014', '', '2014-04-30'),
(3390, 'MSB/CB/A-156', 'Translation of Local Newspapers', '3.2.2014', '', '2014-02-03'),
(3391, 'MSB/CB/A-156', 'Translation of Local Newspapers', '4.2.2014', '', '2014-02-04'),
(3392, 'MSB/CB/A-156', 'Translation of Local Newspapers', '5.2.2014', '', '2014-02-05'),
(3393, 'MSB/CB/A-156', 'Translation of Local Newspapers', '6.2.2014', '', '2014-02-06'),
(3394, 'MSB/CB/A-156', 'Translation of Local Newspapers', '7.2.2014', '', '2014-02-07'),
(3395, 'MSB/CB/A-156', 'Translation of Local Newspapers', '10.2.2014', '', '2014-02-10'),
(3396, 'MSB/CB/A-156', 'Translation of Local Newspapers', '11.2.2014', '', '2014-02-11'),
(3397, 'MSB/CB/A-156', 'Translation of Local Newspapers', '12.2.2014', '', '2014-02-12'),
(3398, 'MSB/CB/A-156', 'Translation of Local Newspapers', '13.2.2014', '', '2014-02-13'),
(3399, 'MSB/CB/A-159', 'Special Cell', '14.2.2014', '', '2014-02-14'),
(3400, 'MSB/CB/A-156', 'Translation of Local Newspapers', '17.2.2014', '', '2014-02-17'),
(3401, 'MSB/CB/A-156', 'Translation of Local Newspapers', '18.2.2014', '', '2014-02-18'),
(3402, 'MSB/CB/A-156', 'Translation of Local Newspapers', '19.2.2014', '', '2014-02-19'),
(3403, 'MSB/CB/A-156', 'Translation of Local Newspapers', '21.2.2014', '', '2014-02-21'),
(3404, 'MSB/CB/A-156', 'Translation of Local Newspapers', '24.2.2014', '', '2014-02-24'),
(3405, 'MSB/CB/A-156', 'Translation of Local Newspapers', '25.2.2014', '', '2014-02-25'),
(3406, 'MSB/CB/A-156', 'Translation of Local Newspapers', '26.2.2014', '', '2014-02-26'),
(3407, 'MSB/CB/A-156', 'Translation of Local Newspapers', '27.2.2014', '', '2014-02-27'),
(3408, 'MSB/CB/A-156', 'Translation of Local Newspapers', '28.2.2014', '', '2014-02-28'),
(3409, 'MSB/CB/A-156', 'Translation of Local Newspapers', '6.1.2014', '', '2014-01-06'),
(3410, 'MSB/CB/A-156', 'Translation of Local Newspapers', '7.1.2014', '', '2014-01-07'),
(3411, 'MSB/CB/A-156', 'Translation of Local Newspapers', '8.1.2014', '', '2014-01-08'),
(3412, 'MSB/CB/A-156', 'Translation of Local Newspapers', '9.1.2014', '', '2014-01-09'),
(3413, 'MSB/CB/A-156', 'Translation of Local Newspapers', '10.1.2014', '', '2014-01-10'),
(3414, 'MSB/CB/A-156', 'Translation of Local Newspapers', '13.1.2014', '', '2014-01-13'),
(3415, 'MSB/CB/A-156', 'Translation of Local Newspapers', '15.1.2014', '', '2014-01-15'),
(3416, 'MSB/CB/A-156', 'Translation of Local Newspapers', '16.1.2014', '', '2014-01-16'),
(3417, 'MSB/CB/A-156', 'Translation of Local Newspapers', '17.1.2014', '', '2014-01-17'),
(3418, 'MSB/CB/A-156', 'Translation of Local Newspapers', '20.1.2014', '', '2014-01-20'),
(3419, 'MSB/CB/A-156', 'Translation of Local Newspapers', '21.1.2014', '', '2014-01-21'),
(3420, 'MSB/CB/A-156', 'Translation of Local Newspapers', '22.1.2014', '', '2014-01-22'),
(3421, 'MSB/CB/A-156', 'Translation of Local Newspapers', '23.1.2014', '', '2014-01-23'),
(3422, 'MSB/CB/A-156', 'Translation of Local Newspapers', '24.1.2014', '', '2014-01-24'),
(3423, 'MSB/CB/A-156', 'Translation of Local Newspapers', '27.1.2014', '', '2014-01-27'),
(3424, 'MSB/CB/A-156', 'Translation of Local Newspapers', '28.1.2014', '', '2014-01-28'),
(3425, 'MSB/CB/A-156', 'Translation of Local Newspapers', '29.1.2014', '', '2014-01-29');
INSERT INTO "file_list" ("id", "file_no", "category", "title", "doc1", "entry_date_real") VALUES
(3426, 'MSB/CB/A-156', 'Translation of Local Newspapers', '30.1.2014', '', '2014-01-30');
INSERT INTO "file_list" ("id", "file_no", "category", "title", "doc1", "entry_date_real") VALUES
(3427, 'MSB/CB/A-156', 'Translation of Local Newspapers', '31.1.2014', '', '2014-01-31');
INSERT INTO "file_list" ("id", "file_no", "category", "title", "doc1", "entry_date_real") VALUES
(3428, 'MSB/CB/C-123', 'MISC. Law & Order/Police Crime', 'DSI 21.9.2022', '', '2022-10-31');
INSERT INTO "file_list" ("id", "file_no", "category", "title", "doc1", "entry_date_real") VALUES
(3429, 'A-3', 'Sinlung Hills Development Council SHDC', 'DSI 30.3.2022', '', '2022-04-01');
INSERT INTO "file_list" ("id", "file_no", "category", "title", "doc1", "entry_date_real") VALUES
(3430, 'A-3', 'Sinlung Hills Development Council SHDC', 'DSI 29.3.2022', '', '2022-03-30');
INSERT INTO "file_list" ("id", "file_no", "category", "title", "doc1", "entry_date_real") VALUES
(3431, 'MSB/CB/A-5(R)', 'MYANMAR REFUGEE', 'DSI 21.4.2022', '', '2022-07-25');
INSERT INTO "file_list" ("id", "file_no", "category", "title", "doc1", "entry_date_real") VALUES
(3432, 'MSB/CB/A-5(A)', 'ROHINGYA', 'DSI 2.9.2022', '', '2022-09-09');
INSERT INTO "file_list" ("id", "file_no", "category", "title", "doc1", "entry_date_real") VALUES
(3433, 'MSB/CB/A-8', 'Election Commission/Central Election', 'DSI 8.7.2022', '', '2022-07-19');
INSERT INTO "file_list" ("id", "file_no", "category", "title", "doc1", "entry_date_real") VALUES
(3434, 'MSB/CB/A-10', 'Kidnapping/Abduction', 'DSI 9.11.2022', '', '2022-11-16');
INSERT INTO "file_list" ("id", "file_no", "category", "title", "doc1", "entry_date_real") VALUES
(3435, 'MSB/CB/A-13', 'Law and Order', 'DSI 14.2.2022 To 27.12.2022', '', '2022-12-29');
INSERT INTO "file_list" ("id", "file_no", "category", "title", "doc1", "entry_date_real") VALUES
(3436, 'A-20', 'Explosive recoveries/Bomb Explosion (Monthly Return)', 'DSI 10.8.2022 TO 24.8.2022', '', '2022-09-01');
INSERT INTO "file_list" ("id", "file_no", "category", "title", "doc1", "entry_date_real") VALUES
(3437, 'A-20', 'Explosive recoveries/Bomb Explosion (Monthly Return)', 'DSI 2.5.2022 TO 24.8.2022', '', '2022-08-26');
INSERT INTO "file_list" ("id", "file_no", "category", "title", "doc1", "entry_date_real") VALUES
(3438, 'MSB/CB/A-20(A)', 'Explosive recoveries/Bomb Explosion (Monthly Return)', 'DSI 5.5.2022', '', '2022-05-06');
INSERT INTO "file_list" ("id", "file_no", "category", "title", "doc1", "entry_date_real") VALUES
(3439, 'A-3', 'Sinlung Hills Development Council SHDC', 'DSI 2.9.2022', '', '2022-09-09');
INSERT INTO "file_list" ("id", "file_no", "category", "title", "doc1", "entry_date_real") VALUES
(3440, 'MSB/CB/A-41', 'Indo Bangladesh Affairs', 'DSI 22.4.2022 TO 19.12.2022', '', '2022-12-21');
INSERT INTO "file_list" ("id", "file_no", "category", "title", "doc1", "entry_date_real") VALUES
(3441, 'MSB/CB/A-59', 'Arakan Liberation Party(ALP)/Arakan Liberation Army(ALA)/Arakan Army(AA)', 'DSI 2.9.2022 TO 15.12.2022', '', '2022-12-21');
INSERT INTO "file_list" ("id", "file_no", "category", "title", "doc1", "entry_date_real") VALUES
(3442, 'MSB/CB/A-62', 'Chin National Front(CNF)/Chin National Army(CNA)', 'DSI 21.4.2022', '', '2022-04-25');
INSERT INTO "file_list" ("id", "file_no", "category", "title", "doc1", "entry_date_real") VALUES
(3443, 'MSB/CB/A-97(A)', 'Monthly return on Law and Order', 'CENTRAL YLA INFO  Dated Lawngtlai the 28th May 2022 Picketing Call Off thu hriattirna', '', '2022-06-01');
INSERT INTO "file_list" ("id", "file_no", "category", "title", "doc1", "entry_date_real") VALUES
(3444, 'MSB/CB/A-97(A)', 'Monthly return on Law and Order', 'Â Â  LAW AND ORDER INCIDENTS FOR THE MONTH OF AUGUST, 2022', '', '2022-09-01');
INSERT INTO "file_list" ("id", "file_no", "category", "title", "doc1", "entry_date_real") VALUES
(3445, 'MSB/CB/A-97(A)', 'Monthly return on Law and Order', 'DSI 2.5.2022 TO 4.11.2022', '', '2022-12-02');
INSERT INTO "file_list" ("id", "file_no", "category", "title", "doc1", "entry_date_real") VALUES
(3446, 'MSB/CB/B-4', 'Mizoram-Cachar Border Dispute/Boundary Committee/Boundary incidents', 'DSI 12.1.2022 TO 28.12.2022', '', '2022-12-29');
INSERT INTO "file_list" ("id", "file_no", "category", "title", "doc1", "entry_date_real") VALUES
(3447, 'MSB/CB/B-14/KNA', 'Kuki National Army', 'DSI 21.11.2022 TO 28.11.2022', '', '2022-12-02');
INSERT INTO "file_list" ("id", "file_no", "category", "title", "doc1", "entry_date_real") VALUES
(3448, 'MSB/CB/B-15', 'Insurgency in North East India', 'DSI 12.7.2022', '', '2022-07-15');
INSERT INTO "file_list" ("id", "file_no", "category", "title", "doc1", "entry_date_real") VALUES
(3449, 'MSB/CB/B-16/BOR', 'Mizoram-Tripura Border Affairs/Manipur Border Affairs', 'DSI 10.5.2022 TO 26.7.2022', '', '2022-07-27');
INSERT INTO "file_list" ("id", "file_no", "category", "title", "doc1", "entry_date_real") VALUES
(3450, 'MSB/CB/B-26(B)', 'HPC(D)  Lalhmingthanga Sanate faction', 'SPECIAL REPORT Dated: 10th January, 2022 Dated: 16th November, 2022 Dated: 16th November, 2022  Dated: 21st December, 2022', '', '2023-01-03');
INSERT INTO "file_list" ("id", "file_no", "category", "title", "doc1", "entry_date_real") VALUES
(3451, 'MSB/CB/B-34/HPC', 'HPC activities', 'DSI 18.2.2022 AND 28.2.2022', '', '2022-03-01');
INSERT INTO "file_list" ("id", "file_no", "category", "title", "doc1", "entry_date_real") VALUES
(3452, 'MSB/CB/B-53/ZORO', 'Zomi Re-Unification Orgaisation/Zo Reunification Organisation', 'DSI10.3.2022 TO 01.12.2022', '', '2022-12-06');
INSERT INTO "file_list" ("id", "file_no", "category", "title", "doc1", "entry_date_real") VALUES
(3453, 'MSB/CB/B-58/VIP(M)', 'VIP Mizoram', 'DSI 15.12.2022 AND 16.12.2022', '', '2022-12-21');
INSERT INTO "file_list" ("id", "file_no", "category", "title", "doc1", "entry_date_real") VALUES
(3454, 'MSB/CB/B-59(A)', 'President visit to Mizoram', 'DSI 5.5.2022 TO 4.11.2022', '', '2022-11-11');
INSERT INTO "file_list" ("id", "file_no", "category", "title", "doc1", "entry_date_real") VALUES
(3455, 'MSB/CB/B-59/Visit', 'VVIP Visit to Mizoram', 'DSI 10.3.2022 TO 10.3.2022', '', '2022-05-06');
INSERT INTO "file_list" ("id", "file_no", "category", "title", "doc1", "entry_date_real") VALUES
(3456, 'MSB/CB/B-61/Misc', 'Miscellaneous', 'DSI 6.4.2022', '', '2022-04-11');
INSERT INTO "file_list" ("id", "file_no", "category", "title", "doc1", "entry_date_real") VALUES
(3457, 'MSB/CB/B-68', 'Religious Activities/ Damage of Worship places etc.', 'DSI 2022 B-68 Religious Activities/ Damage of Worship places etc.', '', '2022-05-13');
INSERT INTO "file_list" ("id", "file_no", "category", "title", "doc1", "entry_date_real") VALUES
(3458, 'MSB/CB/B-73/MLA', 'Mizoram Legislative Assembly/ Cabinet Meeting', 'DSI 2022 Mizoram Legislative Assembly/ Cabinet Meeting', '', '2022-12-22');
INSERT INTO "file_list" ("id", "file_no", "category", "title", "doc1", "entry_date_real") VALUES
(3459, 'MSB/CB/B-80/ND', 'Narcotic Drugs', 'DSI 2022 Narcotic Drugs', '', '2022-05-30');
INSERT INTO "file_list" ("id", "file_no", "category", "title", "doc1", "entry_date_real") VALUES
(3460, 'MSB/CB/B-82/IR Day', 'Independence/Republic Day', 'DSI 2022 Independence/Republic Day', '', '2022-08-18');
INSERT INTO "file_list" ("id", "file_no", "category", "title", "doc1", "entry_date_real") VALUES
(3461, 'MSB/CB/B-84/H.Court', 'High Court Ruling/ Supreme Court Ruling', 'DSI 2022 High Court Ruling/ Supreme Court Ruling', '', '2022-12-21');
INSERT INTO "file_list" ("id", "file_no", "category", "title", "doc1", "entry_date_real") VALUES
(3462, 'MSB/CB/B-85/Arms', 'Arms, Smuggling etc.', 'DSI 2022 Arms, Smuggling etc.', '', '2022-10-31');
INSERT INTO "file_list" ("id", "file_no", "category", "title", "doc1", "entry_date_real") VALUES
(3463, 'MSB/CB/C-59', 'National Students Union of India(MZ)', 'DSI 2022 National Students Union of India(MZ)', '', '2022-05-23');
INSERT INTO "file_list" ("id", "file_no", "category", "title", "doc1", "entry_date_real") VALUES
(3464, 'MSB/CB/C-1', 'Mizoram Civil Service Officer Association(MCSOA)/MDOA', 'DSI 2022 Mizoram Civil Service Officer Association(MCSOA)/MDOA', '', '2022-10-26');
INSERT INTO "file_list" ("id", "file_no", "category", "title", "doc1", "entry_date_real") VALUES
(3465, 'MSB/CB/C-3', 'Mizoram Police Subordination Officers Association (MPSOA)/MPSA/MPCW', 'DSI 2022 Mizoram Police Subordination Officers Association (MPSOA)/MPSA/MPCW', '', '2022-05-23');
INSERT INTO "file_list" ("id", "file_no", "category", "title", "doc1", "entry_date_real") VALUES
(3466, 'MSB/CB/C-2', 'Mizoram Employees & Workers Association (FMGE&W)', 'DSI 2022 Mizoram Employees & Workers Association (FMGE&W)', '', '2022-12-22');
INSERT INTO "file_list" ("id", "file_no", "category", "title", "doc1", "entry_date_real") VALUES
(3467, 'MSB/CB/C-4', 'Mizoram Ministerial Service Association (MMSA)/ Isolated Post Association', 'DSI 2022 Mizoram Ministerial Service Association (MMSA)/ Isolated Post Association', '', '2022-04-11');
INSERT INTO "file_list" ("id", "file_no", "category", "title", "doc1", "entry_date_real") VALUES
(3468, 'MSB/CB/C-5', 'Mizoram Sport Association', 'DSI 2022 Mizoram Sport Association', '', '2022-07-29');
INSERT INTO "file_list" ("id", "file_no", "category", "title", "doc1", "entry_date_real") VALUES
(3469, 'MSB/CB/C-264', 'Mizoram Underground Returnee Association(MURA)', 'DSI 2022 Mizoram Underground Returnee Association(MURA)', '', '2022-04-20');
INSERT INTO "file_list" ("id", "file_no", "category", "title", "doc1", "entry_date_real") VALUES
(3470, 'MSB/CB/A-156', 'Translation of Local Newspapers', '3.3.2014', '', '2014-03-03');
INSERT INTO "file_list" ("id", "file_no", "category", "title", "doc1", "entry_date_real") VALUES
(3471, 'MSB/CB/A-156', 'Translation of Local Newspapers', '4.3.2014', '', '2014-03-04');
INSERT INTO "file_list" ("id", "file_no", "category", "title", "doc1", "entry_date_real") VALUES
(3472, 'MSB/CB/A-156', 'Translation of Local Newspapers', '5.3.2014', '', '2014-03-05');
INSERT INTO "file_list" ("id", "file_no", "category", "title", "doc1", "entry_date_real") VALUES
(3473, 'MSB/CB/A-156', 'Translation of Local Newspapers', '6.3.2014', '', '2014-03-06');
INSERT INTO "file_list" ("id", "file_no", "category", "title", "doc1", "entry_date_real") VALUES
(3474, 'MSB/CB/A-156', 'Translation of Local Newspapers', '10.3.2014', '', '2014-03-10');
INSERT INTO "file_list" ("id", "file_no", "category", "title", "doc1", "entry_date_real") VALUES
(3475, 'MSB/CB/A-156', 'Translation of Local Newspapers', '11.3.2014', '', '2014-03-11');
INSERT INTO "file_list" ("id", "file_no", "category", "title", "doc1", "entry_date_real") VALUES
(3476, 'MSB/CB/A-156', 'Translation of Local Newspapers', '13.3.2014', '', '2014-03-13');
INSERT INTO "file_list" ("id", "file_no", "category", "title", "doc1", "entry_date_real") VALUES
(3477, 'MSB/CB/A-156', 'Translation of Local Newspapers', '14.3.2014', '', '2014-03-14');
INSERT INTO "file_list" ("id", "file_no", "category", "title", "doc1", "entry_date_real") VALUES
(3478, 'MSB/CB/A-156', 'Translation of Local Newspapers', '18.3.2014', '', '2014-03-18');
INSERT INTO "file_list" ("id", "file_no", "category", "title", "doc1", "entry_date_real") VALUES
(3479, 'MSB/CB/A-156', 'Translation of Local Newspapers', '19.3.2014', '', '2014-03-19');
INSERT INTO "file_list" ("id", "file_no", "category", "title", "doc1", "entry_date_real") VALUES
(3480, 'MSB/CB/A-156', 'Translation of Local Newspapers', '20.3.2014', '', '2014-03-20');
INSERT INTO "file_list" ("id", "file_no", "category", "title", "doc1", "entry_date_real") VALUES
(3481, 'MSB/CB/A-156', 'Translation of Local Newspapers', '21.3.2014', '', '2014-03-21');
INSERT INTO "file_list" ("id", "file_no", "category", "title", "doc1", "entry_date_real") VALUES
(3482, 'MSB/CB/A-156', 'Translation of Local Newspapers', '24.3.2014', '', '2014-03-24');
INSERT INTO "file_list" ("id", "file_no", "category", "title", "doc1", "entry_date_real") VALUES
(3483, 'MSB/CB/A-156', 'Translation of Local Newspapers', '25.3.2014', '', '2014-03-25');
INSERT INTO "file_list" ("id", "file_no", "category", "title", "doc1", "entry_date_real") VALUES
(3484, 'MSB/CB/A-156', 'Translation of Local Newspapers', '26.3.2014', '', '2014-03-26');
INSERT INTO "file_list" ("id", "file_no", "category", "title", "doc1", "entry_date_real") VALUES
(3485, 'MSB/CB/A-156', 'Translation of Local Newspapers', '27.3.2014', '', '2014-03-27');
INSERT INTO "file_list" ("id", "file_no", "category", "title", "doc1", "entry_date_real") VALUES
(3486, 'MSB/CB/A-156', 'Translation of Local Newspapers', '28.3.2014', '', '2014-03-28');
INSERT INTO "file_list" ("id", "file_no", "category", "title", "doc1", "entry_date_real") VALUES
(3487, 'MSB/CB/A-156', 'Translation of Local Newspapers', '31.3.2014', '', '2014-03-31');
INSERT INTO "file_list" ("id", "file_no", "category", "title", "doc1", "entry_date_real") VALUES
(3488, 'MSB/CB/A-156', 'Translation of Local Newspapers', '1.5.2014', '', '2014-05-01');
INSERT INTO "file_list" ("id", "file_no", "category", "title", "doc1", "entry_date_real") VALUES
(3489, 'MSB/CB/A-156', 'Translation of Local Newspapers', '2.5.2014', '', '2014-05-02');
INSERT INTO "file_list" ("id", "file_no", "category", "title", "doc1", "entry_date_real") VALUES
(3490, 'MSB/CB/A-156', 'Translation of Local Newspapers', '5.5.2014', '', '2014-05-05');
INSERT INTO "file_list" ("id", "file_no", "category", "title", "doc1", "entry_date_real") VALUES
(3491, 'MSB/CB/A-156', 'Translation of Local Newspapers', '6.5.2014', '', '2014-05-06');
INSERT INTO "file_list" ("id", "file_no", "category", "title", "doc1", "entry_date_real") VALUES
(3492, 'MSB/CB/A-156', 'Translation of Local Newspapers', '7.5.2014', '', '2014-05-07');
INSERT INTO "file_list" ("id", "file_no", "category", "title", "doc1", "entry_date_real") VALUES
(3493, 'MSB/CB/A-156', 'Translation of Local Newspapers', '8.5.2014', '', '2014-05-08');
INSERT INTO "file_list" ("id", "file_no", "category", "title", "doc1", "entry_date_real") VALUES
(3494, 'MSB/CB/A-156', 'Translation of Local Newspapers', '9.5.2014', '', '2014-05-09');
INSERT INTO "file_list" ("id", "file_no", "category", "title", "doc1", "entry_date_real") VALUES
(3495, 'MSB/CB/A-156', 'Translation of Local Newspapers', '12.5.2014', '', '2014-05-12');
INSERT INTO "file_list" ("id", "file_no", "category", "title", "doc1", "entry_date_real") VALUES
(3496, 'MSB/CB/A-156', 'Translation of Local Newspapers', '13.5.2014', '', '2014-05-13');
INSERT INTO "file_list" ("id", "file_no", "category", "title", "doc1", "entry_date_real") VALUES
(3497, 'MSB/CB/A-156', 'Translation of Local Newspapers', '15.5.2014', '', '2014-05-15');
INSERT INTO "file_list" ("id", "file_no", "category", "title", "doc1", "entry_date_real") VALUES
(3498, 'MSB/CB/A-156', 'Translation of Local Newspapers', '16.5.2014', '', '2014-05-16');
INSERT INTO "file_list" ("id", "file_no", "category", "title", "doc1", "entry_date_real") VALUES
(3499, 'MSB/CB/A-156', 'Translation of Local Newspapers', '19.5.2014', '', '2014-05-19');
INSERT INTO "file_list" ("id", "file_no", "category", "title", "doc1", "entry_date_real") VALUES
(3500, 'MSB/CB/A-156', 'Translation of Local Newspapers', '20.5.2014', '', '2014-05-20');
INSERT INTO "file_list" ("id", "file_no", "category", "title", "doc1", "entry_date_real") VALUES
(3501, 'MSB/CB/A-156', 'Translation of Local Newspapers', '21.5.2014', '', '2014-05-21');
INSERT INTO "file_list" ("id", "file_no", "category", "title", "doc1", "entry_date_real") VALUES
(3502, 'MSB/CB/A-156', 'Translation of Local Newspapers', '22.5.2014', '', '2014-05-22');
INSERT INTO "file_list" ("id", "file_no", "category", "title", "doc1", "entry_date_real") VALUES
(3503, 'MSB/CB/A-156', 'Translation of Local Newspapers', '23.5.2014', '', '2014-05-23');
INSERT INTO "file_list" ("id", "file_no", "category", "title", "doc1", "entry_date_real") VALUES
(3504, 'MSB/CB/A-156', 'Translation of Local Newspapers', '26.5.2014', '', '2014-05-26');
INSERT INTO "file_list" ("id", "file_no", "category", "title", "doc1", "entry_date_real") VALUES
(3505, 'MSB/CB/A-156', 'Translation of Local Newspapers', '27.5.2014', '', '2014-05-27');
INSERT INTO "file_list" ("id", "file_no", "category", "title", "doc1", "entry_date_real") VALUES
(3506, 'MSB/CB/A-156', 'Translation of Local Newspapers', '28.5.2014', '', '2014-05-28');
INSERT INTO "file_list" ("id", "file_no", "category", "title", "doc1", "entry_date_real") VALUES
(3507, 'MSB/CB/A-156', 'Translation of Local Newspapers', '29.5.2014', '', '2014-05-29');
INSERT INTO "file_list" ("id", "file_no", "category", "title", "doc1", "entry_date_real") VALUES
(3508, 'MSB/CB/A-156', 'Translation of Local Newspapers', '30.5.2014', '', '2014-05-30');
INSERT INTO "file_list" ("id", "file_no", "category", "title", "doc1", "entry_date_real") VALUES
(3509, 'MSB/CB/A-156', 'Translation of Local Newspapers', '01.08.2022', '', '2022-08-01');
INSERT INTO "file_list" ("id", "file_no", "category", "title", "doc1", "entry_date_real") VALUES
(3510, 'MSB/CB/A-156', 'Translation of Local Newspapers', '02.08.2022', '', '2022-08-02');
INSERT INTO "file_list" ("id", "file_no", "category", "title", "doc1", "entry_date_real") VALUES
(3511, 'MSB/CB/A-156', 'Translation of Local Newspapers', '03.08.2022', '', '2022-08-03');
INSERT INTO "file_list" ("id", "file_no", "category", "title", "doc1", "entry_date_real") VALUES
(3512, 'MSB/CB/A-156', 'Translation of Local Newspapers', '04.08.2022', '', '2022-08-04');
INSERT INTO "file_list" ("id", "file_no", "category", "title", "doc1", "entry_date_real") VALUES
(3513, 'MSB/CB/A-156', 'Translation of Local Newspapers', '05.08.2022', '', '2022-08-05');
INSERT INTO "file_list" ("id", "file_no", "category", "title", "doc1", "entry_date_real") VALUES
(3514, 'MSB/CB/A-156', 'Translation of Local Newspapers', '08.08.2022', '', '2022-08-08');
INSERT INTO "file_list" ("id", "file_no", "category", "title", "doc1", "entry_date_real") VALUES
(3515, 'MSB/CB/A-156', 'Translation of Local Newspapers', '10.08.2022', '', '2022-08-10');
INSERT INTO "file_list" ("id", "file_no", "category", "title", "doc1", "entry_date_real") VALUES
(3516, 'MSB/CB/A-156', 'Translation of Local Newspapers', '11.08.2022', '', '2022-08-11');
INSERT INTO "file_list" ("id", "file_no", "category", "title", "doc1", "entry_date_real") VALUES
(3517, 'MSB/CB/A-156', 'Translation of Local Newspapers', '12.08.2022', '', '2022-08-12');
INSERT INTO "file_list" ("id", "file_no", "category", "title", "doc1", "entry_date_real") VALUES
(3518, 'MSB/CB/A-156', 'Translation of Local Newspapers', '16.08. 2022', '', '2022-08-16');
INSERT INTO "file_list" ("id", "file_no", "category", "title", "doc1", "entry_date_real") VALUES
(3519, 'MSB/CB/A-156', 'Translation of Local Newspapers', '17.08. 2022', '', '2022-08-17');
INSERT INTO "file_list" ("id", "file_no", "category", "title", "doc1", "entry_date_real") VALUES
(3520, 'MSB/CB/A-156', 'Translation of Local Newspapers', '18.08. 2022', '', '2022-08-18');
INSERT INTO "file_list" ("id", "file_no", "category", "title", "doc1", "entry_date_real") VALUES
(3521, 'MSB/CB/A-156', 'Translation of Local Newspapers', '19.08. 2022', '', '2022-08-19');
INSERT INTO "file_list" ("id", "file_no", "category", "title", "doc1", "entry_date_real") VALUES
(3522, 'MSB/CB/A-156', 'Translation of Local Newspapers', '22.08. 2022', '', '2022-08-22');
INSERT INTO "file_list" ("id", "file_no", "category", "title", "doc1", "entry_date_real") VALUES
(3523, 'MSB/CB/A-156', 'Translation of Local Newspapers', '23.08. 2022', '', '2022-08-23');
INSERT INTO "file_list" ("id", "file_no", "category", "title", "doc1", "entry_date_real") VALUES
(3524, 'MSB/CB/A-156', 'Translation of Local Newspapers', '24.08. 2022', '', '2022-08-24');
INSERT INTO "file_list" ("id", "file_no", "category", "title", "doc1", "entry_date_real") VALUES
(3525, 'MSB/CB/A-156', 'Translation of Local Newspapers', '25.08.2022', '', '2022-08-25');