-- PostgreSQL version of MySQL dump
-- Converted by convert_batch_mysql_to_postgres.py

INSERT INTO "file_list" ("id", "file_no", "category", "title", "doc1", "entry_date_real") VALUES
(3526, 'MSB/CB/A-156', 'Translation of Local Newspapers', '26.08. 2022', '', '2022-08-26');
INSERT INTO "file_list" ("id", "file_no", "category", "title", "doc1", "entry_date_real") VALUES
(3527, 'MSB/CB/A-156', 'Translation of Local Newspapers', '29.08.2022', '', '2022-08-29');
INSERT INTO "file_list" ("id", "file_no", "category", "title", "doc1", "entry_date_real") VALUES
(3528, 'MSB/CB/A-156', 'Translation of Local Newspapers', '30.08.2022', '', '2022-08-30');
INSERT INTO "file_list" ("id", "file_no", "category", "title", "doc1", "entry_date_real") VALUES
(3529, 'MSB/CB/A-156', 'Translation of Local Newspapers', '31.08.2022', '', '2022-08-31');
INSERT INTO "file_list" ("id", "file_no", "category", "title", "doc1", "entry_date_real") VALUES
(3530, 'MSB/CB/A-156', 'Translation of Local Newspapers', '01.12.2022', '', '2022-12-01');
INSERT INTO "file_list" ("id", "file_no", "category", "title", "doc1", "entry_date_real") VALUES
(3531, 'MSB/CB/A-156', 'Translation of Local Newspapers', '02.12.2022', '', '2022-12-02');
INSERT INTO "file_list" ("id", "file_no", "category", "title", "doc1", "entry_date_real") VALUES
(3532, 'MSB/CB/A-156', 'Translation of Local Newspapers', '05.12.2022', '', '2022-12-05');
INSERT INTO "file_list" ("id", "file_no", "category", "title", "doc1", "entry_date_real") VALUES
(3533, 'MSB/CB/A-156', 'Translation of Local Newspapers', '06.12.2022', '', '2022-12-06');
INSERT INTO "file_list" ("id", "file_no", "category", "title", "doc1", "entry_date_real") VALUES
(3534, 'MSB/CB/A-156', 'Translation of Local Newspapers', '07.12.2022', '', '2022-12-07');
INSERT INTO "file_list" ("id", "file_no", "category", "title", "doc1", "entry_date_real") VALUES
(3535, 'MSB/CB/A-156', 'Translation of Local Newspapers', '08.12.2022', '', '2022-12-08');
INSERT INTO "file_list" ("id", "file_no", "category", "title", "doc1", "entry_date_real") VALUES
(3536, 'MSB/CB/A-156', 'Translation of Local Newspapers', '09.12.2022', '', '2022-12-09');
INSERT INTO "file_list" ("id", "file_no", "category", "title", "doc1", "entry_date_real") VALUES
(3537, 'MSB/CB/A-156', 'Translation of Local Newspapers', '12.12.2022', '', '2022-12-12');
INSERT INTO "file_list" ("id", "file_no", "category", "title", "doc1", "entry_date_real") VALUES
(3538, 'MSB/CB/A-156', 'Translation of Local Newspapers', '13.12.2022', '', '2022-12-13');
INSERT INTO "file_list" ("id", "file_no", "category", "title", "doc1", "entry_date_real") VALUES
(3539, 'MSB/CB/A-156', 'Translation of Local Newspapers', '14.12.2022', '', '2022-12-14');
INSERT INTO "file_list" ("id", "file_no", "category", "title", "doc1", "entry_date_real") VALUES
(3540, 'MSB/CB/A-156', 'Translation of Local Newspapers', '15.12.2022', '', '2022-12-15');
INSERT INTO "file_list" ("id", "file_no", "category", "title", "doc1", "entry_date_real") VALUES
(3541, 'MSB/CB/A-156', 'Translation of Local Newspapers', '16.12.2022', '', '2022-12-16');
INSERT INTO "file_list" ("id", "file_no", "category", "title", "doc1", "entry_date_real") VALUES
(3542, 'MSB/CB/A-156', 'Translation of Local Newspapers', '19.12.2022', '', '2022-12-19');
INSERT INTO "file_list" ("id", "file_no", "category", "title", "doc1", "entry_date_real") VALUES
(3543, 'MSB/CB/A-156', 'Translation of Local Newspapers', '20.12.2022', '', '2022-12-20');
INSERT INTO "file_list" ("id", "file_no", "category", "title", "doc1", "entry_date_real") VALUES
(3544, 'MSB/CB/A-156', 'Translation of Local Newspapers', '21.12.2022', '', '2022-12-21');
INSERT INTO "file_list" ("id", "file_no", "category", "title", "doc1", "entry_date_real") VALUES
(3545, 'MSB/CB/A-156', 'Translation of Local Newspapers', '22.12.2022', '', '2022-12-22');
INSERT INTO "file_list" ("id", "file_no", "category", "title", "doc1", "entry_date_real") VALUES
(3546, 'MSB/CB/A-156', 'Translation of Local Newspapers', '23.12.2022', '', '2022-12-23');
INSERT INTO "file_list" ("id", "file_no", "category", "title", "doc1", "entry_date_real") VALUES
(3547, 'MSB/CB/A-112', 'Conference of DGP/IGP/ADGP', 'ATR on recommendations of 27th Conference of DGsP/IGsP and Heads of CPOs held at Agartala (November 22-23, 2022)-reg.', '', '2023-01-27');
INSERT INTO "file_list" ("id", "file_no", "category", "title", "doc1", "entry_date_real") VALUES
(3548, 'MSB/CB/C-6', 'Mizoram Subordinate Finance Account Service Association/MTASA/MF&ASA', 'DSI 9.11.2022 Mizoram Subordinate Finance Account Service Association/MTASA/MF&ASA', '', '2022-11-16');
INSERT INTO "file_list" ("id", "file_no", "category", "title", "doc1", "entry_date_real") VALUES
(3549, 'MSB/CB/C-10', 'Federation of Mizoram Engineer Service Association/MDESA', 'DSI 22.11.2022 Federation of Mizoram Engineer Service Association/MDESA', '', '2022-12-06');
INSERT INTO "file_list" ("id", "file_no", "category", "title", "doc1", "entry_date_real") VALUES
(3550, 'MSB/CB/C-12', 'Mizoram Electric Service Association (MESA)/MEMA/MIMA', 'DSI 2022 Mizoram Electric Service Association (MESA)/MEMA/MIMA', '', '2022-08-16');
INSERT INTO "file_list" ("id", "file_no", "category", "title", "doc1", "entry_date_real") VALUES
(3551, 'MSB/CB/C-13', 'Mizoram Group D Association', 'DSI 2022 Mizoram Group D Association', '', '2022-12-20');
INSERT INTO "file_list" ("id", "file_no", "category", "title", "doc1", "entry_date_real") VALUES
(3552, 'MSB/CB/C-15', 'Mizoram Trade Union (MTU)/ National Trade Union of Mizoram(NTUM)', 'DSI 2022 Mizoram Trade Union (MTU)/ National Trade Union of Mizoram(NTUM)', '', '2022-12-06');
INSERT INTO "file_list" ("id", "file_no", "category", "title", "doc1", "entry_date_real") VALUES
(3553, 'MSB/CB/C-20', 'Mizoram Drivers Union/Association', 'DSI 2022 Mizoram Drivers Union/Association', '', '2022-12-20');
INSERT INTO "file_list" ("id", "file_no", "category", "title", "doc1", "entry_date_real") VALUES
(3554, 'MSB/CB/C-26', 'Agriculture/Horticulture/Fisheries Deptt./ZOPAR(B)', 'DSI 2022 Agriculture/Horticulture/Fisheries Deptt./ZOPAR(B)', '', '2022-04-29');
INSERT INTO "file_list" ("id", "file_no", "category", "title", "doc1", "entry_date_real") VALUES
(3555, 'MSB/CB/C-33', 'Mizoram Doctors Association/ Medical & Health', 'DSI 2022 Mizoram Doctors Association/ Medical & Health', '', '2022-08-24');
INSERT INTO "file_list" ("id", "file_no", "category", "title", "doc1", "entry_date_real") VALUES
(3556, 'MSB/CB/C-34', 'Mizoram Govt. Nurses Service Assn./Trained Nurses Assn.  of India', 'DSI 2022 Mizoram Govt. Nurses Service Assn./Trained Nurses Assn.  of India', '', '2022-05-23');
INSERT INTO "file_list" ("id", "file_no", "category", "title", "doc1", "entry_date_real") VALUES
(3557, 'MSB/CB/C-35', 'Mizoram Health Employees Assn./Technical/Mizoram Multipurpose service Assn.', 'DSI 2022 Mizoram Health Employees Assn./Technical/Mizoram Multipurpose service Assn.', '', '2022-12-20');
INSERT INTO "file_list" ("id", "file_no", "category", "title", "doc1", "entry_date_real") VALUES
(3558, 'MSB/CB/C-38', 'Mizoram Civil Pensioners Assn./VRSPA', 'DSI 2022 Mizoram Civil Pensioners Assn./VRSPA', '', '2022-07-04');
INSERT INTO "file_list" ("id", "file_no", "category", "title", "doc1", "entry_date_real") VALUES
(3559, 'MSB/CB/C-43', 'MISCELLANEOUS(NGO)/District Implementing Demand Committee', 'DSI 2022 MISCELLANEOUS(NGO)/District Implementing Demand Committee', '', '2022-12-29');
INSERT INTO "file_list" ("id", "file_no", "category", "title", "doc1", "entry_date_real") VALUES
(3560, 'MSB/CB/C-47', 'MHIP', 'DSI 2022 MHIP', '', '2022-12-20');
INSERT INTO "file_list" ("id", "file_no", "category", "title", "doc1", "entry_date_real") VALUES
(3561, 'MSB/CB/C-50(A)', 'All Mizoram College Teacher Union(Lecturer/Guest Lecturer)', 'DSI 2022 All Mizoram College Teacher Union(Lecturer/Guest Lecturer)', '', '2022-12-20');
INSERT INTO "file_list" ("id", "file_no", "category", "title", "doc1", "entry_date_real") VALUES
(3562, 'MSB/CB/C-51', 'All Mizoram College Students Union/Secondary School.', 'DSI 2022 All Mizoram College Students Union/Secondary School.', '', '2022-12-02');
INSERT INTO "file_list" ("id", "file_no", "category", "title", "doc1", "entry_date_real") VALUES
(3563, 'MSB/CB/C-51(A)', 'AIZAWL CITY COLLEGE JOINT STUDENT UNION', 'DSI 2022 AIZAWL CITY COLLEGE JOINT STUDENT UNION', '', '2022-12-20');
INSERT INTO "file_list" ("id", "file_no", "category", "title", "doc1", "entry_date_real") VALUES
(3564, 'MSB/CB/C-53', 'Mizoram Middle School Teacher Assn.', 'DSI 2022 Mizoram Middle School Teacher Assn.', '', '2022-12-20');
INSERT INTO "file_list" ("id", "file_no", "category", "title", "doc1", "entry_date_real") VALUES
(3565, 'MSB/CB/A-156', 'Translation of Local Newspapers', '1.7.2022', '', '2022-07-01');
INSERT INTO "file_list" ("id", "file_no", "category", "title", "doc1", "entry_date_real") VALUES
(3566, 'MSB/CB/A-156', 'Translation of Local Newspapers', '4.7.2022', '', '2022-07-04');
INSERT INTO "file_list" ("id", "file_no", "category", "title", "doc1", "entry_date_real") VALUES
(3567, 'MSB/CB/A-156', 'Translation of Local Newspapers', '5.7.2022', '', '2022-07-05');
INSERT INTO "file_list" ("id", "file_no", "category", "title", "doc1", "entry_date_real") VALUES
(3568, 'MSB/CB/A-156', 'Translation of Local Newspapers', '7.7.2022', '', '2022-07-07');
INSERT INTO "file_list" ("id", "file_no", "category", "title", "doc1", "entry_date_real") VALUES
(3569, 'MSB/CB/A-156', 'Translation of Local Newspapers', '8.7.2022', '', '2022-07-08');
INSERT INTO "file_list" ("id", "file_no", "category", "title", "doc1", "entry_date_real") VALUES
(3570, 'MSB/CB/A-156', 'Translation of Local Newspapers', '11. 7. 2022', '', '2022-07-11');
INSERT INTO "file_list" ("id", "file_no", "category", "title", "doc1", "entry_date_real") VALUES
(3571, 'MSB/CB/A-156', 'Translation of Local Newspapers', '12.7.2022', '', '2022-07-12');
INSERT INTO "file_list" ("id", "file_no", "category", "title", "doc1", "entry_date_real") VALUES
(3572, 'MSB/CB/A-156', 'Translation of Local Newspapers', '13.7.2022', '', '2022-07-13');
INSERT INTO "file_list" ("id", "file_no", "category", "title", "doc1", "entry_date_real") VALUES
(3573, 'MSB/CB/A-156', 'Translation of Local Newspapers', '14.7.2022', '', '2022-07-14');
INSERT INTO "file_list" ("id", "file_no", "category", "title", "doc1", "entry_date_real") VALUES
(3574, 'MSB/CB/A-156', 'Translation of Local Newspapers', '15.7.2022', '', '2022-07-15');
INSERT INTO "file_list" ("id", "file_no", "category", "title", "doc1", "entry_date_real") VALUES
(3575, 'MSB/CB/A-156', 'Translation of Local Newspapers', '18.7.2022', '', '2022-07-18');
INSERT INTO "file_list" ("id", "file_no", "category", "title", "doc1", "entry_date_real") VALUES
(3576, 'MSB/CB/A-156', 'Translation of Local Newspapers', '19.7.2022', '', '2022-07-19');
INSERT INTO "file_list" ("id", "file_no", "category", "title", "doc1", "entry_date_real") VALUES
(3577, 'MSB/CB/A-156', 'Translation of Local Newspapers', '20.7.2022', '', '2022-07-20');
INSERT INTO "file_list" ("id", "file_no", "category", "title", "doc1", "entry_date_real") VALUES
(3578, 'MSB/CB/A-156', 'Translation of Local Newspapers', '21.7.2022', '', '2022-07-21');
INSERT INTO "file_list" ("id", "file_no", "category", "title", "doc1", "entry_date_real") VALUES
(3579, 'MSB/CB/A-156', 'Translation of Local Newspapers', '22.7.2022', '', '2022-07-22');
INSERT INTO "file_list" ("id", "file_no", "category", "title", "doc1", "entry_date_real") VALUES
(3580, 'MSB/CB/A-156', 'Translation of Local Newspapers', '25.7.2022', '', '2022-07-25');
INSERT INTO "file_list" ("id", "file_no", "category", "title", "doc1", "entry_date_real") VALUES
(3581, 'MSB/CB/A-156', 'Translation of Local Newspapers', '26.7.2022', '', '2022-07-26');
INSERT INTO "file_list" ("id", "file_no", "category", "title", "doc1", "entry_date_real") VALUES
(3582, 'MSB/CB/A-156', 'Translation of Local Newspapers', '27.7.2022', '', '2022-07-27');
INSERT INTO "file_list" ("id", "file_no", "category", "title", "doc1", "entry_date_real") VALUES
(3583, 'MSB/CB/A-156', 'Translation of Local Newspapers', '28.7.2022', '', '2022-07-28');
INSERT INTO "file_list" ("id", "file_no", "category", "title", "doc1", "entry_date_real") VALUES
(3584, 'MSB/CB/A-156', 'Translation of Local Newspapers', '29.7.2022', '', '2022-07-29');
INSERT INTO "file_list" ("id", "file_no", "category", "title", "doc1", "entry_date_real") VALUES
(3585, 'MSB/CB/A-156', 'Translation of Local Newspapers', '16.6.2022', '', '2022-06-16');
INSERT INTO "file_list" ("id", "file_no", "category", "title", "doc1", "entry_date_real") VALUES
(3586, 'MSB/CB/A-156', 'Translation of Local Newspapers', '17.6.2022', '', '2022-06-17');
INSERT INTO "file_list" ("id", "file_no", "category", "title", "doc1", "entry_date_real") VALUES
(3587, 'MSB/CB/A-156', 'Translation of Local Newspapers', '20.6.2022', '', '2022-06-20');
INSERT INTO "file_list" ("id", "file_no", "category", "title", "doc1", "entry_date_real") VALUES
(3588, 'MSB/CB/A-156', 'Translation of Local Newspapers', '21.6.2022', '', '2022-06-21');
INSERT INTO "file_list" ("id", "file_no", "category", "title", "doc1", "entry_date_real") VALUES
(3589, 'MSB/CB/A-156', 'Translation of Local Newspapers', '22.6.2022', '', '2022-06-22');
INSERT INTO "file_list" ("id", "file_no", "category", "title", "doc1", "entry_date_real") VALUES
(3590, 'MSB/CB/A-156', 'Translation of Local Newspapers', '23.6.2022', '', '2022-06-23');
INSERT INTO "file_list" ("id", "file_no", "category", "title", "doc1", "entry_date_real") VALUES
(3591, 'MSB/CB/A-156', 'Translation of Local Newspapers', '23.6.2022', '', '2022-06-23');
INSERT INTO "file_list" ("id", "file_no", "category", "title", "doc1", "entry_date_real") VALUES
(3592, 'MSB/CB/A-156', 'Translation of Local Newspapers', '24.6.2022', '', '2022-06-24');
INSERT INTO "file_list" ("id", "file_no", "category", "title", "doc1", "entry_date_real") VALUES
(3593, 'MSB/CB/A-156', 'Translation of Local Newspapers', '27.6.2022', '', '2022-06-27');
INSERT INTO "file_list" ("id", "file_no", "category", "title", "doc1", "entry_date_real") VALUES
(3594, 'MSB/CB/A-156', 'Translation of Local Newspapers', '28.6.2022', '', '2022-06-28');
INSERT INTO "file_list" ("id", "file_no", "category", "title", "doc1", "entry_date_real") VALUES
(3595, 'MSB/CB/A-156', 'Translation of Local Newspapers', '29.6.2022', '', '2022-06-29');
INSERT INTO "file_list" ("id", "file_no", "category", "title", "doc1", "entry_date_real") VALUES
(3596, 'MSB/CB/A-156', 'Translation of Local Newspapers', 'Fdd News Paper', '', '2022-06-17');
INSERT INTO "file_list" ("id", "file_no", "category", "title", "doc1", "entry_date_real") VALUES
(3597, 'MSB/CB/A-156', 'Translation of Local Newspapers', '07.11.2022', '', '2022-11-07');
INSERT INTO "file_list" ("id", "file_no", "category", "title", "doc1", "entry_date_real") VALUES
(3598, 'MSB/CB/A-156', 'Translation of Local Newspapers', '09.11.2022', '', '2022-11-09');
INSERT INTO "file_list" ("id", "file_no", "category", "title", "doc1", "entry_date_real") VALUES
(3599, 'MSB/CB/A-156', 'Translation of Local Newspapers', '10 .11.2022', '', '2022-11-10');
INSERT INTO "file_list" ("id", "file_no", "category", "title", "doc1", "entry_date_real") VALUES
(3600, 'MSB/CB/A-156', 'Translation of Local Newspapers', '11 .11.2022', '', '2022-11-11');
INSERT INTO "file_list" ("id", "file_no", "category", "title", "doc1", "entry_date_real") VALUES
(3601, 'MSB/CB/A-156', 'Translation of Local Newspapers', '14 .11.2022', '', '2022-11-14');
INSERT INTO "file_list" ("id", "file_no", "category", "title", "doc1", "entry_date_real") VALUES
(3602, 'MSB/CB/A-156', 'Translation of Local Newspapers', '15 .11.2022', '', '2022-11-15');
INSERT INTO "file_list" ("id", "file_no", "category", "title", "doc1", "entry_date_real") VALUES
(3603, 'MSB/CB/A-156', 'Translation of Local Newspapers', '16.11.2022', '', '2022-11-16');
INSERT INTO "file_list" ("id", "file_no", "category", "title", "doc1", "entry_date_real") VALUES
(3604, 'MSB/CB/A-156', 'Translation of Local Newspapers', '21 .11.2022', '', '2022-11-21');
INSERT INTO "file_list" ("id", "file_no", "category", "title", "doc1", "entry_date_real") VALUES
(3605, 'MSB/CB/A-156', 'Translation of Local Newspapers', '22.11.2022', '', '2022-11-22');
INSERT INTO "file_list" ("id", "file_no", "category", "title", "doc1", "entry_date_real") VALUES
(3606, 'MSB/CB/A-156', 'Translation of Local Newspapers', '23.11.2022', '', '2022-11-23');
INSERT INTO "file_list" ("id", "file_no", "category", "title", "doc1", "entry_date_real") VALUES
(3607, 'MSB/CB/A-156', 'Translation of Local Newspapers', '24.11.2022', '', '2022-11-24');
INSERT INTO "file_list" ("id", "file_no", "category", "title", "doc1", "entry_date_real") VALUES
(3608, 'MSB/CB/A-156', 'Translation of Local Newspapers', '25.11.2022', '', '2022-11-25');
INSERT INTO "file_list" ("id", "file_no", "category", "title", "doc1", "entry_date_real") VALUES
(3609, 'MSB/CB/A-156', 'Translation of Local Newspapers', '28.11.2022', '', '2022-11-28');
INSERT INTO "file_list" ("id", "file_no", "category", "title", "doc1", "entry_date_real") VALUES
(3610, 'MSB/CB/A-156', 'Translation of Local Newspapers', '29.11.2022', '', '2022-11-29');
INSERT INTO "file_list" ("id", "file_no", "category", "title", "doc1", "entry_date_real") VALUES
(3611, 'MSB/CB/A-156', 'Translation of Local Newspapers', '30.11.2022', '', '2022-11-30');
INSERT INTO "file_list" ("id", "file_no", "category", "title", "doc1", "entry_date_real") VALUES
(3612, 'MSB/CB/A-156', 'Translation of Local Newspapers', '03.10.2022', '', '2022-10-03');
INSERT INTO "file_list" ("id", "file_no", "category", "title", "doc1", "entry_date_real") VALUES
(3613, 'MSB/CB/A-156', 'Translation of Local Newspapers', '04.10.2022', '', '2022-10-04');
INSERT INTO "file_list" ("id", "file_no", "category", "title", "doc1", "entry_date_real") VALUES
(3614, 'MSB/CB/A-156', 'Translation of Local Newspapers', '06.10.2022', '', '2022-10-06');
INSERT INTO "file_list" ("id", "file_no", "category", "title", "doc1", "entry_date_real") VALUES
(3615, 'MSB/CB/A-156', 'Translation of Local Newspapers', '07.10.2022', '', '2022-10-07');
INSERT INTO "file_list" ("id", "file_no", "category", "title", "doc1", "entry_date_real") VALUES
(3616, 'MSB/CB/A-156', 'Translation of Local Newspapers', '10.10.2022', '', '2022-10-10');
INSERT INTO "file_list" ("id", "file_no", "category", "title", "doc1", "entry_date_real") VALUES
(3617, 'MSB/CB/A-156', 'Translation of Local Newspapers', '11.10.2022', '', '2022-10-11');
INSERT INTO "file_list" ("id", "file_no", "category", "title", "doc1", "entry_date_real") VALUES
(3618, 'MSB/CB/A-156', 'Translation of Local Newspapers', '12.10.2022', '', '2022-10-12');
INSERT INTO "file_list" ("id", "file_no", "category", "title", "doc1", "entry_date_real") VALUES
(3619, 'MSB/CB/A-156', 'Translation of Local Newspapers', '13.10.2022', '', '2022-10-13');
INSERT INTO "file_list" ("id", "file_no", "category", "title", "doc1", "entry_date_real") VALUES
(3620, 'MSB/CB/A-156', 'Translation of Local Newspapers', '14.10.2022', '', '2022-10-14');
INSERT INTO "file_list" ("id", "file_no", "category", "title", "doc1", "entry_date_real") VALUES
(3621, 'MSB/CB/C-54', 'Mizoram Primary School Teacher Assn.', 'Primary School Teachers'' Association (PSTA) General Headquarters, Lawngtlai in its Press Release issued on 15.6.2022', '', '2022-06-17');
INSERT INTO "file_list" ("id", "file_no", "category", "title", "doc1", "entry_date_real") VALUES
(3622, 'MSB/CB/C-55', 'Mizoram Hindi Teacher Assn./MHSU/RBVS', 'DSI 2022 Mizoram Hindi Teacher Assn./MHSU/RBVS', '', '2022-10-31');
INSERT INTO "file_list" ("id", "file_no", "category", "title", "doc1", "entry_date_real") VALUES
(3623, 'MSB/CB/C-57', 'Mizoram Students Union(MSU)', 'DSI 2022 Mizoram Students Union(MSU)', '', '2022-12-21');
INSERT INTO "file_list" ("id", "file_no", "category", "title", "doc1", "entry_date_real") VALUES
(3624, 'MSB/CB/C-58', 'Mizoram Student Self Support Union/SSU', 'DS I2022 Mizoram Student Self Support Union/SSU', '', '2022-12-21');
INSERT INTO "file_list" ("id", "file_no", "category", "title", "doc1", "entry_date_real") VALUES
(3625, 'MSB/CB/C-59', 'National Students Union of India(MZ)', 'DSI 2022 National Students Union of India(MZ)', '', '2022-11-11');
INSERT INTO "file_list" ("id", "file_no", "category", "title", "doc1", "entry_date_real") VALUES
(3626, 'MSB/CB/C-61', 'North East Students Union/ Organisation (NESO)', 'DSI 2022 North East Students Union/ Organisation (NESO)', '', '2022-12-02');
INSERT INTO "file_list" ("id", "file_no", "category", "title", "doc1", "entry_date_real") VALUES
(3627, 'MSB/CB/C-69', 'Mara Students Association/Union/ MTP', 'DSI 2022 Mara Students Association/Union/ MTP', '', '2022-08-26');
INSERT INTO "file_list" ("id", "file_no", "category", "title", "doc1", "entry_date_real") VALUES
(3628, 'MSB/CB/C-70', 'Lai Students Association/Union', 'DSI 2022 Lai Students Association/Union', '', '2022-09-06');
INSERT INTO "file_list" ("id", "file_no", "category", "title", "doc1", "entry_date_real") VALUES
(3629, 'MSB/CB/C-75', 'Natural Calamities', 'DSI 2022 Natural Calamities', '', '2022-08-05');
INSERT INTO "file_list" ("id", "file_no", "category", "title", "doc1", "entry_date_real") VALUES
(3630, 'MSB/CB/C-77', 'MISCELANEOUS (Y&S) & NIT', 'DSI 2022 MISCELANEOUS (Y&S) & NIT', '', '2022-09-13');
INSERT INTO "file_list" ("id", "file_no", "category", "title", "doc1", "entry_date_real") VALUES
(3631, 'MSB/CB/C-80', 'Church activities', 'DSI 2022 Church activities', '', '2022-11-23');
INSERT INTO "file_list" ("id", "file_no", "category", "title", "doc1", "entry_date_real") VALUES
(3632, 'MSB/CB/C-81', 'Young Mans Christian Association', 'DSI 2022 Young Mans Christian Association', '', '2022-08-29');
INSERT INTO "file_list" ("id", "file_no", "category", "title", "doc1", "entry_date_real") VALUES
(3633, 'MSB/CB/C-103', 'Zoram Upa Pawl(MUP)/Mizo Trust', 'DSI 2022 Zoram Upa Pawl(MUP)/Mizo Trust', '', '2022-11-02');
INSERT INTO "file_list" ("id", "file_no", "category", "title", "doc1", "entry_date_real") VALUES
(3634, 'MSB/CB/C-106', 'LC/VC', 'DSI 2022 LC/VC', '', '2022-12-02');
INSERT INTO "file_list" ("id", "file_no", "category", "title", "doc1", "entry_date_real") VALUES
(3635, 'MSB/CB/C-107', 'Ex-MNA Association/Martyr Family Association', 'DSI 2022 Ex-MNA Association/Martyr Family Association', '', '2022-12-12');
INSERT INTO "file_list" ("id", "file_no", "category", "title", "doc1", "entry_date_real") VALUES
(3636, 'MSB/CB/C-109', 'Mizoram Journalist Association(MJA)/ Press Club', 'DSI 2022 Mizoram Journalist Association(MJA)/ Press Club', '', '2022-09-02');
INSERT INTO "file_list" ("id", "file_no", "category", "title", "doc1", "entry_date_real") VALUES
(3637, 'MSB/CB/C-113', 'MNF Party', 'DSI 2022 MNF Party', '', '2022-12-27');
INSERT INTO "file_list" ("id", "file_no", "category", "title", "doc1", "entry_date_real") VALUES
(3638, 'MSB/CB/C-114', 'Congress Party', 'DSI 2022 Congress Party', '', '2022-12-27');
INSERT INTO "file_list" ("id", "file_no", "category", "title", "doc1", "entry_date_real") VALUES
(3639, 'MSB/CB/C-115(B)', 'Peoples Conference Party PCP', 'DSI 2022 Peoples Conference Party PCP', '', '2022-12-27');
INSERT INTO "file_list" ("id", "file_no", "category", "title", "doc1", "entry_date_real") VALUES
(3640, 'MSB/CB/C-116', 'MADC(Mara Autonomous District Council)', 'DSI 2022 MADC(Mara Autonomous District Council)', '', '2022-12-27');
INSERT INTO "file_list" ("id", "file_no", "category", "title", "doc1", "entry_date_real") VALUES
(3641, 'MSB/CB/C-117', 'LADC(Lai Autonomous District Council)', 'DSI 2022 LADC(Lai Autonomous District Council)', '', '2022-12-02');
INSERT INTO "file_list" ("id", "file_no", "category", "title", "doc1", "entry_date_real") VALUES
(3642, 'MSB/CB/C-118', 'CADC(Chakma Autonomous District Council)', 'DSI 2022 CADC(Chakma Autonomous District Council)', '', '2022-11-16');
INSERT INTO "file_list" ("id", "file_no", "category", "title", "doc1", "entry_date_real") VALUES
(3643, 'MSB/CB/C-119', 'Mizo Zirlai Pawl(MZP)', 'DSI 2022 Mizo Zirlai Pawl(MZP)', '', '2022-12-21');
INSERT INTO "file_list" ("id", "file_no", "category", "title", "doc1", "entry_date_real") VALUES
(3644, 'MSB/CB/C-120', 'Y.M.A', 'DSI 2022 Y.M.A', '', '2022-12-29');
INSERT INTO "file_list" ("id", "file_no", "category", "title", "doc1", "entry_date_real") VALUES
(3645, 'MSB/CB/C-122', 'BJP(Bhartya Janata Party)', 'DSI 2022 BJP(Bhartya Janata Party)', '', '2022-12-21');
INSERT INTO "file_list" ("id", "file_no", "category", "title", "doc1", "entry_date_real") VALUES
(3646, 'MSB/CB/C-126', 'YLA(Young Lai Association)', 'DSI 2022 YLA(Young Lai Association)', '', '2022-12-22');
INSERT INTO "file_list" ("id", "file_no", "category", "title", "doc1", "entry_date_real") VALUES
(3647, 'MSB/CB/C-130', 'ZNP(Zoram Nationalist Party)', 'DSI 2022 ZNP(Zoram Nationalist Party)', '', '2022-10-11');
INSERT INTO "file_list" ("id", "file_no", "category", "title", "doc1", "entry_date_real") VALUES
(3648, 'MSB/CB/C-130(B)', 'Zoram Peoples Movement(ZPM)', 'DSI 2022 Zoram Peoples Movement(ZPM)', '', '2022-12-22');
INSERT INTO "file_list" ("id", "file_no", "category", "title", "doc1", "entry_date_real") VALUES
(3649, 'MSB/CB/C-133', 'AMFU(All Mizoram Farmers Union)/NE Farmers Union', 'DSI 2022 AMFU(All Mizoram Farmers Union)/NE Farmers Union', '', '2022-07-27');
INSERT INTO "file_list" ("id", "file_no", "category", "title", "doc1", "entry_date_real") VALUES
(3650, 'MSB/CB/C-134', 'Mizo Consumers Union(MCU)/Co-operative Union', 'DSI 2022 Mizo Consumers Union(MCU)/Co-operative Union', '', '2022-12-20');
INSERT INTO "file_list" ("id", "file_no", "category", "title", "doc1", "entry_date_real") VALUES
(3651, 'MSB/CB/C-140', 'MISCELLANEOUS (L&S)', 'DSI 2022 MISCELLANEOUS (L&S)', '', '2022-12-20');
INSERT INTO "file_list" ("id", "file_no", "category", "title", "doc1", "entry_date_real") VALUES
(3652, 'MSB/CB/C-142', 'Remna Run Chhuak Association/PAMRA', 'DSI 2022 Remna Run Chhuak Association/PAMRA', '', '2022-12-20');
INSERT INTO "file_list" ("id", "file_no", "category", "title", "doc1", "entry_date_real") VALUES
(3653, 'MSB/CB/C-175(B)', 'Mizoram Secondary School Teacher (MISSTA)', 'DSI 2022 Mizoram Secondary School Teacher (MISSTA)', '', '2022-10-31');
INSERT INTO "file_list" ("id", "file_no", "category", "title", "doc1", "entry_date_real") VALUES
(3654, 'MSB/CB/C-186', 'Mizoram Govt. Aided High School Teachers Assn.(MIGAHTA)', 'DSI 2022 Mizoram Govt. Aided High School Teachers Assn.(MIGAHTA)', '', '2022-12-02');
INSERT INTO "file_list" ("id", "file_no", "category", "title", "doc1", "entry_date_real") VALUES
(3655, 'MSB/CB/C-200', 'Mizoram Taxi Driver Association/Auto Rickshaw', 'DSI 2022 Mizoram Taxi Driver Association/Auto Rickshaw', '', '2022-12-22');
INSERT INTO "file_list" ("id", "file_no", "category", "title", "doc1", "entry_date_real") VALUES
(3656, 'MSB/CB/C-210', 'Right to Information Act (RTI)', 'DSI 2022 Right to Information Act (RTI)', '', '2022-02-09');
INSERT INTO "file_list" ("id", "file_no", "category", "title", "doc1", "entry_date_real") VALUES
(3657, 'MSB/CB/C-211', 'Mizoram Peoples Forum(MPF)', 'DSI 2022  Mizoram Peoples Forum(MPF)', '', '2023-04-24');
INSERT INTO "file_list" ("id", "file_no", "category", "title", "doc1", "entry_date_real") VALUES
(3658, 'MSB/CB/C-216', 'Mizoram Cement & Iron Rod Dealer Association', 'DSI 2022 Mizoram Cement & Iron Rod Dealer Association', '', '2022-03-15');
INSERT INTO "file_list" ("id", "file_no", "category", "title", "doc1", "entry_date_real") VALUES
(3659, 'MSB/CB/C-218', 'Former Legislator Association of Mizoram(FLAM)', 'DSI 2022 Former Legislator Association of Mizoram(FLAM)', '', '2022-11-23');
INSERT INTO "file_list" ("id", "file_no", "category", "title", "doc1", "entry_date_real") VALUES
(3660, 'MSB/CB/C-222', 'Science Teachers Association (STA)', 'DSI 2022 Science Teachers Association (STA)', '', '2022-09-12');
INSERT INTO "file_list" ("id", "file_no", "category", "title", "doc1", "entry_date_real") VALUES
(3661, 'MSB/CB/C-226', 'Mizoram Secretariat Service Association (MSSA)', 'DSI 2022 Mizoram Secretariat Service Association (MSSA)', '', '2022-09-21');
INSERT INTO "file_list" ("id", "file_no", "category", "title", "doc1", "entry_date_real") VALUES
(3662, 'MSB/CB/C-239', 'Aizawl City Bus Owner Association', 'DSI 2022 Aizawl City Bus Owner Association', '', '2022-04-21');
INSERT INTO "file_list" ("id", "file_no", "category", "title", "doc1", "entry_date_real") VALUES
(3663, 'MSB/CB/C-264', 'Mizoram Underground Returnee Association(MURA)', 'DSI 2022 Mizoram Underground Returnee Association(MURA)', '', '2022-06-17');
INSERT INTO "file_list" ("id", "file_no", "category", "title", "doc1", "entry_date_real") VALUES
(3664, 'MSB/CB/C-275', 'Federation of Govt.School Teacher Association (FMGST)/SSA/SEWC', 'DSI 2022 Federation of Govt.School Teacher Association (FMGST)/SSA/SEWC', '', '2022-10-25');
INSERT INTO "file_list" ("id", "file_no", "category", "title", "doc1", "entry_date_real") VALUES
(3665, 'MSB/CB/C-285(A)', 'Mizoram Truck Owner/Driver/MTOA/MTDA', 'DSI 2022 Mizoram Truck Owner/Driver/MTOA/MTDA', '', '2022-10-31');
INSERT INTO "file_list" ("id", "file_no", "category", "title", "doc1", "entry_date_real") VALUES
(3666, 'MSB/CB/C-297', 'Zoram Decentralization Front/AAP/UDF/TMC/ZRF', 'DSI 2022 Zoram Decentralization Front/AAP/UDF/TMC/ZRF', '', '2022-12-20');
INSERT INTO "file_list" ("id", "file_no", "category", "title", "doc1", "entry_date_real") VALUES
(3667, 'MSB/CB/Covid 2019', 'Covid 2019', 'DSI 2022 Covid 2019', '', '2022-10-03');
INSERT INTO "file_list" ("id", "file_no", "category", "title", "doc1", "entry_date_real") VALUES
(3668, 'MSB/CB/D-58', 'MAP', 'DSI 2022 MAP', '', '2022-04-13');
INSERT INTO "file_list" ("id", "file_no", "category", "title", "doc1", "entry_date_real") VALUES
(3669, 'MSB/CB/A-156', 'Translation of Local Newspapers', '01.09.2022', '', '2022-09-01');
INSERT INTO "file_list" ("id", "file_no", "category", "title", "doc1", "entry_date_real") VALUES
(3670, 'MSB/CB/A-156', 'Translation of Local Newspapers', '02.09.2022', '', '2022-09-02');
INSERT INTO "file_list" ("id", "file_no", "category", "title", "doc1", "entry_date_real") VALUES
(3671, 'MSB/CB/A-156', 'Translation of Local Newspapers', '05.09.2022', '', '2022-09-05');
INSERT INTO "file_list" ("id", "file_no", "category", "title", "doc1", "entry_date_real") VALUES
(3672, 'MSB/CB/A-156', 'Translation of Local Newspapers', '06.09.2022', '', '2022-09-06');
INSERT INTO "file_list" ("id", "file_no", "category", "title", "doc1", "entry_date_real") VALUES
(3673, 'MSB/CB/A-156', 'Translation of Local Newspapers', '07.09.2022', '', '2022-09-07');
INSERT INTO "file_list" ("id", "file_no", "category", "title", "doc1", "entry_date_real") VALUES
(3674, 'MSB/CB/A-156', 'Translation of Local Newspapers', '08.09.2022', '', '2022-09-08');
INSERT INTO "file_list" ("id", "file_no", "category", "title", "doc1", "entry_date_real") VALUES
(3675, 'MSB/CB/A-156', 'Translation of Local Newspapers', '09.09.2022', '', '2022-09-09');
INSERT INTO "file_list" ("id", "file_no", "category", "title", "doc1", "entry_date_real") VALUES
(3676, 'MSB/CB/A-156', 'Translation of Local Newspapers', '12.09.2022', '', '2022-09-12');
INSERT INTO "file_list" ("id", "file_no", "category", "title", "doc1", "entry_date_real") VALUES
(3677, 'MSB/CB/A-156', 'Translation of Local Newspapers', '13.09.2022', '', '2022-09-13');
INSERT INTO "file_list" ("id", "file_no", "category", "title", "doc1", "entry_date_real") VALUES
(3678, 'MSB/CB/A-156', 'Translation of Local Newspapers', '14.09.2022', '', '2022-09-14');
INSERT INTO "file_list" ("id", "file_no", "category", "title", "doc1", "entry_date_real") VALUES
(3679, 'MSB/CB/A-156', 'Translation of Local Newspapers', '15. 09.2022', '', '2022-09-15');
INSERT INTO "file_list" ("id", "file_no", "category", "title", "doc1", "entry_date_real") VALUES
(3680, 'MSB/CB/A-156', 'Translation of Local Newspapers', '16.09.2022', '', '2022-09-16');
INSERT INTO "file_list" ("id", "file_no", "category", "title", "doc1", "entry_date_real") VALUES
(3681, 'MSB/CB/A-156', 'Translation of Local Newspapers', '19.09.2022', '', '2022-09-19');
INSERT INTO "file_list" ("id", "file_no", "category", "title", "doc1", "entry_date_real") VALUES
(3682, 'MSB/CB/A-156', 'Translation of Local Newspapers', '20.09.2022', '', '2022-09-20');
INSERT INTO "file_list" ("id", "file_no", "category", "title", "doc1", "entry_date_real") VALUES
(3683, 'MSB/CB/A-156', 'Translation of Local Newspapers', '21.09.2022', '', '2022-09-21');
INSERT INTO "file_list" ("id", "file_no", "category", "title", "doc1", "entry_date_real") VALUES
(3684, 'MSB/CB/A-156', 'Translation of Local Newspapers', '22.09.2022', '', '2022-09-22');
INSERT INTO "file_list" ("id", "file_no", "category", "title", "doc1", "entry_date_real") VALUES
(3685, 'MSB/CB/A-156', 'Translation of Local Newspapers', '23.09.2022', '', '2022-09-23');
INSERT INTO "file_list" ("id", "file_no", "category", "title", "doc1", "entry_date_real") VALUES
(3686, 'MSB/CB/A-156', 'Translation of Local Newspapers', '26.09.2022', '', '2022-09-26');
INSERT INTO "file_list" ("id", "file_no", "category", "title", "doc1", "entry_date_real") VALUES
(3687, 'MSB/CB/A-156', 'Translation of Local Newspapers', '27.09.2022', '', '2022-09-27');
INSERT INTO "file_list" ("id", "file_no", "category", "title", "doc1", "entry_date_real") VALUES
(3688, 'MSB/CB/A-156', 'Translation of Local Newspapers', '28.09.2022', '', '2022-09-28');
INSERT INTO "file_list" ("id", "file_no", "category", "title", "doc1", "entry_date_real") VALUES
(3689, 'MSB/CB/A-156', 'Translation of Local Newspapers', '29.09.2022', '', '2022-09-29');
INSERT INTO "file_list" ("id", "file_no", "category", "title", "doc1", "entry_date_real") VALUES
(3690, 'MSB/CB/A-156', 'Translation of Local Newspapers', '30.09.2022', '', '2022-09-30');
INSERT INTO "file_list" ("id", "file_no", "category", "title", "doc1", "entry_date_real") VALUES
(3691, 'MSB/CB/A-156', 'Translation of Local Newspapers', 'News paper 28.4.2014 fdd', '', '2014-04-28');
INSERT INTO "file_list" ("id", "file_no", "category", "title", "doc1", "entry_date_real") VALUES
(3692, 'MSB/CB/A-156', 'Translation of Local Newspapers', 'Newspaper Clipping in connection with Press Release issued by Bru Displaced Welfare Organisation(BDWO).', '', '2010-10-21');
INSERT INTO "file_list" ("id", "file_no", "category", "title", "doc1", "entry_date_real") VALUES
(3693, 'MSB/CB/B-14(B) KCNA/KNA', 'KCNA/KNA Bangladesh', '21.11.2022 SR KNA', '', '2022-11-21');
INSERT INTO "file_list" ("id", "file_no", "category", "title", "doc1", "entry_date_real") VALUES
(3694, 'MSB/CB/B-14/KNA', 'Kuki National Army', 'Kuki-Chin National Front Volunteers', '', '2022-03-23');
INSERT INTO "file_list" ("id", "file_no", "category", "title", "doc1", "entry_date_real") VALUES
(3695, 'MSB/CB/A-62', 'Chin National Front(CNF)/Chin National Army(CNA)', 'Myanmar national seized with explosive hindustan times.docx', '', '2022-03-24');
INSERT INTO "file_list" ("id", "file_no", "category", "title", "doc1", "entry_date_real") VALUES
(3696, 'MSB/CB/B-5/NLFT', 'National LiberationFront of Tripura NLFT', 'REPORT ON ARREST OF JACOB HRANGKHAWL, PRESIDENT NATIONAL LIBERATION FRONT OF TRIPURA (NLFT)', '', '2022-08-17');
INSERT INTO "file_list" ("id", "file_no", "category", "title", "doc1", "entry_date_real") VALUES
(3697, 'MSB/CB/B-85/Arms', 'Arms, Smuggling etc.', 'ARMS & AMMUNITIONS TRAFFICKING IN MIZORAM', '', '2018-12-16');
INSERT INTO "file_list" ("id", "file_no", "category", "title", "doc1", "entry_date_real") VALUES
(3698, 'MSB/CB/B-86/BNLF', 'Bru National Liberation Front', 'Implementation of agreements - Reg.', '', '2022-03-08');
INSERT INTO "file_list" ("id", "file_no", "category", "title", "doc1", "entry_date_real") VALUES
(3699, 'MSB/CB/A-7', 'Enquiry against Police Officers & men', 'Enquiry report in respect of Inspr.(UB) H. Lalchawimawia, Kolasib DEF', '', '2023-02-17');
INSERT INTO "file_list" ("id", "file_no", "category", "title", "doc1", "entry_date_real") VALUES
(3700, 'A-3', 'Sinlung Hills Development Council SHDC', 'IsG BSF-REGION COMDRS BGB LEVEL BORDER COORDINATION CONFERENCE HELD FROM 7 TO 9 DECEMBERÂ  2022 AT AGARTALA, INDIA-VERICITY REPORT OF BGB BOOKLETS.', '', '2023-01-23');
INSERT INTO "file_list" ("id", "file_no", "category", "title", "doc1", "entry_date_real") VALUES
(3701, 'MSB/CB/A-88', 'Restructuring and strengthening of State Unit', 'ENGAGEMENT CARD FOR SPECIAL POLICE OFFICER (M.R)', '', '2023-03-29');
INSERT INTO "file_list" ("id", "file_no", "category", "title", "doc1", "entry_date_real") VALUES
(3702, 'MSB/CB/A-88', 'Restructuring and strengthening of State Unit', 'Special Police Officer (SPO) on MR basis', '', '2023-03-28');
INSERT INTO "file_list" ("id", "file_no", "category", "title", "doc1", "entry_date_real") VALUES
(3703, 'MSB/CB/A-90 (A)', 'Quarterly return', 'POSTING OF MUSLIM PERSONNEL IN POLICE STATIONS', '', '2023-01-04');
INSERT INTO "file_list" ("id", "file_no", "category", "title", "doc1", "entry_date_real") VALUES
(3704, 'MSB/CB/A-90 (A)', 'Quarterly return', 'REPORTS ON POSTING OF MUSLIM PERSONNEL IN THANAS IN THE STATE/UT', '', '2023-01-25');
INSERT INTO "file_list" ("id", "file_no", "category", "title", "doc1", "entry_date_real") VALUES
(3705, 'MSB/CB/A-112', 'Conference of DGP/IGP/ADGP', 'ATR on recommendations of 27th Conference of DGsP/IGsP and Heads of CPOs held at Agartala (November 22-23, 2022)-reg.', '', '2023-01-27');
INSERT INTO "file_list" ("id", "file_no", "category", "title", "doc1", "entry_date_real") VALUES
(3706, 'MSB/CB/A-112', 'Conference of DGP/IGP/ADGP', 'Recommendation of North Eastern Regional Coordination Committee (NERPCC) meeting 2022', '', '2023-04-26');
INSERT INTO "file_list" ("id", "file_no", "category", "title", "doc1", "entry_date_real") VALUES
(3707, 'MSB/CB/A-112', 'Conference of DGP/IGP/ADGP', 'Recommendation of North Eastern Regional Coordination Committee (NERPCC) meeting 2022', '', '2023-04-25');
INSERT INTO "file_list" ("id", "file_no", "category", "title", "doc1", "entry_date_real") VALUES
(3708, 'MSB/CB/A-137', 'Recommendation on good government(group of Minister)(Lead Intelligence Agency)LIA', 'Agenda notes for LIA meeting - reg.(WRITE UP ON AGENDAS POINTS FOR LIA MEETING OF 19 APRIL 2023)', '', '2023-04-18');
INSERT INTO "file_list" ("id", "file_no", "category", "title", "doc1", "entry_date_real") VALUES
(3709, 'MSB/CB/A-149', 'SMAC- Subsidiary Multi Agency Centre', 'Â  MAJOR INCIDENTS DURING THE MONTH OF MARCH, 2023', '', '2023-04-03');
INSERT INTO "file_list" ("id", "file_no", "category", "title", "doc1", "entry_date_real") VALUES
(3710, 'MSB/CB/B-69/SPL', 'Special Report correspondence', 'Zophai BOP', '', '2025-06-25');
INSERT INTO "file_list" ("id", "file_no", "category", "title", "doc1", "entry_date_real") VALUES
(3711, 'MSB/CB/B-69/SPL', 'Special Report correspondence', 'Bairabi All NGO Emergency Meeting', '', '2025-06-25');
INSERT INTO "file_list" ("id", "file_no", "category", "title", "doc1", "entry_date_real") VALUES
(3712, 'MSB/CB/B-69/SPL', 'Special Report correspondence', 'Vairengte and Mizoram Police constructed makeshift camp for Mizoram Police at\r\nPu Darthantluangaâ€™s farm land', '', '2025-06-25');
INSERT INTO "file_list" ("id", "file_no", "category", "title", "doc1", "entry_date_real") VALUES
(3713, 'MSB/CB/B-69/SPL', 'Special Report correspondence', 'Assam Government intended to construct road up to Upper Phainuam Lower Primary School', '', '2025-06-25');
INSERT INTO "file_list" ("id", "file_no", "category", "title", "doc1", "entry_date_real") VALUES
(3714, 'MSB/CB/B-69/SPL', 'Special Report correspondence', 'Assam government started construction of road from Pu Chalchhunga of Buarchep, Kolasib District paddy field, near Hawaithang Junction', '', '2025-06-25');
INSERT INTO "file_list" ("id", "file_no", "category", "title", "doc1", "entry_date_real") VALUES
(3715, 'MSB/CB/B-69/SPL', 'Special Report correspondence', '11.7.2021 @ 2:40 a.m. and 2:43 a.m. 2 (two) loud explosions were heard inside the forest at the disputed area', '', '2025-06-25');
INSERT INTO "file_list" ("id", "file_no", "category", "title", "doc1", "entry_date_real") VALUES
(3716, 'MSB/CB/B-69/SPL', 'Special Report correspondence', 'Assam intended to enter into Mizoram and take new initiative by setting up camp near Tuikhuahlian Bridge', '', '2025-06-25');
INSERT INTO "file_list" ("id", "file_no", "category", "title", "doc1", "entry_date_real") VALUES
(3717, 'MSB/CB/B-69/SPL', 'Special Report correspondence', 'around 20 (twenty) youths from Vairengte under the aegis of Joint VC, Vairengte and Mizoram Police constructed makeshift camp for Mizoram Police at\r\nPu Darthantluangaâ€™s farm land', '', '2025-06-25');
INSERT INTO "file_list" ("id", "file_no", "category", "title", "doc1", "entry_date_real") VALUES
(3718, 'MSB/CB/B-69/SPL', 'Special Report correspondence', 'Assam Government intended to construct road up to Upper Phainuam Lower Primary School', '', '2025-06-25');
INSERT INTO "file_list" ("id", "file_no", "category", "title", "doc1", "entry_date_real") VALUES
(3719, 'MSB/CB/B-69/SPL', 'Special Report correspondence', 'Assam government started construction of road from Pu Chalchhunga of Buarchep, Kolasib District paddy field', '', '2025-06-25');
INSERT INTO "file_list" ("id", "file_no", "category", "title", "doc1", "entry_date_real") VALUES
(3720, 'MSB/CB/B-69/SPL', 'Special Report correspondence', '2 (two) loud explosions were heard inside the forest at the disputed area', '', '2025-06-25');
INSERT INTO "file_list" ("id", "file_no", "category", "title", "doc1", "entry_date_real") VALUES
(3721, 'MSB/CB/B-69/SPL', 'Special Report correspondence', '1 (one) Bolero believed to be carrying officials of Assam entered Chuhvel village, Mamit district', '', '2025-06-25');
INSERT INTO "file_list" ("id", "file_no", "category", "title", "doc1", "entry_date_real") VALUES
(3722, 'MSB/CB/B-69/SPL', 'Special Report correspondence', '2 (two) unoccupied farm huts located at approximately 1.1 km north of Zophai Mizoram Police BOP', '', '2025-06-25');
INSERT INTO "file_list" ("id", "file_no", "category", "title", "doc1", "entry_date_real") VALUES
(3723, 'MSB/CB/B-69/SPL', 'Special Report correspondence', 'Assam Forest Officials and around 70 (seventy) Assam Police personnel and civilians from Gutguti village, Assam, visited Pu John Hallidayâ€™s Farm', '', '2025-06-25');
INSERT INTO "file_list" ("id", "file_no", "category", "title", "doc1", "entry_date_real") VALUES
(3724, 'MSB/CB/B-69/SPL', 'Special Report correspondence', 'Pu C. Vanlalzawma of Bairabi, Kolasib district (ph-8974419602) has seen 5 (five) small motorized boats boarded by around 50 (fifty) Assam Police personnel and proceeded upstream at Tlawng River', '', '2025-06-25');
INSERT INTO "file_list" ("id", "file_no", "category", "title", "doc1", "entry_date_real") VALUES
(3725, 'MSB/CB/B-69/SPL', 'Special Report correspondence', 'Assam Police led by Mr. Nirmal Gosh, Dy. SP (Border);
INSERT INTO "file_list" ("id", "file_no", "category", "title", "doc1", "entry_date_real") VALUES
(Hailakandi District visited the farm land owned by Pu Ramhluna of Vairengte', '', '2025-06-25');
INSERT INTO "file_list" ("id", "file_no", "category", "title", "doc1", "entry_date_real") VALUES
(3726, 'MSB/CB/B-69/SPL', 'Special Report correspondence', 'around 60 (sixty) youths of Vairengte who were proceeding towards\r\nPu Ramhluna''s farm', '', '2025-06-25');
INSERT INTO "file_list" ("id", "file_no", "category", "title", "doc1", "entry_date_real") VALUES
(3727, 'MSB/CB/B-69/SPL', 'Special Report correspondence', 'Mizo Studentsâ€™ Union General Headquarters held its extended OB Meeting today, i.e., 8.3.2021 @ 11:00 a.m. at MSU Office.', '', '2025-06-25');
INSERT INTO "file_list" ("id", "file_no", "category", "title", "doc1", "entry_date_real") VALUES
(3728, 'MSB/CB/B-69/SPL', 'Special Report correspondence', 'MPCC called a Press Conference today, i.e., 16.3.2021 @ 2:00 p.m. at Aizawl Press Club under the guidance of Dr. Lallianchhunga, Media Chairman', '', '2025-06-25');
INSERT INTO "file_list" ("id", "file_no", "category", "title", "doc1", "entry_date_real") VALUES
(3729, 'MSB/CB/B-69/SPL', 'Special Report correspondence', 'All NGOs of Champhai held a meeting today, i.e., 14.5.2021 under the aegis of Sub-Headquarters YMA Champhai', '', '2025-06-25');
INSERT INTO "file_list" ("id", "file_no", "category", "title", "doc1", "entry_date_real") VALUES
(3730, 'MSB/CB/B-167', 'Bru Revolutionary Army (BRU)/BRA/BRAM', 'NOTES ON THE ISSUES OF BRU MILITANCY & BRU REFUGEES', '', '2025-06-25');
INSERT INTO "file_list" ("id", "file_no", "category", "title", "doc1", "entry_date_real") VALUES
(3731, 'MSB/CB/A-10', 'Kidnapping/Abduction', 'PERSONS ABDUCTED / KIDNAPPED BY BNLF,BLFM,UDLA, NLFT, BNCT, BNDLFM, BDFM FOR THE YEAR 2000 - TILL DATE', '', '2025-06-25');
INSERT INTO "file_list" ("id", "file_no", "category", "title", "doc1", "entry_date_real") VALUES
(3732, 'MSB/CB/C-119', 'Mizo Zirlai Pawl(MZP)', 'BRIEF HIGHLIGHT OF THE EVENT OF CHAKMA ETHNIC ISSUE', '', '2025-06-25');
INSERT INTO "file_list" ("id", "file_no", "category", "title", "doc1", "entry_date_real") VALUES
(3733, 'MSB/CB/C-119', 'Mizo Zirlai Pawl(MZP)', 'BRIEF HIGHLIGHT OF THE EVENT OF CHAKMA ETHNIC ISSUE\r\n\r\nDURING- 2014', '', '2025-06-25');
INSERT INTO "file_list" ("id", "file_no", "category", "title", "doc1", "entry_date_real") VALUES
(3734, 'MSB/CB/C-126', 'YLA(Young Lai Association)', 'CENTRAL YOUNG LAI ASSOCIATION (CYLA) ON CHAKMA CENSUS', '', '2025-06-25');
INSERT INTO "file_list" ("id", "file_no", "category", "title", "doc1", "entry_date_real") VALUES
(3735, 'MSB/CB/B-26(B)', 'HPC(D)  Lalhmingthanga Sanate faction', 'NOTES ON HMAR PEOPLES CONVENTION [HPC] AND\r\n\r\nHMAR PEOPLES CONVENTION (DEMOCRATIC) [HPC(D)]', '', '2025-06-25');
INSERT INTO "file_list" ("id", "file_no", "category", "title", "doc1", "entry_date_real") VALUES
(3736, 'MSB/CB/B-26/HPC(D)', 'Correspondence on HPC(D) B-114', 'PERSONS ABDUCTED / KIDNAPPED BY BY HPC(D) FROM 1999 - TILL DATE', '', '2025-06-25');
INSERT INTO "file_list" ("id", "file_no", "category", "title", "doc1", "entry_date_real") VALUES
(3737, 'MSB/CB/B-167', 'Bru Revolutionary Army (BRU)/BRA/BRAM', 'NOTES ON THE ISSUES OF BRU MILITANCY & BRU REFUGEES\r\n\r\nHISTORY', '', '2025-06-25');
INSERT INTO "file_list" ("id", "file_no", "category", "title", "doc1", "entry_date_real") VALUES
(3738, 'MSB/CB/B-5/NLFT', 'National Liberation Front of Tripura', 'ERSONS ABDUCTED / KIDNAPPED BY BNLF,BLFM,UDLA, NLFT, BNCT, BNDLFM, BDFM FOR THE YEAR 2000 - TILL DATE', '', '2025-06-25');
INSERT INTO "file_list" ("id", "file_no", "category", "title", "doc1", "entry_date_real") VALUES
(3739, 'MSB/CB/B-26/HPC(D)', 'Correspondence on HPC(D) B-114', 'NOTES ON HMAR PEOPLES CONVENTION [HPC] AND\r\n\r\nHMAR PEOPLES CONVENTION (DEMOCRATIC) [HPC(D)]', '', '2025-06-25');
INSERT INTO "file_list" ("id", "file_no", "category", "title", "doc1", "entry_date_real") VALUES
(3740, 'MSB/CB/B-26/HPC(D)', 'Correspondence on HPC(D) B-114', 'PERSONS ABDUCTED / KIDNAPPED BY BY HPC(D) FROM 1999 - TILL DATE', '', '2025-06-25');
INSERT INTO "file_list" ("id", "file_no", "category", "title", "doc1", "entry_date_real") VALUES
(3741, 'MSB/CB/B-167', 'Bru Revolutionary Army (BRU)/BRA/BRAM', 'NOTES ON THE ISSUES OF BRU MILITANCY & BRU REFUGEES\r\n\r\nHISTORY', '', '2025-06-26');
INSERT INTO "file_list" ("id", "file_no", "category", "title", "doc1", "entry_date_real") VALUES
(3742, 'MSB/CB/B-26/HPC(D)', 'Correspondence on HPC(D) B-114', 'NOTES ON HMAR PEOPLES CONVENTION [HPC] AND\r\n\r\nHMAR PEOPLES CONVENTION (DEMOCRATIC) [HPC(D)]', '', '2025-06-26');
INSERT INTO "file_list" ("id", "file_no", "category", "title", "doc1", "entry_date_real") VALUES
(3743, 'MSB/CB/A-1', 'DSI Corrrespondence', 'Internal security', '', '2025-06-26');
INSERT INTO "file_list" ("id", "file_no", "category", "title", "doc1", "entry_date_real") VALUES
(3744, 'MSB/CB/A-16', 'Regional Security C0-ordination', 'Agenda for Chief Minister''s Conference on Internal Security to be held on 1st february, 2011 at new delhi', '', '2025-06-26');
INSERT INTO "file_list" ("id", "file_no", "category", "title", "doc1", "entry_date_real") VALUES
(3745, 'MSB/CB/A-16', 'Regional Security C0-ordination', 'WRITE-UP ON AGENDA FOR\r\n\r\nCHIEF MINISTERâ€™S CONFERENCE ON INTERNAL SECURITY\r\n\r\nTO BE HELD ON 16th APRIL, 2012 AT NEW DELHI', '', '2025-06-26');
INSERT INTO "file_list" ("id", "file_no", "category", "title", "doc1", "entry_date_real") VALUES
(3746, 'MSB/CB/A-16', 'Regional Security C0-ordination', 'INTERNAL SECURITY', '', '2025-06-26');
INSERT INTO "file_list" ("id", "file_no", "category", "title", "doc1", "entry_date_real") VALUES
(3747, 'MSB/CB/A-16', 'Regional Security C0-ordination', 'INTERNAL SECURITY', '', '2025-06-26');
INSERT INTO "file_list" ("id", "file_no", "category", "title", "doc1", "entry_date_real") VALUES
(3748, 'MSB/CB/A-16', 'Regional Security C0-ordination', 'Internal security situation in Mizoram', '', '2025-06-26');
INSERT INTO "file_list" ("id", "file_no", "category", "title", "doc1", "entry_date_real") VALUES
(3749, 'MSB/CB/A-16', 'Regional Security C0-ordination', 'INTERNAL SECURITY WITH FOCUS ON INTELLIGENCE SHARING AND CO-ORDINATION FOR COMBATING TERRORISM/INSURGENCY AND POLICE REFORMS.', '', '2025-06-26');
INSERT INTO "file_list" ("id", "file_no", "category", "title", "doc1", "entry_date_real") VALUES
(3750, 'MSB/CB/A-59', 'Arakan Liberation Party(ALP)/Arakan Liberation Army(ALA)/Arakan Army(AA)', 'Arakan Army INCIDENT ALONG INDO-MYANMAR BORDER', '', '2025-06-26');
INSERT INTO "file_list" ("id", "file_no", "category", "title", "doc1", "entry_date_real") VALUES
(3751, 'MSB/CB/B-61/Misc', 'Miscellaneous', 'MIZORAM AT A GLANCE  Mizoram is situated in the north eastern part of India and is flanked by Tripura & Bangladesh on the west, Myanmar on the east & south and Manipur as well as Assam in the north.', '', '2025-06-26');
INSERT INTO "file_list" ("id", "file_no", "category", "title", "doc1", "entry_date_real") VALUES
(3752, 'MSB/CB/B-5/NLFT', 'National Liberation Front of Tripura', 'NATIONAL LIBERATION FRONT OF TRIPURA (NLFT) Formation', '', '2025-06-26');
INSERT INTO "file_list" ("id", "file_no", "category", "title", "doc1", "entry_date_real") VALUES
(3753, 'MSB/CB/A-76(A)', 'PCJSS/Santi Bahini', 'Parbatya Chattagram Jana Samhati Samiti(PCJSS) Background', '', '2025-06-26');
INSERT INTO "file_list" ("id", "file_no", "category", "title", "doc1", "entry_date_real") VALUES
(3754, 'MSB/CB/A-132', 'Terrorist related matters', 'COUNTER TERRORISM CONTINGENCY PLAN FOR LENGPUI AIRPORT, MIZORAM Introduction:', '', '2025-06-26');
INSERT INTO "file_list" ("id", "file_no", "category", "title", "doc1", "entry_date_real") VALUES
(3755, 'MSB/CB/A-132', 'Terrorist related matters', 'MEASURES TO STRENGTHEN THE NATIONAL ANTI-TERRORISM FRAMEWORK', '', '2025-06-26');
INSERT INTO "file_list" ("id", "file_no", "category", "title", "doc1", "entry_date_real") VALUES
(3756, 'MSB/CB/A-132', 'Terrorist related matters', 'Visit of Shri Anil Pradhan, Special Rapporteur, NHRC for North East Zone on 18 â€“ 22 July, 2016 write up pertaining to the subject concerning department.', '', '2025-06-26');
INSERT INTO "file_list" ("id", "file_no", "category", "title", "doc1", "entry_date_real") VALUES
(3757, 'MSB/CB/A-132', 'Terrorist related matters', 'TERRORISM / COUNTER INSURGENCY IN MIZORAM', '', '2025-06-26');
INSERT INTO "file_list" ("id", "file_no", "category", "title", "doc1", "entry_date_real") VALUES
(3758, 'MSB/CB/B-26/HPC(D)', 'Correspondence on HPC(D) B-114', 'VAITIN DT.24.3.1999 INKAHNA.', '', '2025-06-26');
INSERT INTO "file_list" ("id", "file_no", "category", "title", "doc1", "entry_date_real") VALUES
(3759, 'MSB/CB/B-167', 'Bru Revolutionary Army (BRU)/BRA/BRAM', 'BRIEF NOTE ON THE ISSUES OF BRU MILITANCY & BRU REFUGEES\r\n\r\nHISTORY', '', '2025-06-26');
INSERT INTO "file_list" ("id", "file_no", "category", "title", "doc1", "entry_date_real") VALUES
(3760, 'MSB/CB/B-26/HPC(D)', 'Correspondence on HPC(D) B-114', 'BRIEF NOTES ON HMAR PEOPLES CONVENTION (DEMOCRATIC) [HPC(D)]\r\n Background :', '', '2025-06-26');
INSERT INTO "file_list" ("id", "file_no", "category", "title", "doc1", "entry_date_real") VALUES
(3761, 'MSB/CB/A-10', 'Kidnapping/Abduction', 'PERSONS ABDUCTED / KIDNAPPED BY BNLF,BLFM,UDLA, NLFT, BNCT, BNDLFM, BDFM FOR THE YEAR 2000 - TILL DATE', '', '2025-06-26');
INSERT INTO "file_list" ("id", "file_no", "category", "title", "doc1", "entry_date_real") VALUES
(3762, 'MSB/CB/C-167', 'HPC Rosiama Faction - B-24', 'BRIEF NOTE ON THE ISSUES OF BRU REFUGEES\r\nHISTORY', '', '2025-06-26');
INSERT INTO "file_list" ("id", "file_no", "category", "title", "doc1", "entry_date_real") VALUES
(3763, 'MSB/CB/A-118', 'Correspondence on Reng/Bru refugees/Bru repatriation', 'BRIEF NOTE ON THE ISSUES OF BRU REFUGEES & REPATRIATION PROCESS\r\nHISTORY', '', '2025-06-26');
INSERT INTO "file_list" ("id", "file_no", "category", "title", "doc1", "entry_date_real") VALUES
(3764, 'MSB/CB/A-118', 'Correspondence on Reng/Bru refugees/Bru repatriation', 'BRIEF NOTE ON THE ISSUES OF BRU REFUGEES & REPATRIATION PROCESS\r\nHISTORY', '', '2025-06-26');
INSERT INTO "file_list" ("id", "file_no", "category", "title", "doc1", "entry_date_real") VALUES
(3765, 'MSB/CB/B-167', 'Bru Revolutionary Army (BRU)/BRA/BRAM', 'BRU Clarification', '', '2025-06-26');
INSERT INTO "file_list" ("id", "file_no", "category", "title", "doc1", "entry_date_real") VALUES
(3766, 'MSB/CB/B-167', 'Bru Revolutionary Army (BRU)/BRA/BRAM', 'BRIEF NOTE ON THE ISSUES OF BRU REFUGEES & REPATRIATION PROCESS\r\nHISTORY', '', '2025-06-26');
INSERT INTO "file_list" ("id", "file_no", "category", "title", "doc1", "entry_date_real") VALUES
(3767, 'MSB/CB/B-167', 'Bru Revolutionary Army (BRU)/BRA/BRAM', 'BRIEF NOTE ON THE ISSUES OF BRU REFUGEES & REPATRIATION PROCESS\r\nHISTORY', '', '2025-06-26');
INSERT INTO "file_list" ("id", "file_no", "category", "title", "doc1", "entry_date_real") VALUES
(3768, 'MSB/CB/B-167', 'Bru Revolutionary Army (BRU)/BRA/BRAM', 'BRU MILITANCY', '', '2025-06-26');
INSERT INTO "file_list" ("id", "file_no", "category", "title", "doc1", "entry_date_real") VALUES
(3769, 'MSB/CB/B-167', 'Bru Revolutionary Army (BRU)/BRA/BRAM', 'BRU MILITANCY\r\n Bru National Liberation Front (BNLF):', '', '2025-06-26');
INSERT INTO "file_list" ("id", "file_no", "category", "title", "doc1", "entry_date_real") VALUES
(3770, 'MSB/CB/B-167', 'Bru Revolutionary Army (BRU)/BRA/BRAM', 'BRU MILITANCY', '', '2025-06-26');
INSERT INTO "file_list" ("id", "file_no", "category", "title", "doc1", "entry_date_real") VALUES
(3771, 'MSB/CB/B-167', 'Bru Revolutionary Army (BRU)/BRA/BRAM', 'BRU MILITANCY', '', '2025-06-26');
INSERT INTO "file_list" ("id", "file_no", "category", "title", "doc1", "entry_date_real") VALUES
(3772, 'MSB/CB/B-167', 'Bru Revolutionary Army (BRU)/BRA/BRAM', 'BRU REFUGEES\r\nGENESIS', '', '2025-06-26');
INSERT INTO "file_list" ("id", "file_no", "category", "title", "doc1", "entry_date_real") VALUES
(3773, 'MSB/CB/B-167', 'Bru Revolutionary Army (BRU)/BRA/BRAM', 'BRU/REANG', '', '2025-06-26');
INSERT INTO "file_list" ("id", "file_no", "category", "title", "doc1", "entry_date_real") VALUES
(3774, 'MSB/CB/C-167', 'HPC Rosiama Faction - B-24', 'WRITE UP ON BRU/REANG INSURGENCY', '', '2025-06-26');
INSERT INTO "file_list" ("id", "file_no", "category", "title", "doc1", "entry_date_real") VALUES
(3775, 'MSB/CB/B-167', 'Bru Revolutionary Army (BRU)/BRA/BRAM', 'BRIEF NOTE ON THE ISSUES OF BRU REFUGEES & BRU MILITANCY HISTORY', '', '2025-06-26');
INSERT INTO "file_list" ("id", "file_no", "category", "title", "doc1", "entry_date_real") VALUES
(3776, 'MSB/CB/B-26/HPC(D)', 'Correspondence on HPC(D) B-114', 'HMAR PEOPLES CONVENTION (DEMOCRATIC) [HPC(D)]', '', '2025-06-26');
INSERT INTO "file_list" ("id", "file_no", "category", "title", "doc1", "entry_date_real") VALUES
(3777, 'MSB/CB/A-10', 'Kidnapping/Abduction', 'PERSONS ABDUCTED / KIDNAPPED BY BNLF,BLFM,UDLA, NLFT, BNCT, BNDLFM, BDFM FOR THE YEAR 2000 - TILL DATE', '', '2025-06-26');
INSERT INTO "file_list" ("id", "file_no", "category", "title", "doc1", "entry_date_real") VALUES
(3778, 'MSB/CB/B-26/HPC(D)', 'Correspondence on HPC(D) B-114', 'HMAR PEOPLES CONVENTION (DEMOCRATIC) [HPC(D)]\r\n Background :', '', '2025-06-26');
INSERT INTO "file_list" ("id", "file_no", "category", "title", "doc1", "entry_date_real") VALUES
(3779, 'MSB/CB/B-26/HPC(D)', 'Correspondence on HPC(D) B-114', 'HPC(D)', '', '2025-06-26');
INSERT INTO "file_list" ("id", "file_no", "category", "title", "doc1", "entry_date_real") VALUES
(3780, 'MSB/CB/B-26/HPC(D)', 'Correspondence on HPC(D) B-114', 'HMAR PEOPLES CONVENTION (DEMOCRATIC)', '', '2025-06-26');
INSERT INTO "file_list" ("id", "file_no", "category", "title", "doc1", "entry_date_real") VALUES
(3781, 'MSB/CB/B-26/HPC(D)', 'Correspondence on HPC(D) B-114', 'PEACE DIALOGUE BETWEEN GOVT. OF MIZORAM AND HPC(D)', '', '2025-06-26');
INSERT INTO "file_list" ("id", "file_no", "category", "title", "doc1", "entry_date_real") VALUES
(3782, 'MSB/CB/B-26/HPC(D)', 'Correspondence on HPC(D) B-114', 'Point No. 1 Status of all agreements signed by the State Government', '', '2025-06-26');
INSERT INTO "file_list" ("id", "file_no", "category", "title", "doc1", "entry_date_real") VALUES
(3783, 'MSB/CB/B-26/HPC(D)', 'Correspondence on HPC(D) B-114', 'STRENGTH Â AND Â STATUSÂ  OFÂ  HPC(D) Â OUTFITS', '', '2025-06-26');
INSERT INTO "file_list" ("id", "file_no", "category", "title", "doc1", "entry_date_real") VALUES
(3784, 'MSB/CB/B-26/HPC(D)', 'Correspondence on HPC(D) B-114', 'WRITE-UP ON HPC(D)', '', '2025-06-26');
INSERT INTO "file_list" ("id", "file_no", "category", "title", "doc1", "entry_date_real") VALUES
(3785, 'MSB/CB/B-167', 'Bru Revolutionary Army (BRU)/BRA/BRAM', 'NOTES ON THE ISSUES OF BRU MILITANCY & BRU REFUGEES', '', '2025-06-26');
INSERT INTO "file_list" ("id", "file_no", "category", "title", "doc1", "entry_date_real") VALUES
(3786, 'MSB/CB/A-10', 'Kidnapping/Abduction', 'PERSONS ABDUCTED / KIDNAPPED BY BNLF,BLFM,UDLA, NLFT, BNCT, BNDLFM, BDFM FOR THE YEAR 2000 - TILL DATE\r\n\r\n\r\nPERSONS ABDUCTED / KIDNAPPED BY BNLF,BLFM,UDLA, NLFT, BNCT, BNDLFM, BDFM FOR THE YEAR 2000 - TILL DATE', '', '2025-06-26');
INSERT INTO "file_list" ("id", "file_no", "category", "title", "doc1", "entry_date_real") VALUES
(3787, 'MSB/CB/B-26/HPC(D)', 'Correspondence on HPC(D) B-114', 'NOTES ON HMAR PEOPLES CONVENTION [HPC] AND\r\n\r\nHMAR PEOPLES CONVENTION (DEMOCRATIC) [HPC(D)]', '', '2025-06-26');
INSERT INTO "file_list" ("id", "file_no", "category", "title", "doc1", "entry_date_real") VALUES
(3788, 'MSB/CB/B-26/HPC(D)', 'Correspondence on HPC(D) B-114', 'PERSONS ABDUCTED / KIDNAPPED BY BY HPC(D) FROM 1999 - TILL DATE', '', '2025-06-26');
INSERT INTO "file_list" ("id", "file_no", "category", "title", "doc1", "entry_date_real") VALUES
(3789, 'MSB/CB/A-112', 'Conference of DGP/IGP/ADGP', 'Write-up on HPC & HPC(D) insurgents - regarding.', '', '2025-06-26');
INSERT INTO "file_list" ("id", "file_no", "category", "title", "doc1", "entry_date_real") VALUES
(3790, 'MSB/CB/C-298', 'Write -Up File', 'REPORT ON MYANMAR REFUGEE', '', '2025-06-26');
INSERT INTO "file_list" ("id", "file_no", "category", "title", "doc1", "entry_date_real") VALUES
(3791, 'MSB/CB/C-298', 'Write -Up File', 'Report on Seizure of Arms and Ammunitions:', '', '2025-06-26');
INSERT INTO "file_list" ("id", "file_no", "category", "title", "doc1", "entry_date_real") VALUES
(3792, 'MSB/CB/C-298', 'Write -Up File', 'Report on Seizure of Explosive Substances at Farkawn, Champhai District', '', '2025-06-26');
INSERT INTO "file_list" ("id", "file_no", "category", "title", "doc1", "entry_date_real") VALUES
(3793, 'MSB/CB/C-298', 'Write -Up File', 'Write up on Border Management Issues-\r\nBangladesh-IndiaÂ  & Â India-Myanmar', '', '2025-06-26');
INSERT INTO "file_list" ("id", "file_no", "category", "title", "doc1", "entry_date_real") VALUES
(3794, 'MSB/CB/A-41', 'Indo Bangladesh Affairs', 'Write-up in connection with the agenda items for the forthcoming Meeting scheduled to be held on 24.1.2017(Tuesday) under the Chairmanship ofÂ  Pi Renu Sharma, Principal Secretary, Home Department.', '', '2025-06-26');
INSERT INTO "file_list" ("id", "file_no", "category", "title", "doc1", "entry_date_real") VALUES
(3795, 'MSB/CB/C-298', 'Write -Up File', 'ANTI-HUMAN TRAFFICKING IN MIZORAM', '', '2025-06-26');
INSERT INTO "file_list" ("id", "file_no", "category", "title", "doc1", "entry_date_real") VALUES
(3796, 'MSB/CB/C-298', 'Write -Up File', 'ANTI-HUMAN TRAFFICKING IN MIZORAM', '', '2025-06-27');
INSERT INTO "file_list" ("id", "file_no", "category", "title", "doc1", "entry_date_real") VALUES
(3797, 'MSB/CB/C-298', 'Write -Up File', 'Insurgency in North-Eastern States- way forward', '', '2025-06-27');
INSERT INTO "file_list" ("id", "file_no", "category", "title", "doc1", "entry_date_real") VALUES
(3798, 'MSB/CB/C-298', 'Write -Up File', 'REGIONAL SECURITY STRATEGIES CONFERENCE - 2021 FOR NORTH EAST', '', '2025-06-27');
INSERT INTO "file_list" ("id", "file_no", "category", "title", "doc1", "entry_date_real") VALUES
(3799, 'MSB/CB/C-298', 'Write -Up File', 'REGIONAL SECURITY STRATEGIES CONFERENCE - 2021 FOR NORTH EAST', '', '2025-06-27');
INSERT INTO "file_list" ("id", "file_no", "category", "title", "doc1", "entry_date_real") VALUES
(3800, 'MSB/CB/C-298', 'Write -Up File', 'Report on Seizure of Arms and Ammunitions:', '', '2025-06-27');
INSERT INTO "file_list" ("id", "file_no", "category", "title", "doc1", "entry_date_real") VALUES
(3801, 'MSB/CB/C-298', 'Write -Up File', 'Report on Seizure of Explosive Substances at Farkawn, Champhai District 8th Assam Rifles personnel, who were on duty at Farkawn Mobile Check', '', '2025-06-27');
INSERT INTO "file_list" ("id", "file_no", "category", "title", "doc1", "entry_date_real") VALUES
(3802, 'MSB/CB/C-298', 'Write -Up File', 'Ethnic conflict in Mizoram:', '', '2025-06-27');
INSERT INTO "file_list" ("id", "file_no", "category", "title", "doc1", "entry_date_real") VALUES
(3803, 'MSB/CB/B-61/Misc', 'Miscellaneous', 'PARTICULARS OF MIZORAM POLICE SERVICE OFFICERS', '', '2025-06-27');
INSERT INTO "file_list" ("id", "file_no", "category", "title", "doc1", "entry_date_real") VALUES
(3804, 'MSB/CB/B-15', 'Insurgency in North East India', 'MIZORAM CHHUNGA HEL MAN TE', '', '2025-06-27');
INSERT INTO "file_list" ("id", "file_no", "category", "title", "doc1", "entry_date_real") VALUES
(3806, 'MSB/CB/B-61/Misc', 'Miscellaneous', 'STATISTICAL HANDBOOK', '', '2025-06-27');
INSERT INTO "file_list" ("id", "file_no", "category", "title", "doc1", "entry_date_real") VALUES
(3807, 'MSB/CB/C-298', 'Write -Up File', 'WRITE UP ON IMMIGRATION', '', '2025-06-27');
INSERT INTO "file_list" ("id", "file_no", "category", "title", "doc1", "entry_date_real") VALUES
(3808, 'MSB/CB/B-61/Misc', 'Miscellaneous', 'File Index', '', '2025-06-27');
INSERT INTO "file_list" ("id", "file_no", "category", "title", "doc1", "entry_date_real") VALUES
(3809, 'MSB/CB/B-61/Misc', 'Miscellaneous', 'File Index', '', '2025-06-27');
INSERT INTO "file_list" ("id", "file_no", "category", "title", "doc1", "entry_date_real") VALUES
(3810, 'MSB/CB/B-61/Misc', 'Miscellaneous', 'File Index', '', '2025-06-27');
INSERT INTO "file_list" ("id", "file_no", "category", "title", "doc1", "entry_date_real") VALUES
(3811, 'MSB/CB/B-61/Misc', 'Miscellaneous', 'LIST OF FILE INDEX REGISTER OF A,B & C SECTION', '', '2025-06-27');
INSERT INTO "file_list" ("id", "file_no", "category", "title", "doc1", "entry_date_real") VALUES
(3812, 'MSB/CB/B-61/Misc', 'Miscellaneous', 'Common Nomination Form for General Provident FundÂ Â Â Â Â Â Â Â Â Â Â Â Â Â Â Â Â Â Â Â Â Â Â Â Â Â Â Â Â Â Â Â Â Â ', '', '2025-06-27');
INSERT INTO "file_list" ("id", "file_no", "category", "title", "doc1", "entry_date_real") VALUES
(3813, 'MSB/CB/B-61/Misc', 'Miscellaneous', 'Common Nomination Form for General Provident Fund', '', '2025-06-27');
INSERT INTO "file_list" ("id", "file_no", "category", "title", "doc1", "entry_date_real") VALUES
(3814, 'MSB/CB/B-61/Misc', 'Miscellaneous', 'Â  Common Nomination Form for General', '', '2025-06-27');
INSERT INTO "file_list" ("id", "file_no", "category", "title", "doc1", "entry_date_real") VALUES
(3815, 'MSB/CB/B-61/Misc', 'Miscellaneous', 'Common Nomination Form for General Provident Fund', '', '2025-06-27');
INSERT INTO "file_list" ("id", "file_no", "category", "title", "doc1", "entry_date_real") VALUES
(3816, 'MSB/CB/B-73/MLA', 'Mizoram Legislative Assembly/ Cabinet Meeting', 'AMC 2021 Elected', '', '2025-06-27');
INSERT INTO "file_list" ("id", "file_no", "category", "title", "doc1", "entry_date_real") VALUES
(3817, 'MSB/CB/B-73/MLA', 'Mizoram Legislative Assembly/ Cabinet Meeting', 'AMC Voter turn out 2021', '', '2025-06-27');
INSERT INTO "file_list" ("id", "file_no", "category", "title", "doc1", "entry_date_real") VALUES
(3818, 'MSB/CB/B-61/Misc', 'Miscellaneous', 'LIST OF CID(SB) STAFF AS ON 17.02.2021 IN BRANCH WISE AT HQRS AIZAWL', '', '2025-06-27');
INSERT INTO "file_list" ("id", "file_no", "category", "title", "doc1", "entry_date_real") VALUES
(3819, 'MSB/CB/B-73/MLA', 'Mizoram Legislative Assembly/ Cabinet Meeting', 'General Election to Aizawl Municipal Corporation, 2021', '', '2025-07-02');
INSERT INTO "file_list" ("id", "file_no", "category", "title", "doc1", "entry_date_real") VALUES
(3821, 'MSB/CB/A-1', 'DSI Corrrespondence', 'DSI 1 April 2021', '250704124804DSI-1.4.2021.pmd', '2025-07-04');
INSERT INTO "file_list" ("id", "file_no", "category", "title", "doc1", "entry_date_real") VALUES
(3822, 'MSB/CB/A-1', 'DSI Corrrespondence', 'DSI 5 April 2021', '250704124925DSI-5.4.2021.pmd', '2025-07-04');
INSERT INTO "file_list" ("id", "file_no", "category", "title", "doc1", "entry_date_real") VALUES
(3823, 'MSB/CB/A-1', 'DSI Corrrespondence', 'DSI 6 April 2021', '250704124947DSI-6.4.2021.pmd', '2025-07-04');
INSERT INTO "file_list" ("id", "file_no", "category", "title", "doc1", "entry_date_real") VALUES
(3824, 'MSB/CB/A-1', 'DSI Corrrespondence', 'DSI 7 April 2021', '250704125012DSI-7.4.2021.pmd', '2025-07-04');
INSERT INTO "file_list" ("id", "file_no", "category", "title", "doc1", "entry_date_real") VALUES
(3825, 'MSB/CB/A-1', 'DSI Corrrespondence', 'DSI 8 April 2021', '250704125034DSI-8.4.2021.pmd', '2025-07-04');
INSERT INTO "file_list" ("id", "file_no", "category", "title", "doc1", "entry_date_real") VALUES
(3826, 'MSB/CB/A-1', 'DSI Corrrespondence', 'DSI 9 April 2021', '250704125056DSI-9.4.2021.pmd', '2025-07-04');
INSERT INTO "file_list" ("id", "file_no", "category", "title", "doc1", "entry_date_real") VALUES
(3827, 'MSB/CB/A-1', 'DSI Corrrespondence', 'DSI 12 April 2021', '250704125136DSI-12.4.2021.pmd', '2025-07-04');
INSERT INTO "file_list" ("id", "file_no", "category", "title", "doc1", "entry_date_real") VALUES
(3828, 'MSB/CB/A-1', 'DSI Corrrespondence', 'DSI 13 April 2021', '250704125224DSI-13.4.2021.pmd', '2025-07-04');
INSERT INTO "file_list" ("id", "file_no", "category", "title", "doc1", "entry_date_real") VALUES
(3829, 'MSB/CB/A-1', 'DSI Corrrespondence', 'DSI 14 April 2021', '250704125254DSI-14.4.2021.pmd', '2025-07-04');
INSERT INTO "file_list" ("id", "file_no", "category", "title", "doc1", "entry_date_real") VALUES
(3830, 'MSB/CB/A-1', 'DSI Corrrespondence', 'DSI 15 April 2021', '250704125314DSI-15.4.2021.pmd', '2025-07-04');
INSERT INTO "file_list" ("id", "file_no", "category", "title", "doc1", "entry_date_real") VALUES
(3831, 'MSB/CB/A-1', 'DSI Corrrespondence', 'DSI 16 April 2021', '250704125332DSI-16.4.2021.pmd', '2025-07-04');
INSERT INTO "file_list" ("id", "file_no", "category", "title", "doc1", "entry_date_real") VALUES
(3832, 'MSB/CB/A-1', 'DSI Corrrespondence', 'DSI 19 April 2021', '250704125354DSI-19.4.2021.pmd', '2025-07-04');
INSERT INTO "file_list" ("id", "file_no", "category", "title", "doc1", "entry_date_real") VALUES
(3833, 'MSB/CB/A-1', 'DSI Corrrespondence', 'DSI 20 April 2021', '250704125413DSI-20.4.2021.pmd', '2025-07-04');
INSERT INTO "file_list" ("id", "file_no", "category", "title", "doc1", "entry_date_real") VALUES
(3834, 'MSB/CB/A-1', 'DSI Corrrespondence', 'DSI 21 April 2021', '250704125434DSI-21.4.2021.pmd', '2025-07-04');
INSERT INTO "file_list" ("id", "file_no", "category", "title", "doc1", "entry_date_real") VALUES
(3835, 'MSB/CB/A-1', 'DSI Corrrespondence', 'DSI 22 April 2021', '250704125453DSI-22.4.2021.pmd', '2025-07-04');
INSERT INTO "file_list" ("id", "file_no", "category", "title", "doc1", "entry_date_real") VALUES
(3836, 'MSB/CB/A-1', 'DSI Corrrespondence', 'DSI 23 April 2021', '250704125513DSI-23.4.2021.pmd', '2025-07-04');
INSERT INTO "file_list" ("id", "file_no", "category", "title", "doc1", "entry_date_real") VALUES
(3837, 'MSB/CB/A-1', 'DSI Corrrespondence', 'DSI 26 April 2021', '250704125542DSI-26.4.2021.pmd', '2025-07-04');
INSERT INTO "file_list" ("id", "file_no", "category", "title", "doc1", "entry_date_real") VALUES
(3838, 'MSB/CB/A-1', 'DSI Corrrespondence', 'DSI 27 April 2021', '250704125603DSI-27.4.2021.pmd', '2025-07-04');
INSERT INTO "file_list" ("id", "file_no", "category", "title", "doc1", "entry_date_real") VALUES
(3839, 'MSB/CB/A-1', 'DSI Corrrespondence', 'DSI 28 April 2021', '250704125624DSI-28.4.2021.pmd', '2025-07-04');
INSERT INTO "file_list" ("id", "file_no", "category", "title", "doc1", "entry_date_real") VALUES
(3840, 'MSB/CB/A-1', 'DSI Corrrespondence', 'DSI 29 April 2021', '250704125642DSI-29.4.2021.pmd', '2025-07-04');
INSERT INTO "file_list" ("id", "file_no", "category", "title", "doc1", "entry_date_real") VALUES
(3841, 'MSB/CB/A-1', 'DSI Corrrespondence', 'DSI 30 April 2021', '250704125700DSI-30.4.2021.pmd', '2025-07-04');
INSERT INTO "file_list" ("id", "file_no", "category", "title", "doc1", "entry_date_real") VALUES
(3842, 'MSB/CB/A-1', 'DSI Corrrespondence', 'DSI 4 Jan 2021', '250704125816DSI-4.1.2021.pmd', '2025-07-04');
INSERT INTO "file_list" ("id", "file_no", "category", "title", "doc1", "entry_date_real") VALUES
(3843, 'MSB/CB/A-1', 'DSI Corrrespondence', 'DSI 5 Jan 2021', '250704125834DSI-5.1.2021.pmd', '2025-07-04');
INSERT INTO "file_list" ("id", "file_no", "category", "title", "doc1", "entry_date_real") VALUES
(3844, 'MSB/CB/A-1', 'DSI Corrrespondence', 'DSI 6 Jan 2021', '250704125853DSI-6.1.2021.pmd', '2025-07-04');
INSERT INTO "file_list" ("id", "file_no", "category", "title", "doc1", "entry_date_real") VALUES
(3845, 'MSB/CB/A-1', 'DSI Corrrespondence', 'DSI 7 Jan 2021', '250704125911DSI-7.1.2021.pmd', '2025-07-04');
INSERT INTO "file_list" ("id", "file_no", "category", "title", "doc1", "entry_date_real") VALUES
(3846, 'MSB/CB/A-1', 'DSI Corrrespondence', 'DSI 12 Jan 2021', '250704125947DSI-12.1.2021.pmd', '2025-07-04');
INSERT INTO "file_list" ("id", "file_no", "category", "title", "doc1", "entry_date_real") VALUES
(3847, 'MSB/CB/A-1', 'DSI Corrrespondence', 'DSI 13 Jan 2021', '250704010004DSI-13.1.2021.pmd', '2025-07-04');
INSERT INTO "file_list" ("id", "file_no", "category", "title", "doc1", "entry_date_real") VALUES
(3848, 'MSB/CB/A-1', 'DSI Corrrespondence', 'DSI 14 Jan 2021', '250704010028DSI-14.1.2021.pmd', '2025-07-04');
INSERT INTO "file_list" ("id", "file_no", "category", "title", "doc1", "entry_date_real") VALUES
(3849, 'MSB/CB/A-1', 'DSI Corrrespondence', 'DSI 15 Jan 2021', '250704010120DSI-15.1.2021.pmd', '2025-07-04');
INSERT INTO "file_list" ("id", "file_no", "category", "title", "doc1", "entry_date_real") VALUES
(3850, 'MSB/CB/A-1', 'DSI Corrrespondence', 'DSI 18 Jan 2021', '250704010147DSI-18.1.2021.pmd', '2025-07-04');
INSERT INTO "file_list" ("id", "file_no", "category", "title", "doc1", "entry_date_real") VALUES
(3851, 'MSB/CB/A-1', 'DSI Corrrespondence', 'DSI 19 Jan 2021', '250704010205DSI-19.1.2021.pmd', '2025-07-04');
INSERT INTO "file_list" ("id", "file_no", "category", "title", "doc1", "entry_date_real") VALUES
(3852, 'MSB/CB/A-1', 'DSI Corrrespondence', 'DSI 20 Jan 2021', '250704010224DSI-20.1.2021.pmd', '2025-07-04');
INSERT INTO "file_list" ("id", "file_no", "category", "title", "doc1", "entry_date_real") VALUES
(3853, 'MSB/CB/A-1', 'DSI Corrrespondence', 'DSI 21 Jan 2021', '250704010244DSI-21.1.2021.pmd', '2025-07-04');
INSERT INTO "file_list" ("id", "file_no", "category", "title", "doc1", "entry_date_real") VALUES
(3854, 'MSB/CB/A-1', 'DSI Corrrespondence', 'DSI 22 Jan 2021', '250704010304DSI-22.1.2021.pmd', '2025-07-04');
INSERT INTO "file_list" ("id", "file_no", "category", "title", "doc1", "entry_date_real") VALUES
(3855, 'MSB/CB/A-1', 'DSI Corrrespondence', 'DSI 25 Jan 2021', '250704010336DSI-25.1.2021.pmd', '2025-07-04');
INSERT INTO "file_list" ("id", "file_no", "category", "title", "doc1", "entry_date_real") VALUES
(3856, 'MSB/CB/A-1', 'DSI Corrrespondence', 'DSI 27 Jan 2021', '250704010354DSI-27.1.2021.pmd', '2025-07-04');
INSERT INTO "file_list" ("id", "file_no", "category", "title", "doc1", "entry_date_real") VALUES
(3857, 'MSB/CB/A-1', 'DSI Corrrespondence', 'DSI 28 Jan 2021', '250704010416DSI-28.1.2021.pmd', '2025-07-04');
INSERT INTO "file_list" ("id", "file_no", "category", "title", "doc1", "entry_date_real") VALUES
(3858, 'MSB/CB/A-1', 'DSI Corrrespondence', 'DSI 14 Jan 2021', '250704010431DSI-29.1.2021.pmd', '2025-07-04');
INSERT INTO "file_list" ("id", "file_no", "category", "title", "doc1", "entry_date_real") VALUES
(3859, 'MSB/CB/A-1', 'DSI Corrrespondence', 'DSI 1 Feb 2021', '250704010714DSI-1.2.2021.pmd', '2025-07-04');
INSERT INTO "file_list" ("id", "file_no", "category", "title", "doc1", "entry_date_real") VALUES
(3860, 'MSB/CB/A-1', 'DSI Corrrespondence', 'DSI 2 Feb 2021', '250704010738DSI-2.2.2021.pmd', '2025-07-04');
INSERT INTO "file_list" ("id", "file_no", "category", "title", "doc1", "entry_date_real") VALUES
(3861, 'MSB/CB/A-1', 'DSI Corrrespondence', 'DSI 3 Feb 2021', '250704010836DSI-3.2.2021.pmd', '2025-07-04');
INSERT INTO "file_list" ("id", "file_no", "category", "title", "doc1", "entry_date_real") VALUES
(3862, 'MSB/CB/A-1', 'DSI Corrrespondence', 'DSI 4 Feb 2021', '250704010918DSI-4.2.2021.pmd', '2025-07-04');
INSERT INTO "file_list" ("id", "file_no", "category", "title", "doc1", "entry_date_real") VALUES
(3863, 'MSB/CB/A-1', 'DSI Corrrespondence', 'DSI 5 Feb 2021', '250704011048DSI-5.2.2021.pmd', '2025-07-04');
INSERT INTO "file_list" ("id", "file_no", "category", "title", "doc1", "entry_date_real") VALUES
(3864, 'MSB/CB/A-1', 'DSI Corrrespondence', 'DSI 8 Feb 2021', '250704011129DSI-8.2.2021.pmd', '2025-07-04');
INSERT INTO "file_list" ("id", "file_no", "category", "title", "doc1", "entry_date_real") VALUES
(3865, 'MSB/CB/A-1', 'DSI Corrrespondence', 'DSI 9 Feb 2021', '250704011215DSI-9.2.2021.pmd', '2025-07-04');
INSERT INTO "file_list" ("id", "file_no", "category", "title", "doc1", "entry_date_real") VALUES
(3866, 'MSB/CB/A-1', 'DSI Corrrespondence', 'DSI 10 Feb 2021', '250704011248DSI-10.2.2021.pmd', '2025-07-04');
INSERT INTO "file_list" ("id", "file_no", "category", "title", "doc1", "entry_date_real") VALUES
(3867, 'MSB/CB/A-1', 'DSI Corrrespondence', 'DSI 11 Feb 2021', '250704011320DSI-11.2.2021.pmd', '2025-07-04');
INSERT INTO "file_list" ("id", "file_no", "category", "title", "doc1", "entry_date_real") VALUES
(3868, 'MSB/CB/A-1', 'DSI Corrrespondence', 'DSI 12 Feb 2021', '250704011348DSI-12.2.2021.pmd', '2025-07-04');
INSERT INTO "file_list" ("id", "file_no", "category", "title", "doc1", "entry_date_real") VALUES
(3869, 'MSB/CB/A-1', 'DSI Corrrespondence', 'DSI 15 Feb 2021', '250704011411DSI-15.2.2021.pmd', '2025-07-04');
INSERT INTO "file_list" ("id", "file_no", "category", "title", "doc1", "entry_date_real") VALUES
(3870, 'MSB/CB/A-1', 'DSI Corrrespondence', 'DSI 17 Feb 2021', '250704011453DSI-17.2.2021.pmd', '2025-07-04');
INSERT INTO "file_list" ("id", "file_no", "category", "title", "doc1", "entry_date_real") VALUES
(3871, 'MSB/CB/A-1', 'DSI Corrrespondence', 'DSI 18 Feb 2021', '250704011520DSI-18.2.2021.pmd', '2025-07-04');
INSERT INTO "file_list" ("id", "file_no", "category", "title", "doc1", "entry_date_real") VALUES
(3872, 'MSB/CB/A-1', 'DSI Corrrespondence', 'DSI 19 Feb 2021', '250704011541DSI-19.2.2021.pmd', '2025-07-04');
INSERT INTO "file_list" ("id", "file_no", "category", "title", "doc1", "entry_date_real") VALUES
(3873, 'MSB/CB/A-1', 'DSI Corrrespondence', 'DSI 22 Feb 2021', '250704011617DSI-22.2.2021.pmd', '2025-07-04');
INSERT INTO "file_list" ("id", "file_no", "category", "title", "doc1", "entry_date_real") VALUES
(3874, 'MSB/CB/A-1', 'DSI Corrrespondence', 'DSI 23 Feb 2021', '250704011645DSI-23.2.2021.pmd', '2025-07-04');
INSERT INTO "file_list" ("id", "file_no", "category", "title", "doc1", "entry_date_real") VALUES
(3875, 'MSB/CB/A-1', 'DSI Corrrespondence', 'DSI 26 Feb 2021', '250704011806DSI-26.2.2021.pmd', '2025-07-04');
INSERT INTO "file_list" ("id", "file_no", "category", "title", "doc1", "entry_date_real") VALUES
(3876, 'MSB/CB/A-1', 'DSI Corrrespondence', 'DSI 1March 2021', '250704012325DSI-1.3.2021.pmd', '2025-07-04');
INSERT INTO "file_list" ("id", "file_no", "category", "title", "doc1", "entry_date_real") VALUES
(3877, 'MSB/CB/A-1', 'DSI Corrrespondence', 'DSI 2 March 2021', '250704012352DSI-2.3.2021.pmd', '2025-07-04');
INSERT INTO "file_list" ("id", "file_no", "category", "title", "doc1", "entry_date_real") VALUES
(3878, 'MSB/CB/A-1', 'DSI Corrrespondence', 'DSI 3 March 2021', '250704012418DSI-3.3.2021.pmd', '2025-07-04');
INSERT INTO "file_list" ("id", "file_no", "category", "title", "doc1", "entry_date_real") VALUES
(3879, 'MSB/CB/A-1', 'DSI Corrrespondence', 'DSI 4 March 2021', '250704012441DSI-4.3.2021.pmd', '2025-07-04');
INSERT INTO "file_list" ("id", "file_no", "category", "title", "doc1", "entry_date_real") VALUES
(3880, 'MSB/CB/A-1', 'DSI Corrrespondence', 'DSI 9 March 2021', '250704012551DSI-9.3.2021.pmd', '2025-07-04');
INSERT INTO "file_list" ("id", "file_no", "category", "title", "doc1", "entry_date_real") VALUES
(3881, 'MSB/CB/A-1', 'DSI Corrrespondence', 'DSI 10 March 2021', '250704012639DSI-10.3.2021.pmd', '2025-07-04');
INSERT INTO "file_list" ("id", "file_no", "category", "title", "doc1", "entry_date_real") VALUES
(3882, 'MSB/CB/A-1', 'DSI Corrrespondence', 'DSI 11 March 2021', '250704012704DSI-11.3.2021.pmd', '2025-07-04');
INSERT INTO "file_list" ("id", "file_no", "category", "title", "doc1", "entry_date_real") VALUES
(3883, 'MSB/CB/A-1', 'DSI Corrrespondence', 'DSI 12 March 2021', '250704012727DSI-12.3.2021.pmd', '2025-07-04');
INSERT INTO "file_list" ("id", "file_no", "category", "title", "doc1", "entry_date_real") VALUES
(3884, 'MSB/CB/A-1', 'DSI Corrrespondence', 'DSI 15 March 2021', '250704012748DSI-15.3.2021.pmd', '2025-07-04');
INSERT INTO "file_list" ("id", "file_no", "category", "title", "doc1", "entry_date_real") VALUES
(3885, 'MSB/CB/A-1', 'DSI Corrrespondence', 'DSI16 March 2021', '250704012811DSI-16.3.2021.pmd', '2025-07-04');
INSERT INTO "file_list" ("id", "file_no", "category", "title", "doc1", "entry_date_real") VALUES
(3886, 'MSB/CB/A-1', 'DSI Corrrespondence', 'DSI 17 March 2021', '250704012837DSI-17.3.2021.pmd', '2025-07-04');
INSERT INTO "file_list" ("id", "file_no", "category", "title", "doc1", "entry_date_real") VALUES
(3887, 'MSB/CB/A-1', 'DSI Corrrespondence', 'DSI 18 March 2021', '250704012901DSI-18.3.2021.pmd', '2025-07-04');
INSERT INTO "file_list" ("id", "file_no", "category", "title", "doc1", "entry_date_real") VALUES
(3888, 'MSB/CB/A-1', 'DSI Corrrespondence', 'DSI 19 March 2021', '250704012922DSI-19.3.2021.pmd', '2025-07-04');
INSERT INTO "file_list" ("id", "file_no", "category", "title", "doc1", "entry_date_real") VALUES
(3889, 'MSB/CB/A-1', 'DSI Corrrespondence', 'DSI 22 March 2021', '250704012944DSI-22.3.2021.pmd', '2025-07-04');
INSERT INTO "file_list" ("id", "file_no", "category", "title", "doc1", "entry_date_real") VALUES
(3890, 'MSB/CB/A-1', 'DSI Corrrespondence', 'DSI 23 March 2021', '250704013007DSI-23.3.2021.pmd', '2025-07-04');
INSERT INTO "file_list" ("id", "file_no", "category", "title", "doc1", "entry_date_real") VALUES
(3891, 'MSB/CB/A-1', 'DSI Corrrespondence', 'DSI 24 March 2021', '250704013028DSI-24.3.2021.pmd', '2025-07-04');
INSERT INTO "file_list" ("id", "file_no", "category", "title", "doc1", "entry_date_real") VALUES
(3892, 'MSB/CB/A-1', 'DSI Corrrespondence', 'DSI 25 March 2021', '250704013056DSI-25.3.2021.pmd', '2025-07-04');
INSERT INTO "file_list" ("id", "file_no", "category", "title", "doc1", "entry_date_real") VALUES
(3893, 'MSB/CB/A-1', 'DSI Corrrespondence', 'DSI 25 March 2021', '250704013139DSI-25.3.2021.pmd', '2025-07-04');
INSERT INTO "file_list" ("id", "file_no", "category", "title", "doc1", "entry_date_real") VALUES
(3894, 'MSB/CB/A-1', 'DSI Corrrespondence', 'DSI 26 March 2021', '250704013206DSI-26.3.2021.pmd', '2025-07-04');
INSERT INTO "file_list" ("id", "file_no", "category", "title", "doc1", "entry_date_real") VALUES
(3895, 'MSB/CB/A-1', 'DSI Corrrespondence', 'DSI 30 March 2021', '250704013227DSI-30.3.2021.pmd', '2025-07-04');
INSERT INTO "file_list" ("id", "file_no", "category", "title", "doc1", "entry_date_real") VALUES
(3896, 'MSB/CB/A-1', 'DSI Corrrespondence', 'DSI 31 March 2021', '250704013249DSI-31.3.2021.pmd', '2025-07-04');
INSERT INTO "file_list" ("id", "file_no", "category", "title", "doc1", "entry_date_real") VALUES
(3897, 'MSB/CB/A-1', 'DSI Corrrespondence', 'DSI 3 May 2021', '250704013452DSI-3.5.2021.pmd', '2025-07-04');
INSERT INTO "file_list" ("id", "file_no", "category", "title", "doc1", "entry_date_real") VALUES
(3898, 'MSB/CB/A-1', 'DSI Corrrespondence', 'DSI 4 May 2021', '250704013526DSI-4.5.2021.pmd', '2025-07-04');
INSERT INTO "file_list" ("id", "file_no", "category", "title", "doc1", "entry_date_real") VALUES
(3899, 'MSB/CB/A-1', 'DSI Corrrespondence', 'DSI 5 May 2021', '250704013557DSI-5.5.2021.pmd', '2025-07-04');
INSERT INTO "file_list" ("id", "file_no", "category", "title", "doc1", "entry_date_real") VALUES
(3900, 'MSB/CB/A-1', 'DSI Corrrespondence', 'DSI 6 May 2021', '250704013625DSI-6.5.2021.pmd', '2025-07-04');
INSERT INTO "file_list" ("id", "file_no", "category", "title", "doc1", "entry_date_real") VALUES
(3901, 'MSB/CB/A-1', 'DSI Corrrespondence', 'DSI 7 May 2021', '250704013648DSI-7.5.2021.pmd', '2025-07-04');
INSERT INTO "file_list" ("id", "file_no", "category", "title", "doc1", "entry_date_real") VALUES
(3902, 'MSB/CB/A-1', 'DSI Corrrespondence', 'DSI 10 May 2021', '250704013853DSI-10.5.2021.pmd', '2025-07-04');
INSERT INTO "file_list" ("id", "file_no", "category", "title", "doc1", "entry_date_real") VALUES
(3903, 'MSB/CB/A-1', 'DSI Corrrespondence', 'DSI 11 May 2021', '250704013953DSI-11.5.2021.pmd', '2025-07-04');
INSERT INTO "file_list" ("id", "file_no", "category", "title", "doc1", "entry_date_real") VALUES
(3904, 'MSB/CB/A-1', 'DSI Corrrespondence', 'DSI 12 May 2021', '250704014022DSI-12.5.2021.pmd', '2025-07-04');
INSERT INTO "file_list" ("id", "file_no", "category", "title", "doc1", "entry_date_real") VALUES
(3905, 'MSB/CB/A-1', 'DSI Corrrespondence', 'DSI 13 May 2021', '250704014048DSI-13.5.2021.pmd', '2025-07-04');
INSERT INTO "file_list" ("id", "file_no", "category", "title", "doc1", "entry_date_real") VALUES
(3906, 'MSB/CB/A-1', 'DSI Corrrespondence', 'DSI 17 May 2021', '250704014108DSI-17.5.2021.pmd', '2025-07-04');
INSERT INTO "file_list" ("id", "file_no", "category", "title", "doc1", "entry_date_real") VALUES
(3907, 'MSB/CB/A-1', 'DSI Corrrespondence', 'DSI 18 May 2021', '250704014130DSI-18.5.2021.pmd', '2025-07-04');
INSERT INTO "file_list" ("id", "file_no", "category", "title", "doc1", "entry_date_real") VALUES
(3908, 'MSB/CB/A-1', 'DSI Corrrespondence', 'DSI 18 May 2021', '250704014201DSI-18.5.2021.pmd', '2025-07-04');
INSERT INTO "file_list" ("id", "file_no", "category", "title", "doc1", "entry_date_real") VALUES
(3909, 'MSB/CB/A-1', 'DSI Corrrespondence', 'DSI 19 May 2021', '250704014229DSI-19.5.2021.pmd', '2025-07-04');
INSERT INTO "file_list" ("id", "file_no", "category", "title", "doc1", "entry_date_real") VALUES
(3910, 'MSB/CB/A-1', 'DSI Corrrespondence', 'DSI 20 May 2021', '250704014254DSI-20.5.2021.pmd', '2025-07-04');
INSERT INTO "file_list" ("id", "file_no", "category", "title", "doc1", "entry_date_real") VALUES
(3911, 'MSB/CB/A-1', 'DSI Corrrespondence', 'DSI 21 May 2021', '250704014314DSI-21.5.2021.pmd', '2025-07-04');
INSERT INTO "file_list" ("id", "file_no", "category", "title", "doc1", "entry_date_real") VALUES
(3912, 'MSB/CB/A-1', 'DSI Corrrespondence', 'DSI 24 May 2021', '250704014335DSI-24.5.2021.pmd', '2025-07-04');
INSERT INTO "file_list" ("id", "file_no", "category", "title", "doc1", "entry_date_real") VALUES
(3913, 'MSB/CB/A-1', 'DSI Corrrespondence', 'DSI 25 May 2021', '250704014356DSI-25.5.2021.pmd', '2025-07-04');
INSERT INTO "file_list" ("id", "file_no", "category", "title", "doc1", "entry_date_real") VALUES
(3914, 'MSB/CB/A-1', 'DSI Corrrespondence', 'DSI 27 May 2021', '250704014425DSI-27.5.2021.pmd', '2025-07-04');
INSERT INTO "file_list" ("id", "file_no", "category", "title", "doc1", "entry_date_real") VALUES
(3915, 'MSB/CB/A-1', 'DSI Corrrespondence', 'DSI 28 May 2021', '250704014449DSI-28.5.2021.pmd', '2025-07-04');
INSERT INTO "file_list" ("id", "file_no", "category", "title", "doc1", "entry_date_real") VALUES
(3916, 'MSB/CB/A-1', 'DSI Corrrespondence', 'DSI 31 May 2021', '250704014512DSI-31.5.2021.pmd', '2025-07-04');
INSERT INTO "file_list" ("id", "file_no", "category", "title", "doc1", "entry_date_real") VALUES
(3917, 'MSB/CB/A-1', 'DSI Corrrespondence', 'DSI 1 June 2021', '250704014621DSI-1.6.2021.pmd', '2025-07-04');
INSERT INTO "file_list" ("id", "file_no", "category", "title", "doc1", "entry_date_real") VALUES
(3918, 'MSB/CB/A-1', 'DSI Corrrespondence', 'DSI 2 June 2021', '250704014642DSI-2.6.2021.pmd', '2025-07-04');
INSERT INTO "file_list" ("id", "file_no", "category", "title", "doc1", "entry_date_real") VALUES
(3919, 'MSB/CB/A-1', 'DSI Corrrespondence', 'DSI 3 June 2021', '250704014700DSI-3.6.2021.pmd', '2025-07-04');
INSERT INTO "file_list" ("id", "file_no", "category", "title", "doc1", "entry_date_real") VALUES
(3920, 'MSB/CB/A-1', 'DSI Corrrespondence', 'DSI 4 June 2021', '250704014723DSI-4.6.2021.pmd', '2025-07-04');
INSERT INTO "file_list" ("id", "file_no", "category", "title", "doc1", "entry_date_real") VALUES
(3921, 'MSB/CB/A-1', 'DSI Corrrespondence', 'DSI 7 June 2021', '250704014750DSI-7.6.2021.pmd', '2025-07-04');
INSERT INTO "file_list" ("id", "file_no", "category", "title", "doc1", "entry_date_real") VALUES
(3922, 'MSB/CB/A-1', 'DSI Corrrespondence', 'DSI 8 June 2021', '250704014809DSI-8.6.2021.pmd', '2025-07-04');
INSERT INTO "file_list" ("id", "file_no", "category", "title", "doc1", "entry_date_real") VALUES
(3923, 'MSB/CB/A-1', 'DSI Corrrespondence', 'DSI 9 June 2021', '250704014829DSI-9.6.2021.pmd', '2025-07-04');
INSERT INTO "file_list" ("id", "file_no", "category", "title", "doc1", "entry_date_real") VALUES
(3924, 'MSB/CB/A-1', 'DSI Corrrespondence', 'DSI 10 June 2021', '250704014849DSI-10.6.2021.pmd', '2025-07-04');
INSERT INTO "file_list" ("id", "file_no", "category", "title", "doc1", "entry_date_real") VALUES
(3925, 'MSB/CB/A-1', 'DSI Corrrespondence', 'DSI 11 June 2021', '', '2025-07-04');
INSERT INTO "file_list" ("id", "file_no", "category", "title", "doc1", "entry_date_real") VALUES
(3926, 'MSB/CB/A-1', 'DSI Corrrespondence', 'DSI 14 June 2021', '250704014938DSI-14.6.2021.pmd', '2025-07-04');
INSERT INTO "file_list" ("id", "file_no", "category", "title", "doc1", "entry_date_real") VALUES
(3927, 'MSB/CB/A-1', 'DSI Corrrespondence', 'DSI 16 June 2021', '250704015007DSI-16.6.2021.pmd', '2025-07-04');
INSERT INTO "file_list" ("id", "file_no", "category", "title", "doc1", "entry_date_real") VALUES
(3928, 'MSB/CB/A-1', 'DSI Corrrespondence', 'DSI 17 June 2021', '250704015026DSI-17.6.2021.pmd', '2025-07-04');
INSERT INTO "file_list" ("id", "file_no", "category", "title", "doc1", "entry_date_real") VALUES
(3929, 'MSB/CB/A-1', 'DSI Corrrespondence', 'DSI 18 June 2021', '250704015046DSI-18.6.2021.pmd', '2025-07-04');
INSERT INTO "file_list" ("id", "file_no", "category", "title", "doc1", "entry_date_real") VALUES
(3930, 'MSB/CB/A-1', 'DSI Corrrespondence', 'DSI 21 June 2021', '250704015107DSI-21.6.2021.pmd', '2025-07-04');
INSERT INTO "file_list" ("id", "file_no", "category", "title", "doc1", "entry_date_real") VALUES
(3931, 'MSB/CB/A-1', 'DSI Corrrespondence', 'DSI 22 June 2021', '250704015132DSI-22.6.2021.pmd', '2025-07-04');
INSERT INTO "file_list" ("id", "file_no", "category", "title", "doc1", "entry_date_real") VALUES
(3932, 'MSB/CB/A-1', 'DSI Corrrespondence', 'DSI 23 June 2021', '250704015153DSI-23.6.2021.pmd', '2025-07-04');
INSERT INTO "file_list" ("id", "file_no", "category", "title", "doc1", "entry_date_real") VALUES
(3933, 'MSB/CB/A-1', 'DSI Corrrespondence', 'DSI 24 June 2021', '250704015215DSI-24.6.2021.pmd', '2025-07-04');
INSERT INTO "file_list" ("id", "file_no", "category", "title", "doc1", "entry_date_real") VALUES
(3934, 'MSB/CB/A-1', 'DSI Corrrespondence', 'DSI 25 June 2021', '250704015239DSI-25.6.2021.pmd', '2025-07-04');
INSERT INTO "file_list" ("id", "file_no", "category", "title", "doc1", "entry_date_real") VALUES
(3935, 'MSB/CB/A-1', 'DSI Corrrespondence', 'DSI 28 June 2021', '250704015300DSI-28.6.2021.pmd', '2025-07-04');
INSERT INTO "file_list" ("id", "file_no", "category", "title", "doc1", "entry_date_real") VALUES
(3936, 'MSB/CB/A-1', 'DSI Corrrespondence', 'DSI 29 June 2021', '250704015318DSI-29.6.2021.pmd', '2025-07-04');
INSERT INTO "file_list" ("id", "file_no", "category", "title", "doc1", "entry_date_real") VALUES
(3937, 'MSB/CB/A-1', 'DSI Corrrespondence', 'DSI 1 July 2021', '250704015422DSI-1.7.2021.pmd', '2025-07-04');
INSERT INTO "file_list" ("id", "file_no", "category", "title", "doc1", "entry_date_real") VALUES
(3938, 'MSB/CB/A-1', 'DSI Corrrespondence', 'DSI 2 July 2021', '250704015445DSI-2.7.2021.pmd', '2025-07-04');
INSERT INTO "file_list" ("id", "file_no", "category", "title", "doc1", "entry_date_real") VALUES
(3939, 'MSB/CB/A-1', 'DSI Corrrespondence', 'DSI 5 July 2021', '250704015509DSI-5.7.2021.pmd', '2025-07-04');
INSERT INTO "file_list" ("id", "file_no", "category", "title", "doc1", "entry_date_real") VALUES
(3940, 'MSB/CB/A-1', 'DSI Corrrespondence', 'DSI 7 July 2021', '250704015534DSI-7.7.2021.pmd', '2025-07-04');
INSERT INTO "file_list" ("id", "file_no", "category", "title", "doc1", "entry_date_real") VALUES
(3941, 'MSB/CB/A-1', 'DSI Corrrespondence', 'DSI 8 July 2021', '250704015553DSI-8.7.2021.pmd', '2025-07-04');
INSERT INTO "file_list" ("id", "file_no", "category", "title", "doc1", "entry_date_real") VALUES
(3942, 'MSB/CB/A-1', 'DSI Corrrespondence', 'DSI 8 July 2021', '250704015625DSI-9.7.2021.pmd', '2025-07-04');
INSERT INTO "file_list" ("id", "file_no", "category", "title", "doc1", "entry_date_real") VALUES
(3943, 'MSB/CB/A-1', 'DSI Corrrespondence', 'DSI 12 July 2021', '250704015647DSI-12.7.2021.pmd', '2025-07-04');
INSERT INTO "file_list" ("id", "file_no", "category", "title", "doc1", "entry_date_real") VALUES
(3944, 'MSB/CB/A-1', 'DSI Corrrespondence', 'DSI 13 July 2021', '250704015710DSI-13.7.2021.pmd', '2025-07-04');
INSERT INTO "file_list" ("id", "file_no", "category", "title", "doc1", "entry_date_real") VALUES
(3945, 'MSB/CB/A-1', 'DSI Corrrespondence', 'DSI 14 July 2021', '250704015728DSI-14.7.2021.pmd', '2025-07-04');
INSERT INTO "file_list" ("id", "file_no", "category", "title", "doc1", "entry_date_real") VALUES
(3946, 'MSB/CB/A-5', 'Indo-Myanmar Border Affairs(Intelligence)', 'Report on HPOâ€“CNDF Clashes in Chin State, Myanmar (July 2â€“7, 2025)', '', '2025-07-10');
INSERT INTO "file_list" ("id", "file_no", "category", "title", "doc1", "entry_date_real") VALUES
(3947, 'MSB/CB/A-5', 'Indo-Myanmar Border Affairs(Intelligence)', 'NOTES ON AGENDA POINTS FOR ILP MEETING ON 02.06.2025', '', '2025-07-10');
INSERT INTO "file_list" ("id", "file_no", "category", "title", "doc1", "entry_date_real") VALUES
(3948, 'MSB/CB/A-5', 'Indo-Myanmar Border Affairs(Intelligence)', 'Deployment of police personnel and health officials at pilot sites of entry/exit point along Indo-Myanmar Border (IMB).', '', '2025-07-10');
INSERT INTO "file_list" ("id", "file_no", "category", "title", "doc1", "entry_date_real") VALUES
(3949, 'MSB/CB/A-84', 'Achievements of CID(SB)', 'West Phaileng PS Case No.2/2025 Dt 15.1.2025 u/s 61(2) (a) BNS R/w 13,16,18,20,23 UAP Act R/w 25(1AA) Arms Act R/w 14 A Foreigner Act\r\nStatement of Accused arrested on dt15.1.25.Name: Lalbiakchunga (63)', '', '2025-07-10');
INSERT INTO "file_list" ("id", "file_no", "category", "title", "doc1", "entry_date_real") VALUES
(3950, 'MSB/CB/A-84', 'Achievements of CID(SB)', 'West Phaileng PS Case No.2/2025 Dt 15.1.2025 u/s 61(2) (a) BNS R/w 13,16,18,20,23 UAP Act R/w 25(1AA) Arms Act R/w 14 A Foreigner ActStatement of Accused arrested on dt15.1.25.Name: Lalbiakchunga(63)', '', '2025-07-10');
INSERT INTO "file_list" ("id", "file_no", "category", "title", "doc1", "entry_date_real") VALUES
(3951, 'MSB/CB/A-84', 'Achievements of CID(SB)', 'West Phaileng PS Case No.2/2025 Dt 15.1.2025 u/s 61(2) (a) BNS R/w 13,16,18,20,23 UAP Act R/w 25(1AA) Arms Act R/w 14 A Foreigner ActStatement of Accused arrested on dt15.1.25.Name: Lalbiakchunga (63)', '', '2025-07-10');
INSERT INTO "file_list" ("id", "file_no", "category", "title", "doc1", "entry_date_real") VALUES
(3952, 'MSB/CB/A-84', 'Achievements of CID(SB)', 'West Phaileng PS Case No.2/2025 Dt 15.1.2025 u/s 61(2) (a) BNS R/w 13,16,18,20,23 UAP Act R/w 25(1AA) Arms Act R/w 14 A Foreigner ActStatement of Accused arrested on dt15.1.25.\r\nName: Lalbiakchunga(63)', '', '2025-07-10');
INSERT INTO "file_list" ("id", "file_no", "category", "title", "doc1", "entry_date_real") VALUES
(3953, 'MSB/CB/A-88(B)', 'SPO', 'ENGAGEMENT CARD FOR SPECIAL POLICE OFFICER (M.R)', '', '2025-07-10');
INSERT INTO "file_list" ("id", "file_no", "category", "title", "doc1", "entry_date_real") VALUES
(3954, 'MSB/CB/A-88(B)', 'SPO', 'NGAGEMENT CARD FOR SPECIAL POLICE OFFICER (M.R) Mr. Chinpui Paihte', '', '2025-07-10');
INSERT INTO "file_list" ("id", "file_no", "category", "title", "doc1", "entry_date_real") VALUES
(3955, 'MSB/CB/A-88(B)', 'SPO', 'ENGAGEMENT CARD FOR SPECIAL POLICE OFFICER (M.R) Mr. Chinpui Paihte', '', '2025-07-10');
INSERT INTO "file_list" ("id", "file_no", "category", "title", "doc1", "entry_date_real") VALUES
(3956, 'MSB/CB/A-88(B)', 'SPO', 'Report on contribution of SpecialÂ  Police Officers.', '', '2025-07-10');
INSERT INTO "file_list" ("id", "file_no", "category", "title", "doc1", "entry_date_real") VALUES
(3957, 'MSB/CB/A-88(B)', 'SPO', 'Review Committee for appointment of Special Police Officer (SPO) under CID(SB) Mizoram', '', '2025-07-10');
INSERT INTO "file_list" ("id", "file_no", "category", "title", "doc1", "entry_date_real") VALUES
(3958, 'MSB/CB/A-88(B)', 'SPO', 'Review Committee for appointment of Special Police Officer (SPO) under CID(SB) Mizoram', '', '2025-07-10');
INSERT INTO "file_list" ("id", "file_no", "category", "title", "doc1", "entry_date_real") VALUES
(3959, 'MSB/CB/A-88(B)', 'SPO', 'Review Committee for appointment of Special Police Officer (SPO) under CID(SB) Mizoram', '', '2025-07-10');
INSERT INTO "file_list" ("id", "file_no", "category", "title", "doc1", "entry_date_real") VALUES
(3960, 'MSB/CB/A-120', 'Declaration/proposal for unlawful activities of militant', 'information on Unlawful Organizations Operating in Mizoram â€“ reg.', '', '2025-07-10');
INSERT INTO "file_list" ("id", "file_no", "category", "title", "doc1", "entry_date_real") VALUES
(3961, 'MSB/CB/A-137', 'Recommendation on good government(group of Minister)(Lead Intelligence Agency)LIA', 'Notes on Agenda Points for LIA Meeting.', '', '2025-07-10');
INSERT INTO "file_list" ("id", "file_no", "category", "title", "doc1", "entry_date_real") VALUES
(3962, 'MSB/CB/A-137', 'Recommendation on good government(group of Minister)(Lead Intelligence Agency)LIA', 'NOTES ON AGENDA POINTS FOR LIA MEETING, 1stÂ  July, 2025', '', '2025-07-10');
INSERT INTO "file_list" ("id", "file_no", "category", "title", "doc1", "entry_date_real") VALUES
(3963, 'MSB/CB/A-137', 'Recommendation on good government(group of Minister)(Lead Intelligence Agency)LIA', 'NOTES ON AGENDA POINTS FOR LIA MEETING 11.04.2025', '', '2025-07-10');
INSERT INTO "file_list" ("id", "file_no", "category", "title", "doc1", "entry_date_real") VALUES
(3964, 'MSB/CB/A-137', 'Recommendation on good government(group of Minister)(Lead Intelligence Agency)LIA', 'NOTES ON AGENDA POINTS FOR LIA MEETING 11.04.2025', '', '2025-07-10');
INSERT INTO "file_list" ("id", "file_no", "category", "title", "doc1", "entry_date_real") VALUES
(3965, 'MSB/CB/A-137', 'Recommendation on good government(group of Minister)(Lead Intelligence Agency)LIA', 'Preparation of notes, reg. 61st Directional Level Co-Ordination Meeting of LIA for your kind perusal please.', '', '2025-07-10');
INSERT INTO "file_list" ("id", "file_no", "category", "title", "doc1", "entry_date_real") VALUES
(3966, 'MSB/CB/A-137', 'Recommendation on good government(group of Minister)(Lead Intelligence Agency)LIA', 'NOTES ON AGENDA POINTS FOR LIA MEETING, 25th June, 2025', '', '2025-07-10');
INSERT INTO "file_list" ("id", "file_no", "category", "title", "doc1", "entry_date_real") VALUES
(3967, 'MSB/CB/A-137', 'Recommendation on good government(group of Minister)(Lead Intelligence Agency)LIA', 'NOTES ON AGENDA POINTS FOR LIA MEETING 27.01.2025', '', '2025-07-10');
INSERT INTO "file_list" ("id", "file_no", "category", "title", "doc1", "entry_date_real") VALUES
(3968, 'MSB/CB/A-137', 'Recommendation on good government(group of Minister)(Lead Intelligence Agency)LIA', 'NOTES ON AGENDA POINTS FOR LIA MEETING 27.02.2025', '', '2025-07-10');
INSERT INTO "file_list" ("id", "file_no", "category", "title", "doc1", "entry_date_real") VALUES
(3969, 'MSB/CB/A-137', 'Recommendation on good government(group of Minister)(Lead Intelligence Agency)LIA', 'NOTES ON AGENDA POINTS FOR LIA MEETING 27.03.2025', '', '2025-07-10');
INSERT INTO "file_list" ("id", "file_no", "category", "title", "doc1", "entry_date_real") VALUES
(3970, 'MSB/CB/A-137', 'Recommendation on good government(group of Minister)(Lead Intelligence Agency)LIA', 'NOTES ON AGENDA POINTS FOR LIA MEETING 28.04.2025', '', '2025-07-10');
INSERT INTO "file_list" ("id", "file_no", "category", "title", "doc1", "entry_date_real") VALUES
(3971, 'MSB/CB/A-137', 'Recommendation on good government(group of Minister)(Lead Intelligence Agency)LIA', 'NOTES ON AGENDA POINTS FOR LIA MEETING 28.04.2025', '', '2025-07-10');
INSERT INTO "file_list" ("id", "file_no", "category", "title", "doc1", "entry_date_real") VALUES
(3972, 'MSB/CB/B-4', 'Mizoram-Cachar Border Dispute/Boundary Committee/Boundary incidents', 'Notes for Mizoram â€“ Assam Boundary Meeting on 16.04.2025.', '', '2025-07-10');
INSERT INTO "file_list" ("id", "file_no", "category", "title", "doc1", "entry_date_real") VALUES
(3973, 'MSB/CB/B-4', 'Mizoram-Cachar Border Dispute/Boundary Committee/Boundary incidents', 'Notes for Mizoram â€“ Assam Boundary meeting on 16.04.2025', '', '2025-07-10');
INSERT INTO "file_list" ("id", "file_no", "category", "title", "doc1", "entry_date_real") VALUES
(3974, 'MSB/CB/B-5/NLFT', 'National Liberation Front of Tripura', 'REPORT ON ACTIVITIES OF THBTA Dated: 28 January, 2025', '', '2025-07-10');
INSERT INTO "file_list" ("id", "file_no", "category", "title", "doc1", "entry_date_real") VALUES
(3975, 'MSB/CB/B-5/NLFT', 'National Liberation Front of Tripura', 'SPECIAL REPORT ON NEWLY FORMED INSURGENT GROUP Dated: 4th February, 2025', '', '2025-07-10');
INSERT INTO "file_list" ("id", "file_no", "category", "title", "doc1", "entry_date_real") VALUES
(3976, 'MSB/CB/B-18', 'Muslim Fundamentalists Organisation in the North East- B-97', 'Response to Inquiry Regarding All India Muslim Personal Law Board Conference â€“ Reg.', '', '2025-07-10');
